,filename,original_sentence,google_word,google_phoneme,sphinx_word,sphinx_phoneme
0,./utterance_data/speaker_W/001.wav,Well go to Sofa  take empty_ketchup finally come back .,well go to sofa take empty ketchup finally come back,W EH1 L G OW1 T UW1 S OW1 F AH0 T EY1 K EH1 M P T IY0 K EH1 CH AH0 P F AY1 N AH0 L IY0 K AH1 M B AE1 K,well go to so that him to do just fine in combat,W EH1 L G OW1 T UW1 S OW1 DH AE1 T HH IH1 M T UW1 D UW1 JH AH1 S T F AY1 N IH0 N K AA1 M B AE0 T
1,./utterance_data/speaker_W/002.wav,Go to Dining_Sofa next detect camera  take it .,go to dining sofa next detect camera tickets,G OW1 T UW1 D AY1 N IH0 NG S OW1 F AH0 N EH1 K S T D IH0 T EH1 K T K AE1 M ER0 AH0 T IH1 K AH0 T S,go to dining set so far next attacked camera take it,G OW1 T UW1 D AY1 N IH0 NG S EH1 T S OW1 F AA1 R N EH1 K S T AH0 T AE1 K T K AE1 M ER0 AH0 T EY1 K IH1 T
2,./utterance_data/speaker_W/003.wav,Move to Living_Table  grasp Bleach  leave the apartment please .,move to living table grass Plant leave the apartment please,M UW1 V T UW1 L IH1 V IH0 NG T EY1 B AH0 L G R AE1 S P L AE1 N T L IY1 V DH AH0 AH0 P AA1 R T M AH0 N T P L IY1 Z,move to the b. table grasp financial leave the apartment peace,M UW1 V T UW1 DH AH0 B IY1 T EY1 B AH0 L G R AE1 S P F AH0 N AE1 N SH AH0 L L IY1 V DH AH0 AH0 P AA1 R T M AH0 N T P IY1 S
3,./utterance_data/speaker_W/004.wav,Go to Sofa  take Cup_Star put it on Living_Table okay .,go to sofa take cup * pooted on living table okay,G OW1 T UW1 S OW1 F AH0 T EY1 K K AH1 P P IY1 OW1 OW1 T IY1 IY1 D IY1 AA1 N L IH1 V IH0 NG T EY1 B AH0 L OW2 K EY1,go to so bob take cop to start who did it on t. v. tape okay,G OW1 T UW1 S OW1 B AA1 B T EY1 K K AA1 P T UW1 S T AA1 R T HH UW1 D IH1 D IH1 T AA1 N T IY1 V IY1 T EY1 P OW2 K EY1
4,./utterance_data/speaker_W/005.wav,Go to Kitchen_Table move to Living_Table take Red_Tea .,go to kitchen table move to living table take red tea,G OW1 T UW1 K IH1 CH AH0 N T EY1 B AH0 L M UW1 V T UW1 L IH1 V IH0 NG T EY1 B AH0 L T EY1 K R EH1 D T IY1,go to a kitchen table move to the b. table take ricky,G OW1 T UW1 AH0 K IH1 CH AH0 N T EY1 B AH0 L M UW1 V T UW1 DH AH0 B IY1 T EY1 B AH0 L T EY1 K R IH1 K IY2
5,./utterance_data/speaker_W/006.wav,Can you move to Living_Table get toy_car then come back .,can you move to living table get toy car then come back,K AE1 N Y UW1 M UW1 V T UW1 L IH1 V IH0 NG T EY1 B AH0 L G EH1 T T OY1 K AA1 R DH EH1 N K AH1 M B AE1 K,can you move to the table kid's toy car didn't call back,K AE1 N Y UW1 M UW1 V T UW1 DH AH0 T EY1 B AH0 L K IH1 D Z T OY1 K AA1 R D IH1 D AH0 N T K AO1 L B AE1 K
6,./utterance_data/speaker_W/007.wav,Move to Side_Table get ground_pepper place it on Sofa okay .,move to side a table get ground paper proceed on sofa okay,M UW1 V T UW1 S AY1 D AH0 T EY1 B AH0 L G EH1 T G R AW1 N D P EY1 P ER0 P R AH0 S IY1 D AA1 N S OW1 F AH0 OW2 K EY1,move to a side table gave the koran to paper pasted on so called k.,M UW1 V T UW1 AH0 S AY1 D T EY1 B AH0 L G EY1 V DH AH0 K AO0 R AA1 N T UW1 P EY1 P ER0 P EY1 S T IH0 D AA1 N S OW1 K AO1 L D K EY1
7,./utterance_data/speaker_W/008.wav,Would you go to Kitchen_Table  take sugar  bring it to Side_Table .,would you go to kitchen table take sugar bring it to a sorted table,W UH1 D Y UW1 G OW1 T UW1 K IH1 CH AH0 N T EY1 B AH0 L T EY1 K SH UH1 G ER0 B R IH1 NG IH1 T T UW1 AH0 S AO1 R T IH0 D T EY1 B AH0 L,would you go to the kitchen table picture garber i need to start a bow,W UH1 D Y UW1 G OW1 T UW1 DH AH0 K IH1 CH AH0 N T EY1 B AH0 L P IH1 K CH ER0 G AA1 R B ER0 AY1 N IY1 D T UW1 S T AA1 R T AH0 B AW1
8,./utterance_data/speaker_W/009.wav,Can you move to Side_Table get salt then come back .,can you move to Salt table get salt then come back,K AE1 N Y UW1 M UW1 V T UW1 S AO1 L T T EY1 B AH0 L G EH1 T S AO1 L T DH EH1 N K AH1 M B AE1 K,can you move two sides table gets older than combat,K AE1 N Y UW1 M UW1 V T UW1 S AY1 D Z T EY1 B AH0 L G EH1 T S OW1 L D ER0 DH AE1 N K AA1 M B AE0 T
9,./utterance_data/speaker_W/010.wav,Go to Visitor_Room take canned_juice put it on Bar please .,go to visitor room take cans juice put it on Barclays,G OW1 T UW1 V IH1 Z IH0 T ER0 R UW1 M T EY1 K K AE1 N Z JH UW1 S P UH1 T IH1 T AA1 N B AA1 R K L IY0 Z,go to a visitor's room take can't use put it on our parents,G OW1 T UW1 AH0 V IH1 Z IH0 T ER0 Z R UW1 M T EY1 K K AE1 N T Y UW1 S P UH1 T IH1 T AA1 N AW1 ER0 P EH1 R AH0 N T S
10,./utterance_data/speaker_W/011.wav,Move to Sofa  go to Bar then exit the apartment .,move to sofa go to a bar then existed the apartment,M UW1 V T UW1 S OW1 F AH0 G OW1 T UW1 AH0 B AA1 R DH EH1 N IH0 G Z IH1 S T AH0 D DH AH0 AH0 P AA1 R T M AH0 N T,move to sofa go to our van existence of apartments,M UW1 V T UW1 S OW1 F AH0 G OW1 T UW1 AW1 ER0 V AE1 N EH0 G Z IH1 S T AH0 N S AH1 V AH0 P AA1 R T M AH0 N T S
11,./utterance_data/speaker_W/012.wav,Well get Cup_Noodle from Living_Table go to Dining_Room move to Sofa .,well gets cup noodle from leaving table go to the dining room move to sofa,W EH1 L G EH1 T S K AH1 P N UW1 D AH0 L F R AH1 M L IY1 V IH0 NG T EY1 B AH0 L G OW1 T UW1 DH AH0 D AY1 N IH0 NG R UW1 M M UW1 V T UW1 S OW1 F AH0,well gates cop noodle from the b. table go to the audience and moved to so far,W EH1 L G EY1 T S K AA1 P N UW1 D AH0 L F R AH1 M DH AH0 B IY1 T EY1 B AH0 L G OW1 T UW1 DH AH0 AA1 D IY0 AH0 N S AH0 N D M UW1 V D T UW1 S OW1 F AA1 R
12,./utterance_data/speaker_W/013.wav,Call a person then ask for an order get Brown_Tea from Reception_Table .,how a person then ask for an order gets brunke from reception table,HH AW1 AH0 P ER1 S AH0 N DH EH1 N AE1 S K F AO1 R AE1 N AO1 R D ER0 G EH1 T S B R AH1 NG K F R AH1 M R IH0 S EH1 P SH AH0 N T EY1 B AH0 L,whoa percent vans cost forget watergate raunchy fraud reception table,W OW1 P ER0 S EH1 N T V AE1 N Z K AA1 S T F ER0 G EH1 T W AO1 T ER0 G EY2 T R AO1 N CH IY0 F R AO1 D R IH0 S EH1 P SH AH0 N T EY1 B AH0 L
13,./utterance_data/speaker_W/014.wav,Can you bring nursing_bottle from Bar go to Kitchen_Room move to Sofa .,can you bring nursing photo from Fargo to Kitchen room move to sofa,K AE1 N Y UW1 B R IH1 NG N ER1 S IH0 NG F OW1 T OW2 F R AH1 M F AA1 R G OW2 T UW1 K IH1 CH AH0 N R UW1 M M UW1 V T UW1 S OW1 F AH0,can you brain there is a photo for all cargo to teaches him move to sofa,K AE1 N Y UW1 B R EY1 N DH EH1 R IH1 Z AH0 F OW1 T OW2 F AO1 R AO1 L K AA1 R G OW2 T UW1 T IY1 CH AH0 Z HH IH1 M M UW1 V T UW1 S OW1 F AH0
14,./utterance_data/speaker_W/015.wav,Can you bring filled_ketchup from Sofa go to lobby move to Reception_Table .,can you bring field Ketchup from sofa go to Lobby move to reception table,K AE1 N Y UW1 B R IH1 NG F IY1 L D K EH1 CH AH0 P F R AH1 M S OW1 F AH0 G OW1 T UW1 L AA1 B IY0 M UW1 V T UW1 R IH0 S EH1 P SH AH0 N T EY1 B AH0 L,can you brave bielecki job from so far go to bobbie moved to reception table,K AE1 N Y UW1 B R EY1 V B IY0 L EH1 T S K IY0 JH AA1 B F R AH1 M S OW1 F AA1 R G OW1 T UW1 B AA1 B IY0 M UW1 V D T UW1 R IH0 S EH1 P SH AH0 N T EY1 B AH0 L
15,./utterance_data/speaker_W/016.wav,Would you go to Dining_Table  take spray_bottle  bring it to Living_Sofa .,would you go to dining table takes parade photo Bryant to living sofa,W UH1 D Y UW1 G OW1 T UW1 D AY1 N IH0 NG T EY1 B AH0 L T EY1 K S P ER0 EY1 D F OW1 T OW2 B R AY1 AH0 N T T UW1 L IH1 V IH0 NG S OW1 F AH0,would you go to dining table takes for a photo breaks to tv so far,W UH1 D Y UW1 G OW1 T UW1 D AY1 N IH0 NG T EY1 B AH0 L T EY1 K S F AO1 R AH0 F OW1 T OW2 B R EY1 K S T UW1 T IY1 V IY1 S OW1 F AA1 R
16,./utterance_data/speaker_W/017.wav,Go to lobby  move to Dining_Table  finally leave the apartment .,go to Lobby move to dining table finally leaves Apartments,G OW1 T UW1 L AA1 B IY0 M UW1 V T UW1 D AY1 N IH0 NG T EY1 B AH0 L F AY1 N AH0 L IY0 L IY1 V Z AH0 P AA1 R T M AH0 N T S,go to all be moved to the dining table by many indians apartments,G OW1 T UW1 AO1 L B IY1 M UW1 V D T UW1 DH AH0 D AY1 N IH0 NG T EY1 B AH0 L B AY1 M EH1 N IY0 IH1 N D IY0 AH0 N Z AH0 P AA1 R T M AH0 N T S
17,./utterance_data/speaker_W/018.wav,Would you move to Reception_Table grasp dog_doll and come back .,would you move to a reception table grass producto and the comeback,W UH1 D Y UW1 M UW1 V T UW1 AH0 R IH0 S EH1 P SH AH0 N T EY1 B AH0 L G R AE1 S P IY1 AA1 R OW1 D IY1 Y UW1 S IY1 T IY1 OW1 AH0 N D DH AH0 K AH1 M B AE2 K,would you move to the reception table grasp that although had to combat,W UH1 D Y UW1 M UW1 V T UW1 DH AH0 R IH0 S EH1 P SH AH0 N T EY1 B AH0 L G R AE1 S P DH AE1 T AO2 L DH OW1 HH AE1 D T UW1 K AA1 M B AE0 T
18,./utterance_data/speaker_W/019.wav,Move to Living_Table  grasp Cup_Noodle  leave the apartment please .,move to living table grasp cup noodle leave the apartment please,M UW1 V T UW1 L IH1 V IH0 NG T EY1 B AH0 L G R AE1 S P K AH1 P N UW1 D AH0 L L IY1 V DH AH0 AH0 P AA1 R T M AH0 N T P L IY1 Z,most houdini table grasp cop noodle thieves apartment treats,M OW1 S T HH UW0 D IY1 N IY0 T EY1 B AH0 L G R AE1 S P K AA1 P N UW1 D AH0 L TH IY1 V Z AH0 P AA1 R T M AH0 N T T R IY1 T S
19,./utterance_data/speaker_W/020.wav,Can you go to Side_Table take cigarette carry it to Bar .,can you go to side table take cigarettes carried to bar,K AE1 N Y UW1 G OW1 T UW1 S AY1 D T EY1 B AH0 L T EY1 K S IH2 G ER0 EH1 T S K AE1 R IY0 D T UW1 B AA1 R,can you go to side table takes a great air raids to bar,K AE1 N Y UW1 G OW1 T UW1 S AY1 D T EY1 B AH0 L T EY1 K S AH0 G R EY1 T EH1 R R EY1 D Z T UW1 B AA1 R
20,./utterance_data/speaker_W/021.wav,Can you go to Kitchen_Table take apple carry it to Living_Table .,can you go to kitchen table take apple carrot to living table,K AE1 N Y UW1 G OW1 T UW1 K IH1 CH AH0 N T EY1 B AH0 L T EY1 K AE1 P AH0 L K AE1 R AH0 T T UW1 L IH1 V IH0 NG T EY1 B AH0 L,can you go to a key to the table take the babcock air raids today the table,K AE1 N Y UW1 G OW1 T UW1 AH0 K IY1 T UW1 DH AH0 T EY1 B AH0 L T EY1 K DH AH0 B AE1 B K AO0 K EH1 R R EY1 D Z T AH0 D EY1 DH AH0 T EY1 B AH0 L
21,./utterance_data/speaker_W/022.wav,Go to Corridor er find a person neayby bring sauce from Dining_Sofa .,go to Corridor find a person nearby brain sauce from dining sofa,G OW1 T UW1 K AO1 R AH0 D ER0 F AY1 N D AH0 P ER1 S AH0 N N IH1 R B AY1 B R EY1 N S AO1 S F R AH1 M D AY1 N IH0 NG S OW1 F AH0,go to korea don't wind up her xavier pi brains souls from chinese so far,G OW1 T UW1 K AO2 R IY1 AH0 D OW1 N T W AY1 N D AH1 P HH ER1 Z EY1 V Y ER0 P AY1 B R EY1 N Z S OW1 L Z F R AH1 M CH AY0 N IY1 Z S OW1 F AA1 R
22,./utterance_data/speaker_W/023.wav,Well go to Side_Table  take Korean_Soup finally come back .,well go to side of table take Korean soap finally come back,W EH1 L G OW1 T UW1 S AY1 D AH1 V T EY1 B AH0 L T EY1 K K AO2 R IY1 AH0 N S OW1 P F AY1 N AH0 L IY0 K AH1 M B AE1 K,well go to set a table take korean soap find any combat who,W EH1 L G OW1 T UW1 S EH1 T AH0 T EY1 B AH0 L T EY1 K K AO2 R IY1 AH0 N S OW1 P F AY1 N D EH1 N IY0 K AA1 M B AE0 T HH UW1
23,./utterance_data/speaker_W/024.wav,Go to Dining_Sofa find a person neayby  er follow a person .,go to Donnie sofa find a person nearby photo of person,G OW1 T UW1 D AA1 N IY0 S OW1 F AH0 F AY1 N D AH0 P ER1 S AH0 N N IH1 R B AY1 F OW1 T OW2 AH1 V P ER1 S AH0 N,go to chinese so called by de paris in the air by phone all percent,G OW1 T UW1 CH AY0 N IY1 Z S OW1 K AO1 L D B AY1 D IY1 P EH1 R IH0 S IH0 N DH AH0 EH1 R B AY1 F OW1 N AO1 L P ER0 S EH1 N T
24,./utterance_data/speaker_W/025.wav,Would you move to Reception_Table take Orange_Juice then come back .,would you move to reception table take orange juice then come back,W UH1 D Y UW1 M UW1 V T UW1 R IH0 S EH1 P SH AH0 N T EY1 B AH0 L T EY1 K AO1 R AH0 N JH JH UW1 S DH EH1 N K AH1 M B AE1 K,would you move to reception table take orange juice been combat,W UH1 D Y UW1 M UW1 V T UW1 R IH0 S EH1 P SH AH0 N T EY1 B AH0 L T EY1 K AO1 R AH0 N JH JH UW1 S B IH1 N K AA1 M B AE0 T
25,./utterance_data/speaker_W/026.wav,Would you move to Side_Table take dog_doll then come back .,would you remember to start a table take dog toe then come back,W UH1 D Y UW1 R IH0 M EH1 M B ER0 T UW1 S T AA1 R T AH0 T EY1 B AH0 L T EY1 K D AO1 G T OW1 DH EH1 N K AH1 M B AE1 K,would you move decided they both take bob dole then come back,W UH1 D Y UW1 M UW1 V D IH2 S AY1 D IH0 D DH EY1 B OW1 TH T EY1 K B AA1 B D OW1 L DH EH1 N K AH1 M B AE1 K
26,./utterance_data/speaker_W/027.wav,Go to lobby take empty_ketchup put it on Dining_Table please .,go to Lobby take empty ketchup put it on dining table please,G OW1 T UW1 L AA1 B IY0 T EY1 K EH1 M P T IY0 K EH1 CH AH0 P P UH1 T IH1 T AA1 N D AY1 N IH0 NG T EY1 B AH0 L P L IY1 Z,go to all be taken empty good job put it on dining table please,G OW1 T UW1 AO1 L B IY1 T EY1 K AH0 N EH1 M P T IY0 G UH1 D JH AA1 B P UH1 T IH1 T AA1 N D AY1 N IH0 NG T EY1 B AH0 L P L IY1 Z
27,./utterance_data/speaker_W/028.wav,Would you go to Sofa  take Cup_Star  bring it to Side_Table .,would you go to sofa take Capstar bring it to side table,W UH1 D Y UW1 G OW1 T UW1 S OW1 F AH0 T EY1 K S IY1 AH0 P IY1 EH1 S T IY1 AH0 AA1 R B R IH1 NG IH1 T T UW1 S AY1 D T EY1 B AH0 L,would you go to so far take pop star for you to set a table,W UH1 D Y UW1 G OW1 T UW1 S OW1 F AA1 R T EY1 K P AA1 P S T AA1 R F AO1 R Y UW1 T UW1 S EH1 T AH0 T EY1 B AH0 L
28,./utterance_data/speaker_W/029.wav,Go to Living_Sofa get Korean_Soup  exit from Kitchen_Room okay .,go to DD's sofa did Korean soap equidistant from Kitchen room okay,G OW1 T UW1 D IY1 D IY1 EH1 S S OW1 F AH0 D IH1 D K AO2 R IY1 AH0 N S OW1 P IY1 K Y UW1 Y UW1 AY1 D IY1 AY1 EH1 S T IY1 AH0 EH1 N T IY1 F R AH1 M K IH1 CH AH0 N R UW1 M OW2 K EY1,go to woody be so foul deed carre is solved it does is the wrong key chains on a kid,G OW1 T UW1 W UH1 D IY0 B IY1 S OW1 F AW1 L D IY1 D K AA1 R IH1 Z S AA1 L V D IH1 T D AH1 Z IH1 Z DH AH0 R AO1 NG K IY1 CH EY1 N Z AA1 N AH0 K IH1 D
29,./utterance_data/speaker_W/030.wav,Go to Bar find a person neayby  er follow a person .,go to a bar find a person nearby photo a person,G OW1 T UW1 AH0 B AA1 R F AY1 N D AH0 P ER1 S AH0 N N IH1 R B AY1 F OW1 T OW2 AH0 P ER1 S AH0 N,go to a bar fine doctor xavier pi photo op percent,G OW1 T UW1 AH0 B AA1 R F AY1 N D AA1 K T ER0 Z EY1 V Y ER0 P AY1 F OW1 T OW2 AA1 P P ER0 S EH1 N T
30,./utterance_data/speaker_W/031.wav,Can you go to lobby get canned_juice then come back .,can you go to Lobby get can choose then come back,K AE1 N Y UW1 G OW1 T UW1 L AA1 B IY0 G EH1 T K AE1 N CH UW1 Z DH EH1 N K AH1 M B AE1 K,can you go to bobbie kids can't choose then call back,K AE1 N Y UW1 G OW1 T UW1 B AA1 B IY0 K IH1 D Z K AE1 N T CH UW1 Z DH EH1 N K AO1 L B AE1 K
31,./utterance_data/speaker_W/032.wav,Well move to Living_Table Grasp Brown_Tea then come back .,well move to living table cross Bronte then come back,W EH1 L M UW1 V T UW1 L IH1 V IH0 NG T EY1 B AH0 L K R AO1 S B R AA1 N T IY0 DH EH1 N K AH1 M B AE1 K,well move to the table grosse ferrante then combat,W EH1 L M UW1 V T UW1 DH AH0 T EY1 B AH0 L G R AA1 S F ER0 AA1 N T IY0 DH EH1 N K AA1 M B AE0 T
32,./utterance_data/speaker_W/033.wav,Go to Dining_Table Grasp filled_plastic_bottle  leave the apartment please .,go to dining table Crossfield plastic photo leave the apartment please,G OW1 T UW1 D AY1 N IH0 NG T EY1 B AH0 L K R AO1 S F IY2 L D P L AE1 S T IH0 K F OW1 T OW2 L IY1 V DH AH0 AH0 P AA1 R T M AH0 N T P L IY1 Z,go to dining table grasp field to pass take a photo believe apartment peace,G OW1 T UW1 D AY1 N IH0 NG T EY1 B AH0 L G R AE1 S P F IY1 L D T UW1 P AE1 S T EY1 K AH0 F OW1 T OW2 B IH0 L IY1 V AH0 P AA1 R T M AH0 N T P IY1 S
33,./utterance_data/speaker_W/034.wav,Well move to Reception_Table Grasp Japanese_Tea then come back .,well move to reception table correspond to Penn St then come back,W EH1 L M UW1 V T UW1 R IH0 S EH1 P SH AH0 N T EY1 B AH0 L K AO2 R AH0 S P AA1 N D T UW1 P EH1 N S T R IY1 T DH EH1 N K AH1 M B AE1 K,well move to reception table grasp it to pay these g. then combat,W EH1 L M UW1 V T UW1 R IH0 S EH1 P SH AH0 N T EY1 B AH0 L G R AE1 S P IH1 T T UW1 P EY1 DH IY1 Z JH IY1 DH EH1 N K AA1 M B AE0 T
34,./utterance_data/speaker_W/035.wav,Go to lobby Grasp nursing_bottle throw it into Dustbin please .,go to lobby for Aspen nursing boat or throw it in dusting please,G OW1 T UW1 L AA1 B IY0 F AO1 R AE1 S P AH0 N N ER1 S IH0 NG B OW1 T AO1 R TH R OW1 IH1 T IH0 N D AH1 S T IH0 NG P L IY1 Z,go to all be grasp and there's a volatile therapy to the ancient lasting peace,G OW1 T UW1 AO1 L B IY1 G R AE1 S P AH0 N D DH EH1 R Z AH0 V AA1 L AH0 T AH0 L TH EH1 R AH0 P IY0 T UW1 DH AH0 EY1 N CH AH0 N T L AE1 S T IH0 NG P IY1 S
35,./utterance_data/speaker_W/036.wav,Can you go to Visitor_Room get Japanese_Tea then come back .,can you go to visitor room get Japanese tea then come back,K AE1 N Y UW1 G OW1 T UW1 V IH1 Z IH0 T ER0 R UW1 M G EH1 T JH AE2 P AH0 N IY1 Z T IY1 DH EH1 N K AH1 M B AE1 K,can you go to visit several gets japanese t. v. a comeback,K AE1 N Y UW1 G OW1 T UW1 V IH1 Z IH0 T S EH1 V R AH0 L G EH1 T S JH AE2 P AH0 N IY1 Z T IY1 V IY1 AH0 K AH1 M B AE2 K
36,./utterance_data/speaker_W/037.wav,Go to kitchen next find Cup_Noodle take it .,go to Kitchen next to find cup noodle tickets,G OW1 T UW1 K IH1 CH AH0 N N EH1 K S T T UW1 F AY1 N D K AH1 P N UW1 D AH0 L T IH1 K AH0 T S,go to teaching makes the fines caputo patriots,G OW1 T UW1 T IY1 CH IH0 NG M EY1 K S DH AH0 F AY1 N Z K AA0 P UW1 T OW0 P EY1 T R IY0 AH0 T S
37,./utterance_data/speaker_W/038.wav,Can you go to Visitor_Room get toy_penguin then come back .,can you go to visitor room get toy penguin then come back,K AE1 N Y UW1 G OW1 T UW1 V IH1 Z IH0 T ER0 R UW1 M G EH1 T T OY1 P EH1 NG G W AH0 N DH EH1 N K AH1 M B AE1 K,can you go to visit her throne gets hoyt hanging them combat,K AE1 N Y UW1 G OW1 T UW1 V IH1 Z IH0 T HH ER1 TH R OW1 N G EH1 T S HH OY1 T HH AE1 NG IH0 NG DH EH1 M K AA1 M B AE0 T
38,./utterance_data/speaker_W/039.wav,Well get Bath_Cleaner from Living_Table go to Visitor_Room go to Living_Room .,well get batch cleaner from leaving table go to visitors room go to living room,W EH1 L G EH1 T B AE1 CH K L IY1 N ER0 F R AH1 M L IY1 V IH0 NG T EY1 B AH0 L G OW1 T UW1 V IH1 Z IH0 T ER0 Z R UW1 M G OW1 T UW1 L IH1 V IH0 NG R UW1 M,well it's batch cadena of romany mean table go to resist has known go to the dijon,W EH1 L IH1 T S B AE1 CH K AH0 D IY1 N AH0 AH1 V R AA1 M AH0 N IY0 M IY1 N T EY1 B AH0 L G OW1 T UW1 R IH0 Z IH1 S T HH AE1 Z N OW1 N G OW1 T UW1 DH AH0 D IY1 ZH AA2 N
39,./utterance_data/speaker_W/040.wav,Would you go to Dining_Room Grasp pink_cup er come back .,would you go to add on your drum grasping cup comeback,W UH1 D Y UW1 G OW1 T UW1 AE1 D AA1 N Y AO1 R D R AH1 M G R AE1 S P IH0 NG K AH1 P K AH1 M B AE2 K,would you go to dine years in grasping cop said come back,W UH1 D Y UW1 G OW1 T UW1 D AY1 N Y IH1 R Z IH0 N G R AE1 S P IH0 NG K AA1 P S EH1 D K AH1 M B AE1 K
40,./utterance_data/speaker_W/041.wav,Go to Dining_Sofa  take Korean_Soup put it on Bar okay .,go to dining sofa take Korean soap put it on par okay,G OW1 T UW1 D AY1 N IH0 NG S OW1 F AH0 T EY1 K K AO2 R IY1 AH0 N S OW1 P P UH1 T IH1 T AA1 N P AA1 R OW2 K EY1,go to buy new sofa take the reins soap put it on bar okay,G OW1 T UW1 B AY1 N UW1 S OW1 F AH0 T EY1 K DH AH0 R EY1 N Z S OW1 P P UH1 T IH1 T AA1 N B AA1 R OW2 K EY1
41,./utterance_data/speaker_W/042.wav,Go to lobby take nursing_bottle put it on Bar please .,go to Lobby take snorting powder coated ombre please,G OW1 T UW1 L AA1 B IY0 T EY1 K S N AO1 R T IH0 NG P AW1 D ER0 K OW1 T AH0 D OW1 EH1 M B IY1 AA1 R IY1 P L IY1 Z,go to it'll be taken our thing volatile put it on bar peace,G OW1 T UW1 IH1 T AH0 L B IY1 T EY1 K AH0 N AW1 ER0 TH IH1 NG V AA1 L AH0 T AH0 L P UH1 T IH1 T AA1 N B AA1 R P IY1 S
42,./utterance_data/speaker_W/043.wav,Call a person then ask for an order get cubic_clock from Bar .,Co-op Parsons and ask for an odor get Cupid clock from bar,K OW1 AA2 P P AA1 R S AH0 N Z AH0 N D AE1 S K F AO1 R AE1 N OW1 D ER0 G EH1 T K Y UW1 P IH0 D K L AA1 K F R AH1 M B AA1 R,caught person then paused for an older gates cubic clock rumbaugh,K AA1 T P ER1 S AH0 N DH EH1 N P AO1 Z D F AO1 R AE1 N OW1 L D ER0 G EY1 T S K Y UW1 B IH0 K K L AA1 K R AH1 M B AO2
43,./utterance_data/speaker_W/044.wav,Go to Corridor get Red_Tea throw it into Dustbin please .,go to Corridor Gatorade T throw it into the steam please,G OW1 T UW1 K AO1 R AH0 D ER0 G AE1 T ER0 EY2 D T IY1 TH R OW1 IH1 T IH1 N T UW0 DH AH0 S T IY1 M P L IY1 Z,go to korea don't get to read see steroids painted lasting peace,G OW1 T UW1 K AO2 R IY1 AH0 D OW1 N T G EH1 T T UW1 R EH1 D S IY1 S T EH1 R OY0 D Z P EY1 N T IH0 D L AE1 S T IH0 NG P IY1 S
44,./utterance_data/speaker_W/045.wav,Go to Kitchen_Room  go to Dining_Sofa er leave the apartment .,go to Kitchen room go to dining sofa leave the apartments,G OW1 T UW1 K IH1 CH AH0 N R UW1 M G OW1 T UW1 D AY1 N IH0 NG S OW1 F AH0 L IY1 V DH AH0 AH0 P AA1 R T M AH0 N T S,go to teachers room go to buy news so far neither apartments,G OW1 T UW1 T IY1 CH ER0 Z R UW1 M G OW1 T UW1 B AY1 N UW1 Z S OW1 F AA1 R N IY1 DH ER0 AH0 P AA1 R T M AH0 N T S
45,./utterance_data/speaker_W/046.wav,Go to Side_Table find a person neayby  er follow a person .,go to side table find a person nearby photo of person,G OW1 T UW1 S AY1 D T EY1 B AH0 L F AY1 N D AH0 P ER1 S AH0 N N IH1 R B AY1 F OW1 T OW2 AH1 V P ER1 S AH0 N,good to size table wine doctor xavier by a photo op parson,G UH1 D T UW1 S AY1 Z T EY1 B AH0 L W AY1 N D AA1 K T ER0 Z EY1 V Y ER0 B AY1 AH0 F OW1 T OW2 AA1 P P AA1 R S AH0 N
46,./utterance_data/speaker_W/047.wav,Move to Kitchen_Table  go to Living_Sofa then exit the apartment .,multiplication table go to leaving sofa then it exists Apartments,M AH2 L T AH0 P L AH0 K EY1 SH AH0 N T EY1 B AH0 L G OW1 T UW1 L IY1 V IH0 NG S OW1 F AH0 DH EH1 N IH1 T IH0 G Z IH1 S T S AH0 P AA1 R T M AH0 N T S,multiplication tables go to a baby so far been a vistas of pop continents,M AH2 L T AH0 P L AH0 K EY1 SH AH0 N T EY1 B AH0 L Z G OW1 T UW1 AH0 B EY1 B IY0 S OW1 F AA1 R B IH1 N AH0 V IH1 S T AH0 Z AH1 V P AA1 P K AA1 N T AH0 N AH0 N T S
47,./utterance_data/speaker_W/048.wav,Go to Living_Sofa  take filled_ketchup put it on Kitchen_Table okay .,go to living sofa take field ketchup put it on kitchen table okay,G OW1 T UW1 L IH1 V IH0 NG S OW1 F AH0 T EY1 K F IY1 L D K EH1 CH AH0 P P UH1 T IH1 T AA1 N K IH1 CH AH0 N T EY1 B AH0 L OW2 K EY1,go to remain so far take failed to job put it on kitchen table okay,G OW1 T UW1 R IH0 M EY1 N S OW1 F AA1 R T EY1 K F EY1 L D T UW1 JH AA1 B P UH1 T IH1 T AA1 N K IH1 CH AH0 N T EY1 B AH0 L OW2 K EY1
48,./utterance_data/speaker_W/049.wav,Can you move to Kitchen_Table get rabbit_doll then come back .,can you move to kitchen table get to Rapid thaw then come back,K AE1 N Y UW1 M UW1 V T UW1 K IH1 CH AH0 N T EY1 B AH0 L G EH1 T T UW1 R AE1 P AH0 D TH AO1 DH EH1 N K AH1 M B AE1 K,can you move to teach and save o. j. to read it to all of a combat,K AE1 N Y UW1 M UW1 V T UW1 T IY1 CH AH0 N D S EY1 V OW1 JH EY1 T UW1 R EH1 D IH1 T T UW1 AO1 L AH1 V AH0 K AA1 M B AE0 T
49,./utterance_data/speaker_W/050.wav,Well get toy_car from Sofa go to bed_room move to Living_Table .,wellgate toy car from sofa go to a bathroom move to living tab,D AH1 B AH0 L Y UW0 IY1 EH1 L EH1 L JH IY1 AH0 T IY1 IY1 T OY1 K AA1 R F R AH1 M S OW1 F AH0 G OW1 T UW1 AH0 B AE1 TH R UW2 M M UW1 V T UW1 L IH1 V IH0 NG T AE1 B,well it's toy car fromm so far though two bedrooms moved to the table,W EH1 L IH1 T S T OY1 K AA1 R F R AA1 M S OW1 F AA1 R DH OW1 T UW1 B EH1 D R UW2 M Z M UW1 V D T UW1 DH AH0 T EY1 B AH0 L
50,./utterance_data/speaker_W/051.wav,Go to Side_Table next detect toy_duck  take it .,go to side table next to detective toy dog take it,G OW1 T UW1 S AY1 D T EY1 B AH0 L N EH1 K S T T UW1 D IH0 T EH1 K T IH0 V T OY1 D AO1 G T EY1 K IH1 T,go to side table next that detective hoyt doc take it beats,G OW1 T UW1 S AY1 D T EY1 B AH0 L N EH1 K S T DH AE1 T D IH0 T EH1 K T IH0 V HH OY1 T D AA1 K T EY1 K IH1 T B IY1 T S
51,./utterance_data/speaker_W/052.wav,Go to Visitor_Room get toy_penguin throw it into Dustbin please .,go to Avatar room get toy penguin throw it into casting please,G OW1 T UW1 AE1 V AH0 T AA2 R R UW1 M G EH1 T T OY1 P EH1 NG G W AH0 N TH R OW1 IH1 T IH1 N T UW0 K AE1 S T IH0 NG P L IY1 Z,go to obey the third row gates toyed hankering for you to pinto lasting peace,G OW1 T UW1 OW0 B EY1 DH AH0 TH ER1 D R OW1 G EY1 T S T OY1 D HH AE1 NG K ER0 IH0 NG F AO1 R Y UW1 T UW1 P IH1 N T OW2 L AE1 S T IH0 NG P IY1 S
52,./utterance_data/speaker_W/053.wav,Would you move to Dining_Sofa get hourglass bring it to Side_Table .,would you move to a dining sofa get our class bring it to side table,W UH1 D Y UW1 M UW1 V T UW1 AH0 D AY1 N IH0 NG S OW1 F AH0 G EH1 T AW1 ER0 K L AE1 S B R IH1 NG IH1 T T UW1 S AY1 D T EY1 B AH0 L,that would you move it to the chinese sofa gates argonauts brain needs to side table,DH AE1 T W UH1 D Y UW1 M UW1 V IH1 T T UW1 DH AH0 CH AY0 N IY1 Z S OW1 F AH0 G EY1 T S AA1 R G AH0 N AO2 T S B R EY1 N N IY1 D Z T UW1 S AY1 D T EY1 B AH0 L
53,./utterance_data/speaker_W/054.wav,Would you move to Bar Grasp rubik's_cube and come back .,would you move to ba grasper Rubik's Cube and the comeback,W UH1 D Y UW1 M UW1 V T UW1 B IY2 EY1 JH IY1 AA1 R AH0 EH1 S P IY1 IY1 AA1 R R UW1 B IH0 K S K Y UW1 B AH0 N D DH AH0 K AH1 M B AE2 K,would you move to our grasp of rapids cuba and to call back,W UH1 D Y UW1 M UW1 V T UW1 AW1 ER0 G R AE1 S P AH1 V R AE1 P AH0 D Z K Y UW1 B AH0 AH0 N D T UW1 K AO1 L B AE1 K
54,./utterance_data/speaker_W/055.wav,Go to Kitchen_Room Grasp camera throw it into Dustbin please .,go to Kitchen room crossbow camera throw it into dusting please,G OW1 T UW1 K IH1 CH AH0 N R UW1 M K R AO1 S B OW2 K AE1 M ER0 AH0 TH R OW1 IH1 T IH1 N T UW0 D AH1 S T IH0 NG P L IY1 Z,go to peter jones or osgood camera thorough eats into the lasting peace,G OW1 T UW1 P IY1 T ER0 JH OW1 N Z AO1 R AA1 S G UH2 D K AE1 M ER0 AH0 TH ER1 OW0 IY1 T S IH1 N T UW0 DH AH0 L AE1 S T IH0 NG P IY1 S
