,filename,original_sentence,google_word,google_phoneme,sphinx_word,sphinx_phoneme
55,./utterance_data/speaker_W/056.wav,Would you go to Sofa take Chip_Star er come back .,would you go to a sofa take cheap star combat,W UH1 D Y UW1 G OW1 T UW1 AH0 S OW1 F AH0 T EY1 K CH IY1 P S T AA1 R K AA1 M B AE0 T,would you go to a sofa take shape spa call back,W UH1 D Y UW1 G OW1 T UW1 AH0 S OW1 F AH0 T EY1 K SH EY1 P S P AA1 K AO1 L B AE1 K
56,./utterance_data/speaker_W/057.wav,Go to Visitor_Room next find apple Grasp it .,go to visitors room next to find Apple grow speeds,G OW1 T UW1 V IH1 Z IH0 T ER0 Z R UW1 M N EH1 K S T T UW1 F AY1 N D AE1 P AH0 L G R OW1 S P IY1 D Z,go to a visitor's room next to finds apple grosse beats,G OW1 T UW1 AH0 V IH1 Z IH0 T ER0 Z R UW1 M N EH1 K S T T UW1 F AY1 N D Z AE1 P AH0 L G R AA1 S B IY1 T S
57,./utterance_data/speaker_W/058.wav,Well go to Kitchen_Table  take dog_doll finally come back .,well go to the kitchen table take dog dog finally come back,W EH1 L G OW1 T UW1 DH AH0 K IH1 CH AH0 N T EY1 B AH0 L T EY1 K D AO1 G D AO1 G F AY1 N AH0 L IY0 K AH1 M B AE1 K,well go to teach a table take book fell by many com back,W EH1 L G OW1 T UW1 T IY1 CH AH0 T EY1 B AH0 L T EY1 K B UH1 K F EH1 L B AY1 M EH1 N IY0 K AA1 M B AE1 K
58,./utterance_data/speaker_W/059.wav,Would you go to Kitchen_Table  take rubik's_cube  bring it to Dining_Table .,what do you go to kitchen table take Rob xcube bring it to dining table,W AH1 T D UW1 Y UW1 G OW1 T UW1 K IH1 CH AH0 N T EY1 B AH0 L T EY1 K R AA1 B EH1 K S S IY1 Y UW1 B IY1 IY1 B R IH1 NG IH1 T T UW1 D AY1 N IH0 NG T EY1 B AH0 L,what do you go to the kitchen table take robbins kiev bright needs to dining table,W AH1 T D UW1 Y UW1 G OW1 T UW1 DH AH0 K IH1 CH AH0 N T EY1 B AH0 L T EY1 K R AA1 B IH0 N Z K IY2 EH1 V B R AY1 T N IY1 D Z T UW1 D AY1 N IH0 NG T EY1 B AH0 L
59,./utterance_data/speaker_W/060.wav,Well move to Living_Sofa get empty_plastic_bottle and come back .,well move to living sofa get empty plastic bottle and the comeback,W EH1 L M UW1 V T UW1 L IH1 V IH0 NG S OW1 F AH0 G EH1 T EH1 M P T IY0 P L AE1 S T IH0 K B AA1 T AH0 L AH0 N D DH AH0 K AH1 M B AE2 K,well move to tv so far gate empty plastic a volatile and the com back,W EH1 L M UW1 V T UW1 T IY1 V IY1 S OW1 F AA1 R G EY1 T EH1 M P T IY0 P L AE1 S T IH0 K AH0 V AA1 L AH0 T AH0 L AH0 N D DH AH0 K AA1 M B AE1 K
60,./utterance_data/speaker_W/061.wav,Go to Kitchen_Table find a person neayby  er follow a person .,go to kitchen table find a person nearby photo up person,G OW1 T UW1 K IH1 CH AH0 N T EY1 B AH0 L F AY1 N D AH0 P ER1 S AH0 N N IH1 R B AY1 F OW1 T OW2 AH1 P P ER1 S AH0 N,goto kitchen table find that a person year by the role of the present,G OW1 T UW2 K IH1 CH AH0 N T EY1 B AH0 L F AY1 N D DH AE1 T AH0 P ER1 S AH0 N Y IH1 R B AY1 DH AH0 R OW1 L AH1 V DH AH0 P R EH1 Z AH0 N T
61,./utterance_data/speaker_W/062.wav,Go to Living_Room get Blue_Potato throw it into Dustbin please .,go to the living room gets blue potato throw it into dusting please,G OW1 T UW1 DH AH0 L IH1 V IH0 NG R UW1 M G EH1 T S B L UW1 P AH0 T EY1 T OW2 TH R OW1 IH1 T IH1 N T UW0 D AH1 S T IH0 NG P L IY1 Z,go to woody mia film gates blue potato thoroughly it's being sued by steam peace,G OW1 T UW1 W UH1 D IY0 M IY1 AH0 F IH1 L M G EY1 T S B L UW1 P AH0 T EY1 T OW2 TH ER1 OW0 L IY0 IH1 T S B IY1 IH0 NG S UW1 D B AY1 S T IY1 M P IY1 S
62,./utterance_data/speaker_W/063.wav,Can you go to kitchen Grasp bear_doll  bring it to Living_Table .,can you go to Kuching Hospital bring it to living table,K AE1 N Y UW1 G OW1 T UW1 K EY1 Y UW1 S IY1 EY1 CH AY1 EH1 N JH IY1 HH AA1 S P IH2 T AH0 L B R IH1 NG IH1 T T UW1 L IH1 V IH0 NG T EY1 B AH0 L,can you go to teaching grasp beira da brain it's judy the table,K AE1 N Y UW1 G OW1 T UW1 T IY1 CH IH0 NG G R AE1 S P B EY1 R AH0 D AA1 B R EY1 N IH1 T S JH UW1 D IY0 DH AH0 T EY1 B AH0 L
63,./utterance_data/speaker_W/064.wav,Would you go to lobby Grasp pink_cup finally come back .,would you go to the ob grasping cup finally come back,W UH1 D Y UW1 G OW1 T UW1 DH AH0 OW1 B IY1 G R AE1 S P IH0 NG K AH1 P F AY1 N AH0 L IY0 K AH1 M B AE1 K,good to go to bobbie grasp pink cop find any combat,G UH1 D T UW1 G OW1 T UW1 B AA1 B IY0 G R AE1 S P P IH1 NG K K AA1 P F AY1 N D EH1 N IY0 K AA1 M B AE0 T
64,./utterance_data/speaker_W/065.wav,Move to Dining_Table  Grasp hourglass  leave the apartment please .,move to dining table hourglass leave the apartment please,M UW1 V T UW1 D AY1 N IH0 NG T EY1 B AH0 L AW1 ER0 G L AE2 S L IY1 V DH AH0 AH0 P AA1 R T M AH0 N T P L IY1 Z,move to the dining table grasp of our gods heaved apartment peace,M UW1 V T UW1 DH AH0 D AY1 N IH0 NG T EY1 B AH0 L G R AE1 S P AH1 V AW1 ER0 G AA1 D Z HH IY1 V D AH0 P AA1 R T M AH0 N T P IY1 S
65,./utterance_data/speaker_W/066.wav,Would you go to Dining_Sofa get Cloth_Cleaner carry it to Living_Table .,would you go to Tanya sofa get clothes cleaner carrot to living table,W UH1 D Y UW1 G OW1 T UW1 T AA1 N Y AH0 S OW1 F AH0 G EH1 T K L OW1 DH Z K L IY1 N ER0 K AE1 R AH0 T T UW1 L IH1 V IH0 NG T EY1 B AH0 L,would you go to a tiny so far it can waltz cutting are carried to the table,W UH1 D Y UW1 G OW1 T UW1 AH0 T AY1 N IY0 S OW1 F AA1 R IH1 T K AE1 N W AO1 L T S K AH1 T IH0 NG AA1 R K AE1 R IY0 D T UW1 DH AH0 T EY1 B AH0 L
66,./utterance_data/speaker_W/067.wav,Go to Visitor_Room next find toy_car take it .,go to visit our room next to find toy car tickets,G OW1 T UW1 V IH1 Z IH0 T AW1 ER0 R UW1 M N EH1 K S T T UW1 F AY1 N D T OY1 K AA1 R T IH1 K AH0 T S,total visitors' room next to find toy car to gates,T OW1 T AH0 L V IH1 Z IH0 T ER0 Z R UW1 M N EH1 K S T T UW1 F AY1 N D T OY1 K AA1 R T UW1 G EY1 T S
67,./utterance_data/speaker_W/068.wav,Go to Dining_Room  go to Side_Table then exit the apartment .,go to the dining room go to the side the table then it exists as Apartments,G OW1 T UW1 DH AH0 D AY1 N IH0 NG R UW1 M G OW1 T UW1 DH AH0 S AY1 D DH AH0 T EY1 B AH0 L DH EH1 N IH1 T IH0 G Z IH1 S T S AE1 Z AH0 P AA1 R T M AH0 N T S,go to the dining room good society table then he does is to zapata months,G OW1 T UW1 DH AH0 D AY1 N IH0 NG R UW1 M G UH1 D S AH0 S AY1 AH0 T IY0 T EY1 B AH0 L DH EH1 N HH IY1 D AH1 Z IH1 Z T UW1 Z AA0 P AA1 T AH0 M AH1 N TH S
68,./utterance_data/speaker_W/069.wav,Go to Dining_Room go to Living_Table  and exit from Visitor_Room .,go to dining room go to the living table at Vista from Oviedo,G OW1 T UW1 D AY1 N IH0 NG R UW1 M G OW1 T UW1 DH AH0 L IH1 V IH0 NG T EY1 B AH0 L AE1 T V IH1 S T AH0 F R AH1 M OW0 V IY0 EY1 D OW0,go to die news room go to the b. table and it is the problem is eternal,G OW1 T UW1 D AY1 N UW1 Z R UW1 M G OW1 T UW1 DH AH0 B IY1 T EY1 B AH0 L AH0 N D IH1 T IH1 Z DH AH0 P R AA1 B L AH0 M IH1 Z IH0 T ER1 N AH0 L
69,./utterance_data/speaker_W/070.wav,Go to Dining_Sofa find a person neayby  er follow a person .,go to dining sofa find a person nearby photo of person,G OW1 T UW1 D AY1 N IH0 NG S OW1 F AH0 F AY1 N D AH0 P ER1 S AH0 N N IH1 R B AY1 F OW1 T OW2 AH1 V P ER1 S AH0 N,good to buy new sofa find a person year by photo op prison,G UH1 D T UW1 B AY1 N UW1 S OW1 F AH0 F AY1 N D AH0 P ER1 S AH0 N Y IH1 R B AY1 F OW1 T OW2 AA1 P P R IH1 Z AH0 N
70,./utterance_data/speaker_W/071.wav,Call a person then ask for an order get Cloth_Cleaner from Dining_Table .,call a person then ask for an older get clothes cleaner from a dining table,K AO1 L AH0 P ER1 S AH0 N DH EH1 N AE1 S K F AO1 R AE1 N OW1 L D ER0 G EH1 T K L OW1 DH Z K L IY1 N ER0 F R AH1 M AH0 D AY1 N IH0 NG T EY1 B AH0 L,call up her isn't there law school and border states colonels could either from a dining table,K AO1 L AH1 P HH ER1 IH1 Z AH0 N T DH EH1 R L AO1 S K UW1 L AH0 N D B AO1 R D ER0 S T EY1 T S K ER1 N AH0 L Z K UH1 D IY1 DH ER0 F R AH1 M AH0 D AY1 N IH0 NG T EY1 B AH0 L
71,./utterance_data/speaker_W/072.wav,Go to Bar  take spray_bottle put it on Dining_Sofa okay .,go to a bar take spray bottle put it on dining sofa okay,G OW1 T UW1 AH0 B AA1 R T EY1 K S P R EY1 B AA1 T AH0 L P UH1 T IH1 T AA1 N D AY1 N IH0 NG S OW1 F AH0 OW2 K EY1,good to bar takes parade boats all put it on chinese so far okay,G UH1 D T UW1 B AA1 R T EY1 K S P ER0 EY1 D B OW1 T S AO1 L P UH1 T IH1 T AA1 N CH AY0 N IY1 Z S OW1 F AA1 R OW2 K EY1
72,./utterance_data/speaker_W/073.wav,Move to Living_Table  Grasp sauce  leave the apartment please .,move to living table crossbow Source leave the apartment please,M UW1 V T UW1 L IH1 V IH0 NG T EY1 B AH0 L K R AO1 S B OW2 S AO1 R S L IY1 V DH AH0 AH0 P AA1 R T M AH0 N T P L IY1 Z,move to the table carrasco souls leave the apartment please,M UW1 V T UW1 DH AH0 T EY1 B AH0 L K AA0 R AA1 S K OW0 S OW1 L Z L IY1 V DH AH0 AH0 P AA1 R T M AH0 N T P L IY1 Z
73,./utterance_data/speaker_W/074.wav,Go to kitchen  move to Kitchen_Table  finally leave the apartment .,go to Kitchen move to kitchen table finally leave the apartment,G OW1 T UW1 K IH1 CH AH0 N M UW1 V T UW1 K IH1 CH AH0 N T EY1 B AH0 L F AY1 N AH0 L IY0 L IY1 V DH AH0 AH0 P AA1 R T M AH0 N T,go to a cage and moved to a kitchen table five and indeed develop apartments,G OW1 T UW1 AH0 K EY1 JH AH0 N D M UW1 V D T UW1 AH0 K IH1 CH AH0 N T EY1 B AH0 L F AY1 V AH0 N D IH2 N D IY1 D D IH0 V EH1 L AH0 P AH0 P AA1 R T M AH0 N T S
74,./utterance_data/speaker_W/075.wav,Go to Dining_Sofa and find a person neayby bring dog_doll from Living_Table .,go to a dining sofa and the find a person nearby brain talked out from leaving table,G OW1 T UW1 AH0 D AY1 N IH0 NG S OW1 F AH0 AH0 N D DH AH0 F AY1 N D AH0 P ER1 S AH0 N N IH1 R B AY1 B R EY1 N T AO1 K T AW1 T F R AH1 M L IY1 V IH0 NG T EY1 B AH0 L,go to the chinese sofa and a fine doctor xavier pi brain doctor al fromm would be the table,G OW1 T UW1 DH AH0 CH AY0 N IY1 Z S OW1 F AH0 AH0 N D AH0 F AY1 N D AA1 K T ER0 Z EY1 V Y ER0 P AY1 B R EY1 N D AA1 K T ER0 AE1 L F R AA1 M W UH1 D B IY1 DH AH0 T EY1 B AH0 L
75,./utterance_data/speaker_W/076.wav,Would you go to Sofa get Lemon_Tea carry it to Dining_Table .,would you go to sofa get lemon she carried to dining table,W UH1 D Y UW1 G OW1 T UW1 S OW1 F AH0 G EH1 T L EH1 M AH0 N SH IY1 K AE1 R IY0 D T UW1 D AY1 N IH0 NG T EY1 B AH0 L,would you go to so did the name of g. carried to the dining table,W UH1 D Y UW1 G OW1 T UW1 S OW1 D IH1 D DH AH0 N EY1 M AH1 V JH IY1 K AE1 R IY0 D T UW1 DH AH0 D AY1 N IH0 NG T EY1 B AH0 L
76,./utterance_data/speaker_W/077.wav,Go to Kitchen_Room  find a person neayby  finally follow a person .,go to kitchenramma find a person nearby finally photo of person,G OW1 T UW1 K EY1 AY1 T IY1 S IY1 EY1 CH IY1 EH1 N AA1 R AH0 EH1 M EH1 M AH0 F AY1 N D AH0 P ER1 S AH0 N N IH1 R B AY1 F AY1 N AH0 L IY0 F OW1 T OW2 AH1 V P ER1 S AH0 N,go to gauges i'm find operas the nearby find an evil person,G OW1 T UW1 G EY1 JH AH0 Z AY1 M F AY1 N D AA1 P R AH0 Z DH AH0 N IH1 R B AY1 F AY1 N D AE1 N IY1 V AH0 L P ER1 S AH0 N
77,./utterance_data/speaker_W/078.wav,Go to kitchen  find a person neayby  finally follow a person .,go to Kitchen find a person nearby finally photo of person,G OW1 T UW1 K IH1 CH AH0 N F AY1 N D AH0 P ER1 S AH0 N N IH1 R B AY1 F AY1 N AH0 L IY0 F OW1 T OW2 AH1 V P ER1 S AH0 N,go to teach and find out for the nearby by many vote all parts of,G OW1 T UW1 T IY1 CH AH0 N D F AY1 N D AW1 T F AO1 R DH AH0 N IH1 R B AY1 B AY1 M EH1 N IY0 V OW1 T AO1 L P AA1 R T S AH1 V
78,./utterance_data/speaker_W/079.wav,Go to Dining_Room er find a person neayby bring camera from Dining_Table .,go to a dining room find a person nearby bring camera from dining table,G OW1 T UW1 AH0 D AY1 N IH0 NG R UW1 M F AY1 N D AH0 P ER1 S AH0 N N IH1 R B AY1 B R IH1 NG K AE1 M ER0 AH0 F R AH1 M D AY1 N IH0 NG T EY1 B AH0 L,go to the dining room finds our present year by brain camera fromm dining table,G OW1 T UW1 DH AH0 D AY1 N IH0 NG R UW1 M F AY1 N D Z AW1 ER0 P R EH1 Z AH0 N T Y IH1 R B AY1 B R EY1 N K AE1 M ER0 AH0 F R AA1 M D AY1 N IH0 NG T EY1 B AH0 L
79,./utterance_data/speaker_W/080.wav,Go to Visitor_Room Grasp nursing_bottle throw it into Dustbin please .,go to visitor Drum Corps Aspen nursing boat or throw it into a dusting please,G OW1 T UW1 V IH1 Z IH0 T ER0 D R AH1 M K AO1 R AE1 S P AH0 N N ER1 S IH0 NG B OW1 T AO1 R TH R OW1 IH1 T IH1 N T UW0 AH0 D AH1 S T IH0 NG P L IY1 Z,go to visit sir john ross put our same boat so thoroughly to each of us the peace,G OW1 T UW1 V IH1 Z IH0 T S ER1 JH AA1 N R AA1 S P UH1 T AW1 ER0 S EY1 M B OW1 T S OW1 TH ER1 OW0 L IY0 T UW1 IY1 CH AH1 V AH1 S DH AH0 P IY1 S
80,./utterance_data/speaker_W/081.wav,Go to Living_Room next find Lemon_Tea take it .,go to living room next to find La Monte tickets,G OW1 T UW1 L IH1 V IH0 NG R UW1 M N EH1 K S T T UW1 F AY1 N D L AA1 M AA1 N T IY0 T IH1 K AH0 T S,go to a devious room next to find them on t. k. kids,G OW1 T UW1 AH0 D IY1 V IY0 AH0 S R UW1 M N EH1 K S T T UW1 F AY1 N D DH EH1 M AA1 N T IY1 K EY1 K IH1 D Z
81,./utterance_data/speaker_W/082.wav,Go to Dining_Sofa take Red_Potato  leave the apartment please .,go to the dining sofa take red potato leave the apartment please,G OW1 T UW1 DH AH0 D AY1 N IH0 NG S OW1 F AH0 T EY1 K R EH1 D P AH0 T EY1 T OW2 L IY1 V DH AH0 AH0 P AA1 R T M AH0 N T P L IY1 Z,go to the dining sofa take rate potato believe that apartment please,G OW1 T UW1 DH AH0 D AY1 N IH0 NG S OW1 F AH0 T EY1 K R EY1 T P AH0 T EY1 T OW2 B IH0 L IY1 V DH AE1 T AH0 P AA1 R T M AH0 N T P L IY1 Z
82,./utterance_data/speaker_W/083.wav,Would you go to Bar  take Red_Potato  bring it to Dining_Table .,or do you go to a bar take red potato Bryant to dining table,AO1 R D UW1 Y UW1 G OW1 T UW1 AH0 B AA1 R T EY1 K R EH1 D P AH0 T EY1 T OW2 B R AY1 AH0 N T T UW1 D AY1 N IH0 NG T EY1 B AH0 L,what do you go too far take to read potato rights to a dining table,W AH1 T D UW1 Y UW1 G OW1 T UW1 F AA1 R T EY1 K T UW1 R EH1 D P AH0 T EY1 T OW2 R AY1 T S T UW1 AH0 D AY1 N IH0 NG T EY1 B AH0 L
83,./utterance_data/speaker_W/084.wav,Well move to Reception_Table Grasp Japanese_Dressing then come back .,well move to the reception table garage Japanese tracing then come back,W EH1 L M UW1 V T UW1 DH AH0 R IH0 S EH1 P SH AH0 N T EY1 B AH0 L G ER0 AA1 ZH JH AE2 P AH0 N IY1 Z T R EY1 S IH0 NG DH EH1 N K AH1 M B AE1 K,well move to their inception table crossed to the news jersey than combat,W EH1 L M UW1 V T UW1 DH EH1 R IH2 N S EH1 P SH AH0 N T EY1 B AH0 L K R AO1 S T T UW1 DH AH0 N UW1 Z JH ER1 Z IY0 DH AE1 N K AA1 M B AE0 T
84,./utterance_data/speaker_W/085.wav,Would you go to lobby Grasp toy_penguin finally come back .,would you go to Lobby grasp toys penguin finally come back,W UH1 D Y UW1 G OW1 T UW1 L AA1 B IY0 G R AE1 S P T OY1 Z P EH1 NG G W AH0 N F AY1 N AH0 L IY0 K AH1 M B AE1 K,what do yoga jalopy grosse pointe henry hyde any combat,W AH1 T D UW1 Y OW1 G AH0 JH AH0 L AA1 P IY0 G R AA1 S P OY1 N T HH EH1 N R IY0 HH AY1 D EH1 N IY0 K AA1 M B AE0 T
85,./utterance_data/speaker_W/086.wav,Go to lobby er find a person neayby bring cubic_clock from Sofa .,go to the lobby find a person nearby brain cubic clock from sofa,G OW1 T UW1 DH AH0 L AA1 B IY0 F AY1 N D AH0 P ER1 S AH0 N N IH1 R B AY1 B R EY1 N K Y UW1 B IH0 K K L AA1 K F R AH1 M S OW1 F AH0,go to bobbie finds all present nearby brain cubic clock fromm so far,G OW1 T UW1 B AA1 B IY0 F AY1 N D Z AO1 L P R EH1 Z AH0 N T N IH1 R B AY1 B R EY1 N K Y UW1 B IH0 K K L AA1 K F R AA1 M S OW1 F AA1 R
86,./utterance_data/speaker_W/087.wav,Well get Egg_Soup from Sofa go to Visitor_Room move to Dining_Table .,well get egg soap from sofa go to avatars room move to a dining table,W EH1 L G EH1 T EH1 G S OW1 P F R AH1 M S OW1 F AH0 G OW1 T UW1 AE1 V AH0 T AA2 R Z R UW1 M M UW1 V T UW1 AH0 D AY1 N IH0 NG T EY1 B AH0 L,well it takes over fromm sofa go to vista arizona moved to a dining table,W EH1 L IH1 T T EY1 K S OW1 V ER0 F R AA1 M S OW1 F AH0 G OW1 T UW1 V IH1 S T AH0 EH2 R IH0 Z OW1 N AH0 M UW1 V D T UW1 AH0 D AY1 N IH0 NG T EY1 B AH0 L
87,./utterance_data/speaker_W/088.wav,Move to Dining_Table  go to Sofa then exit the apartment .,move to dining table go to sofa then because it's the apartments,M UW1 V T UW1 D AY1 N IH0 NG T EY1 B AH0 L G OW1 T UW1 S OW1 F AH0 DH EH1 N B IH0 K AO1 Z IH1 T S DH AH0 AH0 P AA1 R T M AH0 N T S,move to the dining table go to the sofa did exist as apartments,M UW1 V T UW1 DH AH0 D AY1 N IH0 NG T EY1 B AH0 L G OW1 T UW1 DH AH0 S OW1 F AH0 D IH1 D IH0 G Z IH1 S T AE1 Z AH0 P AA1 R T M AH0 N T S
88,./utterance_data/speaker_W/089.wav,Move to Living_Table get salt place it on Bar okay .,move to living table get swords place it's on par okay,M UW1 V T UW1 L IH1 V IH0 NG T EY1 B AH0 L G EH1 T S AO1 R D Z P L EY1 S IH1 T S AA1 N P AA1 R OW2 K EY1,move to the table did salts today seats on bar okay,M UW1 V T UW1 DH AH0 T EY1 B AH0 L D IH1 D S AO1 L T S T AH0 D EY1 S IY1 T S AA1 N B AA1 R OW2 K EY1
89,./utterance_data/speaker_W/090.wav,Go to Visitor_Room next find Strawberry_Juice take it .,go to visitors room next to find strawberry juice,G OW1 T UW1 V IH1 Z IH0 T ER0 Z R UW1 M N EH1 K S T T UW1 F AY1 N D S T R AO1 B EH2 R IY0 JH UW1 S,go to a visitor from next to find strawberry juice pay keats,G OW1 T UW1 AH0 V IH1 Z IH0 T ER0 F R AH1 M N EH1 K S T T UW1 F AY1 N D S T R AO1 B EH2 R IY0 JH UW1 S P EY1 K IY1 T S
90,./utterance_data/speaker_W/091.wav,Go to Corridor take toy_duck put it on Reception_Table please .,go to Corridor take toy dog put it on reception table please,G OW1 T UW1 K AO1 R AH0 D ER0 T EY1 K T OY1 D AO1 G P UH1 T IH1 T AA1 N R IH0 S EH1 P SH AH0 N T EY1 B AH0 L P L IY1 Z,go to great or take toy dark put it on reception table please,G OW1 T UW1 G R EY1 T AO1 R T EY1 K T OY1 D AA1 R K P UH1 T IH1 T AA1 N R IH0 S EH1 P SH AH0 N T EY1 B AH0 L P L IY1 Z
91,./utterance_data/speaker_W/092.wav,Well go to Dining_Sofa  take Cup_Noodle finally come back .,well go to a dining sofa take cup noodle finally call me back,W EH1 L G OW1 T UW1 AH0 D AY1 N IH0 NG S OW1 F AH0 T EY1 K K AH1 P N UW1 D AH0 L F AY1 N AH0 L IY0 K AO1 L M IY1 B AE1 K,well go to buy new sofa take cop do it all fine and a comeback,W EH1 L G OW1 T UW1 B AY1 N UW1 S OW1 F AH0 T EY1 K K AA1 P D UW1 IH1 T AO1 L F AY1 N AH0 N D AH0 K AH1 M B AE2 K
92,./utterance_data/speaker_W/093.wav,Go to kitchen  go to Living_Sofa er leave the apartment .,go to Kitchen go to living sofa leave the apartment,G OW1 T UW1 K IH1 CH AH0 N G OW1 T UW1 L IH1 V IH0 NG S OW1 F AH0 L IY1 V DH AH0 AH0 P AA1 R T M AH0 N T,go to teach and go to tv so far where the leaves of apartments,G OW1 T UW1 T IY1 CH AH0 N D G OW1 T UW1 T IY1 V IY1 S OW1 F AA1 R W EH1 R DH AH0 L IY1 V Z AH1 V AH0 P AA1 R T M AH0 N T S
93,./utterance_data/speaker_W/094.wav,Go to lobby get empty_plastic_bottle throw it into Dustbin please .,go to Lobby get empty plastic photo throw it into Dustin please,G OW1 T UW1 L AA1 B IY0 G EH1 T EH1 M P T IY0 P L AE1 S T IH0 K F OW1 T OW2 TH R OW1 IH1 T IH1 N T UW0 D AH1 S T IH0 N P L IY1 Z,go to bobbie it's empty plastic bottle thorough eats into a vast increase,G OW1 T UW1 B AA1 B IY0 IH1 T S EH1 M P T IY0 P L AE1 S T IH0 K B AA1 T AH0 L TH ER1 OW0 IY1 T S IH1 N T UW0 AH0 V AE1 S T IH2 N K R IY1 S
94,./utterance_data/speaker_W/095.wav,Would you go to lobby Grasp soysauce er come back .,what do you go to Lobby grass put soy sauce or come back,W AH1 T D UW1 Y UW1 G OW1 T UW1 L AA1 B IY0 G R AE1 S P UH1 T S OY1 S AO1 S AO1 R K AH1 M B AE1 K,what do you go to bobbie grasp the soy sauce air combat,W AH1 T D UW1 Y UW1 G OW1 T UW1 B AA1 B IY0 G R AE1 S P DH AH0 S OY1 S AO1 S EH1 R K AA1 M B AE0 T
95,./utterance_data/speaker_W/096.wav,Go to Kitchen_Room get twin_bell_alarm_clock throw it into Dustbin please .,go to the kitchen room get twin Bell alarm clock throw it into a dusting please,G OW1 T UW1 DH AH0 K IH1 CH AH0 N R UW1 M G EH1 T T W IH1 N B EH1 L AH0 L AA1 R M K L AA1 K TH R OW1 IH1 T IH1 N T UW0 AH0 D AH1 S T IH0 NG P L IY1 Z,good to teach his own gates train bell are on caulk zero eating into a vast increase,G UH1 D T UW1 T IY1 CH HH IH1 Z OW1 N G EY1 T S T R EY1 N B EH1 L AA1 R AA1 N K AA1 K Z IH1 R OW0 IY1 T IH0 NG IH1 N T UW0 AH0 V AE1 S T IH2 N K R IY1 S
96,./utterance_data/speaker_W/097.wav,Well go to Kitchen_Table  take Brown_Tea  bring it to Dining_Sofa .,well go to a kitchen table take Bronte bring it to dining sofa,W EH1 L G OW1 T UW1 AH0 K IH1 CH AH0 N T EY1 B AH0 L T EY1 K B R AA1 N T IY0 B R IH1 NG IH1 T T UW1 D AY1 N IH0 NG S OW1 F AH0,well go to teach unstable take bronte rights sued by the sofa,W EH1 L G OW1 T UW1 T IY1 CH AH0 N S T EY1 B AH0 L T EY1 K B R AA1 N T IY0 R AY1 T S S UW1 D B AY1 DH AH0 S OW1 F AH0
97,./utterance_data/speaker_W/098.wav,Go to lobby  go to Reception_Table er leave the apartment .,go to Lobby go to reception table leave the apartment,G OW1 T UW1 L AA1 B IY0 G OW1 T UW1 R IH0 S EH1 P SH AH0 N T EY1 B AH0 L L IY1 V DH AH0 AH0 P AA1 R T M AH0 N T,go to bobbie go to the reception table heaved apartments,G OW1 T UW1 B AA1 B IY0 G OW1 T UW1 DH AH0 R IH0 S EH1 P SH AH0 N T EY1 B AH0 L HH IY1 V D AH0 P AA1 R T M AH0 N T S
98,./utterance_data/speaker_W/099.wav,Would you go to Bar take Red_Potato er come back .,would you go to a bar take red potato come back,W UH1 D Y UW1 G OW1 T UW1 AH0 B AA1 R T EY1 K R EH1 D P AH0 T EY1 T OW2 K AH1 M B AE1 K,it would you go too far take rates potato of combat,IH1 T W UH1 D Y UW1 G OW1 T UW1 F AA1 R T EY1 K R EY1 T S P AH0 T EY1 T OW2 AH1 V K AA1 M B AE0 T
99,./utterance_data/speaker_W/100.wav,Would you go to lobby Grasp toy_duck finally come back .,would you go to Lobby grass pathetic finally come back,W UH1 D Y UW1 G OW1 T UW1 L AA1 B IY0 G R AE1 S P AH0 TH EH1 T IH0 K F AY1 N AH0 L IY0 K AH1 M B AE1 K,would you go to all the grasp of hoyt are caught by many combat,W UH1 D Y UW1 G OW1 T UW1 AO1 L DH AH0 G R AE1 S P AH1 V HH OY1 T AA1 R K AA1 T B AY1 M EH1 N IY0 K AA1 M B AE0 T
