,filename,original_sentence,google_word,google_phoneme,sphinx_word,sphinx_phoneme
57,./utterance_data/speaker_T/058.wav,Well go to Kitchen_Table  take dog_doll finally come back .,well go to kitchen table take doctor finally come back,W EH1 L G OW1 T UW1 K IH1 CH AH0 N T EY1 B AH0 L T EY1 K D AA1 K T ER0 F AY1 N AH0 L IY0 K AH1 M B AE1 K,let go to get to them and take a look don't buy a comeback,L EH1 T G OW1 T UW1 G EH1 T T UW1 DH EH1 M AH0 N D T EY1 K AH0 L UH1 K D OW1 N T B AY1 AH0 K AH1 M B AE2 K
58,./utterance_data/speaker_T/059.wav,Would you go to Kitchen_Table  take rubik's_cube  bring it to Dining_Table .,would you go to kitchen table to dining table,W UH1 D Y UW1 G OW1 T UW1 K IH1 CH AH0 N T EY1 B AH0 L T UW1 D AY1 N IH0 NG T EY1 B AH0 L,the blood to go to the defense they couldn't get playing the two bankhead,DH AH0 B L AH1 D T UW1 G OW1 T UW1 DH AH0 D IH0 F EH1 N S DH EY1 K UH1 D AH0 N T G EH1 T P L EY1 IH0 NG DH AH0 T UW1 B AE1 NG K HH EH2 D
59,./utterance_data/speaker_T/060.wav,Well move to Living_Sofa get empty_plastic_bottle and come back .,Spider-Man Badoo dating sofa get empty plastic bottle and come back,S P AY1 D ER0 M AE0 N B IY1 AH0 D IY1 OW1 OW1 D EY1 T IH0 NG S OW1 F AH0 G EH1 T EH1 M P T IY0 P L AE1 S T IH0 K B AA1 T AH0 L AH0 N D K AH1 M B AE1 K,it let amanda today makes of dead and the plastic bucket and come back,IH1 T L EH1 T AH0 M AE1 N D AH0 T AH0 D EY1 M EY1 K S AH1 V D EH1 D AH0 N D DH AH0 P L AE1 S T IH0 K B AH1 K AH0 T AH0 N D K AH1 M B AE1 K
60,./utterance_data/speaker_T/061.wav,Go to Kitchen_Table find a person neayby  er follow a person .,go to kitchen table find a person nearby for opossum,G OW1 T UW1 K IH1 CH AH0 N T EY1 B AH0 L F AY1 N D AH0 P ER1 S AH0 N N IH1 R B AY1 F AO1 R OW0 P AA1 S AH0 M,good eating didn't find out that some dna full of passing,G UH1 D IY1 T IH0 NG D IH1 D AH0 N T F AY1 N D AW1 T DH AE1 T S AH1 M D IY1 EH2 N EY1 F UH1 L AH1 V P AE1 S IH0 NG
61,./utterance_data/speaker_T/062.wav,Go to Living_Room get Blue_Potato throw it into Dustbin please .,go to living room get potato throw it in the dust being please,G OW1 T UW1 L IH1 V IH0 NG R UW1 M G EH1 T P AH0 T EY1 T OW2 TH R OW1 IH1 T IH0 N DH AH0 D AH1 S T B IY1 IH0 NG P L IY1 Z,what did he mean to get good political silicate he did death being the youths,W AH1 T D IH1 D HH IY1 M IY1 N T UW1 G EH1 T G UH1 D P AH0 L IH1 T AH0 K AH0 L S IH1 L AH0 K AH0 T HH IY1 D IH1 D D EH1 TH B IY1 IH0 NG DH AH0 Y UW1 DH Z
62,./utterance_data/speaker_T/063.wav,Can you go to kitchen Grasp bear_doll  bring it to Living_Table .,can you go to Kitchen craft bring it to living table,K AE1 N Y UW1 G OW1 T UW1 K IH1 CH AH0 N K R AE1 F T B R IH1 NG IH1 T T UW1 L IH1 V IH0 NG T EY1 B AH0 L,tango to get to test the ad on being a duty in the denver,T AE1 NG G OW0 T UW1 G EH1 T T UW1 T EH1 S T DH AH0 AE1 D AA1 N B IY1 IH0 NG AH0 D UW1 T IY0 IH0 N DH AH0 D EH1 N V ER0
63,./utterance_data/speaker_T/064.wav,Would you go to lobby Grasp pink_cup finally come back .,Buju go to Robbie grasping cup,B IY1 Y UW1 JH EY1 Y UW1 G OW1 T UW1 R AA1 B IY0 G R AE1 S P IH0 NG K AH1 P,the jello dunleavy that's being kept praying combat,DH AH0 JH EH1 L OW0 D UW1 N L AH0 V IY0 DH AE1 T S B IY1 IH0 NG K EH1 P T P R EY1 IH0 NG K AA1 M B AE0 T
64,./utterance_data/speaker_T/065.wav,Move to Dining_Table  Grasp hourglass  leave the apartment please .,Liberty dining table grasp the apartment please,L IH1 B ER0 T IY2 D AY1 N IH0 NG T EY1 B AH0 L G R AE1 S P DH AH0 AH0 P AA1 R T M AH0 N T P L IY1 Z,they would did ending the day the guest on us he does that but that the man who needs,DH EY1 W UH1 D D IH1 D EH1 N D IH0 NG DH AH0 D EY1 DH AH0 G EH1 S T AA1 N AH1 S HH IY1 D AH1 Z DH AE1 T B AH1 T DH AE1 T DH AH0 M AE1 N HH UW1 N IY1 D Z
65,./utterance_data/speaker_T/066.wav,Would you go to Dining_Sofa get Cloth_Cleaner carry it to Living_Table .,would you go to dining sofa get girls Crainer carry 8 to living tab,W UH1 D Y UW1 G OW1 T UW1 D AY1 N IH0 NG S OW1 F AH0 G EH1 T G ER1 L Z S IY1 AA1 R AH0 AY1 EH1 N IY1 AA1 R K AE1 R IY0 EY1 T T UW1 L IH1 V IH0 NG T AE1 B,the gelatin day so flat get those playing carry eighths to be mean to it,DH AH0 JH EH1 L AH0 T AH0 N D EY1 S OW1 F L AE1 T G EH1 T DH OW1 Z P L EY1 IH0 NG K AE1 R IY0 EY1 T TH S T UW1 B IY1 M IY1 N T UW1 IH1 T
66,./utterance_data/speaker_T/067.wav,Go to Visitor_Room next find toy_car take it .,go to Bitterroot next find the car,G OW1 T UW1 B IH1 T ER0 R UW2 T N EH1 K S T F AY1 N D DH AH0 K AA1 R,good to be dead and next to find a dike that peggy,G UH1 D T UW1 B IY1 D EH1 D AH0 N D N EH1 K S T T UW1 F AY1 N D AH0 D AY1 K DH AE1 T P EH1 G IY0
67,./utterance_data/speaker_T/068.wav,Go to Dining_Room  go to Side_Table then exit the apartment .,go to dining room go to side table,G OW1 T UW1 D AY1 N IH0 NG R UW1 M G OW1 T UW1 S AY1 D T EY1 B AH0 L,glutted begging them are going to strike them dead the to set up at the met,G L AH1 T IH0 D B EH1 G IH0 NG DH EH1 M AA1 R G OW1 IH0 NG T UW1 S T R AY1 K DH EH1 M D EH1 D DH AH0 T UW1 S EH1 T AH1 P AE1 T DH AH0 M EH1 T
68,./utterance_data/speaker_T/069.wav,Go to Dining_Room go to Living_Table  and exit from Visitor_Room .,go to dining room go to the training table at exit for pistol,G OW1 T UW1 D AY1 N IH0 NG R UW1 M G OW1 T UW1 DH AH0 T R EY1 N IH0 NG T EY1 B AH0 L AE1 T EH1 G Z IH0 T F AO1 R P IH1 S T AH0 L,good good getting the goods is dating and pillow fact is it's far is that,G UH1 D G UH1 D G EH1 T IH0 NG DH AH0 G UH1 D Z IH1 Z D EY1 T IH0 NG AH0 N D P IH1 L OW0 F AE1 K T IH1 Z IH1 T S F AA1 R IH1 Z DH AE1 T
69,./utterance_data/speaker_T/070.wav,Go to Dining_Sofa find a person neayby  er follow a person .,go to Danny sofa find a person nearby,G OW1 T UW1 D AE1 N IY0 S OW1 F AH0 F AY1 N D AH0 P ER1 S AH0 N N IH1 R B AY1,good today so flat find that baths and the handbag know full wrap path,G UH1 D T AH0 D EY1 S OW1 F L AE1 T F AY1 N D DH AE1 T B AE1 TH S AH0 N D DH AH0 HH AE1 N D B AE2 G N OW1 F UH1 L R AE1 P P AE1 TH
70,./utterance_data/speaker_T/071.wav,Call a person then ask for an order get Cloth_Cleaner from Dining_Table .,call the Apostle ask for older get throat cleaner from dining table,K AO1 L DH AH0 AH0 P AA1 S AH0 L AE1 S K F AO1 R OW1 L D ER0 G EH1 T TH R OW1 T K L IY1 N ER0 F R AH1 M D AY1 N IH0 NG T EY1 B AH0 L,claudette pass and then ask pull out and all of that gate that all of the man who along with banging the game,K L OW0 D EH1 T P AE1 S AH0 N D DH EH1 N AE1 S K P UH1 L AW1 T AH0 N D AO1 L AH1 V DH AE1 T G EY1 T DH AE1 T AO1 L AH1 V DH AH0 M AE1 N HH UW1 AH0 L AO1 NG W IH1 DH B AE1 NG IH0 NG DH AH0 G EY1 M
71,./utterance_data/speaker_T/072.wav,Go to Bar  take spray_bottle put it on Dining_Sofa okay .,Nothing by take a spray bottle put it on dining Sulphur okay,N AH1 TH IH0 NG B AY1 T EY1 K AH0 S P R EY1 B AA1 T AH0 L P UH1 T IH1 T AA1 N D AY1 N IH0 NG S AH1 L F ER0 OW2 K EY1,but the back gate it's been a book on the seat on bang silver applegate,B AH1 T DH AH0 B AE1 K G EY1 T IH1 T S B IH1 N AH0 B UH1 K AA1 N DH AH0 S IY1 T AA1 N B AE1 NG S IH1 L V ER0 AE1 P AH0 L G EY2 T
72,./utterance_data/speaker_T/073.wav,Move to Living_Table  Grasp sauce  leave the apartment please .,navigate to readings Taylor grasp sauce apartment,N AE1 V AH0 G EY2 T T UW1 R IY1 D IH0 NG Z T EY1 L ER0 G R AE1 S P S AO1 S AH0 P AA1 R T M AH0 N T,the duty being dead gasped tells me that it about them and booty,DH AH0 D UW1 T IY0 B IY1 IH0 NG D EH1 D G AE1 S P T T EH1 L Z M IY1 DH AE1 T IH1 T AH0 B AW1 T DH EH1 M AH0 N D B UW1 T IY0
73,./utterance_data/speaker_T/074.wav,Go to kitchen  move to Kitchen_Table  finally leave the apartment .,go to kitchen table to the kitchen table finally leave his apartment,G OW1 T UW1 K IH1 CH AH0 N T EY1 B AH0 L T UW1 DH AH0 K IH1 CH AH0 N T EY1 B AH0 L F AY1 N AH0 L IY0 L IY1 V HH IH1 Z AH0 P AA1 R T M AH0 N T,go to a good team limited keating said the time eddie he does that document,G OW1 T UW1 AH0 G UH1 D T IY1 M L IH1 M AH0 T AH0 D K IY1 T IH0 NG S EH1 D DH AH0 T AY1 M EH1 D IY0 HH IY1 D AH1 Z DH AE1 T D AA1 K Y AH0 M EH0 N T
74,./utterance_data/speaker_T/075.wav,Go to Dining_Sofa and find a person neayby bring dog_doll from Living_Table .,go to dining sofa and find a Paso nearby bring doctor from leaving the tab,G OW1 T UW1 D AY1 N IH0 NG S OW1 F AH0 AH0 N D F AY1 N D AH0 P AE1 S OW0 N IH1 R B AY1 B R IH1 NG D AA1 K T ER0 F R AH1 M L IY1 V IH0 NG DH AH0 T AE1 B,good good thanks a flag and buying that pass on the ed begley and don't go on get them,G UH1 D G UH1 D TH AE1 NG K S AH0 F L AE1 G AH0 N D B AY1 IH0 NG DH AE1 T P AE1 S AA1 N DH AH0 EH1 D B EH1 G L IY0 AH0 N D D OW1 N T G OW1 AA1 N G EH1 T DH EH1 M
75,./utterance_data/speaker_T/076.wav,Would you go to Sofa get Lemon_Tea carry it to Dining_Table .,would you go to sofa get 78 the dining table,W UH1 D Y UW1 G OW1 T UW1 S OW1 F AH0 G EH1 T S EH1 V AH0 N EY1 T DH AH0 D AY1 N IH0 NG T EY1 B AH0 L,good to go to sofa get to live on the cat eighty two banging the table,G UH1 D T UW1 G OW1 T UW1 S OW1 F AH0 G EH1 T T UW1 L AY1 V AA1 N DH AH0 K AE1 T EY1 T IY0 T UW1 B AE1 NG IH0 NG DH AH0 T EY1 B AH0 L
76,./utterance_data/speaker_T/077.wav,Go to Kitchen_Room  find a person neayby  finally follow a person .,go to Kitchen Wyandotte Plaza,G OW1 T UW1 K IH1 CH AH0 N D AH1 B AH0 L Y UW0 W AY1 AH0 EH1 N D IY1 OW1 T IY1 T IY1 IY1 P L AA1 Z AH0,good to get in and buy that that sydney and why that,G UH1 D T UW1 G EH1 T IH0 N AH0 N D B AY1 DH AE1 T DH AE1 T S IH1 D N IY0 AH0 N D W AY1 DH AE1 T
77,./utterance_data/speaker_T/078.wav,Go to kitchen  find a person neayby  finally follow a person .,would you go to Sephora get 72 dining table,W UH1 D Y UW1 G OW1 T UW1 S EH0 F AO1 R AH0 G EH1 T S EH1 V AH0 N T UW1 D AY1 N IH0 NG T EY1 B AH0 L,would you go to so flat again today on the cat a day banging the table,W UH1 D Y UW1 G OW1 T UW1 S OW1 F L AE1 T AH0 G EH1 N T AH0 D EY1 AA1 N DH AH0 K AE1 T AH0 D EY1 B AE1 NG IH0 NG DH AH0 T EY1 B AH0 L
78,./utterance_data/speaker_T/079.wav,Go to Dining_Room er find a person neayby bring camera from Dining_Table .,go to dining room I'll find a puzzle nearby bring camera from dining table,G OW1 T UW1 D AY1 N IH0 NG R UW1 M AY1 L F AY1 N D AH0 P AH1 Z AH0 L N IH1 R B AY1 B R IH1 NG K AE1 M ER0 AH0 F R AH1 M D AY1 N IH0 NG T EY1 B AH0 L,good to bennington outcry that baton yeah by agreeing to a man at home dining table,G UH1 D T UW1 B EH1 N IH0 NG T AH0 N AW1 T K R AY2 DH AE1 T B AH0 T AA1 N Y AE1 B AY1 AH0 G R IY1 IH0 NG T UW1 AH0 M AE1 N AE1 T HH OW1 M D AY1 N IH0 NG T EY1 B AH0 L
79,./utterance_data/speaker_T/080.wav,Go to Visitor_Room Grasp nursing_bottle throw it into Dustbin please .,Golden Pizza Durham nothing but throw it into Destiny please,G OW1 L D AH0 N P IY1 T S AH0 D ER1 AH0 M N AH1 TH IH0 NG B AH1 T TH R OW1 IH1 T IH1 N T UW0 D EH1 S T AH0 N IY0 P L IY1 Z,god because adam that nothing but so so eighty painted destiny buddies,G AA1 D B IH0 K AO1 Z AE1 D AH0 M DH AE1 T N AH1 TH IH0 NG B AH1 T S OW1 S OW1 EY1 T IY0 P EY1 N T IH0 D D EH1 S T AH0 N IY0 B AH1 D IY0 Z
80,./utterance_data/speaker_T/081.wav,Go to Living_Room next find Lemon_Tea take it .,go to Dominguez next find remedy take,G OW1 T UW1 D AH0 M IH1 NG IH0 Z N EH1 K S T F AY1 N D R EH1 M AH0 D IY0 T EY1 K,what do you mean the next time there i am want the day cookie,W AH1 T D UW1 Y UW1 M IY1 N DH AH0 N EH1 K S T T AY1 M DH EH1 R AY1 AE1 M W AA1 N T DH AH0 D EY1 K UH1 K IY0
81,./utterance_data/speaker_T/082.wav,Go to Dining_Sofa take Red_Potato  leave the apartment please .,go to dining sofa bed Pottery apartment please,G OW1 T UW1 D AY1 N IH0 NG S OW1 F AH0 B EH1 D P AA1 T ER0 IY0 AH0 P AA1 R T M AH0 N T P L IY1 Z,what did that is so flat take it and put it even though about them and buddies,W AH1 T D IH1 D DH AE1 T IH1 Z S OW1 F L AE1 T T EY1 K IH1 T AH0 N D P UH1 T IH1 T IY1 V IH0 N DH OW1 AH0 B AW1 T DH EH1 M AH0 N D B AH1 D IY0 Z
82,./utterance_data/speaker_T/083.wav,Would you go to Bar  take Red_Potato  bring it to Dining_Table .,go to go to buy take me to deposit bring it to dining table,G OW1 T UW1 G OW1 T UW1 B AY1 T EY1 K M IY1 T UW1 D AH0 P AA1 Z IH0 T B R IH1 NG IH1 T T UW1 D AY1 N IH0 NG T EY1 B AH0 L,the budget look too bad they could add to what did they gave to banging the table,DH AH0 B AH1 JH IH0 T L UH1 K T UW1 B AE1 D DH EY1 K UH1 D AE1 D T UW1 W AH1 T D IH1 D DH EY1 G EY1 V T UW1 B AE1 NG IH0 NG DH AH0 T EY1 B AH0 L
83,./utterance_data/speaker_T/084.wav,Well move to Reception_Table Grasp Japanese_Dressing then come back .,well Moto reception table grasp Japanese dressing,W EH1 L M OW1 T OW0 R IH0 S EH1 P SH AH0 N T EY1 B AH0 L G R AE1 S P JH AE2 P AH0 N IY1 Z D R EH1 S IH0 NG,lemon to miss a shot dead the desk gemini that scene then come back,L EH1 M AH0 N T UW1 M IH1 S AH0 SH AA1 T D EH1 D DH AH0 D EH1 S K JH EH1 M AH0 N AY2 DH AE1 T S IY1 N DH EH1 N K AH1 M B AE1 K
84,./utterance_data/speaker_T/085.wav,Would you go to lobby Grasp toy_penguin finally come back .,would you go to kobe last time hanging finally come back,W UH1 D Y UW1 G OW1 T UW1 K OW1 B EY0 L AE1 S T T AY1 M HH AE1 NG IH0 NG F AY1 N AH0 L IY0 K AH1 M B AE1 K,the budget lagoon really grasped dying being hit by a comeback,DH AH0 B AH1 JH IH0 T L AH0 G UW1 N R IH1 L IY0 G R AE1 S P T D AY1 IH0 NG B IY1 IH0 NG HH IH1 T B AY1 AH0 K AH1 M B AE2 K
85,./utterance_data/speaker_T/086.wav,Go to lobby er find a person neayby bring cubic_clock from Sofa .,go to Ruby find a person nearby cubic clock from,G OW1 T UW1 R UW1 B IY0 F AY1 N D AH0 P ER1 S AH0 N N IH1 R B AY1 K Y UW1 B IH0 K K L AA1 K F R AH1 M,but though the outline that lesson the aback going to be a cook on a sofa,B AH1 T DH OW1 DH AH0 AW1 T L AY2 N DH AE1 T L EH1 S AH0 N DH AH0 AH0 B AE1 K G OW1 IH0 NG T UW1 B IY1 AH0 K UH1 K AA1 N AH0 S OW1 F AH0
86,./utterance_data/speaker_T/087.wav,Well get Egg_Soup from Sofa go to Visitor_Room move to Dining_Table .,where to get excerpt from sofa dining table,W EH1 R T UW1 G EH1 T EH1 K S ER0 P T F R AH1 M S OW1 F AH0 D AY1 N IH0 NG T EY1 B AH0 L,when it gets the exit far off so far good to base at them to thank him,W EH1 N IH1 T G EH1 T S DH AH0 EH1 G Z IH0 T F AA1 R AO1 F S OW1 F AA1 R G UH1 D T UW1 B EY1 S AE1 T DH EH1 M T UW1 TH AE1 NG K HH IH1 M
87,./utterance_data/speaker_T/088.wav,Move to Dining_Table  go to Sofa then exit the apartment .,movie do dining table go to safa apartments,M UW1 V IY0 D UW1 D AY1 N IH0 NG T EY1 B AH0 L G OW1 T UW1 EH1 S AH0 EH1 F AH0 AH0 P AA1 R T M AH0 N T S,the dude bank in the book is so flat that they did that by coming to,DH AH0 D UW1 D B AE1 NG K IH0 N DH AH0 B UH1 K IH1 Z S OW1 F L AE1 T DH AE1 T DH EY1 D IH1 D DH AE1 T B AY1 K AH1 M IH0 NG T UW1
88,./utterance_data/speaker_T/089.wav,Move to Living_Table get salt place it on Bar okay .,mobile during Tara gets South price it by okay,M OW1 B AH0 L D UH1 R IH0 NG T EH1 R AH0 G EH1 T S S AW1 TH P R AY1 S IH1 T B AY1 OW2 K EY1,that would do him a better get set for a city to back okay,DH AE1 T W UH1 D D UW1 HH IH1 M AH0 B EH1 T ER0 G EH1 T S EH1 T F AO1 R AH0 S IH1 T IY0 T UW1 B AE1 K OW2 K EY1
89,./utterance_data/speaker_T/090.wav,Go to Visitor_Room next find Strawberry_Juice take it .,go to Bristol next find strawberry juice,G OW1 T UW1 B R IH1 S T AH0 L N EH1 K S T F AY1 N D S T R AO1 B EH2 R IY0 JH UW1 S,look at this then the next five that ages deadly it,L UH1 K AE1 T DH IH1 S DH EH1 N DH AH0 N EH1 K S T F AY1 V DH AE1 T EY1 JH AH0 Z D EH1 D L IY0 IH1 T
90,./utterance_data/speaker_T/091.wav,Go to Corridor take toy_duck put it on Reception_Table please .,go to Korea take play dog food on the table please,G OW1 T UW1 K AO2 R IY1 AH0 T EY1 K P L EY1 D AO1 G F UW1 D AA1 N DH AH0 T EY1 B AH0 L P L IY1 Z,but what that could that tape played that the two eight long does it show did to their needs,B AH1 T W AH1 T DH AE1 T K UH1 D DH AE1 T T EY1 P P L EY1 D DH AE1 T DH AH0 T UW1 EY1 T L AO1 NG D AH1 Z IH1 T SH OW1 D IH1 D T UW1 DH EH1 R N IY1 D Z
91,./utterance_data/speaker_T/092.wav,Well go to Dining_Sofa  take Cup_Noodle finally come back .,where to go to dining sofa tag cup noodle,W EH1 R T UW1 G OW1 T UW1 D AY1 N IH0 NG S OW1 F AH0 T AE1 G K AH1 P N UW1 D AH0 L,when will it do that you saw flatbed cap in the home by a cam back,W EH1 N W IH1 L IH1 T D UW1 DH AE1 T Y UW1 S AO1 F L AE1 T B EH2 D K AE1 P IH0 N DH AH0 HH OW1 M B AY1 AH0 K AE1 M B AE1 K
92,./utterance_data/speaker_T/093.wav,Go to kitchen  go to Living_Sofa er leave the apartment .,go to the kitchen go to reading so far,G OW1 T UW1 DH AH0 K IH1 CH AH0 N G OW1 T UW1 R IY1 D IH0 NG S OW1 F AA1 R,to go take a tango it is ruining skull flap needed the batman,T UW1 G OW1 T EY1 K AH0 T AE1 NG G OW0 IH1 T IH1 Z R UW1 IH0 N IH0 NG S K AH1 L F L AE1 P N IY1 D AH0 D DH AH0 B AE1 T M AE2 N
93,./utterance_data/speaker_T/094.wav,Go to lobby get empty_plastic_bottle throw it into Dustbin please .,go to Robbie get empty plastic bottle throw it into testing place,G OW1 T UW1 R AA1 B IY0 G EH1 T EH1 M P T IY0 P L AE1 S T IH0 K B AA1 T AH0 L TH R OW1 IH1 T IH1 N T UW0 T EH1 S T IH0 NG P L EY1 S,good to know being gets up and the best take god out sydow date being did that mean please,G UH1 D T UW1 N OW1 B IY1 IH0 NG G EH1 T S AH1 P AH0 N D DH AH0 B EH1 S T T EY1 K G AA1 D AW1 T S IH1 D OW0 D EY1 T B IY1 IH0 NG D IH1 D DH AE1 T M IY1 N P L IY1 Z
94,./utterance_data/speaker_T/095.wav,Would you go to lobby Grasp soysauce er come back .,would you go to Lobby grasp soy sauce I'll come back,W UH1 D Y UW1 G OW1 T UW1 L AA1 B IY0 G R AE1 S P S OY1 S AO1 S AY1 L K AH1 M B AE1 K,the jingle of the gobi gas and so they sell us now come back,DH AH0 JH IH1 NG G AH0 L AH1 V DH AH0 G OW1 B IY0 G AE1 S AH0 N D S OW1 DH EY1 S EH1 L AH1 S N AW1 K AH1 M B AE1 K
95,./utterance_data/speaker_T/096.wav,Go to Kitchen_Room get twin_bell_alarm_clock throw it into Dustbin please .,go to Kitchen on get symbol alarm clock throw it in the dash mean,G OW1 T UW1 K IH1 CH AH0 N AA1 N G EH1 T S IH1 M B AH0 L AH0 L AA1 R M K L AA1 K TH R OW1 IH1 T IH0 N DH AH0 D AE1 SH M IY1 N,look the kitchen and get them out battle the snow eight painted das mean buddy,L UH1 K DH AH0 K IH1 CH AH0 N AH0 N D G EH1 T DH EH1 M AW1 T B AE1 T AH0 L DH AH0 S N OW1 EY1 T P EY1 N T IH0 D D AE1 S M IY1 N B AH1 D IY0
96,./utterance_data/speaker_T/097.wav,Well go to Kitchen_Table  take Brown_Tea  bring it to Dining_Sofa .,well go to kitchen table take Brandy Brands 18 dining sofa,W EH1 L G OW1 T UW1 K IH1 CH AH0 N T EY1 B AH0 L T EY1 K B R AE1 N D IY0 B R AE1 N D Z W AH1 N EY1 T D AY1 N IH0 NG S OW1 F AH0,well good to get to them but they had the landscape to bang so flat,W EH1 L G UH1 D T UW1 G EH1 T T UW1 DH EH1 M B AH1 T DH EY1 HH AE1 D DH AH0 L AE1 N D S K EY2 P T UW1 B AE1 NG S OW1 F L AE1 T
97,./utterance_data/speaker_T/098.wav,Go to lobby  go to Reception_Table er leave the apartment .,go to Roby go to the solution table apartment,G OW1 T UW1 R OW1 B IY0 G OW1 T UW1 DH AH0 S AH0 L UW1 SH AH0 N T EY1 B AH0 L AH0 P AA1 R T M AH0 N T,look it'll be good this is shown to the bat you is that the battlements,L UH1 K IH1 T AH0 L B IY1 G UH1 D DH IH1 S IH1 Z SH OW1 N T UW1 DH AH0 B AE1 T Y UW1 IH1 Z DH AE1 T DH AH0 B AE1 T AH0 L M AH0 N T S
98,./utterance_data/speaker_T/099.wav,Would you go to Bar take Red_Potato er come back .,would you go to buy take that potato at Camelback,W UH1 D Y UW1 G OW1 T UW1 B AY1 T EY1 K DH AE1 T P AH0 T EY1 T OW2 AE1 T S IY1 AH0 EH1 M IY1 EH1 L B IY1 AH0 S IY1 K EY1,good to go to bat take it what did the bag can back,G UH1 D T UW1 G OW1 T UW1 B AE1 T T EY1 K IH1 T W AH1 T D IH1 D DH AH0 B AE1 G K AE1 N B AE1 K
99,./utterance_data/speaker_T/100.wav,Would you go to lobby Grasp toy_duck finally come back .,did you go to Robocraft dark pee come back,D IH1 D Y UW1 G OW1 T UW1 AA1 R OW1 B IY1 OW1 S IY1 AA1 R AH0 EH1 F T IY1 D AA1 R K P IY1 K AH1 M B AE1 K,they didn't go to lou obeyed that they backed by a comeback,DH EY1 D IH1 D AH0 N T G OW1 T UW1 L UW1 OW0 B EY1 D DH AE1 T DH EY1 B AE1 K T B AY1 AH0 K AH1 M B AE2 K
