,filename,original_sentence,google_word,google_phoneme,sphinx_word,sphinx_phoneme
0,./utterance_data/speaker_T/001.wav,Well go to Sofa  take empty_ketchup finally come back .,where to go to Safari take an empty SketchUp finally come back,W EH1 R T UW1 G OW1 T UW1 S AH0 F AA1 R IY0 T EY1 K AE1 N EH1 M P T IY0 EH1 S K EY1 IY1 T IY1 S IY1 EY1 CH Y UW1 P IY1 F AY1 N AH0 L IY0 K AH1 M B AE1 K,when will it do sulfide take that and he's staked out i'm a comeback,W EH1 N W IH1 L IH1 T D UW1 S AH1 L F AY2 D T EY1 K DH AE1 T AH0 N D HH IY1 Z S T EY1 K T AW1 T AY1 M AH0 K AH1 M B AE2 K
1,./utterance_data/speaker_T/002.wav,Go to Dining_Sofa next detect camera  take it .,go to dining sofa next deck camera decorate,G OW1 T UW1 D AY1 N IH0 NG S OW1 F AH0 N EH1 K S T D EH1 K K AE1 M ER0 AH0 D EH1 K ER0 EY2 T,good to denny's so flat banks of get command take a seat,G UH1 D T UW1 D EH1 N IY0 Z S OW1 F L AE1 T B AE1 NG K S AH1 V G EH1 T K AH0 M AE1 N D T EY1 K AH0 S IY1 T
2,./utterance_data/speaker_T/003.wav,Move to Living_Table  grasp Bleach  leave the apartment please .,movie during table grass Bridge apartment please,M UW1 V IY0 D UH1 R IH0 NG T EY1 B AH0 L G R AE1 S B R IH1 JH AH0 P AA1 R T M AH0 N T P L IY1 Z,brutally beaten to death leaves the being set up at the peace,B R UW1 T AH0 L IY0 B IY1 T AH0 N T UW1 D EH1 TH L IY1 V Z DH AH0 B IY1 IH0 NG S EH1 T AH1 P AE1 T DH AH0 P IY1 S
3,./utterance_data/speaker_T/004.wav,Go to Sofa  take Cup_Star put it on Living_Table okay .,go to Suffern take out put it on living table okay,G OW1 T UW1 S AH1 F ER0 N T EY1 K AW1 T P UH1 T IH1 T AA1 N L IH1 V IH0 NG T EY1 B AH0 L OW2 K EY1,that is so tied to a depth than the teeth being in the o. k.,DH AE1 T IH1 Z S OW1 T AY1 D T UW1 AH0 D EH1 P TH DH AE1 N DH AH0 T IY1 TH B IY1 IH0 NG IH0 N DH AH0 OW1 K EY1
4,./utterance_data/speaker_T/005.wav,Go to Kitchen_Table move to Living_Table take Red_Tea .,go to kitchen table Myrtle reading table,G OW1 T UW1 K IH1 CH AH0 N T EY1 B AH0 L M ER1 T AH0 L R IY1 D IH0 NG T EY1 B AH0 L,go to teach in tampa the two he became the dignity,G OW1 T UW1 T IY1 CH IH0 N T AE1 M P AH0 DH AH0 T UW1 HH IY1 B IH0 K EY1 M DH AH0 D IH1 G N AH0 T IY0
5,./utterance_data/speaker_T/006.wav,Can you move to Living_Table get toy_car then come back .,can you move do dipping table get the car then come back,K AE1 N Y UW1 M UW1 V D UW1 D IH1 P IH0 NG T EY1 B AH0 L G EH1 T DH AH0 K AA1 R DH EH1 N K AH1 M B AE1 K,can you move to the vain to get a cat to hand combat,K AE1 N Y UW1 M UW1 V T UW1 DH AH0 V EY1 N T UW1 G EH1 T AH0 K AE1 T T UW1 HH AE1 N D K AA1 M B AE0 T
6,./utterance_data/speaker_T/007.wav,Move to Side_Table get ground_pepper place it on Sofa okay .,Liberty side table,L IH1 B ER0 T IY2 S AY1 D T EY1 B AH0 L,the good the sanctity of the events at the end to it they seem to suffer oh,DH AH0 G UH1 D DH AH0 S AE1 NG K T IH0 T IY0 AH1 V DH AH0 IH0 V EH1 N T S AE1 T DH AH0 EH1 N D T UW1 IH1 T DH EY1 S IY1 M T UW1 S AH1 F ER0 OW1
7,./utterance_data/speaker_T/008.wav,Would you go to Kitchen_Table  take sugar  bring it to Side_Table .,but you go to kitchen table text Sugar bring it to side table,B AH1 T Y UW1 G OW1 T UW1 K IH1 CH AH0 N T EY1 B AH0 L T EH1 K S T SH UH1 G ER0 B R IH1 NG IH1 T T UW1 S AY1 D T EY1 B AH0 L,good to go to get him to take show that they need to send him,G UH1 D T UW1 G OW1 T UW1 G EH1 T HH IH1 M T UW1 T EY1 K SH OW1 DH AE1 T DH EY1 N IY1 D T UW1 S EH1 N D HH IH1 M
8,./utterance_data/speaker_T/009.wav,Can you move to Side_Table get salt then come back .,can you move to side table gets South then come back,K AE1 N Y UW1 M UW1 V T UW1 S AY1 D T EY1 B AH0 L G EH1 T S S AW1 TH DH EH1 N K AH1 M B AE1 K,can you move to send to get this show and then come back,K AE1 N Y UW1 M UW1 V T UW1 S EH1 N D T UW1 G EH1 T DH IH1 S SH OW1 AH0 N D DH EH1 N K AH1 M B AE1 K
9,./utterance_data/speaker_T/010.wav,Go to Visitor_Room take canned_juice put it on Bar please .,go to beach and take a can't just put it down bad,G OW1 T UW1 B IY1 CH AH0 N D T EY1 K AH0 K AE1 N T JH AH1 S T P UH1 T IH1 T D AW1 N B AE1 D,go to the senate take that can't you see that she found that pretty,G OW1 T UW1 DH AH0 S EH1 N AH0 T T EY1 K DH AE1 T K AE1 N T Y UW1 S IY1 DH AE1 T SH IY1 F AW1 N D DH AE1 T P R IH1 T IY0
10,./utterance_data/speaker_T/011.wav,Move to Sofa  go to Bar then exit the apartment .,movie do so far go to back then exit the apartment,M UW1 V IY0 D UW1 S OW1 F AA1 R G OW1 T UW1 B AE1 K DH EH1 N EH1 G Z IH0 T DH AH0 AH0 P AA1 R T M AH0 N T,move to supply aquila to the dead easy that that's meant,M UW1 V T UW1 S AH0 P L AY1 AE1 K W AH0 L AH0 T UW1 DH AH0 D EH1 D IY1 Z IY0 DH AE1 T DH AE1 T S M EH1 N T
11,./utterance_data/speaker_T/012.wav,Well get Cup_Noodle from Living_Table go to Dining_Room move to Sofa .,where to get cup noodle from a make table go to dining room,W EH1 R T UW1 G EH1 T K AH1 P N UW1 D AH0 L F R AH1 M AH0 M EY1 K T EY1 B AH0 L G OW1 T UW1 D AY1 N IH0 NG R UW1 M,let him get kept near the top the mainstay of the glutted banging the movie to suffer,L EH1 T HH IH1 M G EH1 T K EH1 P T N IH1 R DH AH0 T AA1 P DH AH0 M EY1 N S T EY2 AH1 V DH AH0 G L AH1 T IH0 D B AE1 NG IH0 NG DH AH0 M UW1 V IY0 T UW1 S AH1 F ER0
12,./utterance_data/speaker_T/013.wav,Call a person then ask for an order get Brown_Tea from Reception_Table .,go to person then ask for other get Brandy from reception table,G OW1 T UW1 P ER1 S AH0 N DH EH1 N AE1 S K F AO1 R AH1 DH ER0 G EH1 T B R AE1 N D IY0 F R AH1 M R IH0 S EH1 P SH AH0 N T EY1 B AH0 L,what lesson and said that's cool though that gate then the prom said john did that,W AH1 T L EH1 S AH0 N AH0 N D S EH1 D DH AE1 T S K UW1 L DH OW1 DH AE1 T G EY1 T DH EH1 N DH AH0 P R AA1 M S EH1 D JH AA1 N D IH1 D DH AE1 T
13,./utterance_data/speaker_T/014.wav,Can you bring nursing_bottle from Bar go to Kitchen_Room move to Sofa .,can you bring glass bottle from Fargo to Kitchen room with sofa,K AE1 N Y UW1 B R IH1 NG G L AE1 S B AA1 T AH0 L F R AH1 M F AA1 R G OW2 T UW1 K IH1 CH AH0 N R UW1 M W IH1 DH S OW1 F AH0,i can play and that she could blow to put on that close to teach him the bird to suffer,AY1 K AE1 N P L EY1 AH0 N D DH AE1 T SH IY1 K UH1 D B L OW1 T UW1 P UH1 T AA1 N DH AE1 T K L OW1 S T UW1 T IY1 CH HH IH1 M DH AH0 B ER1 D T UW1 S AH1 F ER0
14,./utterance_data/speaker_T/015.wav,Can you bring filled_ketchup from Sofa go to lobby move to Reception_Table .,can you bring food Ketchup from sofa go to Dobie Bluetooth reception table,K AE1 N Y UW1 B R IH1 NG F UW1 D K EH1 CH AH0 P F R AH1 M S OW1 F AH0 G OW1 T UW1 D AA1 B IY0 B L UW1 T UW2 TH R IH0 S EH1 P SH AH0 N T EY1 B AH0 L,tanya blake is a good chap who aren't so flat go to will be moved to deception in,T AA1 N Y AH0 B L EY1 K IH1 Z AH0 G UH1 D CH AE1 P HH UW1 AA1 R AH0 N T S OW1 F L AE1 T G OW1 T UW1 W IH1 L B IY1 M UW1 V D T UW1 D IH0 S EH1 P SH AH0 N IH0 N
15,./utterance_data/speaker_T/016.wav,Would you go to Dining_Table  take spray_bottle  bring it to Living_Sofa .,would you go to dining table take spray bottle Living sofa,W UH1 D Y UW1 G OW1 T UW1 D AY1 N IH0 NG T EY1 B AH0 L T EY1 K S P R EY1 B AA1 T AH0 L L IH1 V IH0 NG S OW1 F AH0,would you go to de used him takes benevolent when they did it himself,W UH1 D Y UW1 G OW1 T UW1 D IY1 Y UW1 Z D HH IH1 M T EY1 K S B AH0 N EH1 V AH0 L AH0 N T W EH1 N DH EY1 D IH1 D IH1 T HH IH0 M S EH1 L F
16,./utterance_data/speaker_T/017.wav,Go to lobby  move to Dining_Table  finally leave the apartment .,go to Robbie Rebel to dining table apartment,G OW1 T UW1 R AA1 B IY0 R EH1 B AH0 L T UW1 D AY1 N IH0 NG T EY1 B AH0 L AH0 P AA1 R T M AH0 N T,what the of the village to turning to find the view that happened,W AH1 T DH AH0 AH1 V DH AH0 V IH1 L AH0 JH T UW1 T ER1 N IH0 NG T UW1 F AY1 N D DH AH0 V Y UW1 DH AE1 T HH AE1 P AH0 N D
17,./utterance_data/speaker_T/018.wav,Would you move to Reception_Table grasp dog_doll and come back .,Virgin Mobile reception table grass dog door and come back,V ER1 JH IH0 N M OW1 B AH0 L R IH0 S EH1 P SH AH0 N T EY1 B AH0 L G R AE1 S D AO1 G D AO1 R AH0 N D K AH1 M B AE1 K,the gym attitude is it shown to the rest of the dough and come back,DH AH0 JH IH1 M AE1 T AH0 T UW2 D IH1 Z IH1 T SH OW1 N T UW1 DH AH0 R EH1 S T AH1 V DH AH0 D OW1 AH0 N D K AH1 M B AE1 K
18,./utterance_data/speaker_T/019.wav,Move to Living_Table  grasp Cup_Noodle  leave the apartment please .,LIberty Leading table glass cup noodle attachment,L IH1 B ER0 T IY2 L IY1 D IH0 NG T EY1 B AH0 L G L AE1 S K AH1 P N UW1 D AH0 L AH0 T AE1 CH M AH0 N T,then the duty being dead and that cotton is a game that but that the mint green,DH EH1 N DH AH0 D UW1 T IY0 B IY1 IH0 NG D EH1 D AH0 N D DH AE1 T K AA1 T AH0 N IH1 Z AH0 G EY1 M DH AE1 T B AH1 T DH AE1 T DH AH0 M IH1 N T G R IY1 N
19,./utterance_data/speaker_T/020.wav,Can you go to Side_Table take cigarette carry it to Bar .,can you go to start the take cigarette carry it to buy,K AE1 N Y UW1 G OW1 T UW1 S T AA1 R T DH AH0 T EY1 K S IH2 G ER0 EH1 T K AE1 R IY0 IH1 T T UW1 B AY1,jaya good does that then take say that it can eighty two back,JH AY1 AH0 G UH1 D D AH1 Z DH AE1 T DH EH1 N T EY1 K S EY1 DH AE1 T IH1 T K AE1 N EY1 T IY0 T UW1 B AE1 K
20,./utterance_data/speaker_T/021.wav,Can you go to Kitchen_Table take apple carry it to Living_Table .,can you go to kitchen table after 38 the living table,K AE1 N Y UW1 G OW1 T UW1 K IH1 CH AH0 N T EY1 B AH0 L AE1 F T ER0 TH R IY1 EY1 T DH AH0 L IH1 V IH0 NG T EY1 B AH0 L,tango to keep sheep have to captain carry it to be maintained,T AE1 NG G OW0 T UW1 K IY1 P SH IY1 P HH AE1 V T UW1 K AE1 P T AH0 N K AE1 R IY0 IH1 T T UW1 B IY1 M EY0 N T EY1 N D
21,./utterance_data/speaker_T/022.wav,Go to Corridor er find a person neayby bring sauce from Dining_Sofa .,go to CODA find a person Rings sauce from dining sofa,G OW1 T UW1 K OW1 D AH0 F AY1 N D AH0 P ER1 S AH0 N R IH1 NG Z S AO1 S F R AH1 M D AY1 N IH0 NG S OW1 F AH0,good to put that kind of lesson yet that links so's flown banging so flat,G UH1 D T UW1 P UH1 T DH AE1 T K AY1 N D AH1 V L EH1 S AH0 N Y EH1 T DH AE1 T L IH1 NG K S S OW1 Z F L OW1 N B AE1 NG IH0 NG S OW1 F L AE1 T
22,./utterance_data/speaker_T/023.wav,Well go to Side_Table  take Korean_Soup finally come back .,where to go to side table 10 CareerSource finally,W EH1 R T UW1 G OW1 T UW1 S AY1 D T EY1 B AH0 L W AH1 N Z IH1 R OW0 S IY1 AH0 AA1 R IY1 IY1 AA1 R EH1 S OW1 Y UW1 AA1 R S IY1 IY1 F AY1 N AH0 L IY0,when you go to sedative who pay cody sells by many cover that,W EH1 N Y UW1 G OW1 T UW1 S EH1 D AH0 T IH0 V HH UW1 P EY1 K OW1 D IY0 S EH1 L Z B AY1 M EH1 N IY0 K AH1 V ER0 DH AE1 T
23,./utterance_data/speaker_T/024.wav,Go to Dining_Sofa find a person neayby  er follow a person .,go to dining sofa find a person nearby,G OW1 T UW1 D AY1 N IH0 NG S OW1 F AH0 F AY1 N D AH0 P ER1 S AH0 N N IH1 R B AY1,good to denny's skull flap buying the lesson the embankment flow of us,G UH1 D T UW1 D EH1 N IY0 Z S K AH1 L F L AE1 P B AY1 IH0 NG DH AH0 L EH1 S AH0 N DH AH0 EH0 M B AE1 NG K M AH0 N T F L OW1 AH1 V AH1 S
24,./utterance_data/speaker_T/025.wav,Would you move to Reception_Table take Orange_Juice then come back .,the gym abadula special table take orange juice then come back,DH AH0 JH IH1 M AH0 B IY1 AH0 D IY1 Y UW1 EH1 L AH0 S P EH1 SH AH0 L T EY1 B AH0 L T EY1 K AO1 R AH0 N JH JH UW1 S DH EH1 N K AH1 M B AE1 K,the gem of it do is to show him the day cut or induced to hand combat,DH AH0 JH EH1 M AH1 V IH1 T D UW1 IH1 Z T UW1 SH OW1 HH IH1 M DH AH0 D EY1 K AH1 T AO1 R IH2 N D UW1 S T T UW1 HH AE1 N D K AA1 M B AE0 T
25,./utterance_data/speaker_T/026.wav,Would you move to Side_Table take dog_doll then come back .,did you move it to the side table take doctor then come back,D IH1 D Y UW1 M UW1 V IH1 T T UW1 DH AH0 S AY1 D T EY1 B AH0 L T EY1 K D AA1 K T ER0 DH EH1 N K AH1 M B AE1 K,the gym that decided to take that don't then come back,DH AH0 JH IH1 M DH AE1 T D IH2 S AY1 D IH0 D T UW1 T EY1 K DH AE1 T D OW1 N T DH EH1 N K AH1 M B AE1 K
26,./utterance_data/speaker_T/027.wav,Go to lobby take empty_ketchup put it on Dining_Table please .,go to the VA Tech empty ketchup put it on dining table,G OW1 T UW1 DH AH0 V IY1 AH0 T EH1 K EH1 M P T IY0 K EH1 CH AH0 P P UH1 T IH1 T AA1 N D AY1 N IH0 NG T EY1 B AH0 L,good to be dead empty to chapter to eat on banging the table three,G UH1 D T UW1 B IY1 D EH1 D EH1 M P T IY0 T UW1 CH AE1 P T ER0 T UW1 IY1 T AA1 N B AE1 NG IH0 NG DH AH0 T EY1 B AH0 L TH R IY1
27,./utterance_data/speaker_T/028.wav,Would you go to Sofa  take Cup_Star  bring it to Side_Table .,would you go to Sofitel kapstadt bring it to size,W UH1 D Y UW1 G OW1 T UW1 S AA1 F AH0 T EH2 L K EY1 AH0 P IY1 EH1 S T IY1 AH0 D IY1 T IY1 B R IH1 NG IH1 T T UW1 S AY1 Z,the jungle it does so flat head caps that plane he did said they,DH AH0 JH AH1 NG G AH0 L IH1 T D AH1 Z S OW1 F L AE1 T HH EH1 D K AE1 P S DH AE1 T P L EY1 N HH IY1 D IH1 D S EH1 D DH EY1
28,./utterance_data/speaker_T/029.wav,Go to Living_Sofa get Korean_Soup  exit from Kitchen_Room okay .,go to living sofa get Korea Civ exit for kids in love okay,G OW1 T UW1 L IH1 V IH0 NG S OW1 F AH0 G EH1 T K AO2 R IY1 AH0 S IY1 AY1 V IY1 EH1 G Z IH0 T F AO1 R K IH1 D Z IH0 N L AH1 V OW2 K EY1,go to living so flat get caught yes it does it fall mud caked in and all day,G OW1 T UW1 L IH1 V IH0 NG S OW1 F L AE1 T G EH1 T K AA1 T Y EH1 S IH1 T D AH1 Z IH1 T F AO1 L M AH1 D K EY1 K T IH0 N AH0 N D AO1 L D EY1
29,./utterance_data/speaker_T/030.wav,Go to Bar find a person neayby  er follow a person .,go to bed find a person for me a puzzle,G OW1 T UW1 B EH1 D F AY1 N D AH0 P ER1 S AH0 N F AO1 R M IY1 AH0 P AH1 Z AH0 L,good to bed playing at that bad knee and be a bad fall the lesson,G UH1 D T UW1 B EH1 D P L EY1 IH0 NG AE1 T DH AE1 T B AE1 D N IY1 AH0 N D B IY1 AH0 B AE1 D F AO1 L DH AH0 L EH1 S AH0 N
30,./utterance_data/speaker_T/031.wav,Can you go to lobby get canned_juice then come back .,can you go to the way I get confused then come back,K AE1 N Y UW1 G OW1 T UW1 DH AH0 W EY1 AY1 G EH1 T K AH0 N F Y UW1 Z D DH EH1 N K AH1 M B AE1 K,can go into guilty and get grad students didn't come back,K AE1 N G OW1 IH1 N T UW0 G IH1 L T IY0 AH0 N D G EH1 T G R AE1 D S T UW1 D AH0 N T S D IH1 D AH0 N T K AH1 M B AE1 K
31,./utterance_data/speaker_T/032.wav,Well move to Living_Table Grasp Brown_Tea then come back .,where the writing-table grass prante,W EH1 R DH AH0 D AH1 B AH0 L Y UW0 AA1 R AY1 T IY1 AY1 EH1 N JH IY1 T IY1 AH0 B IY1 EH1 L IY1 G R AE1 S P IY1 AA1 R AH0 EH1 N T IY1 IY1,well moves to lady luck at the gas man he said come back,W EH1 L M UW1 V Z T UW1 L EY1 D IY0 L AH1 K AE1 T DH AH0 G AE1 S M AE1 N HH IY1 S EH1 D K AH1 M B AE1 K
32,./utterance_data/speaker_T/033.wav,Go to Dining_Table Grasp filled_plastic_bottle  leave the apartment please .,go to dining table last page classic butter apartment please,G OW1 T UW1 D AY1 N IH0 NG T EY1 B AH0 L L AE1 S T P EY1 JH K L AE1 S IH0 K B AH1 T ER0 AH0 P AA1 R T M AH0 N T P L IY1 Z,glutted banging the day of the best paid that's equal to the beams and at it the youths,G L AH1 T IH0 D B AE1 NG IH0 NG DH AH0 D EY1 AH1 V DH AH0 B EH1 S T P EY1 D DH AE1 T S IY1 K W AH0 L T UW1 DH AH0 B IY1 M Z AH0 N D AE1 T IH1 T DH AH0 Y UW1 DH Z
33,./utterance_data/speaker_T/034.wav,Well move to Reception_Table Grasp Japanese_Tea then come back .,Play the movie to deception Taylor Japanese tea come back,P L EY1 DH AH0 M UW1 V IY0 T UW1 D IH0 S EH1 P SH AH0 N T EY1 L ER0 JH AE2 P AH0 N IY1 Z T IY1 K AH1 M B AE1 K,they moved to this it's shown to the asks japanese he can come back,DH EY1 M UW1 V D T UW1 DH IH1 S IH1 T S SH OW1 N T UW1 DH AH0 AE1 S K S JH AE2 P AH0 N IY1 Z HH IY1 K AE1 N K AH1 M B AE1 K
34,./utterance_data/speaker_T/035.wav,Go to lobby Grasp nursing_bottle throw it into Dustbin please .,go to Ruby Crest Nursing,G OW1 T UW1 R UW1 B IY0 K R EH1 S T N ER1 S IH0 NG,look do the best passing,L UH1 K D UW1 DH AH0 B EH1 S T P AE1 S IH0 NG
35,./utterance_data/speaker_T/036.wav,Can you go to Visitor_Room get Japanese_Tea then come back .,go to Ruby Crest Nursing butter throw it into the Dustbin please,G OW1 T UW1 R UW1 B IY0 K R EH1 S T N ER1 S IH0 NG B AH1 T ER0 TH R OW1 IH1 T IH1 N T UW0 DH AH0 D AH1 S T B IH0 N P L IY1 Z,what did well be that nothing about the look so it needs you to bask in the ether,W AH1 T D IH1 D W EH1 L B IY1 DH AE1 T N AH1 TH IH0 NG AH0 B AW1 T DH AH0 L UH1 K S OW1 IH1 T N IY1 D Z Y UW1 T UW1 B AE1 S K IH0 N DH AH0 IY1 TH ER0
36,./utterance_data/speaker_T/037.wav,Go to kitchen next find Cup_Noodle take it .,go to Kitchen next five cup noodle,G OW1 T UW1 K IH1 CH AH0 N N EH1 K S T F AY1 V K AH1 P N UW1 D AH0 L,go to get a next time it happened in the bag,G OW1 T UW1 G EH1 T AH0 N EH1 K S T T AY1 M IH1 T HH AE1 P AH0 N D IH0 N DH AH0 B AE1 G
37,./utterance_data/speaker_T/038.wav,Can you go to Visitor_Room get toy_penguin then come back .,can you go to potato to get a comeback,K AE1 N Y UW1 G OW1 T UW1 P AH0 T EY1 T OW2 T UW1 G EH1 T AH0 K AH1 M B AE2 K,china good too busy there to get tight game he said come back,CH AY1 N AH0 G UH1 D T UW1 B IH1 Z IY0 DH EH1 R T UW1 G EH1 T T AY1 T G EY1 M HH IY1 S EH1 D K AH1 M B AE1 K
38,./utterance_data/speaker_T/039.wav,Well get Bath_Cleaner from Living_Table go to Visitor_Room go to Living_Room .,where to get a screen from being disabled go to the beach Tulum go to the bingo,W EH1 R T UW1 G EH1 T AH0 S K R IY1 N F R AH1 M B IY1 IH0 NG D IH0 S EY1 B AH0 L D G OW1 T UW1 DH AH0 B IY1 CH T IY1 Y UW1 EH1 L Y UW1 EH1 M G OW1 T UW1 DH AH0 B IH1 NG G OW0,let it get back screen and known to being a kid goes to the staten go to the beat him,L EH1 T IH1 T G EH1 T B AE1 K S K R IY1 N AH0 N D N OW1 N T UW1 B IY1 IH0 NG AH0 K IH1 D G OW1 Z T UW1 DH AH0 S T AE1 T AH0 N G OW1 T UW1 DH AH0 B IY1 T HH IH1 M
39,./utterance_data/speaker_T/040.wav,Would you go to Dining_Room Grasp pink_cup er come back .,would you go to dining room pink cap come back,W UH1 D Y UW1 G OW1 T UW1 D AY1 N IH0 NG R UW1 M P IH1 NG K K AE1 P K AH1 M B AE1 K,would you go to danny who live gasped being kept bad come back,W UH1 D Y UW1 G OW1 T UW1 D AE1 N IY0 HH UW1 L AY1 V G AE1 S P T B IY1 IH0 NG K EH1 P T B AE1 D K AH1 M B AE1 K
40,./utterance_data/speaker_T/041.wav,Go to Dining_Sofa  take Korean_Soup put it on Bar okay .,go to Danny guccifer take Korean soup retreat,G OW1 T UW1 D AE1 N IY0 JH IY1 Y UW1 S IY1 S IY1 AY1 EH1 F IY1 AA1 R T EY1 K K AO2 R IY1 AH0 N S UW1 P R IY0 T R IY1 T,what did benny discipline take cody and says that the two that okay,W AH1 T D IH1 D B EH1 N IY0 D IH1 S AH0 P L AH0 N T EY1 K K OW1 D IY0 AH0 N D S EH1 Z DH AE1 T DH AH0 T UW1 DH AE1 T OW2 K EY1
41,./utterance_data/speaker_T/042.wav,Go to lobby take nursing_bottle put it on Bar please .,go to Robbie Tech nursing butter put it on Bob braids,G OW1 T UW1 R AA1 B IY0 T EH1 K N ER1 S IH0 NG B AH1 T ER0 P UH1 T IH1 T AA1 N B AA1 B B R EY1 D Z,look to all the dead not seeing a bottle of that date on that jury if,L UH1 K T UW1 AO1 L DH AH0 D EH1 D N AA1 T S IY1 IH0 NG AH0 B AA1 T AH0 L AH1 V DH AE1 T D EY1 T AA1 N DH AE1 T JH UH1 R IY0 IH1 F
42,./utterance_data/speaker_T/043.wav,Call a person then ask for an order get cubic_clock from Bar .,Coda person ask for an odor get cubic clock from,K OW1 D AH0 P ER1 S AH0 N AE1 S K F AO1 R AE1 N OW1 D ER0 G EH1 T K Y UW1 B IH0 K K L AA1 K F R AH1 M,claudette pass the senate ask for a bullet that it to the cook phoned back,K L OW0 D EH1 T P AE1 S DH AH0 S EH1 N AH0 T AE1 S K F AO1 R AH0 B UH1 L AH0 T DH AE1 T IH1 T T UW1 DH AH0 K UH1 K F OW1 N D B AE1 K
43,./utterance_data/speaker_T/044.wav,Go to Corridor get Red_Tea throw it into Dustbin please .,go to Kotor there get ready throw it into test me please,G OW1 T UW1 K EY1 OW1 T IY1 OW1 AA1 R DH EH1 R G EH1 T R EH1 D IY0 TH R OW1 IH1 T IH1 N T UW0 T EH1 S T M IY1 P L IY1 Z,good to go to that get to that di figaro aids tainted that's a pretty,G UH1 D T UW1 G OW1 T UW1 DH AE1 T G EH1 T T UW1 DH AE1 T D IY1 F IH1 G ER0 OW2 EY1 D Z T EY1 N T IH0 D DH AE1 T S AH0 P R IH1 T IY0
44,./utterance_data/speaker_T/045.wav,Go to Kitchen_Room  go to Dining_Sofa er leave the apartment .,go to Kitchener go to dining staff at the apartment,G OW1 T UW1 K IH1 CH AH0 N ER0 G OW1 T UW1 D AY1 N IH0 NG S T AE1 F AE1 T DH AH0 AH0 P AA1 R T M AH0 N T,go to teaching them good to getting stuff that badly needed the batman,G OW1 T UW1 T IY1 CH IH0 NG DH EH1 M G UH1 D T UW1 G EH1 T IH0 NG S T AH1 F DH AE1 T B AE1 D L IY0 N IY1 D AH0 D DH AH0 B AE1 T M AE2 N
45,./utterance_data/speaker_T/046.wav,Go to Side_Table find a person neayby  er follow a person .,go to side table find a person by photo at peso,G OW1 T UW1 S AY1 D T EY1 B AH0 L F AY1 N D AH0 P ER1 S AH0 N B AY1 F OW1 T OW2 AE1 T P EY1 S OW0,good to said didn't mind that lesson yet then pull out path,G UH1 D T UW1 S EH1 D D IH1 D AH0 N T M AY1 N D DH AE1 T L EH1 S AH0 N Y EH1 T DH EH1 N P UH1 L AW1 T P AE1 TH
46,./utterance_data/speaker_T/047.wav,Move to Kitchen_Table  go to Living_Sofa then exit the apartment .,Liberty kitchen table go to living so far is it Apartments,L IH1 B ER0 T IY2 K IH1 CH AH0 N T EY1 B AH0 L G OW1 T UW1 L IH1 V IH0 NG S OW1 F AA1 R IH1 Z IH1 T AH0 P AA1 R T M AH0 N T S,that didn't he didn't get a good today being supplied that the date that the bad thing,DH AE1 T D IH1 D AH0 N T HH IY1 D IH1 D AH0 N T G EH1 T AH0 G UH1 D T AH0 D EY1 B IY1 IH0 NG S AH0 P L AY1 D DH AE1 T DH AH0 D EY1 T DH AE1 T DH AH0 B AE1 D TH IH1 NG
47,./utterance_data/speaker_T/048.wav,Go to Living_Sofa  take filled_ketchup put it on Kitchen_Table okay .,go to the wings of a tech fair catch up to date on kitchen table okay,G OW1 T UW1 DH AH0 W IH1 NG Z AH1 V AH0 T EH1 K F EH1 R K AE1 CH AH1 P T UW1 D EY1 T AA1 N K IH1 CH AH0 N T EY1 B AH0 L OW2 K EY1,good today being so than ten days to chat to date to do that again,G UH1 D T AH0 D EY1 B IY1 IH0 NG S OW1 DH AE1 N T EH1 N D EY1 Z T UW1 CH AE1 T T UW1 D EY1 T T UW1 D UW1 DH AE1 T AH0 G EH1 N
48,./utterance_data/speaker_T/049.wav,Can you move to Kitchen_Table get rabbit_doll then come back .,Calumet to Kitchen Tyler get out the door then come back,K AE2 L Y AH0 M EH1 T T UW1 K IH1 CH AH0 N T AY1 L ER0 G EH1 T AW1 T DH AH0 D AO1 R DH EH1 N K AH1 M B AE1 K,italian leather to get to bed and get daddy to go then come back,IH2 T AE1 L Y AH0 N L EH1 DH ER0 T UW1 G EH1 T T UW1 B EH1 D AH0 N D G EH1 T D AE1 D IY0 T UW1 G OW1 DH EH1 N K AH1 M B AE1 K
49,./utterance_data/speaker_T/050.wav,Well get toy_car from Sofa go to bed_room move to Living_Table .,where to get toy car from sofa go to bedroom move to living table,W EH1 R T UW1 G EH1 T T OY1 K AA1 R F R AH1 M S OW1 F AH0 G OW1 T UW1 B EH1 D R UW2 M M UW1 V T UW1 L IH1 V IH0 NG T EY1 B AH0 L,when gets to leak hat on sofa go to bed to move into the big tent,W EH1 N G EH1 T S T UW1 L IY1 K HH AE1 T AA1 N S OW1 F AH0 G OW1 T UW1 B EH1 D T UW1 M UW1 V IH1 N T UW0 DH AH0 B IH1 G T EH1 N T
50,./utterance_data/speaker_T/051.wav,Go to Side_Table next detect toy_duck  take it .,go to side table next tide at Target,G OW1 T UW1 S AY1 D T EY1 B AH0 L N EH1 K S T T AY1 D AE1 T T AA1 R G AH0 T,good decided that the banks you get payback can't be sick,G UH1 D D IH2 S AY1 D IH0 D DH AE1 T DH AH0 B AE1 NG K S Y UW1 G EH1 T P EY1 B AE2 K K AE1 N T B IY1 S IH1 K
51,./utterance_data/speaker_T/052.wav,Go to Visitor_Room get toy_penguin throw it into Dustbin please .,go to visit Aurora get type and throw it into that's being played,G OW1 T UW1 V IH1 Z IH0 T ER0 AO1 R AH0 G EH1 T T AY1 P AH0 N D TH R OW1 IH1 T IH1 N T UW0 DH AE1 T S B IY1 IH0 NG P L EY1 D,go it does david baron get tied banging felt it into that's being made,G OW1 IH1 T D AH1 Z D EY1 V IH0 D B AE1 R AH0 N G EH1 T T AY1 D B AE1 NG IH0 NG F EH1 L T IH1 T IH1 N T UW0 DH AE1 T S B IY1 IH0 NG M EY1 D
52,./utterance_data/speaker_T/053.wav,Would you move to Dining_Sofa get hourglass bring it to Side_Table .,Jim Abbott do dining suffragette fagus bring it to side table,JH IH1 M AE1 B AH0 T D UW1 D AY1 N IH0 NG S AH2 F R AH0 JH EH1 T EH1 F AH0 JH IY1 Y UW1 EH1 S B R IH1 NG IH1 T T UW1 S AY1 D T EY1 B AH0 L,the gym and to danny's so flat get well that's going to be a tooth i'd get,DH AH0 JH IH1 M AH0 N D T UW1 D AE1 N IY0 Z S OW1 F L AE1 T G EH1 T W EH1 L DH AE1 T S G OW1 IH0 NG T UW1 B IY1 AH0 T UW1 TH AY1 D G EH1 T
53,./utterance_data/speaker_T/054.wav,Would you move to Bar Grasp rubik's_cube and come back .,the gym abbotabad grass Rubik's Cube and catback,DH AH0 JH IH1 M AH0 B IY1 B IY1 OW1 T IY1 AH0 B IY1 AH0 D IY1 G R AE1 S R UW1 B IH0 K S K Y UW1 B AH0 N D S IY1 AH0 T IY1 B IY1 AH0 S IY1 K EY1,the gym the two that gas bill make it a handicap back,DH AH0 JH IH1 M DH AH0 T UW1 DH AE1 T G AE1 S B IH1 L M EY1 K IH1 T AH0 HH AE1 N D IY0 K AE2 P B AE1 K
54,./utterance_data/speaker_T/055.wav,Go to Kitchen_Room Grasp camera throw it into Dustbin please .,go to Kitchen gas camera throw it into testing place,G OW1 T UW1 K IH1 CH AH0 N G AE1 S K AE1 M ER0 AH0 TH R OW1 IH1 T IH1 N T UW0 T EH1 S T IH0 NG P L EY1 S,got to get to nerve gas command are subtlety seeking to testing v.,G AA1 T T UW1 G EH1 T T UW1 N ER1 V G AE1 S K AH0 M AE1 N D AA1 R S AH1 T AH0 L T IY0 S IY1 K IH0 NG T UW1 T EH1 S T IH0 NG V IY1
55,./utterance_data/speaker_T/056.wav,Would you go to Sofa take Chip_Star er come back .,did you go to suffer take chipsa comeback,D IH1 D Y UW1 G OW1 T UW1 S AH1 F ER0 T EY1 K S IY1 EY1 CH AY1 P IY1 EH1 S AH0 K AH1 M B AE2 K,the did you go to supplant keg tapes that come back,DH AH0 D IH1 D Y UW1 G OW1 T UW1 S AH0 P L AE1 N T K EH1 G T EY1 P S DH AE1 T K AH1 M B AE1 K
56,./utterance_data/speaker_T/057.wav,Go to Visitor_Room next find apple Grasp it .,go to Big Data next find Apple,G OW1 T UW1 B IH1 G D EY1 T AH0 N EH1 K S T F AY1 N D AE1 P AH0 L,look the bitch then the next friday at the gas mickey,L UH1 K DH AH0 B IH1 CH DH EH1 N DH AH0 N EH1 K S T F R AY1 D IY0 AE1 T DH AH0 G AE1 S M IH1 K IY0
