Input,phonemelabel,Noisylabel,Labeldata
Move to Living_Sofa get Long_Potato place it on Side_Table okay .,M UW1 V T UW1 L IH1 V IH0 NG S OW1 F AH0 G EH1 T L AO1 NG P AH0 T EY1 T OW2 P L EY1 S IH1 T AA1 N S AY1 D T EY1 B AH0 L OW2 K EY1,M UW1 T UW1 L IH1 V N NG S OW1 AY F AH0 G EH1 T AO1 NG P AH0 T EY1 T OW2 P L EY1 ER0 S IH1 T AA1 N S AY1 D T EY1 B AH0 L OW2 K EY1,Move ( Living_Sofa ) Find ( Long_Potato Living_Sofa  ) Grasp ( Long_Potato )  Move ( Side_Table ) Place ( Long_Potato Living_Sofa )
Can you bring camera from Side_Table go to bed_room move to Living_Sofa .,K AE1 N Y UW1 B R IH1 NG K AE1 M ER0 AH0 F R AH1 M S AY1 D T EY1 B AH0 L G OW1 T UW1 B EH1 D R UW1 M M UW1 V T UW1 L IH1 V IH0 NG S OW1 F AH0,K AE1 N Y UW1 B R NG K AE1 M ER0 AH0 R AH1 M S AY1 D T EY1 B OY2 L G OW1 AE2 T UW1 B EH1 D R M M UW1 V T UW1 L IH1 V IH0 NG OW1 F AH0,Move ( Side_Table ) Find ( camera Side_Table  ) Grasp ( camera ) Move ( bed_room ) ( Living_Sofa )
Go to bed_room er find a person neayby bring empty_plastic_bottle from Reception_Table .,G OW1 T UW1 B EH1 D R UW1 M ER0 F AY1 N D AH0 P ER1 S AH0 N N IH1 R B AY1 B R IH1 NG EH1 M P T IY0 P L AE1 S T IH0 K B AA1 T AH0 L F R AH1 M R IH0 S EH1 P SH AH0 N T EY1 B AH0 L,G OW1 T UW1 B EH1 D R UW1 M ER0 AY1 EY0 N AH0 P ER1 S AH0 N N OW B R B AY1 B R IH1 NG EH1 M Y P T IY0 P L AE1 S T IH0 K B AA1 T AY0 AH0 L HH NG R ER1 AH1 M IH0 S EH1 P SH AH0 AW2 T EY1 B AH0 L,Move ( bed_room ) Find ( person bed_room ) Move ( Reception_Table ) Grasp ( empty_plastic_bottle )
Would you bring spray_bottle from Living_Sofa go to Dining_Sofa go to Kitchen_Table  .,W UH1 D Y UW1 B R IH1 NG S P R EY1 B AA1 T AH0 L F R AH1 M L IH1 V IH0 NG S OW1 F AH0 G OW1 T UW1 D AY1 N IH0 NG S OW1 F AH0 G OW1 T UW1 K IH1 CH AH0 N T EY1 B AH0 L,W UH1 D Y UW1 R IH1 NG S P R EY1 B AA1 T AH0 L F R AH1 M L IH1 V IH0 NG S OW1 F AH0 OW1 T UW1 D AY1 N IH0 DH NG S OW1 F AH0 G OW1 T UW1 K IH1 CH AH0 N T EY1 B AH0 L,Move ( Living_Sofa ) Place ( spray_bottle Living_Sofa ) Move ( Dining_Sofa ) Move ( Dining_Sofa ) 
Go to Dining_Room er find a person neayby bring tumbler from Side_Table .,G OW1 T UW1 D AY1 N IH0 NG R UW1 M ER0 F AY1 N D AH0 P ER1 S AH0 N N IH1 R B AY1 B R IH1 NG T AH1 M B L ER0 F R AH1 M S AY1 D T EY1 B AH0 L,G OW1 T UW1 D AY1 N IH0 NG R UW1 M ER0 F AY1 N D AH0 P ER1 S AH0 N N IH1 R B AY1 B R IH1 NG T AH1 M B L ER0 F R AH1 M S AY1 D T EY1 B AH0 L,Move ( Dining_Room ) Find ( person Dining_Room ) Move ( Side_Table ) Grasp ( tumbler )
Go to Dining_Room next find nursing_bottle take it .,G OW1 T UW1 D AY1 N IH0 NG R UW1 M N EH1 K S T F AY1 N D N ER1 S IH0 NG B AA1 T AH0 L T EY1 K IH1 T,G OW1 T AE2 UW1 D AY1 N IH0 NG R UW1 M N EH1 IH1 S T F AY1 N D N ER1 S IH0 NG B AA1 T AH0 L T EY1 K IH1 T,Move (  Dining_Room  ) Find ( nursing_bottle Dining_Room  ) Grasp ( nursing_bottle ) 
Would you go to Dining_Sofa take hourglass er come back .,W UH1 D Y UW1 G OW1 T UW1 D AY1 N IH0 NG S OW1 F AH0 T EY1 K AW1 ER0 G L AE2 S ER0 K AH1 M B AE1 K,W UH1 D IH2 Y UW1 G OW1 T UW1 D N IH0 NG S OW1 F AH0 T EY1 K IY0 IH1 AW1 ER0 G L AE2 S K AH1 M B AE1 K,Move ( Dining_Sofa ) Find ( hourglass Dining_Sofa ) Grasp ( hourglass ) Move ( HERE )
Can you go to Dining_Sofa take sauce carry it to Side_Table .,K AE1 N Y UW1 G OW1 T UW1 D AY1 N IH0 NG S OW1 F AH0 T EY1 K S AO1 S K AE1 R IY0 IH1 T T UW1 S AY1 D T EY1 B AH0 L,EH1 AE1 EY0 Y UW1 G OW1 T UW1 AH AY1 N IH0 NG OW1 F AH0 T EY1 K S AO1 S K AE1 DH R IY0 IH1 T T UW1 S AY1 D T EY1 B AH0 L,Move ( Dining_Sofa  ) Find ( sauce Dining_Sofa ) Grasp ( sauce ) Move ( Side_Table )
Go to Dining_Sofa  and  detect rabbit_doll Grasp it .,G OW1 T UW1 D AY1 N IH0 NG S OW1 F AH0 AH0 N D D IH0 T EH1 K T R AE1 B AH0 T D AA1 L G R AE1 S P IH1 T,G OW1 T IH UW1 D AY1 N IH0 NG S ER OW1 F AH0 EH0 AH0 D D IH0 T EH1 AO0 T R AE1 B AH0 T D AA1 L G R AE1 S P IH1 T,Move (  Dining_Sofa  ) Find ( rabbit_doll Dining_Sofa  ) Grasp ( rabbit_doll ) 
Go to Dining_Room  move to Kitchen_Table  finally leave the apartment .,G OW1 T UW1 D AY1 N IH0 NG R UW1 M M UW1 V T UW1 K IH1 CH AH0 N T EY1 B AH0 L F AY1 N AH0 L IY0 L IY1 V DH AH0 AH0 P AA1 R T M AH0 N T,G OW1 T UW1 D AY1 N IH0 NG R UW1 AO1 M UW1 V T UW1 K IH1 CH TH B AH0 N T G EY1 B AH0 L F AY1 N AH0 L IY0 L IY1 V DH AH0 Z P AA1 R T M AH0 N T,Move ( Dining_Room ) Move ( Kitchen_Table )  Move ( apartment )
Would you go to Dining_Room Grasp Stick_Potato finally come back .,W UH1 D Y UW1 G OW1 T UW1 D AY1 N IH0 NG R UW1 M G R AE1 S P S T IH1 K P AH0 T EY1 T OW2 F AY1 N AH0 L IY0 K AH1 M B AE1 K,W UH1 D Y UW1 G OW1 T D AY1 N IY0 IH0 NG AY R UW1 M G R AE1 S P S IH1 K P AH0 T EY1 T OW2 F AY1 N AH0 L IY0 K AH1 B AE1 K,Move ( Dining_Room ) Find ( Stick_Potato Dining_Room ) Grasp ( Stick_Potato )  Move ( HERE )
Go to Sofa take cigarette  leave the apartment please .,G OW1 T UW1 S OW1 F AH0 T EY1 K S IH2 G ER0 EH1 T L IY1 V DH AH0 AH0 P AA1 R T M AH0 N T P L IY1 Z,EY2 OW1 T F UW1 S F AH0 T EY1 K S IH2 G EY2 ER0 EH1 T IY1 AA2 DH AH0 AH0 P AA1 R M AH0 N T P L IY1 Z,Move ( Sofa ) Grasp ( cigarette ) Move ( apartment )
Move to Dining_Sofa get Long_Potato place it on Sofa okay .,M UW1 V T UW1 D AY1 N IH0 NG S OW1 F AH0 G EH1 T L AO1 NG P AH0 T EY1 T OW2 P L EY1 S IH1 T AA1 N S OW1 F AH0 OW2 K EY1,AY1 M UW1 ER2 V T AY UW1 D UW1 N IH0 NG S OW1 F AH0 G EH1 T L AO1 NG P AH0 T EY1 T OW2 P L EY1 S IH1 T AA1 N S OW1 F AH0 OW2,Move ( Dining_Sofa ) Find ( Long_Potato Dining_Sofa  ) Grasp ( Long_Potato )  Move ( Sofa ) Place ( Long_Potato Dining_Sofa )
Go to lobby then find a person neayby bring camera from Living_Table .,G OW1 T UW1 L AA1 B IY0 DH EH1 N F AY1 N D AH0 P ER1 S AH0 N N IH1 R B AY1 B R IH1 NG K AE1 M ER0 AH0 F R AH1 M L IH1 V IH0 NG T EY1 B AH0 L,G OW1 T UW1 L AA1 B IY0 DH EH1 N F N D AH0 P ER1 S AH0 AY0 N N IH1 R B AY1 B R IH1 NG K AE1 M ER0 AH0 F R AH1 M L IH1 V IH0 NG T EY1 AH0 OW0 L,Move ( lobby ) Find ( person lobby ) Move ( Living_Table ) Grasp ( camera )
Would you bring sauce from Living_Table go to Living_Sofa go to Sofa  .,W UH1 D Y UW1 B R IH1 NG S AO1 S F R AH1 M L IH1 V IH0 NG T EY1 B AH0 L G OW1 T UW1 L IH1 V IH0 NG S OW1 F AH0 G OW1 T UW1 S OW1 F AH0,W UH1 D Y UW1 B R IH1 NG IY1 AO1 S F R AH1 M L OW1 IH1 V IH0 NG T EY1 B AH0 L G OW1 T UW1 L IH1 V IH0 NG S OW1 Y F AH0 G OW1 T UW1 S OW1 F AH0,Move ( Living_Table ) Place ( sauce Living_Table ) Move ( Living_Sofa ) Move ( Living_Sofa ) 
Would you go to Side_Table get Cup_Star carry it to Living_Table .,W UH1 D Y UW1 G OW1 T UW1 S AY1 D T EY1 B AH0 L G EH1 T K AH1 P S T AA1 R K AE1 R IY0 IH1 T T UW1 L IH1 V IH0 NG T EY1 B AH0 L,W UH1 D Y UW1 G OW1 T UW1 S AY1 D T EY1 B AH0 L G EH1 T K AH1 P S T AA1 R K AE1 R IY0 R IH1 AA2 ER1 T UW1 L IH1 V IH0 T EY1 ER1 B AH0 L,Move (  Side_Table ) Find ( Cup_Star Side_Table  ) Grasp ( Cup_Star )  Move ( Living_Table )
Can you go to Side_Table take Dish_Cleaner carry it to Sofa .,K AE1 N Y UW1 G OW1 T UW1 S AY1 D T EY1 B AH0 L T EY1 K D IH1 SH K L IY1 N ER0 K AE1 R IY0 IH1 T T UW1 S OW1 F AH0,K AE1 N AO1 G OW1 T UW1 S AY1 D T EY1 B AH0 L T EY1 K D IH1 SH K L IY1 N ER0 K R IY0 IH1 T T UW1 S OW1 F AH0,Move ( Side_Table  ) Find ( Dish_Cleaner Side_Table ) Grasp ( Dish_Cleaner ) Move ( Sofa )
Go to Bar and find a person neayby bring rubik's_cube from Dining_Sofa .,G OW1 T UW1 B AA1 R AH0 N D F AY1 N D AH0 P ER1 S AH0 N N IH1 R B AY1 B R IH1 NG R UW1 B IH0 K S K Y UW1 B F R AH1 M D AY1 N IH0 NG S OW1 F AH0,G OW1 T UW1 B R AH0 N F AY1 N D AH0 P ER1 S AH0 N UH1 N IH1 B AY1 B AO1 R IH1 N AY1 R UW1 B IH0 K S K Y UW1 B F R AH1 M D AY1 N IH0 DH S OW1 F AH0,Move (  Bar  ) Find ( rubik's_cube Bar  ) Grasp ( rubik's_cube ) Find ( pesron Bar ) Plcae ( rubik's_cube PERSON )
Well move to Sofa Grasp Brown_Tea then come back .,W EH1 L M UW1 V T UW1 S OW1 F AH0 G R AE1 S P B R AW1 N T IY1 DH EH1 N K AH1 M B AE1 K,W EH1 L M AY V T UW1 S OW1 AE0 F AH0 G R AE1 S B R AW1 N T IY1 DH EH1 N K AH1 M B AE1 K,Move ( Sofa ) Move ( Brown_Tea ) Move ( HERE )
Call a person then ask for an order get Lemon_Tea from Side_Table .,K AO1 L AH0 P ER1 S AH0 N DH EH1 N AE1 S K F AO1 R AE1 N AO1 R D ER0 G EH1 T L EH1 M AH0 N T IY1 F R AH1 M S AY1 D T EY1 B AH0 L,K AO1 L AH0 P P AA1 S AH0 N DH EH1 N AE1 S AO1 R AE1 N AO1 R D ER0 G R Y T L EH1 M N T IY1 F R AH1 M S AY1 D T EY1 B AH0 L,Say ( person ) Listen ( Lemon_Tea ) Move ( Side_Table ) Find ( Lemon_Tea Side_Table ) Grasp ( Lemon_Tea ) Move ( Lemon_Tea ) Place ( Lemon_Tea Side_Table ) 
Go to lobby  move to Living_Sofa  then leave the apartment .,G OW1 T UW1 L AA1 B IY0 M UW1 V T UW1 L IH1 V IH0 NG S OW1 F AH0 DH EH1 N L IY1 V DH AH0 AH0 P AA1 R T M AH0 N T,G OW1 T UW1 AA1 B IY0 M UH V T UW1 L V IH0 NG S OW1 F AH0 DH EH1 N L IY1 DH AH0 AH0 P AA1 R T M JH AH0 N EH1 T,Move ( lobby ) Move ( Living_Sofa ) Move ( apartment )
Can you move to Dining_Table get twin_bell_alarm_clock then come back .,K AE1 N Y UW1 M UW1 V T UW1 D AY1 N IH0 NG T EY1 B AH0 L G EH1 T T W IH1 N B EH1 L AH0 L AA1 R M K L AA1 K DH EH1 N K AH1 M B AE1 K,K AE1 N Y UW1 JH M UW1 V T UW1 D AY1 N IH0 NG T EY1 B AH0 G EH1 T T W IH1 N B EH1 L AH0 L AA1 R M K L AA1 K DH EH1 N K AH1 M B AE1 K,Move ( Dining_Table ) Grasp ( twin_bell_alarm_clock ) Move ( HERE )
Go to Living_Sofa get sugar  exit from lobby okay .,G OW1 T UW1 L IH1 V IH0 NG S OW1 F AH0 G EH1 T SH UH1 G ER0 EH1 G Z IH0 T F R AH1 M L AA1 B IY0 OW2 K EY1,G OW1 T UW1 L IH1 V IH0 NG S OW1 F AH0 G EH1 T SH UH1 G ER0 G Z IH0 T F R Z M AA1 HH IY0 OW2 EY1,Move (  Living_Sofa  ) Find ( sugar Living_Sofa  ) Grasp ( sugar ) Move ( lobby )
Go to Living_Table move to Reception_Table  then leave the apartment .,G OW1 T UW1 L IH1 V IH0 NG T EY1 B AH0 L M UW1 V T UW1 R IH0 S EH1 P SH AH0 N T EY1 B AH0 L DH EH1 N L IY1 V DH AH0 AH0 P AA1 R T M AH0 N T,G OW1 T L IH1 V IH0 K AH2 T IH1 EY1 B AH0 L UW1 V T UW1 R IH0 OY1 S EH1 P SH AH0 N EY1 B AH0 DH EH1 N L IY1 V DH AH0 AH0 EH0 P AA1 R T M AH0 N T,Move ( Living_Table ) Move ( Reception_Table ) Move ( apartment )
Go to Sofa move to Side_Table  then leave the apartment .,G OW1 T UW1 S OW1 F AH0 M UW1 V T UW1 S AY1 D T EY1 B AH0 L DH EH1 N L IY1 V DH AH0 AH0 P AA1 R T M AH0 N T,G OW1 T UW1 AE0 S OW1 F AH0 AH M V T UW1 AY1 D T EY1 B AH0 L DH EH1 N L IY1 V AA DH AH0 AH0 P AA1 R T M AH0 N SH,Move ( Sofa ) Move ( Side_Table ) Move ( apartment )
Move to Dining_Table  Grasp canned_juice  leave the apartment please .,M UW1 V T UW1 D AY1 N IH0 NG T EY1 B AH0 L G R AE1 S P K AE1 N D JH UW1 S L IY1 V DH AH0 AH0 P AA1 R T M AH0 N T P L IY1 Z,M UW1 V T UW1 D AY1 N NG T EY1 B AH0 L G R AE1 S P K AE1 N D JH K UW1 S L IY1 V DH AH0 AH0 P AA1 R T M AH0 N T P L IY1 Z,Move ( Dining_Table ) Find ( canned_juice Dining_Table  ) Grasp ( canned_juice ) Move ( apartment )
Move to Dining_Sofa and detect Japanese_Dressing get it .,M UW1 V T UW1 D AY1 N IH0 NG S OW1 F AH0 AH0 N D D IH0 T EH1 K T JH AE2 P AH0 N IY1 Z D R EH1 S IH0 NG G EH1 T IH1 T,M UW1 V D AY1 N IH0 NG S OW OW1 F AH0 AH0 N D D T EH1 K JH AE2 P AH0 N IY1 Z D R EH1 S IH0 NG G EH1 T IH1 T,Move ( Dining_Sofa ) Find ( Japanese_Dressing Dining_Sofa ) Grasp ( Japanese_Dressing )
Go to Living_Room er find a person neayby bring toy_duck from Dining_Sofa .,G OW1 T UW1 L IH1 V IH0 NG R UW1 M ER0 F AY1 N D AH0 P ER1 S AH0 N N IH1 R B AY1 B R IH1 NG T OY1 D AH1 K F R AH1 M D AY1 N IH0 NG S OW1 F AH0,G OW1 T UW1 K L IH1 V IH0 IY1 R UW1 M ER0 F AY1 N D AH0 P ER1 S N N IH1 R B AY1 B R IH1 NG T OY1 D AH1 K F R AH1 M D AY1 N IH0 NG S OW1 F AH0,Move ( Living_Room ) Find ( person Living_Room ) Move ( Dining_Sofa ) Grasp ( toy_duck )
Well get bell_pepper from Kitchen_Table go to Visitor_Room move to Living_Table .,W EH1 L G EH1 T B EH1 L P EH1 P ER0 F R AH1 M K IH1 CH AH0 N T EY1 B AH0 L G OW1 T UW1 V IH1 Z IH0 T ER0 R UW1 M M UW1 V T UW1 L IH1 V IH0 NG T EY1 B AH0 L,W EH1 L G EH1 T B EH1 L P EH1 P ER0 UH2 F R AH1 M K IH1 CH AH0 N T EY1 B AH0 AH2 L G OW1 T UW1 V IH1 Z IH0 T ER0 R UW1 M M UW1 V UW1 L IH1 V IH0 NG T EY1 EH1 B ER2 S L,Move ( Kitchen_Table ) Grasp ( bell_pepper ) Move ( Visitor_Room ) Move ( Living_Table )
Go to Dining_Sofa go to Corridor  and leave the apartment .,G OW1 T UW1 D AY1 N IH0 NG S OW1 F AH0 G OW1 T UW1 K AO1 R AH0 D ER0 AH0 N D L IY1 V DH AH0 AH0 P AA1 R T M AH0 N T,G OW1 T UW1 D AY1 N AE NG S OW1 F AH0 G OW1 T UW1 K AO1 R AH0 D ER0 AH0 N D AY2 L IY1 V DH AH0 OY P AA1 R T M AH0 N T,Move ( Dining_Sofa )  Move ( Corridor )  Move ( apartment )
Well go to Living_Table  take Lemon_Tea finally come back .,W EH1 L G OW1 T UW1 L IH1 V IH0 NG T EY1 B AH0 L T EY1 K L EH1 M AH0 N T IY1 F AY1 N AH0 L IY0 K AH1 M B AE1 K,W TH G OW1 EY2 UW1 L IH1 IH0 T EY1 B AH0 L T EY1 K AW1 L EH1 M AH0 N IY1 F N AH0 L IY0 K OW0 AH1 M S AE1 K,Move ( Living_Table ) Grasp ( Lemon_Tea ) Move ( HERE )
Can you go to Living_Room get toy_penguin then come back .,K AE1 N Y UW1 G OW1 T UW1 L IH1 V IH0 NG R UW1 M G EH1 T T OY1 P EH1 NG G W AH0 N DH EH1 N K AH1 M B AE1 K,K AE1 N Y M UW1 G OW1 T L IH1 V IH0 NG R UW1 M G EH1 T T OY1 P EH1 NG G W AH0 N DH EH1 N K AH1 M B AE1 K,Move (  Living_Room  ) Find ( toy_penguin Living_Room ) Grasp ( toy_penguin ) Move ( HERE )
Move to Bar find a person neayby then follow a person .,M UW1 V T UW1 B AA1 R F AY1 N D AH0 P ER1 S AH0 N N IH1 R B AY1 DH EH1 N F AA1 L OW0 AH0 P ER1 S AH0 N,M UW1 V T UW1 B R F AY1 N D AE1 UH1 P ER1 S N CH R AY1 DH EH1 N F AA1 L OW0 AH0 P ER1 S AH0 N,Move (  Bar  ) Find ( person Bar  ) Follow ( pesron )
Well move to Dining_Table Grasp bell_pepper then come back .,W EH1 L M UW1 V T UW1 D AY1 N IH0 NG T EY1 B AH0 L G R AE1 S P B EH1 L P EH1 P ER0 DH EH1 N K AH1 M B AE1 K,W EH0 EH1 L M UW1 V T UW1 D AY1 N IH0 NG T EY1 B N AH0 L G R AE1 S P B EH1 L EH1 P ER0 DH EH1 N K AH1 AW2 B AE1 K,Move ( Dining_Table ) Move ( bell_pepper ) Move ( HERE )
Would you move to Living_Sofa get Orange_Juice bring it to Side_Table .,W UH1 D Y UW1 M UW1 V T UW1 L IH1 V IH0 NG S OW1 F AH0 G EH1 T AO1 R AH0 N JH JH UW1 S B R IH1 NG IH1 T T UW1 S AY1 D T EY1 B AH0 L,T D M UW1 V T UW1 AH1 D V IH0 NG S OW1 F AH0 G EH1 T AO1 UH2 R AH0 N JH JH UW1 S B R IH1 NG IH1 T UW1 S AY1 D T EY1 B AH0 L,Move ( Living_Sofa ) Find ( Orange_Juice Living_Sofa  ) Grasp ( Orange_Juice ) Move ( Side_Table )
Go to Kitchen_Room next find filled_ketchup Grasp it .,G OW1 T UW1 K IH1 CH AH0 N R UW1 M N EH1 K S T F AY1 N D F IH1 L D K EH1 CH AH0 P G R AE1 S P IH1 T,G OW1 T UW1 K IH1 CH AH0 F R UW1 M N EH1 DH S T F AY1 N D F IH1 L D K EH1 CH AH0 P G R AE1 S P IH1 T,Move ( Kitchen_Room ) Find ( filled_ketchup Kitchen_Room ) Grasp ( filled_ketchup )
Go to Sofa get Red_Potato  exit from Kitchen_Room okay .,G OW1 T UW1 S OW1 F AH0 G EH1 T R EH1 D P AH0 T EY1 T OW2 EH1 G Z IH0 T F R AH1 M K IH1 CH AH0 N R UW1 M OW2 K EY1,G OW1 T UW1 S OW1 F UH0 G IY0 EH1 T EH1 D P AH0 T EY1 UH0 OW2 EH1 G Z IH0 T F R R AH1 M K IH1 CH AH0 N R UW1 M OW2 K OW OW EY1,Move (  Sofa  ) Find ( Red_Potato Sofa  ) Grasp ( Red_Potato ) Move ( Kitchen_Room )
Go to Bar take rabbit_doll put it on Living_Table please .,G OW1 T UW1 B AA1 R T EY1 K R AE1 B AH0 T D AA1 L P UH1 T IH1 T AA1 N L IH1 V IH0 NG T EY1 B AH0 L P L IY1 Z,G OW1 L UW1 UH1 B AA1 R UW2 T EY1 K R AE1 B AH0 T D AA1 L P JH UH1 T CH IH1 T AA1 N AO2 V IH0 NG T OY1 EY1 B AH0 L L AE2 Z,Move (  Bar  ) Find ( rabbit_doll Bar  ) Grasp ( rabbit_doll ) Plcae ( rabbit_doll Living_Table )
Can you go to Corridor Grasp canned_juice  bring it to Kitchen_Table .,K AE1 N Y UW1 G OW1 T UW1 K AO1 R AH0 D ER0 G R AE1 S P K AE1 N D JH UW1 S B R IH1 NG IH1 T T UW1 K IH1 CH AH0 N T EY1 B AH0 L,K AE1 N Y HH UW1 G OW1 T UW1 K AO1 R AH0 D ER0 G R AE1 P K AE1 N D JH UW1 S R IH1 NG IH1 T T UW1 K IH1 CH AH0 N IH1 T EY1 B AH0 L,Move ( Corridor ) Find ( canned_juice Corridor ) Grasp ( canned_juice ) Move ( Kitchen_Table )  Find ( canned_juice Kitchen_Table ) Grasp ( canned_juice ) Move ( Corridor )
Can you move to Dining_Table get spray_bottle then come back .,K AE1 N Y UW1 M UW1 V T UW1 D AY1 N IH0 NG T EY1 B AH0 L G EH1 T S P R EY1 B AA1 T AH0 L DH EH1 N K AH1 M B AE1 K,AE1 N Y UW1 N UW1 V T UW1 D ZH AY1 N IH0 IY2 T EY1 B OY1 L G EH1 T S R EY1 B T AH0 L DH EH1 N K AH1 IY B AE1 K,Move ( Dining_Table ) Grasp ( spray_bottle ) Move ( HERE )
Go to lobby then find a person neayby bring Chip_Star from Reception_Table .,G OW1 T UW1 L AA1 B IY0 DH EH1 N F AY1 N D AH0 P ER1 S AH0 N N IH1 R B AY1 B R IH1 NG CH IH1 P S T AA1 R F R AH1 M R IH0 S EH1 P SH AH0 N T EY1 B AH0 L,G EH2 T UW1 AA1 B IY0 DH EH1 N F AY1 N D AH0 P ER1 S AO2 N N IH1 R B AY1 B R IH1 CH IH1 P S T F R AH1 M R S AY1 EH1 P SH AH0 N T EY1 B L AH0 L,Move ( lobby ) Find ( person lobby ) Move ( Reception_Table ) Grasp ( Chip_Star )
Go to bed_room go to Side_Table  and exit from Visitor_Room .,G OW1 T UW1 B EH1 D R UW1 M G OW1 T UW1 S AY1 D T EY1 B AH0 L AH0 N D EH1 G Z IH0 T F R AH1 M V IH1 Z IH0 T ER0 R UW1 M,EY1 G OW1 T UW1 B R UW1 M G OW1 T UW1 AY1 D T EY1 B AH0 L AH0 N D EH1 G IH0 W T F R AH1 M V ER1 OY0 IH0 T ER0 R UW1 AH2,Move ( bed_room ) Move ( Side_Table ) Move ( Visitor_Room )
Go to Living_Sofa get filled_ketchup  exit from Corridor okay .,G OW1 T UW1 L IH1 V IH0 NG S OW1 F AH0 G EH1 T F IH1 L D K EH1 CH AH0 P EH1 G Z IH0 T F R AH1 M K AO1 R AH0 D ER0 OW2 K EY1,G OW1 T UW1 L IH1 IH0 NG S OW1 F AH0 G T F IH1 L D K EH1 CH IH P EH1 G Z UW T AA F ER1 R AH1 M K AO1 R AH0 D ER0 OW2 K EY1,Move (  Living_Sofa  ) Find ( filled_ketchup Living_Sofa  ) Grasp ( filled_ketchup ) Move ( Corridor )
Go to Dining_Sofa find a person neayby  er follow a person .,G OW1 T UW1 D AY1 N IH0 NG S OW1 F AH0 F AY1 N D AH0 P ER1 S AH0 N N IH1 R B AY1 ER0 F AA1 L OW0 AH0 P ER1 S AH0 N,G OW1 T UW1 D N IH0 NG S OW1 F AH0 F AY1 D AH0 P D ER1 S AH0 N N IH1 B AY1 ER0 F AA1 L OW0 AO1 AH0 P ER1 S AH0 N,Move ( Dining_Sofa ) Find ( person Dining_Sofa ) Follow ( person )
Go to kitchen  move to Dining_Sofa  then leave the apartment .,G OW1 T UW1 K IH1 CH AH0 N M UW1 V T UW1 D AY1 N IH0 NG S OW1 F AH0 DH EH1 N L IY1 V DH AH0 AH0 P AA1 R T M AH0 N T,G OW1 T UW1 K IH1 UH1 AH0 N M UW1 V IH UW1 D AY1 N IH0 NG S OW1 F AH0 DH EH1 N L IY1 V OY2 DH AH0 AH0 P AA1 R UH T M AH0 N T,Move ( kitchen ) Move ( Dining_Sofa ) Move ( apartment )
Go to lobby  move to Living_Table  then leave the apartment .,G OW1 T UW1 L AA1 B IY0 M UW1 V T UW1 L IH1 V IH0 NG T EY1 B AH0 L DH EH1 N L IY1 V DH AH0 AH0 P AA1 R T M AH0 N T,G OW1 T UW1 L UW0 AA1 B IY0 M UW1 V T UW1 L IH1 V IH0 NG T EY1 UW1 B OY0 L DH EH1 N IY1 V DH AH0 AH0 P AA1 R AW M AH0 N T,Move ( lobby ) Move ( Living_Table ) Move ( apartment )
Go to Visitor_Room next find soysauce take it .,G OW1 T UW1 V IH1 Z IH0 T ER0 R UW1 M N EH1 K S T F AY1 N D S OY1 S AO2 S T EY1 K IH1 T,G OW1 T UW1 V IH1 Z IH0 T ER0 R UW1 M N EH1 K S F AY1 N D OY1 S AE0 AO2 S T EY1 K IH1 T,Move (  Visitor_Room  ) Find ( soysauce Visitor_Room  ) Grasp ( soysauce ) 
Would you go to lobby Grasp empty_ketchup finally come back .,W UH1 D Y UW1 G OW1 T UW1 L AA1 B IY0 G R AE1 S P EH1 M P T IY0 K EH1 CH AH0 P F AY1 N AH0 L IY0 K AH1 M B AE1 K,W UH1 D Y UW1 G T UW1 AA1 B IY0 G R AE1 S P EH1 M P T K P CH AH0 P F EY0 AY1 AA2 L AA2 AH0 L IY0 K AH1 M B IY K,Move ( lobby ) Find ( empty_ketchup lobby ) Grasp ( empty_ketchup )  Move ( HERE )
Would you bring tumbler from Bar go to Side_Table go to Living_Sofa  .,W UH1 D Y UW1 B R IH1 NG T AH1 M B L ER0 F R AH1 M B AA1 R G OW1 T UW1 S AY1 D T EY1 B AH0 L G OW1 T UW1 L IH1 V IH0 NG S OW1 F AH0,W UH1 Y UW1 B R IH1 NG T AH1 M B L ER0 F R AH1 M AA1 R G OW1 T UW1 S AY1 D T EY1 B AH0 L G OW1 T AH1 UW1 L OW1 V IH0 NG S IY1 F AH0,Move ( Bar ) Place ( tumbler Bar ) Move ( Side_Table ) Move ( Side_Table ) 
Go to Living_Room Grasp cigarette throw it into Dustbin okay .,G OW1 T UW1 L IH1 V IH0 NG R UW1 M G R AE1 S P S IH2 G ER0 EH1 T TH R OW1 IH1 T IH1 N T UW0 D AH1 S T B IH0 N OW2 K EY1,G OW1 T UW1 NG L IH1 V IH0 NG R M AE1 S S IH2 IH2 ER0 EH1 T TH R OW1 IH1 T IH1 T UW0 D AH1 S T IH0 OW2 K EY1,Move (  Living_Room  ) Find ( cigarette Living_Room  ) Grasp ( cigarette ) Move ( Dustbin ) Place ( cigarette Dustbin ) 
Well go to Living_Sofa  take empty_plastic_bottle finally come back .,W EH1 L G OW1 T UW1 L IH1 V IH0 NG S OW1 F AH0 T EY1 K EH1 M P T IY0 P L AE1 S T IH0 K B AA1 T AH0 L F AY1 N AH0 L IY0 K AH1 M B AE1 K,W EH1 L G OW1 T UW1 L IH1 V IH0 NG S AO1 F AH0 T EY1 K EH1 M P T IY0 P L AE1 UW2 T IH0 K B AA1 T AH0 L F AY1 N AH0 L IY0 K AH1 M AE1 K,Move ( Living_Sofa ) Grasp ( empty_plastic_bottle ) Move ( HERE )
Go to Bar get nursing_bottle  exit from kitchen okay .,G OW1 T UW1 B AA1 R G EH1 T N ER1 S IH0 NG B AA1 T AH0 L EH1 G Z IH0 T F R AH1 M K IH1 CH AH0 N OW2 K EY1,G OW1 UW1 B AA1 R G EH1 T N ER1 S NG B AA1 EY0 AH0 L EH1 G Z IH0 T F R AH1 M K IH1 CH OY2 N OW2 K,Move (  Bar  ) Find ( nursing_bottle Bar  ) Grasp ( nursing_bottle ) Move ( kitchen )
Go to Kitchen_Room  move to Reception_Table  finally leave the apartment .,G OW1 T UW1 K IH1 CH AH0 N R UW1 M M UW1 V T UW1 R IH0 S EH1 P SH AH0 N T EY1 B AH0 L F AY1 N AH0 L IY0 L IY1 V DH AH0 AH0 P AA1 R T M AH0 N T,OY1 G OW1 T UW1 IH1 CH AH0 N R UW1 JH L M AE1 UW1 V T UW1 R IH0 S EH1 AA1 P SH AH0 N T EY1 AH0 L F AY1 N AH0 L IY0 L IY1 V DH AH0 AH0 P AA1 R T M AH0 N T,Move ( Kitchen_Room ) Move ( Reception_Table )  Move ( apartment )
Move to Dining_Table  get Lemon_Tea  exit from Dining_Room okay .,M UW1 V T UW1 D AY1 N IH0 NG T EY1 B AH0 L G EH1 T L EH1 M AH0 N T IY1 EH1 G Z IH0 T F R AH1 M D AY1 N IH0 NG R UW1 M OW2 K EY1,M UW1 V T UW1 D AE2 N IH0 NG T EY1 B AH0 L G EH1 T L EH1 DH AH0 N T IY1 EH1 G Y IH0 T F ER0 R AH1 M D AY1 N IH0 R M OW2 EY1,Move ( Dining_Table ) Find ( Lemon_Tea Dining_Table ) Grasp ( Lemon_Tea ) Move ( Dining_Room )
Would you go to bed_room Grasp Bath_Cleaner finally come back .,W UH1 D Y UW1 G OW1 T UW1 B EH1 D R UW1 M G R AE1 S P B AE1 TH K L IY1 N ER0 F AY1 N AH0 L IY0 K AH1 M B AE1 K,W UH1 D Y G OW1 T EY0 UW1 TH EH1 D R UW1 AE M G R AE1 S P B AE1 TH IH0 K L IY1 N ER0 F AY1 N AH0 L IY0 K AH1 M B AE1 K,Move ( bed_room ) Find ( Bath_Cleaner bed_room ) Grasp ( Bath_Cleaner )  Move ( HERE )
Go to lobby Grasp apple place it on Living_Sofa okay .,G OW1 T UW1 L AA1 B IY0 G R AE1 S P AE1 P AH0 L P L EY1 S IH1 T AA1 N L IH1 V IH0 NG S OW1 F AH0 OW2 K EY1,G OW1 IH0 UW1 L AA1 IH2 B IY0 ER2 R AE1 P AE1 P AH0 L P L EY1 S IH1 T AA1 N L V IH0 NG S OW1 F AH AH0 EH1 OW2 IH K EY1,Move ( lobby ) Grasp ( apple ) Move ( Living_Sofa ) Place ( apple Living_Sofa )
Go to Dining_Room get Brown_Tea throw it into Dustbin please .,G OW1 T UW1 D AY1 N IH0 NG R UW1 M G EH1 T B R AW1 N T IY1 TH R OW1 IH1 T IH1 N T UW0 D AH1 S T B IH0 N P L IY1 Z,G OW1 T UW1 D AY1 N IH0 NG R UW1 M G EH1 T EY2 B R N T IY1 TH OW1 IY0 IH1 T AO0 AA IY1 IH1 N T UW0 D AH1 S T B EY IH0 N P L IY1 Z,Move ( Dining_Room ) Find ( Brown_Tea Dining_Room ) Grasp ( Brown_Tea ) Move ( Dustbin ) Place ( Brown_Tea Dustbin )
Go to Dining_Sofa find a person neayby  er follow a person .,G OW1 T UW1 D AY1 N IH0 NG S OW1 F AH0 F AY1 N D AH0 P ER1 S AH0 N N IH1 R B AY1 ER0 F AA1 L OW0 AH0 P ER1 S AH0 N,G OW1 T AE1 D AY1 N IH0 NG AE1 S JH OW1 F AH0 F AY1 N D AH0 P ER1 S AH0 N N IH1 R B ER0 F AA1 AY1 AH0 P UH S AH0 N,Move ( Dining_Sofa ) Find ( person Dining_Sofa ) Follow ( person )
Go to Reception_Table go to kitchen  and leave the apartment .,G OW1 T UW1 R IH0 S EH1 P SH AH0 N T EY1 B AH0 L G OW1 T UW1 K IH1 CH AH0 N AH0 N D L IY1 V DH AH0 AH0 P AA1 R T M AH0 N T,G Y D T UH IH0 S EH1 P AO2 AH0 N T EY1 B AH0 L G OW1 T UW1 AO0 K IH1 CH AH0 N AH0 N D L IY1 V DH AH0 AH0 P AA1 R AE2 M AH0 N OW IY2,Move ( Reception_Table )  Move ( kitchen )  Move ( apartment )
Would you go to Dining_Table get nursing_bottle carry it to Side_Table .,W UH1 D Y UW1 G OW1 T UW1 D AY1 N IH0 NG T EY1 B AH0 L G EH1 T N ER1 S IH0 NG B AA1 T AH0 L K AE1 R IY0 IH1 T T UW1 S AY1 D T EY1 B AH0 L,W UH1 AA0 Y UW1 G OW1 T UW1 AY1 N IH0 NG T EY1 B AH0 L AE1 G EH1 T N ER1 S IH0 NG B AA1 T AH0 L K AE1 R IY0 IH1 T T UW1 F AY1 D T EY1 B AH0 L,Move (  Dining_Table ) Find ( nursing_bottle Dining_Table  ) Grasp ( nursing_bottle )  Move ( Side_Table )
Move to Living_Table  Grasp bell_pepper  leave the apartment please .,M UW1 V T UW1 L IH1 V IH0 NG T EY1 B AH0 L G R AE1 S P B EH1 L P EH1 P ER0 L IY1 V DH AH0 AH0 P AA1 R T M AH0 N T P L IY1 Z,M UW1 V T UW1 L IH1 V IH0 NG T EY1 B AH0 L UW0 G R AE1 S P B EH1 L P EH1 P ER0 L IY1 V DH IY1 AH0 P AA1 R T M AH0 N IY0 P L IY1 Z,Move ( Living_Table ) Find ( bell_pepper Living_Table  ) Grasp ( bell_pepper ) Move ( apartment )
Go to Living_Room Grasp Korean_Soup throw it into Dustbin okay .,G OW1 T UW1 L IH1 V IH0 NG R UW1 M G R AE1 S P K AO2 R IY1 AH0 N S UW1 P TH R OW1 IH1 T IH1 N T UW0 D AH1 S T B IH0 N OW2 K EY1,G OW1 T UW1 EH L AH1 V IH0 NG R UW1 M G R AE1 S P K AO2 B R IY1 AH0 N S UW1 P TH R N IH1 T IH1 N T UW0 D AH1 S T B IH0 N OW2 K EY1,Move (  Living_Room  ) Find ( Korean_Soup Living_Room  ) Grasp ( Korean_Soup ) Move ( Dustbin ) Place ( Korean_Soup Dustbin ) 
Go to kitchen Grasp Japanese_Dressing throw it into Dustbin please .,G OW1 T UW1 K IH1 CH AH0 N G R AE1 S P JH AE2 P AH0 N IY1 Z D R EH1 S IH0 NG TH R OW1 IH1 T IH1 N T UW0 D AH1 S T B IH0 N P L IY1 Z,G P OW1 T UW1 K IH1 CH AY0 AH0 N UH G R AE1 S P JH AE2 P AH0 N IY1 Z D R EH1 S IH0 NG TH R IH1 T IH1 N T UW0 D AH1 S T B IH0 N IH L IY1 Z,Move ( kitchen ) Grasp ( Japanese_Dressing ) Move ( Dustbin ) Place ( Japanese_Dressing Dustbin  ) 
Well move to Dining_Sofa get soysauce and come back .,W EH1 L M UW1 V T UW1 D AY1 N IH0 NG S OW1 F AH0 G EH1 T S OY1 S AO2 S AH0 N D K AH1 M B AE1 K,EH1 L M UW1 V T UW1 AY1 N IH0 NG S OW1 AA0 F AH0 G EH1 T S OY1 S AO2 S AH0 D K AH1 M B AE1 K,Move ( Dining_Sofa ) Grasp ( soysauce ) Move ( Dining_Sofa ) Grasp ( soysauce ) Move ( HERE )
Go to kitchen Grasp pink_cup place it on Living_Table okay .,G OW1 T UW1 K IH1 CH AH0 N G R AE1 S P P IH1 NG K K AH1 P P L EY1 S IH1 T AA1 N L IH1 V IH0 NG T EY1 B AH0 L OW2 K EY1,G OW1 T UW1 K IH1 CH AH0 N G R AE1 S P P IH1 NG K K ER1 AH1 P P L EY1 S IH1 T AA1 AY2 L IH1 V IH0 T EY1 B AH0 L OW2 ER K EY1,Move ( kitchen ) Grasp ( pink_cup ) Move ( Living_Table ) Place ( pink_cup Living_Table )
