Input,phonemelabel,Noisylabel,Labeldata
Well go to Dining_Table  take toy_duck finally come back .,W EH1 L G OW1 T UW1 D AY1 N IH0 NG T EY1 B AH0 L T EY1 K T OY1 D AH1 K F AY1 N AH0 L IY0 K AH1 M B AE1 K,W EH1 L G OW1 T UW1 D N IH0 NG T EY1 B AH0 IH2 T EY1 OY0 K T OW0 JH D AH1 K F AY1 N EY2 AH0 L HH K AH1 M B AE1 K,Move ( Dining_Table ) Grasp ( toy_duck ) Move ( HERE )
Go to Living_Sofa  take pink_cup put it on Bar okay .,G OW1 T UW1 L IH1 V IH0 NG S OW1 F AH0 T EY1 K P IH1 NG K K AH1 P P UH1 T IH1 T AA1 N B AA1 R OW2 K EY1,G IH2 OW1 T UW1 L IH1 V IH0 NG S OW1 F AH0 T EY1 K D P IH1 NG K K AH1 P UH1 T IH1 T AA1 N B AA1 R N OW2 K EY1,Move ( Living_Sofa )  Grasp ( pink_cup ) Move ( Bar ) Place ( pink_cup Living_Sofa )
Go to Visitor_Room take tumbler place it on Dining_Sofa okay .,G OW1 T UW1 V IH1 Z IH0 T ER0 R UW1 M T EY1 K T AH1 M B L ER0 P L EY1 S IH1 T AA1 N D AY1 N IH0 NG S OW1 F AH0 OW2 K EY1,G OW1 T UW1 V IH1 Z T ER0 UW1 M T OW0 EY1 K T AH1 M B L ER0 P L EY1 S IH1 T AA1 N Z D AY1 N NG S OW1 HH F AH0 OW2 K EY1,Move (  Visitor_Room  ) Find ( tumbler Visitor_Room ) Grasp ( tumbler ) Move ( Dining_Sofa )
Well get sauce from Dining_Sofa go to bed_room move to Kitchen_Table .,W EH1 L G EH1 T S AO1 S F R AH1 M D AY1 N IH0 NG S OW1 F AH0 G OW1 T UW1 B EH1 D R UW1 M M UW1 V T UW1 K IH1 CH AH0 N T EY1 B AH0 L,W EH1 L G EH1 T S AO1 S F R AH1 M D N IH0 NG S OW1 F AH0 G OW1 T UW1 B EH1 D R UW1 M M UW1 V T UW1 K IH1 CH UW AH0 N T EH2 B AH0 L,Move ( Dining_Sofa ) Grasp ( sauce ) Move ( bed_room ) Move ( Kitchen_Table )
Can you go to Living_Room get Strawberry_Juice then come back .,K AE1 N Y UW1 G OW1 T UW1 L IH1 V IH0 NG R UW1 M G EH1 T S T R AO1 B EH2 R IY0 JH UW1 S DH EH1 N K AH1 M B AE1 K,K AE1 N Y UW1 G HH T UW1 L IH1 V IH0 NG R UW1 M G EH1 T S T R AO1 B EH2 R IY0 JH S DH EH1 N K AH1 M B K,Move (  Living_Room  ) Find ( Strawberry_Juice Living_Room ) Grasp ( Strawberry_Juice ) Move ( HERE )
Go to Visitor_Room  move to Kitchen_Table  finally leave the apartment .,G OW1 T UW1 V IH1 Z IH0 T ER0 R UW1 M M UW1 V T UW1 K IH1 CH AH0 N T EY1 B AH0 L F AY1 N AH0 L IY0 L IY1 V DH AH0 AH0 P AA1 R T M AH0 N T,G B T UW1 V IH1 Z IH0 T ER0 R M M UW1 V T UW1 K IH1 CH AH0 N T EY1 B AH0 L F AY1 N AH0 L IY0 L IH V OW DH AH0 B P AA1 R T M AH0 N T,Move ( Visitor_Room ) Move ( Kitchen_Table )  Move ( apartment )
Go to Living_Room  find a person neayby  finally follow a person .,G OW1 T UW1 L IH1 V IH0 NG R UW1 M F AY1 N D AH0 P ER1 S AH0 N N IH1 R B AY1 F AY1 N AH0 L IY0 F AA1 L OW0 AH0 P ER1 S AH0 N,G OW1 T UW1 IH1 AA1 V IH0 NG R UW1 M F AY1 N D AH0 P ER1 S AH0 N N IH1 R B F AY1 N AH0 AW2 IY0 F IY OW0 P JH UH0 AH0 N,Move ( Living_Room ) Find ( person Living_Room ) Follow ( person )
Would you move to Living_Sofa Grasp cubic_clock and come back .,W UH1 D Y UW1 M UW1 V T UW1 L IH1 V IH0 NG S OW1 F AH0 G R AE1 S P K Y UW1 B IH0 K K L AA1 K AH0 N D K AH1 M B AE1 K,W UH1 D Y UW1 M UW1 V T UW1 L IH1 V OW1 F AH0 G R AH1 S P OY0 K Y UW1 B IH0 F K L AA1 K AH0 N D K M B AE1 K,Move ( Living_Sofa ) Grasp ( cubic_clock ) Move ( HERE )
Go to Dining_Room Grasp bear_doll place it on Side_Table okay .,G OW1 T UW1 D AY1 N IH0 NG R UW1 M G R AE1 S P B EH1 R D AA1 L P L EY1 S IH1 T AA1 N S AY1 D T EY1 B AH0 L OW2 K EY1,G OW1 T UW1 D AY1 N SH IH0 NG R UW1 M G R AE1 S P B EH1 R D AA1 L P L S IH1 T AA1 N S AY1 IH2 AW EY1 AH0 L OW2 K EY,Move ( Dining_Room ) Grasp ( bear_doll ) Move ( Side_Table ) Place ( bear_doll Side_Table )
Go to Kitchen_Room take empty_plastic_bottle put it on Reception_Table please .,G OW1 T UW1 K IH1 CH AH0 N R UW1 M T EY1 K EH1 M P T IY0 P L AE1 S T IH0 K B AA1 T AH0 L P UH1 T IH1 T AA1 N R IH0 S EH1 P SH AH0 N T EY1 B AH0 L P L IY1 Z,G OW1 UW2 T UW1 K IH1 CH N R UW1 M T EY1 K EH1 TH P T IY0 P L AE S UH0 T IH0 K B AA1 T AH0 L P UH1 T IH1 AA1 ER1 N R EY2 AA1 S EH1 P S AH0 N T EY1 B AE L P L IY1 Z,Move ( Kitchen_Room ) Find ( empty_plastic_bottle Kitchen_Room ) Grasp ( empty_plastic_bottle ) Move ( Reception_Table ) Place ( empty_plastic_bottle Reception_Table )
Can you go to Corridor get pink_cup then come back .,K AE1 N Y UW1 G OW1 T UW1 K AO1 R AH0 D ER0 G EH1 T P IH1 NG K K AH1 P DH EH1 N K AH1 M B AE1 K,K AE1 N Y UW1 AW2 G T UW1 K AO1 R AH0 AE0 ER0 G T P IH1 NG K K AH1 AH1 P DH EH1 N K AH1 M R B AH1 AE1,Move (  Corridor  ) Find ( pink_cup Corridor ) Grasp ( pink_cup ) Move ( HERE )
Call a person then ask for an order get Egg_Soup from Dining_Sofa .,K AO1 L AH0 P ER1 S AH0 N DH EH1 N AE1 S K F AO1 R AE1 N AO1 R D ER0 G EH1 T EH1 G S UW1 P F R AH1 M D AY1 N IH0 NG S OW1 F AH0,K AO1 L AH0 ER1 S AH0 EH1 N AE1 S K F AO1 R AE1 N AO1 R D ER0 G EH1 T EH1 G S UW1 P F AW R AH1 M D AY1 N IH0 NG OW1 F AH0,Say ( person ) Listen ( Egg_Soup ) Move ( Dining_Sofa ) Find ( Egg_Soup Dining_Sofa ) Grasp ( Egg_Soup ) Move ( Egg_Soup ) Place ( Egg_Soup Dining_Sofa ) 
Would you go to Kitchen_Table get Bath_Cleaner carry it to Dining_Sofa .,W UH1 D Y UW1 G OW1 T UW1 K IH1 CH AH0 N T EY1 B AH0 L G EH1 T B AE1 TH K L IY1 N ER0 K AE1 R IY0 IH1 T T UW1 D AY1 N IH0 NG S OW1 F AH0,W AW1 UH1 D Y UW1 G OW1 T UW1 OW0 K IH1 CH AH0 N T EY1 B AH0 L G EH1 T B AE1 TH K L IY1 N ER0 K AE1 EY R IY0 T T UW1 D AY1 N HH IH0 NG S OW1 F AH0,Move (  Kitchen_Table ) Find ( Bath_Cleaner Kitchen_Table  ) Grasp ( Bath_Cleaner )  Move ( Dining_Sofa )
Would you go to bed_room Grasp filled_ketchup finally come back .,W UH1 D Y UW1 G OW1 T UW1 B EH1 D R UW1 M G R AE1 S P F IH1 L D K EH1 CH AH0 P F AY1 N AH0 L IY0 K AH1 M B AE1 K,W UH1 D Y UW1 G OW1 T B EH1 D R UW1 AW2 R AY2 R OY0 S P F IH1 L D K EH1 CH AH0 P F AY1 N W L K AH1 M B AE1 K,Move ( bed_room ) Find ( filled_ketchup bed_room ) Grasp ( filled_ketchup )  Move ( HERE )
Go to Kitchen_Room Grasp apple place it on Kitchen_Table okay .,G OW1 T UW1 K IH1 CH AH0 N R UW1 M G R AE1 S P AE1 P AH0 L P L EY1 S IH1 T AA1 N K IH1 CH AH0 N T EY1 B AH0 L OW2 K EY1,OW1 T UW1 K IH1 CH AH0 N R UW1 M G R AE1 S UH1 P AE1 P AH0 L L EY1 IH S IH1 T OW2 AA1 N K IH1 CH AH0 EH2 T EY1 B AH0 L OW2 K EY1,Move ( Kitchen_Room ) Grasp ( apple ) Move ( Kitchen_Table ) Place ( apple Kitchen_Table )
Would you bring hourglass from Side_Table move to Bar go to bed_room .,W UH1 D Y UW1 B R IH1 NG AW1 ER0 G L AE2 S F R AH1 M S AY1 D T EY1 B AH0 L M UW1 V T UW1 B AA1 R G OW1 T UW1 B EH1 D R UW1 M,W UH1 D ER0 Y OY AY2 B R IH1 NG AW1 ER0 G L AE2 S F R AH1 M S AY1 D EH0 T EY1 B AH0 L M UW1 V T ER UW1 B AA1 R G OW1 T UW1 B D OW EH1 M,Move ( Side_Table ) Find ( hourglass Side_Table ) Move ( Bar ) Move ( bed_room )
Go to Living_Table Grasp Seafood_Noodle  leave the apartment please .,G OW1 T UW1 L IH1 V IH0 NG T EY1 B AH0 L G R AE1 S P S IY1 F UW2 D N UW1 D AH0 L L IY1 V DH AH0 AH0 P AA1 R T M AH0 N T P L IY1 Z,OW1 T UW1 L IH1 V K IH0 NG T EY1 B AH0 L G R AE1 S P S IY1 F D N UW1 D L IY1 V DH AH0 AH0 G P AA1 R T M AH0 N T P L IY1 Z,Move ( Living_Table ) Grasp ( Seafood_Noodle ) Move ( apartment )
Can you move to Dining_Table get Seafood_Noodle then come back .,K AE1 N Y UW1 M UW1 V T UW1 D AY1 N IH0 NG T EY1 B AH0 L G EH1 T S IY1 F UW2 D N UW1 D AH0 L DH EH1 N K AH1 M B AE1 K,K AE1 N Y UW1 M UW1 V T UW1 D AY1 N IH0 NG T ER2 EY1 B AH0 L G EY1 EH1 T S F UW2 D N UW1 D AA0 L DH EH1 N K AH1 M UW0 B AE1 K,Move ( Dining_Table ) Grasp ( Seafood_Noodle ) Move ( HERE )
Go to Kitchen_Room next find sugar Grasp it .,G OW1 T UW1 K IH1 CH AH0 N R UW1 M N EH1 K S T F AY1 N D SH UH1 G ER0 G R AE1 S P IH1 T,G OW1 T UW1 K IH1 CH AH0 N R V UW1 M AA1 N AH EH1 K S T F AY1 N D SH UH1 G ER0 G R AE1 EY1 P IH1,Move ( Kitchen_Room ) Find ( sugar Kitchen_Room ) Grasp ( sugar )
Go to Living_Room  move to Dining_Table  then leave the apartment .,G OW1 T UW1 L IH1 V IH0 NG R UW1 M M UW1 V T UW1 D AY1 N IH0 NG T EY1 B AH0 L DH EH1 N L IY1 V DH AH0 AH0 P AA1 R T M AH0 N T,G OW1 T UW1 L ER1 V IH0 NG R UW1 IY2 M M UW1 EH0 T UW1 D AY1 N IH0 T EY1 B OY0 DH EH1 N L IY1 V DH AH0 P AA1 R T M AH0 N T,Move ( Living_Room ) Move ( Dining_Table ) Move ( apartment )
Can you bring sugar from Living_Table go to Kitchen_Room move to Dining_Sofa .,K AE1 N Y UW1 B R IH1 NG SH UH1 G ER0 F R AH1 M L IH1 V IH0 NG T EY1 B AH0 L G OW1 T UW1 K IH1 CH AH0 N R UW1 M M UW1 V T UW1 D AY1 N IH0 NG S OW1 F AH0,K AE1 N Y UW1 B R IH1 NG SH UH1 G ER0 F R AH1 M L IH1 V IH0 NG T EY1 B L G OW1 T UW1 K IH1 CH AH0 N AH0 R UW1 M M UW1 V T UW1 D AY1 N OY2 NG S OW1 F AH0,Move ( Living_Table ) Find ( sugar Living_Table  ) Grasp ( sugar ) Move ( Kitchen_Room ) ( Dining_Sofa )
Can you bring twin_bell_alarm_clock from Kitchen_Table go to Visitor_Room move to Side_Table .,K AE1 N Y UW1 B R IH1 NG T W IH1 N B EH1 L AH0 L AA1 R M K L AA1 K F R AH1 M K IH1 CH AH0 N T EY1 B AH0 L G OW1 T UW1 V IH1 Z IH0 T ER0 R UW1 M M UW1 V T UW1 S AY1 D T EY1 B AH0 L,K AE1 N Y B R IH1 T W IH1 N B EH1 L IH2 L AA1 R M L AA1 K F R AH1 M K IH1 CH AH0 N T EY1 B W L G OW1 T UW1 V IH1 Z IH0 ER2 ER0 R UW1 M M UW1 V AA0 T UW1 S AY1 D T EY1 B IY1 AH0 L,Move ( Kitchen_Table ) Find ( twin_bell_alarm_clock Kitchen_Table  ) Grasp ( twin_bell_alarm_clock ) Move ( Visitor_Room ) ( Side_Table )
Would you bring Cloth_Cleaner from Dining_Table move to Sofa go to Visitor_Room .,W UH1 D Y UW1 B R IH1 NG K L AO1 TH K L IY1 N ER0 F R AH1 M D AY1 N IH0 NG T EY1 B AH0 L M UW1 V T UW1 S OW1 F AH0 G OW1 T UW1 V IH1 Z IH0 T ER0 R UW1 M,W UH1 D Y UW1 B UH1 IH1 NG D K L AO1 TH AY1 L IY1 N ER0 F R AH1 M D AY1 N IH0 NG T EY1 B AH0 L M ER1 UW1 V T UW1 S OW1 F EH AH0 G OW1 T AA1 UW1 V IH1 UW1 IH0 T ER0 R UW1 M,Move ( Dining_Table ) Find ( Cloth_Cleaner Dining_Table ) Move ( Sofa ) Move ( Visitor_Room )
Go to Visitor_Room take salt place it on Kitchen_Table okay .,G OW1 T UW1 V IH1 Z IH0 T ER0 R UW1 M T EY1 K S AO1 L T P L EY1 S IH1 T AA1 N K IH1 CH AH0 N T EY1 B AH0 L OW2 K EY1,G OW1 T UW1 V EY0 IH1 Z IH0 T ER0 R UW1 M T EY1 K S AO1 L T P L EY1 S IH1 T AA1 N K IH1 CH AH0 T EY1 B AH0 L OW2 AW2 EY1,Move (  Visitor_Room  ) Find ( salt Visitor_Room ) Grasp ( salt ) Move ( Kitchen_Table )
Go to lobby take canned_juice put it on Living_Sofa please .,G OW1 T UW1 L AA1 B IY0 T EY1 K K AE1 N D JH UW1 S P UH1 T IH1 T AA1 N L IH1 V IH0 NG S OW1 F AH0 P L IY1 Z,G OW1 T UW1 L AA1 B IY0 T EY1 K K AE1 N D JH UW1 S P UH1 T IH1 T AA1 N L IH1 W AE0 NG S OW1 F AH0 UH P L IY1 Z,Move ( lobby ) Find ( canned_juice lobby ) Grasp ( canned_juice ) Move ( Living_Sofa ) Place ( canned_juice Living_Sofa )
Move to Dining_Sofa  next detect Cloth_Cleaner  get it .,M UW1 V T UW1 D AY1 N IH0 NG S OW1 F AH0 N EH1 K S T D IH0 T EH1 K T K L AO1 TH K L IY1 N ER0 G EH1 T IH1 T,M UW1 V T UW1 D AY1 N IH0 NG S OW1 F AH0 N EH1 K S T OY IH0 CH T EH1 K T K L AO1 TH K L IY1 N ER0 AY1 EH1 EY T IH1,Move ( Dining_Sofa ) Find ( Cloth_Cleaner Dining_Sofa ) Grasp ( Cloth_Cleaner )
Move to Side_Table  next detect twin_bell_alarm_clock  get it .,M UW1 V T UW1 S AY1 D T EY1 B AH0 L N EH1 K S T D IH0 T EH1 K T T W IH1 N B EH1 L AH0 L AA1 R M K L AA1 K G EH1 T IH1 T,M UW1 V T UW1 S AY1 D T EY1 B Y L N K AW0 T D IH0 T EH1 K T T W N B EH1 L AH0 L AA1 R M K L AA1 K G EH1 T IH1 OW1,Move ( Side_Table ) Find ( twin_bell_alarm_clock Side_Table ) Grasp ( twin_bell_alarm_clock )
Would you go to Dining_Sofa take Bleach er come back .,W UH1 D Y UW1 G OW1 T UW1 D AY1 N IH0 NG S OW1 F AH0 T EY1 K B L IY1 CH ER0 K AH1 M B AE1 K,W UH1 D Y UW1 G OW1 T UW1 D AY1 N IH0 AW0 NG S OW1 F AH0 T EY1 K B L IY1 CH ER0 K EH2 M B AE1 K,Move ( Dining_Sofa ) Find ( Bleach Dining_Sofa ) Grasp ( Bleach ) Move ( HERE )
Go to Side_Table next detect cigarette  take it .,G OW1 T UW1 S AY1 D T EY1 B AH0 L N EH1 K S T D IH0 T EH1 K T S IH2 G ER0 EH1 T T EY1 K IH1 T,G OW1 T UW1 S AY1 D T EY1 B AH0 D N EH1 K S T D IH0 T EH1 K T S UW1 IH2 G ER0 EH1 T AY0 EY1 K IY2 T,Move ( Side_Table ) Find ( cigarette Side_Table  ) Grasp ( cigarette )
Would you bring Strawberry_Juice from Living_Sofa go to Reception_Table go to Sofa  .,W UH1 D Y UW1 B R IH1 NG S T R AO1 B EH2 R IY0 JH UW1 S F R AH1 M L IH1 V IH0 NG S OW1 F AH0 G OW1 T UW1 R IH0 S EH1 P SH AH0 N T EY1 B AH0 L G OW1 T UW1 S OW1 F AH0,W D Y UW1 B R IH1 P S T R AO1 V EH2 R IY0 JH UW1 S F R AH1 M L IH1 V IH0 NG S OW1 F AH0 G OW1 AY UW1 R IH0 S EH1 P SH AH0 N EY1 B AH0 L G OW1 T S UH OW1 F AH0,Move ( Living_Sofa ) Place ( Strawberry_Juice Living_Sofa ) Move ( Reception_Table ) Move ( Reception_Table ) 
Go to Side_Table Grasp Cup_Star  leave the apartment please .,G OW1 T UW1 S AY1 D T EY1 B AH0 L G R AE1 S P K AH1 P S T AA1 R L IY1 V DH AH0 AH0 P AA1 R T M AH0 N T P L IY1 Z,G OW1 T UW1 S AY1 D T EY1 AH2 AH0 L G R AE1 S P K AH1 P T AA1 R L IY1 V DH AH0 AH0 P AA1 R T M AH0 N P L IY1,Move ( Side_Table ) Grasp ( Cup_Star ) Move ( apartment )
Go to lobby  move to Dining_Sofa  then leave the apartment .,G OW1 T UW1 L AA1 B IY0 M UW1 V T UW1 D AY1 N IH0 NG S OW1 F AH0 DH EH1 N L IY1 V DH AH0 AH0 P AA1 R T M AH0 N T,G OW1 T UW1 L AA1 B IY0 EH2 UW1 V T AA0 UW1 D AY1 N IH0 NG S OW1 F Z AH0 EY1 DH EH1 N L IY1 V AH0 AH0 P AA1 R T M AH0 N T,Move ( lobby ) Move ( Dining_Sofa ) Move ( apartment )
Go to Corridor then find a person neayby bring Red_Tea from Sofa .,G OW1 T UW1 K AO1 R AH0 D ER0 DH EH1 N F AY1 N D AH0 P ER1 S AH0 N N IH1 R B AY1 B R IH1 NG R EH1 D T IY1 F R AH1 M S OW1 F AH0,G OW1 T AO0 K AO1 UH0 R AH0 D ER0 DH EH1 N F S AY1 AE0 N D AH0 P ER1 AH0 N N IH1 R B AY1 AA1 B R IH1 NG AA D T IY1 F R AH1 M S OW1 F AH0,Move ( Corridor ) Find ( person Corridor ) Move ( Sofa ) Grasp ( Red_Tea )
Go to Living_Room er find a person neayby bring Orange_Juice from Dining_Table .,G OW1 T UW1 L IH1 V IH0 NG R UW1 M ER0 F AY1 N D AH0 P ER1 S AH0 N N IH1 R B AY1 B R IH1 NG AO1 R AH0 N JH JH UW1 S F R AH1 M D AY1 N IH0 NG T EY1 B AH0 L,G AO1 T UW1 IH1 V IH0 NG R UW1 M ER0 F EH AY1 N OY1 UH AH0 P ER1 S AH0 N N R B AY AO2 AY1 R AO1 IH1 NG AO1 R AH0 N JH JH UW1 S AE2 F R AH1 M D AY1 N IH0 ER1 NG T EY1 B AH0 L,Move ( Living_Room ) Find ( person Living_Room ) Move ( Dining_Table ) Grasp ( Orange_Juice )
Can you go to kitchen get Bath_Cleaner then come back .,K AE1 N Y UW1 G OW1 T UW1 K IH1 CH AH0 N G EH1 T B AE1 TH K L IY1 N ER0 DH EH1 N K AH1 M B AE1 K,K AE1 N UW0 Y UW1 G OW1 T UW1 IH1 CH AH0 N G EH1 T ER0 B AE1 TH K L IY1 ER1 N ER0 DH EH1 N K AH1 ER0 M B AE1 K,Move (  kitchen  ) Find ( Bath_Cleaner kitchen ) Grasp ( Bath_Cleaner ) Move ( HERE )
Well go to Dining_Sofa  take toy_car  bring it to Bar .,W EH1 L G OW1 T UW1 D AY1 N IH0 NG S OW1 F AH0 T EY1 K T OY1 K AA1 R B R IH1 NG IH1 T T UW1 B AA1 R,W EH1 L G OW1 T D AY1 N IH0 NG S N AA2 OW1 F AH0 T EY1 K T OY1 K AA1 AW0 R B R IH1 NG IH1 T T UW1 OW1 B AA1 R,Move (  Dining_Sofa ) Find ( toy_car Dining_Sofa  ) Grasp ( toy_car )  Move ( Bar )
Go to Kitchen_Table next detect nursing_bottle  take it .,G OW1 T UW1 K IH1 CH AH0 N T EY1 B AH0 L N EH1 K S T D IH0 T EH1 K T N ER1 S IH0 NG B AA1 T AH0 L T EY1 K IH1 T,G OW1 T UW1 AO1 IH1 CH AH0 N T EY1 B AH0 L N K S T D IH0 T EH1 K T N ER1 S UH1 NG B AA1 T M AH0 AE1 T EY1 K IH1 T,Move ( Kitchen_Table ) Find ( nursing_bottle Kitchen_Table  ) Grasp ( nursing_bottle )
Go to Kitchen_Room Grasp apple place it on Sofa okay .,G OW1 T UW1 K IH1 CH AH0 N R UW1 M G R AE1 S P AE1 P AH0 L P L EY1 S IH1 T AA1 N S OW1 F AH0 OW2 K EY1,G OW1 T UW1 K IH1 T AH0 N R UW1 M G R AE1 S P AE1 P AE2 L P L EY1 S IH1 AA1 S OW1 F AH0 OW2 K EY1,Move ( Kitchen_Room ) Grasp ( apple ) Move ( Sofa ) Place ( apple Sofa )
Go to Dining_Room go to Kitchen_Table  and exit from bed_room .,G OW1 T UW1 D AY1 N IH0 NG R UW1 M G OW1 T UW1 K IH1 CH AH0 N T EY1 B AH0 L AH0 N D EH1 G Z IH0 T F R AH1 M B EH1 D R UW1 M,G OW1 T UW1 D AY1 N IH0 NG R UW1 M G OW1 T UW1 K IH1 CH AH0 N T EY1 B IH0 EH AH0 N D EH1 G Z IH0 T F R R AH1 M B EH1 D R UW1 M,Move ( Dining_Room ) Move ( Kitchen_Table ) Move ( bed_room )
Well move to Side_Table get bell_pepper and come back .,W EH1 L M UW1 V T UW1 S AY1 D T EY1 B AH0 L G EH1 T B EH1 L P EH1 P ER0 AH0 N D K AH1 M B AE1 K,W EH1 L M UW1 V T UW1 S AY1 D T EY1 B AH0 L G EH1 T B EH1 L EH1 P ER0 AH0 N D K AH1 M B AE1 K,Move ( Side_Table ) Grasp ( bell_pepper ) Move ( Side_Table ) Grasp ( bell_pepper ) Move ( HERE )
Go to lobby er find a person neayby bring rubik's_cube from Living_Sofa .,G OW1 T UW1 L AA1 B IY0 ER0 F AY1 N D AH0 P ER1 S AH0 N N IH1 R B AY1 B R IH1 NG R UW1 B IH0 K S K Y UW1 B F R AH1 M L IH1 V IH0 NG S OW1 F AH0,G OW1 T UW1 L AA1 B ER0 F AY1 N D AH0 P ER1 CH S AH0 N IH1 R B AY1 B R IH1 NG DH R UW1 B IH0 K S K Y UW1 B F R AH1 M L IH1 V IH0 SH S OW1 AH0,Move ( lobby ) Find ( person lobby ) Move ( Living_Sofa ) Grasp ( rubik's_cube )
Go to Dining_Table  take salt put it on Dining_Sofa okay .,G OW1 T UW1 D AY1 N IH0 NG T EY1 B AH0 L T EY1 K S AO1 L T P UH1 T IH1 T AA1 N D AY1 N IH0 NG S OW1 F AH0 OW2 K EY1,G OW1 T UW1 D AY1 IH0 T EY1 B DH AH0 L T EY1 K S AO1 L AA1 T P UH1 T IH1 T AA1 N D AY1 N IH0 NG S OW1 F AH0 OW2 K EY1,Move ( Dining_Table )  Grasp ( salt ) Move ( Dining_Sofa ) Place ( salt Dining_Table )
Can you move to Kitchen_Table get sauce then come back .,K AE1 N Y UW1 M UW1 V T UW1 K IH1 CH AH0 N T EY1 B AH0 L G EH1 T S AO1 S DH EH1 N K AH1 M B AE1 K,K AE1 N Y UW1 M UW1 V T UW1 AE0 IH1 CH AH0 N T EY1 B AH0 L G EH1 T S AO1 S DH N K AH1 M B AE1 K,Move ( Kitchen_Table ) Grasp ( sauce ) Move ( HERE )
Go to kitchen Grasp rabbit_doll throw it into Dustbin please .,G OW1 T UW1 K IH1 CH AH0 N G R AE1 S P R AE1 B AH0 T D AA1 L TH R OW1 IH1 T IH1 N T UW0 D AH1 S T B IH0 N P L IY1 Z,G OW1 T UW1 K IH1 CH OY2 N G DH R AE1 S P AE1 B AH0 T AW OY L TH R OW1 IH1 AA2 IH1 N T UW0 D AH1 T IH0 AW2 P L IY1 Z,Move ( kitchen ) Grasp ( rabbit_doll ) Move ( Dustbin ) Place ( rabbit_doll Dustbin  ) 
Go to Dining_Sofa find a person neayby  er follow a person .,G OW1 T UW1 D AY1 N IH0 NG S OW1 F AH0 F AY1 N D AH0 P ER1 S AH0 N N IH1 R B AY1 ER0 F AA1 L OW0 AH0 P ER1 S AH0 N,G OW1 T AH1 D AY1 N IH0 AY2 S OW1 F AH0 F AY1 N D AH0 P ER1 S AH0 N N IH1 R B OY1 EY1 ER0 F AY0 AA1 L OW0 AH0 ER1 S AA0 AH0 N,Move ( Dining_Sofa ) Find ( person Dining_Sofa ) Follow ( person )
Go to Dining_Sofa then detect empty_ketchup  take it .,G OW1 T UW1 D AY1 N IH0 NG S OW1 F AH0 DH EH1 N D IH0 T EH1 K T EH1 M P T IY0 K EH1 CH AH0 P T EY1 K IH1 T,G OW1 T UW1 D AY1 N IH0 NG S OW1 AH0 DH EH1 N D IH0 T EH1 T EH1 M P T IY0 K EY1 EH1 CH AH0 P EY1 K IH1 T,Move ( Dining_Sofa ) Find ( empty_ketchup Dining_Sofa ) Grasp ( empty_ketchup )  Move ( empty_ketchup )
Can you go to bed_room get Japanese_Tea then come back .,K AE1 N Y UW1 G OW1 T UW1 B EH1 D R UW1 M G EH1 T JH AE2 P AH0 N IY1 Z T IY1 DH EH1 N K AH1 M B AE1 K,K AE1 Z N Y UW1 G OW1 T UW1 EH1 D R UW1 OY1 G EH1 T JH AE2 P AH0 N AE0 T IY0 IY1 DH EH1 N K AH1 M TH B AE1 K,Move (  bed_room  ) Find ( Japanese_Tea bed_room ) Grasp ( Japanese_Tea ) Move ( HERE )
Would you go to bed_room Grasp empty_plastic_bottle finally come back .,W UH1 D Y UW1 G OW1 T UW1 B EH1 D R UW1 M G R AE1 S P EH1 M P T IY0 P L AE1 S T IH0 K B AA1 T AH0 L F AY1 N AH0 L IY0 K AH1 M B AE1 K,W UW0 Y UW1 G OW1 T UW1 ER B EH1 D R EY0 UW1 M G R AE1 S P EH1 M P AA EH IY0 P L AE1 S T IH0 K B AA1 T AH0 L F AY1 N AH0 L IY0 AA2 AH1 M B AE1 K,Move ( bed_room ) Find ( empty_plastic_bottle bed_room ) Grasp ( empty_plastic_bottle )  Move ( HERE )
Go to Kitchen_Room next find a person neayby get Japanese_Dressing from Living_Sofa .,G OW1 T UW1 K IH1 CH AH0 N R UW1 M N EH1 K S T F AY1 N D AH0 P ER1 S AH0 N N IH1 R B AY1 G EH1 T JH AE2 P AH0 N IY1 Z D R EH1 S IH0 NG F R AH1 M L IH1 V IH0 NG S OW1 F AH0,G OW1 T UW1 R K IH1 CH AH0 N R UW1 M N EH1 K S T F AY1 ER1 N D AH0 TH P ER1 S AH0 N N IH1 R B AY1 G EH1 T JH P AH0 N IY1 Z D R EH1 OY S ER2 NG F OY1 R AH1 M L IH1 V ZH NG S OW1 F AH0,Move ( Kitchen_Room ) Find ( person ) Move ( Living_Sofa ) Grasp ( Japanese_Dressing )
Move to Sofa and detect toy_penguin get it .,M UW1 V T UW1 S OW1 F AH0 AH0 N D D IH0 T EH1 K T T OY1 P EH1 NG G W AH0 N G EH1 T IH1 T,M UW1 V T UW1 S OW1 F AH0 AH0 D D T EH1 AA0 K T T OY1 P EH1 G N G EH1 AW T IH1 T,Move ( Sofa ) Find ( toy_penguin Sofa ) Grasp ( toy_penguin )
Well go to Reception_Table  take Green_Tea finally come back .,W EH1 L G OW1 T UW1 R IH0 S EH1 P SH AH0 N T EY1 B AH0 L T EY1 K G R IY1 N T IY1 F AY1 N AH0 L IY0 K AH1 M B AE1 K,W EH1 L G OW1 T UW1 R IH0 S EH1 P SH AH0 AH1 N T AE1 B OY1 AH0 L T EY1 K G R AW N SH IY1 F AY1 N AH0 L IY0 K AH1 V M B AE1 K,Move ( Reception_Table ) Grasp ( Green_Tea ) Move ( HERE )
Go to Reception_Table next detect Lemon_Tea  take it .,G OW1 T UW1 R IH0 S EH1 P SH AH0 N T EY1 B AH0 L N EH1 K S T D IH0 T EH1 K T L EH1 M AH0 N T IY1 T EY1 K IH1 T,G OW1 T UW1 R IH0 UH0 S EH1 UH2 P SH AH0 N T EY1 B AH0 L N AW2 EH1 K S T D IH0 T EH1 K L EH1 M AH0 T IY1 EY1 K IH1 T,Move ( Reception_Table ) Find ( Lemon_Tea Reception_Table  ) Grasp ( Lemon_Tea )
Go to kitchen er find a person neayby bring Korean_Soup from Dining_Sofa .,G OW1 T UW1 K IH1 CH AH0 N ER0 F AY1 N D AH0 P ER1 S AH0 N N IH1 R B AY1 B R IH1 NG K AO2 R IY1 AH0 N S UW1 P F R AH1 M D AY1 N IH0 NG S OW1 F AH0,G OW1 T UH0 AH0 UW1 K IH1 CH AH0 N ER0 F AY1 N D AH0 AW0 P ER1 S AA AH0 N N AW2 IH1 R B AY1 B R IH1 NG K AO2 R IY1 AH0 N UW1 P R M D OY0 AH1 NG S OW1 F AH0,Move ( kitchen ) Find ( person kitchen ) Move ( Dining_Sofa ) Grasp ( Korean_Soup )
Go to kitchen go to Reception_Table  and exit from Kitchen_Room .,G OW1 T UW1 K IH1 CH AH0 N G OW1 T UW1 R IH0 S EH1 P SH AH0 N T EY1 B AH0 L AH0 N D EH1 G Z IH0 T F R AH1 M K IH1 CH AH0 N R UW1 M,G OW1 T UW1 K IH1 CH AH0 N G OW1 T UW1 IH0 S TH UW2 SH N T F EY1 B AH0 L AH0 N D EH1 G Z IH0 F R AH1 M K IH1 CH AH0 N R UW1 AY1 M,Move ( kitchen ) Move ( Reception_Table ) Move ( Kitchen_Room )
Would you move to Bar get bear_doll bring it to Living_Sofa .,W UH1 D Y UW1 M UW1 V T UW1 B AA1 R G EH1 T B EH1 R D AA1 L B R IH1 NG IH1 T T UW1 L IH1 V IH0 NG S OW1 F AH0,UH1 EH D UW1 M UW1 V T UW1 EY AA1 AY1 G EH1 T B R D AA1 L R IH1 NG IH1 T T UW1 L IH1 V IH0 NG S OW1 F AH0,Move ( Bar ) Find ( bear_doll Bar  ) Grasp ( bear_doll ) Move ( Living_Sofa )
Move to Side_Table  get twin_bell_alarm_clock  exit from lobby okay .,M UW1 V T UW1 S AY1 D T EY1 B AH0 L G EH1 T T W IH1 N B EH1 L AH0 L AA1 R M K L AA1 K EH1 G Z IH0 T F R AH1 M L AA1 B IY0 OW2 K EY1,M UW1 V T UW1 S AY1 D T EY1 B AH0 UH2 L G T T W IH1 N B EH1 L AH0 AA1 R M K L AA1 K EH1 G W Z IH0 T F R AH1 M L AA1 IY0 UH2 K EY1,Move ( Side_Table ) Find ( twin_bell_alarm_clock Side_Table ) Grasp ( twin_bell_alarm_clock ) Move ( lobby )
Well go to Sofa  take white_cup  bring it to Reception_Table .,W EH1 L G OW1 T UW1 S OW1 F AH0 T EY1 K W AY1 T K AH1 P B R IH1 NG IH1 T T UW1 R IH0 S EH1 P SH AH0 N T EY1 B AH0 L,W AH2 EH1 L G OW1 UW1 S OW1 F T EY1 K W AY1 T K AH1 Y B R IH1 NG IH1 JH T T UW1 R IH0 S EH1 P SH AH0 N T EY1 B AH0 AW0 L,Move (  Sofa ) Find ( white_cup Sofa  ) Grasp ( white_cup )  Move ( Reception_Table )
Can you go to bed_room Grasp white_cup  bring it to Dining_Sofa .,K AE1 N Y UW1 G OW1 T UW1 B EH1 D R UW1 M G R AE1 S P W AY1 T K AH1 P B R IH1 NG IH1 T T UW1 D AY1 N IH0 NG S OW1 F AH0,K AE1 N Z G AH0 OW1 T UW1 B EH1 D R UW1 M G R AE1 S P W AY1 T K AH1 P B R IH1 NG IH1 T T UW1 D AY1 N ER0 NG S OW1 F AH0,Move ( bed_room ) Find ( white_cup bed_room ) Grasp ( white_cup ) Move ( Dining_Sofa )  Find ( white_cup Dining_Sofa ) Grasp ( white_cup ) Move ( bed_room )
Would you go to Bar  take tumbler  bring it to Sofa .,W UH1 D Y UW1 G OW1 T UW1 B AA1 R T EY1 K T AH1 M B L ER0 B R IH1 NG IH1 T T UW1 S OW1 F AH0,W UH1 D Y OW1 G OW1 T UW1 B AA1 R T EY1 K T AH1 M B L ER0 B R IH1 NG IH1 T T UW1 AE S OW1 F AH0,Move ( Bar ) Find ( tumbler Bar ) Grasp ( tumbler ) Move ( Sofa )
Go to Dining_Sofa then detect Long_Potato  take it .,G OW1 T UW1 D AY1 N IH0 NG S OW1 F AH0 DH EH1 N D IH0 T EH1 K T L AO1 NG P AH0 T EY1 T OW2 T EY1 K IH1 T,G OW1 T UW1 D AY1 UW IH0 NG S OW1 F AH0 DH EH1 N B D IH0 T EH1 K TH T L AO1 NG AH0 T EY1 T OW2 T K T,Move ( Dining_Sofa ) Find ( Long_Potato Dining_Sofa ) Grasp ( Long_Potato )  Move ( Long_Potato )
Go to bed_room take Strawberry_Juice put it on Dining_Sofa please .,G OW1 T UW1 B EH1 D R UW1 M T EY1 K S T R AO1 B EH2 R IY0 JH UW1 S P UH1 T IH1 T AA1 N D AY1 N IH0 NG S OW1 F AH0 P L IY1 Z,G OW1 T UW1 B EH1 D R UW1 M T EY1 AE2 AO0 S T R AO1 B DH R IY0 JH UW1 S V T IH1 T AA1 N D AY1 IH0 NG OW1 OY2 AH0 N P IY1 Z,Move ( bed_room ) Find ( Strawberry_Juice bed_room ) Grasp ( Strawberry_Juice ) Move ( Dining_Sofa ) Place ( Strawberry_Juice Dining_Sofa )
Go to bed_room  move to Living_Table  finally leave the apartment .,G OW1 T UW1 B EH1 D R UW1 M M UW1 V T UW1 L IH1 V IH0 NG T EY1 B AH0 L F AY1 N AH0 L IY0 L IY1 V DH AH0 AH0 P AA1 R T M AH0 N T,G OW1 T UW1 B EH1 D UW1 M M UW1 V T UW1 L IH1 V IH0 NG T EY1 B AH0 L F AY1 N AH0 L IY0 L IY1 V DH UW2 AH0 P AA1 R T M L N T,Move ( bed_room ) Move ( Living_Table )  Move ( apartment )
Go to lobby  go to Dining_Table er leave the apartment .,G OW1 T UW1 L AA1 B IY0 G OW1 T UW1 D AY1 N IH0 NG T EY1 B AH0 L ER0 L IY1 V DH AH0 AH0 P AA1 R T M AH0 N T,G OW1 T UW1 L AA1 B IY0 OW1 UW1 AY1 N IH0 NG T EY1 B AH0 L ER0 L V DH AH0 AH0 P AA1 R T M AH0 N T,Move ( lobby ) Move ( Dining_Table )  Move ( apartment )
Go to Living_Sofa get cubic_clock  exit from bed_room okay .,G OW1 T UW1 L IH1 V IH0 NG S OW1 F AH0 G EH1 T K Y UW1 B IH0 K K L AA1 K EH1 G Z IH0 T F R AH1 M B EH1 D R UW1 M OW2 K EY1,G OW1 T UW1 L HH IH1 IH0 NG S OW1 F AH0 G EH1 T K Y OW UW1 B IH0 K K L AA1 K G Z IH0 T F R AH1 M AY2 B EH1 R UW1 M OW2 K EY1,Move (  Living_Sofa  ) Find ( cubic_clock Living_Sofa  ) Grasp ( cubic_clock ) Move ( bed_room )
Go to Dining_Table take soysauce put it on Bar please .,G OW1 T UW1 D AY1 N IH0 NG T EY1 B AH0 L T EY1 K S OY1 S AO2 S P UH1 T IH1 T AA1 N B AA1 R P L IY1 Z,G OW1 T UW1 ER0 AA2 AY1 N IH0 NG T EY1 B AH0 L T K S OY1 S AO2 S P UH1 T IH1 T AA1 N B AA1 R P L IY1 Z,Move (  Dining_Table  ) Find ( soysauce Dining_Table  ) Grasp ( soysauce ) Plcae ( soysauce Bar )
Well move to Living_Table Grasp tumbler then come back .,W EH1 L M UW1 V T UW1 L IH1 V IH0 NG T EY1 B AH0 L G R AE1 S P T AH1 M B L ER0 DH EH1 N K AH1 M B AE1 K,W EH1 L OY2 M UW1 V T UW1 L IH1 V IH0 T EY1 AH0 L NG R AE1 S P T AE1 M B ER0 DH EH1 N K AH1 M B AE1 K,Move ( Living_Table ) Move ( tumbler ) Move ( HERE )
