Input,phonemelabel,Noisylabel,Labeldata
Can you go to bed_room get Bath_Cleaner then come back .,K AE1 N Y UW1 G OW1 T UW1 B EH1 D R UW1 M G EH1 T B AE1 TH K L IY1 N ER0 DH EH1 N K AH1 M B AE1 K,K AE1 N Y UW1 G EH OW1 T AH EH1 D R M G EH1 T B AE1 TH OY1 K L Y SH N ER0 P DH EH1 N K AA2 AH1 M B AE1 K,Move (  bed_room  ) Find ( Bath_Cleaner bed_room ) Grasp ( Bath_Cleaner ) Move ( HERE )
Well go to Living_Table  take toy_car finally come back .,W EH1 L G OW1 T UW1 L IH1 V IH0 NG T EY1 B AH0 L T EY1 K T OY1 K AA1 R F AY1 N AH0 L IY0 K AH1 M B AE1 K,W EH1 L G T UW1 L IH1 V IH0 NG T EY1 B AH0 L T EY1 K T OY1 K AA1 F AY1 N AH0 L IY0 K AH1 M B AE1 K,Move ( Living_Table ) Grasp ( toy_car ) Move ( HERE )
Well get camera from Kitchen_Table go to kitchen go to Visitor_Room .,W EH1 L G EH1 T K AE1 M ER0 AH0 F R AH1 M K IH1 CH AH0 N T EY1 B AH0 L G OW1 T UW1 K IH1 CH AH0 N G OW1 T UW1 V IH1 Z IH0 T ER0 R UW1 M,W EH1 AO2 L G EH1 T K AE1 M AW2 F R AH1 M K IH1 CH AH0 N EY1 B AY1 L UW G OW1 T UW1 K IH1 CH AH0 N G OW1 T V Z IH0 T ER0 R UW1 M,Move ( Kitchen_Table ) Find ( camera Kitchen_Table  ) Grasp ( camera )  Move ( kitchen ) Move ( Visitor_Room )
Would you bring soysauce from Dining_Sofa go to Living_Table go to Sofa  .,W UH1 D Y UW1 B R IH1 NG S OY1 S AO2 S F R AH1 M D AY1 N IH0 NG S OW1 F AH0 G OW1 T UW1 L IH1 V IH0 NG T EY1 B AH0 L G OW1 T UW1 S OW1 F AH0,W UH1 D B R IH1 NG S OY1 IH0 AO2 S F R AH1 UH1 M D AY1 N IH0 AE2 UH0 S OW1 AE2 F AH0 OW1 T UW1 L IH1 V IH0 NG T EY1 B AH0 L G OW1 T UW1 OW1 F AH0,Move ( Dining_Sofa ) Place ( soysauce Dining_Sofa ) Move ( Living_Table ) Move ( Living_Table ) 
Would you move to Bar get camera bring it to Kitchen_Table .,W UH1 D Y UW1 M UW1 V T UW1 B AA1 R G EH1 T K AE1 M ER0 AH0 B R IH1 NG IH1 T T UW1 K IH1 CH AH0 N T EY1 B AH0 L,W UH1 D Y UW1 UW1 V T UW1 B AA1 IY0 EH1 T K AE1 M ER0 AH0 B R IH1 NG IH1 T UW1 K IH1 CH AH0 N T EY1 B AH0 L,Move ( Bar ) Find ( camera Bar  ) Grasp ( camera ) Move ( Kitchen_Table )
Can you go to Living_Table take canned_juice carry it to Sofa .,K AE1 N Y UW1 G OW1 T UW1 L IH1 V IH0 NG T EY1 B AH0 L T EY1 K K AE1 N D JH UW1 S K AE1 R IY0 IH1 T T UW1 S OW1 F AH0,K AE1 N Y UW1 G OW1 T UW1 L IH1 V AY IH0 NG T B AH0 L T EY1 K AE1 N D JH UW1 S K AE1 R IY0 IH1 T T UW1 S OW1 F AH0,Move ( Living_Table  ) Find ( canned_juice Living_Table ) Grasp ( canned_juice ) Move ( Sofa )
Would you bring bell_pepper from Reception_Table move to Bar go to Living_Room .,W UH1 D Y UW1 B R IH1 NG B EH1 L P EH1 P ER0 F R AH1 M R IH0 S EH1 P SH AH0 N T EY1 B AH0 L M UW1 V T UW1 B AA1 R G OW1 T UW1 L IH1 V IH0 NG R UW1 M,D W UH1 D Y UW1 B R IH1 IY NG IH0 B EH1 L P EH1 P ER0 F R AH1 M R S EH1 P SH AH0 N T EY1 B AH0 L M UW1 V AW1 UW1 AW1 B AA1 R OW1 T UW1 L IH1 V IH0 NG R UW1 M,Move ( Reception_Table ) Find ( bell_pepper Reception_Table ) Move ( Bar ) Move ( Living_Room )
Go to Living_Table find a person neayby finally follow a person .,G OW1 T UW1 L IH1 V IH0 NG T EY1 B AH0 L F AY1 N D AH0 P ER1 S AH0 N N IH1 R B AY1 F AY1 N AH0 L IY0 F AA1 L OW0 AH0 P ER1 S AH0 N,G OW1 T UH1 L IH1 V IH0 NG T EY1 B UW1 AH0 L F AY1 N D EY AH0 P ER1 S AH0 OW2 N IH1 R B AY1 F AY1 N AH0 L IY0 F AW L OW0 AH0 P ER1 S AH0 N,Move ( Living_Table ) Find ( person Living_Table  ) Follow ( person )
Well go to Living_Sofa  take Red_Potato finally come back .,W EH1 L G OW1 T UW1 L IH1 V IH0 NG S OW1 F AH0 T EY1 K R EH1 D P AH0 T EY1 T OW2 F AY1 N AH0 L IY0 K AH1 M B AE1 K,W L G OW1 T UW1 L IH1 V IH0 NG S OW1 F AH0 T EY1 K R EH1 D IH2 P AH0 T EY1 T OW2 AY1 N IY0 AH0 L IY0 NG K AH1 M B AE1 K,Move ( Living_Sofa ) Grasp ( Red_Potato ) Move ( HERE )
Go to lobby  find a person neayby  finally follow a person .,G OW1 T UW1 L AA1 B IY0 F AY1 N D AH0 P ER1 S AH0 N N IH1 R B AY1 F AY1 N AH0 L IY0 F AA1 L OW0 AH0 P ER1 S AH0 N,OY1 EH G OW1 T UW1 L B IY0 F AY1 N D AH0 ER1 S AH0 N AA0 IH1 R B AY1 N AY1 N AH0 L IY0 F AA1 L OW0 AW0 P ER1 S AH0 N,Move ( lobby ) Find ( person lobby ) Follow ( person )
Would you move to Side_Table Grasp apple and come back .,W UH1 D Y UW1 M UW1 V T UW1 S AY1 D T EY1 B AH0 L G R AE1 S P AE1 P AH0 L AH0 N D K AH1 M B AE1 K,W UH1 D Y UW1 M UW1 V T UW1 S AY1 D T EY1 B AH0 L G R AE1 S P AE1 P AH0 AH0 N K K AH1 M B AE1 K,Move ( Side_Table ) Grasp ( apple ) Move ( HERE )
Would you go to Kitchen_Room Grasp empty_ketchup er come back .,W UH1 D Y UW1 G OW1 T UW1 K IH1 CH AH0 N R UW1 M G R AE1 S P EH1 M P T IY0 K EH1 CH AH0 P ER0 K AH1 M B AE1 K,UH1 D Y AE1 UW1 OW1 T UW1 K IH1 CH AH0 AY1 EY2 N R UW1 M G R AE1 S P EH1 UW2 M P T IY0 K EH1 CH AH0 P ER0 K AH1 M B AE1 AE0 K,Move ( Kitchen_Room ) Find ( empty_ketchup Kitchen_Room ) Move ( HERE )
Go to Living_Room get Long_Potato throw it into Dustbin please .,G OW1 T UW1 L IH1 V IH0 NG R UW1 M G EH1 T L AO1 NG P AH0 T EY1 T OW2 TH R OW1 IH1 T IH1 N T UW0 D AH1 S T B IH0 N P L IY1 Z,G OW1 EY T UW1 L AH1 IH1 V IH0 NG R UW1 M G EH1 T L AO1 NG P L AH0 T EY1 T OW2 TH R EH IH1 T IH1 N T UW0 D AH1 S T IH0 N OY2 L IY1,Move ( Living_Room ) Find ( Long_Potato Living_Room ) Grasp ( Long_Potato ) Move ( Dustbin ) Place ( Long_Potato Dustbin )
Go to Dining_Room  go to Living_Table then exit the apartment .,G OW1 T UW1 D AY1 N IH0 NG R UW1 M G OW1 T UW1 L IH1 V IH0 NG T EY1 B AH0 L DH EH1 N EH1 G Z IH0 T DH AH0 AH0 P AA1 R T M AH0 N T,B G OW1 T UW1 D AY1 N IH0 IH2 NG R UW1 M G OW1 T UW1 L IH1 V IH0 NG T EY1 B AH0 L N EH1 G Z IH0 T DH AH0 AH0 P AA1 R T M CH AH0 N T,Move ( Dining_Room ) Move ( Living_Table )  Move ( apartment )
Go to Corridor Grasp pink_cup throw it into Dustbin please .,G OW1 T UW1 K AO1 R AH0 D ER0 G R AE1 S P P IH1 NG K K AH1 P TH R OW1 IH1 T IH1 N T UW0 D AH1 S T B IH0 N P L IY1 Z,G OW1 T UW1 K AO1 AO2 R AH0 D ER0 UH R AE1 S P P NG K K AH1 P TH R OW1 IH1 T IH1 N T UW0 D AH1 S T B IH0 N P IY1 Z,Move ( Corridor ) Grasp ( pink_cup ) Move ( Dustbin ) Place ( pink_cup Dustbin  ) 
Move to Living_Table  go to Kitchen_Table then exit the apartment .,M UW1 V T UW1 L IH1 V IH0 NG T EY1 B AH0 L G OW1 T UW1 K IH1 CH AH0 N T EY1 B AH0 L DH EH1 N EH1 G Z IH0 T DH AH0 AH0 P AA1 R T M AH0 N T,M UW1 T UW1 L IH1 V IH0 NG T EY1 B G AH0 L G OW1 T UW1 K IH1 CH AH0 N T B T AH0 L DH EH1 N EH1 G Z IH0 T DH IY0 AH0 AH0 W P UW AA1 R T M N T,Move ( Living_Table ) Move ( Kitchen_Table ) Move ( apartment )
Go to Corridor Grasp Stick_Potato place it on Dining_Sofa okay .,G OW1 T UW1 K AO1 R AH0 D ER0 G R AE1 S P S T IH1 K P AH0 T EY1 T OW2 P L EY1 S IH1 T AA1 N D AY1 N IH0 NG S OW1 F AH0 OW2 K EY1,G OW1 T UW1 K AO1 R AH0 D ER0 G R S P S IH1 K P AH0 T EY1 T OW2 P L EY1 S IY1 T AA1 N D AY1 N IH0 NG S OW1 F AH0 OW2 K EY1,Move ( Corridor ) Grasp ( Stick_Potato ) Move ( Dining_Sofa ) Place ( Stick_Potato Dining_Sofa )
Move to Dining_Table find a person neayby then follow a person .,M UW1 V T UW1 D AY1 N IH0 NG T EY1 B AH0 L F AY1 N D AH0 P ER1 S AH0 N N IH1 R B AY1 DH EH1 N F AA1 L OW0 AH0 P ER1 S AH0 N,M UW1 V T UW1 D AY1 N IH0 NG T EY1 B L F AY1 N AH0 P ER1 S AH0 ER2 N N IH1 R B AY1 DH EH1 N F AA1 L OW0 AH0 P ER1 S AH0 N,Move (  Dining_Table  ) Find ( person Dining_Table  ) Follow ( pesron )
Well go to Side_Table  take rabbit_doll  bring it to Dining_Sofa .,W EH1 L G OW1 T UW1 S AY1 D T EY1 B AH0 L T EY1 K R AE1 B AH0 T D AA1 L B R IH1 NG IH1 T T UW1 D AY1 N IH0 NG S OW1 F AH0,W EH1 L G OW1 T UW1 S AY1 Z T EY1 B AH0 L T EY1 K R AE1 B AH0 T D B B R IH1 NG IH1 T T UW1 D AY1 IH0 NG S OW1 F AH0,Move (  Side_Table ) Find ( rabbit_doll Side_Table  ) Grasp ( rabbit_doll )  Move ( Dining_Sofa )
Go to Living_Sofa find a person neayby finally follow a person .,G OW1 T UW1 L IH1 V IH0 NG S OW1 F AH0 F AY1 N D AH0 P ER1 S AH0 N N IH1 R B AY1 F AY1 N AH0 L IY0 F AA1 L OW0 AH0 P ER1 S AH0 N,G AW0 OW1 T UW1 L IH1 V IH0 NG S OW1 F AH0 F Y AO0 AY1 N D AH0 P ER1 S IY1 N N IH1 R B AY1 AY0 AY1 N AH0 L IY0 F AA1 L OW0 AH0 P ER1 S AH0 N,Move ( Living_Sofa ) Find ( person Living_Sofa  ) Follow ( person )
Go to Side_Table find a person neayby finally follow a person .,G OW1 T UW1 S AY1 D T EY1 B AH0 L F AY1 N D AH0 P ER1 S AH0 N N IH1 R B AY1 F AY1 N AH0 L IY0 F AA1 L OW0 AH0 P ER1 S AH0 N,G OW1 T UW1 AY1 D T EY1 B AH0 L P F AY1 N D AH0 P AA UW S AH0 N F N IY2 R B IY2 AY1 F AY1 N AH0 L IY0 F AA1 L OW0 AH0 P ER1 S N,Move ( Side_Table ) Find ( person Side_Table  ) Follow ( person )
Go to Living_Room go to Side_Table  and exit from kitchen .,G OW1 T UW1 L IH1 V IH0 NG R UW1 M G OW1 T UW1 S AY1 D T EY1 B AH0 L AH0 N D EH1 G Z IH0 T F R AH1 M K IH1 CH AH0 N,G T UW1 L IH1 V IH0 IH2 R UW1 M G AH2 T UW1 S AY1 T EY1 F AH0 L AH0 N D EH1 Z IH0 T F R AH1 NG M K IH1 CH AH0 N,Move ( Living_Room ) Move ( Side_Table ) Move ( kitchen )
Well move to Dining_Table get cubic_clock and come back .,W EH1 L M UW1 V T UW1 D AY1 N IH0 NG T EY1 B AH0 L G EH1 T K Y UW1 B IH0 K K L AA1 K AH0 N D K AH1 M B AE1 K,W EH1 L ZH M UW1 V T IY2 D AY1 N IH0 NG JH EY1 B AH0 L G EH1 T K Y UW1 B IH0 K K L AA1 K UW2 AH0 T D K AH1 M L B AE1 K,Move ( Dining_Table ) Grasp ( cubic_clock ) Move ( Dining_Table ) Grasp ( cubic_clock ) Move ( HERE )
Move to Dining_Table  get toy_penguin  exit from bed_room okay .,M UW1 V T UW1 D AY1 N IH0 NG T EY1 B AH0 L G EH1 T T OY1 P EH1 NG G W AH0 N EH1 G Z IH0 T F R AH1 M B EH1 D R UW1 M OW2 K EY1,M UW1 V T UW1 D AY1 B IH0 NG T EY1 B AH0 L G EH1 T T HH Z N P EH1 NG G W AH0 N EH1 G DH AO2 IH0 L F R AH1 M B EH1 D R UW1 M OW2 K EY1,Move ( Dining_Table ) Find ( toy_penguin Dining_Table ) Grasp ( toy_penguin ) Move ( bed_room )
Go to Visitor_Room er find a person neayby bring Strawberry_Juice from Reception_Table .,G OW1 T UW1 V IH1 Z IH0 T ER0 R UW1 M ER0 F AY1 N D AH0 P ER1 S AH0 N N IH1 R B AY1 B R IH1 NG S T R AO1 B EH2 R IY0 JH UW1 S F R AH1 M R IH0 S EH1 P SH AH0 N T EY1 B AH0 L,G T UW1 V IH1 Z IH0 T ER0 UH1 UW1 R HH M ER0 F AY1 N D AH0 P ER1 S AH0 N N IH1 AA R B AY1 B R IH1 NG S T R TH AO1 B EH2 R IY0 JH UW1 S F R AH1 R AO1 IH0 G P IH1 SH AH0 N T EY1 B AH0 L,Move ( Visitor_Room ) Find ( person Visitor_Room ) Move ( Reception_Table ) Grasp ( Strawberry_Juice )
Go to Visitor_Room Grasp filled_ketchup place it on Dining_Sofa okay .,G OW1 T UW1 V IH1 Z IH0 T ER0 R UW1 M G R AE1 S P F IH1 L D K EH1 CH AH0 P P L EY1 S IH1 T AA1 N D AY1 N IH0 NG S OW1 F AH0 OW2 K EY1,G OW0 EH2 UH UW1 V Z IH0 ER JH T ER0 R UW1 M G R AE1 S AO0 F IH1 L D K EH1 CH AH0 P P L EY1 S IH1 T N AY1 ER2 ER1 S OW1 F AH0 K EY1,Move ( Visitor_Room ) Grasp ( filled_ketchup ) Move ( Dining_Sofa ) Place ( filled_ketchup Dining_Sofa )
Go to kitchen then find a person neayby bring filled_ketchup from Kitchen_Table .,G OW1 T UW1 K IH1 CH AH0 N DH EH1 N F AY1 N D AH0 P ER1 S AH0 N N IH1 R B AY1 B R IH1 NG F IH1 L D K EH1 CH AH0 P F R AH1 M K IH1 CH AH0 N T EY1 B AH0 L,G OW1 T TH UW1 K EY2 CH ER1 AH0 AE1 DH EH1 N F AY1 N D AH0 P ER1 S AH0 N N IH1 R B AY1 B R IH1 NG F IH1 L ER D K EH1 AY1 CH AH0 P UW R UW K IH1 CH AH0 N T EY1 B AH0 L,Move ( kitchen ) Find ( person kitchen ) Move ( Kitchen_Table ) Grasp ( filled_ketchup )
Go to Living_Room  move to Living_Table  finally leave the apartment .,G OW1 T UW1 L IH1 V IH0 NG R UW1 M M UW1 V T UW1 L IH1 V IH0 NG T EY1 B AH0 L F AY1 N AH0 L IY0 L IY1 V DH AH0 AH0 P AA1 R T M AH0 N T,OW1 T UW1 L IH1 V IH0 NG R AY M M UW1 V T UW1 L IH1 V IH0 NG T EY1 B AH0 L F AY1 N AH0 L IY0 L IY1 V DH AH0 AA1 R T M AH0 N T,Move ( Living_Room ) Move ( Living_Table )  Move ( apartment )
Well go to Dining_Table  take Cup_Noodle finally come back .,W EH1 L G OW1 T UW1 D AY1 N IH0 NG T EY1 B AH0 L T EY1 K K AH1 P N UW1 D AH0 L F AY1 N AH0 L IY0 K AH1 M B AE1 K,W EH1 L G OW1 T UW1 D AY1 N IH0 NG T EY1 B EH2 L T AY0 K K AH1 P N UW1 D AH0 L F AY1 N AH0 AH2 L IY0 K AH1 M B AE1 K,Move ( Dining_Table ) Grasp ( Cup_Noodle ) Move ( HERE )
Go to Living_Room go to Dining_Table  and exit from bed_room .,G OW1 T UW1 L IH1 V IH0 NG R UW1 M G OW1 T UW1 D AY1 N IH0 NG T EY1 B AH0 L AH0 N D EH1 G Z IH0 T F R AH1 M B EH1 D R UW1 M,G OW1 T UW1 L IH1 V IH0 HH R UW1 M G Y OW1 T UW1 D AY1 N IH0 NG T EY1 B AH0 L AH0 N D EH1 G Z IH0 T F R AH1 M B EH1 D R UW1 IH1 M,Move ( Living_Room ) Move ( Dining_Table ) Move ( bed_room )
Move to Living_Sofa  next detect Cup_Star  get it .,M UW1 V T UW1 L IH1 V IH0 NG S OW1 F AH0 N EH1 K S T D IH0 T EH1 K T K AH1 P S T AA1 R G EH1 T IH1 T,M UW1 V T UW1 L AY1 N V IH0 NG S OW1 F AH0 N EH1 K DH D IH0 EH1 K K AH1 P AH2 S AY1 T AA1 R G EH1 T IH1 ER1 T,Move ( Living_Sofa ) Find ( Cup_Star Living_Sofa ) Grasp ( Cup_Star )
Go to Kitchen_Room  go to Dining_Sofa then exit the apartment .,G OW1 T UW1 K IH1 CH AH0 N R UW1 M G OW1 T UW1 D AY1 N IH0 NG S OW1 F AH0 DH EH1 N EH1 G Z IH0 T DH AH0 AH0 P AA1 R T M AH0 N T,G OW1 T UW1 IH1 CH AH0 N R UW1 M G OW1 UW1 D AY1 N IH0 NG S OW1 F AH0 DH EH1 N EH1 G UH Z IH0 T DH AH0 AH0 P OY0 AA1 R T M AH0 N ER0 T,Move ( Kitchen_Room ) Move ( Dining_Sofa )  Move ( apartment )
Would you go to Side_Table get cubic_clock carry it to Dining_Table .,W UH1 D Y UW1 G OW1 T UW1 S AY1 D T EY1 B AH0 L G EH1 T K Y UW1 B IH0 K K L AA1 K K AE1 R IY0 IH1 T T UW1 D AY1 N IH0 NG T EY1 B AH0 L,W UH1 D AE UW1 G OW1 UW1 S AY1 D T EY1 B AH0 L EH1 K ZH Y UW1 B IH0 K K L AA1 K K AY0 UW0 R IY0 IH1 T T UW1 D N IH0 NG T EY1 UW1 B AH0 L,Move (  Side_Table ) Find ( cubic_clock Side_Table  ) Grasp ( cubic_clock )  Move ( Dining_Table )
Can you go to Kitchen_Table take Japanese_Dressing carry it to Reception_Table .,K AE1 N Y UW1 G OW1 T UW1 K IH1 CH AH0 N T EY1 B AH0 L T EY1 K JH AE2 P AH0 N IY1 Z D R EH1 S IH0 NG K AE1 R IY0 IH1 T T UW1 R IH0 S EH1 P SH AH0 N T EY1 B AH0 L,K IH0 N Y AW UW1 G OW1 T UW1 K CH UH0 AH0 N T EY1 B AH0 L EY1 UW0 EY1 JH AE2 P AH0 N IY1 Z D R EH1 S IH0 NG K AE1 IH1 T T UW1 IH0 S EH1 P SH AH0 N T AO1 EY1 B AH0,Move ( Kitchen_Table  ) Find ( Japanese_Dressing Kitchen_Table ) Grasp ( Japanese_Dressing ) Move ( Reception_Table )
Go to lobby  move to Kitchen_Table  then leave the apartment .,G OW1 T UW1 L AA1 B IY0 M UW1 V T UW1 K IH1 CH AH0 N T EY1 B AH0 L DH EH1 N L IY1 V DH AH0 AH0 P AA1 R T M AH0 N T,G OW1 T UW1 L AE0 AA1 B IY0 M UW1 T UW1 K IH1 CH AH0 N T EY1 B AH0 L DH EH1 N L IY1 V DH AH0 AH0 P R HH M AH0 N T,Move ( lobby ) Move ( Kitchen_Table ) Move ( apartment )
Would you go to Kitchen_Table get soysauce carry it to Living_Sofa .,W UH1 D Y UW1 G OW1 T UW1 K IH1 CH AH0 N T EY1 B AH0 L G EH1 T S OY1 S AO2 S K AE1 R IY0 IH1 T T UW1 L IH1 V IH0 NG S OW1 F AH0,W UH1 D Y UW1 G AY T UW1 K EY2 IH1 CH AH0 AY0 N T EY1 B AH0 G EH1 T S OY1 S AO2 S K IY0 IH1 T T UW1 L IH1 V IH0 NG S OW1 F AH0,Move (  Kitchen_Table ) Find ( soysauce Kitchen_Table  ) Grasp ( soysauce )  Move ( Living_Sofa )
Go to Sofa get Red_Potato  exit from Kitchen_Room okay .,G OW1 T UW1 S OW1 F AH0 G EH1 T R EH1 D P AH0 T EY1 T OW2 EH1 G Z IH0 T F R AH1 M K IH1 CH AH0 N R UW1 M OW2 K EY1,G OW1 T S F AH0 G EH1 T R EH1 D P AH0 T EY1 T EH1 G Z IH0 F R M K AY TH CH N R UW1 M OW2 K OW0,Move (  Sofa  ) Find ( Red_Potato Sofa  ) Grasp ( Red_Potato ) Move ( Kitchen_Room )
Move to Kitchen_Table get toy_duck place it on Dining_Table okay .,M UW1 V T UW1 K IH1 CH AH0 N T EY1 B AH0 L G EH1 T T OY1 D AH1 K P L EY1 S IH1 T AA1 N D AY1 N IH0 NG T EY1 B AH0 L OW2 K EY1,M OW0 UW1 V T UW1 UH K CH AH0 N T EY1 B AH0 L G EH1 T T OY1 D AH1 K P L EY1 IH1 T AA1 N D AY1 N IH0 NG AW2 T EY1 AH0 L OW2 K EY1,Move ( Kitchen_Table ) Find ( toy_duck Kitchen_Table  ) Grasp ( toy_duck )  Move ( Dining_Table ) Place ( toy_duck Kitchen_Table )
Go to Corridor get salt throw it into Dustbin please .,G OW1 T UW1 K AO1 R AH0 D ER0 G EH1 T S AO1 L T TH R OW1 IH1 T IH1 N T UW0 D AH1 S T B IH0 N P L IY1 Z,G OW1 T UW1 IY1 AO1 R F D ER0 G EH1 T S AO1 T TH R OW1 IH1 T IH1 N T D AH1 S AW2 OW B IH0 N P L EY2 Z,Move ( Corridor ) Find ( salt Corridor ) Grasp ( salt ) Move ( Dustbin ) Place ( salt Dustbin )
Would you go to Dining_Room Grasp empty_plastic_bottle er come back .,W UH1 D Y UW1 G OW1 T UW1 D AY1 N IH0 NG R UW1 M G R AE1 S P EH1 M P T IY0 P L AE1 S T IH0 K B AA1 T AH0 L ER0 K AH1 M B AE1 K,W UH1 D Y UW1 G OW1 T UW1 D AY1 N IH0 R UW1 M G R AE1 S P EH1 M P T IY0 P L AE1 S T IH0 K B AA0 K T AH0 OY L IH1 K G AY2 AE1 K,Move ( Dining_Room ) Find ( empty_plastic_bottle Dining_Room ) Move ( HERE )
Go to Corridor next find a person neayby get Cloth_Cleaner from Kitchen_Table .,G OW1 T UW1 K AO1 R AH0 D ER0 N EH1 K S T F AY1 N D AH0 P ER1 S AH0 N N IH1 R B AY1 G EH1 T K L AO1 TH K L IY1 N ER0 F R AH1 M K IH1 CH AH0 N T EY1 B AH0 L,G OW1 T UW1 K AO1 R AH0 D ER0 N EH1 K S T F N D AH0 P ER1 S AH0 N N IH1 R B AY1 G EH1 T K L AO1 TH L N ER0 F R AH1 M K IH1 CH AH0 N T EY1 B AH0 L,Move ( Corridor ) Find ( person ) Move ( Kitchen_Table ) Grasp ( Cloth_Cleaner )
Well get Cup_Noodle from Dining_Sofa go to kitchen move to Sofa .,W EH1 L G EH1 T K AH1 P N UW1 D AH0 L F R AH1 M D AY1 N IH0 NG S OW1 F AH0 G OW1 T UW1 K IH1 CH AH0 N M UW1 V T UW1 S OW1 F AH0,W IH1 EH1 G EH1 T UH K AH1 P UW1 D OY1 L F R AH1 AA AY1 D IH0 NG S OW1 F UH OW1 T UW1 K IH1 CH AO2 M UW1 V T UW1 S OW1 F AH0,Move ( Dining_Sofa ) Grasp ( Cup_Noodle ) Move ( kitchen ) Move ( Sofa )
Go to bed_room take filled_plastic_bottle place it on Dining_Table okay .,G OW1 T UW1 B EH1 D R UW1 M T EY1 K F IH1 L D P L AE1 S T IH0 K B AA1 T AH0 L P L EY1 S IH1 T AA1 N D AY1 N IH0 NG T EY1 B AH0 L OW2 K EY1,G OW1 T UW1 B EH1 D UW1 M T EY1 K F IH1 L D P L AE1 S T OY2 K B AA1 T AH0 AO0 L P L EY1 IH1 T AA1 AW1 N D AY1 N IH0 NG T EY1 B IH2 AH0 L OW2 K EY1,Move (  bed_room  ) Find ( filled_plastic_bottle bed_room ) Grasp ( filled_plastic_bottle ) Move ( Dining_Table )
Go to Sofa move to Dining_Table  then leave the apartment .,G OW1 T UW1 S OW1 F AH0 M UW1 V T UW1 D AY1 N IH0 NG T EY1 B AH0 L DH EH1 N L IY1 V DH AH0 AH0 P AA1 R T M AH0 N T,G T UW1 S OW1 OY2 AH0 M UW1 V T UW1 D AY1 N IH0 NG T EY1 B AH0 ER L DH EH1 CH N IY1 V DH AH0 AH0 P AA1 R T M AH0 N T,Move ( Sofa ) Move ( Dining_Table ) Move ( apartment )
Go to kitchen  go to Side_Table er leave the apartment .,G OW1 T UW1 K IH1 CH AH0 N G OW1 T UW1 S AY1 D T EY1 B AH0 L ER0 L IY1 V DH AH0 AH0 P AA1 R T M AH0 N T,G ZH OW1 UH2 AE UW1 K IH1 CH AH0 N G IY0 OW1 T UW1 S AY1 D T EY1 B AH0 L ER0 L IY1 V DH AH0 AH0 P AA1 R T M AH0 N T,Move ( kitchen ) Move ( Side_Table )  Move ( apartment )
Go to Visitor_Room  go to Bar then exit the apartment .,G OW1 T UW1 V IH1 Z IH0 T ER0 R UW1 M G OW1 T UW1 B AA1 R DH EH1 N EH1 G Z IH0 T DH AH0 AH0 P AA1 R T M AH0 N T,P UH G OW1 T UW1 V IH1 Z IH0 T IY1 ER0 R M G OW1 T UW1 B AA1 R DH EH1 N EH1 Z IH0 T DH AH0 AH0 P OW0 R T M AH0 N T,Move ( Visitor_Room ) Move ( Bar )  Move ( apartment )
Move to Kitchen_Table  next detect Korean_Soup  get it .,M UW1 V T UW1 K IH1 CH AH0 N T EY1 B AH0 L N EH1 K S T D IH0 T EH1 K T K AO2 R IY1 AH0 N S UW1 P G EH1 T IH1 T,ER M UW1 EY V T UW1 K IH1 CH AH0 N T V AH0 Z N EH1 AW2 K S T D IH0 ER2 T EH1 K T K DH AO2 R IY1 AH0 N S IY2 AW0 P G UH0 T IH1 T,Move ( Kitchen_Table ) Find ( Korean_Soup Kitchen_Table ) Grasp ( Korean_Soup )
Would you go to Dining_Room Grasp Chip_Star finally come back .,W UH1 D Y UW1 G OW1 T UW1 D AY1 N IH0 NG R UW1 M G R AE1 S P CH IH1 P S T AA1 R F AY1 N AH0 L IY0 K AH1 M B AE1 K,W UH1 D Y UW1 G OW1 T UW1 D AY1 N NG R UW1 M G R AE1 S P IH1 P S T AA1 R F AY1 N AH0 L IY0 K AH1 M B AE1 K,Move ( Dining_Room ) Find ( Chip_Star Dining_Room ) Grasp ( Chip_Star )  Move ( HERE )
Go to kitchen and find a person neayby bring Cloth_Cleaner from Side_Table .,G OW1 T UW1 K IH1 CH AH0 N AH0 N D F AY1 N D AH0 P ER1 S AH0 N N IH1 R B AY1 B R IH1 NG K L AO1 TH K L IY1 N ER0 F R AH1 M S AY1 D T EY1 B AH0 L,G T UW1 K IH1 CH AH0 IH AH0 N D F AY1 D AH0 P ER1 S AH0 N N IH1 R B JH AY1 B R IH1 NG K L AO1 TH K L IY1 ER0 F EY K R HH AH1 S AY1 D T EY1 B AH0 L,Move ( kitchen ) Find ( person kitchen ) Move ( Side_Table ) Grasp ( Cloth_Cleaner )  Move ( person )
Go to Bar  and  detect canned_juice Grasp it .,G OW1 T UW1 B AA1 R AH0 N D D IH0 T EH1 K T K AE1 N D JH UW1 S G R AE1 S P IH1 T,G OW1 T UW1 B AA1 R AH0 N D D IH0 T UH EH1 K T K AE1 N D JH UW1 S T G AE1 S P IH1 T,Move (  Bar  ) Find ( canned_juice Bar  ) Grasp ( canned_juice ) 
Go to bed_room get soysauce throw it into Dustbin please .,G OW1 T UW1 B EH1 D R UW1 M G EH1 T S OY1 S AO2 S TH R OW1 IH1 T IH1 N T UW0 D AH1 S T B IH0 N P L IY1 Z,UW0 OW1 T AH B AA1 EH1 D R UW1 M G EH1 T AW1 OY1 S AO2 S TH R OW1 IH1 T IH1 N T UW0 D AH1 S T B IH0 N P L IY1 Z,Move ( bed_room ) Find ( soysauce bed_room ) Grasp ( soysauce ) Move ( Dustbin ) Place ( soysauce Dustbin )
Can you bring Japanese_Dressing from Living_Table go to Living_Room move to Kitchen_Table .,K AE1 N Y UW1 B R IH1 NG JH AE2 P AH0 N IY1 Z D R EH1 S IH0 NG F R AH1 M L IH1 V IH0 NG T EY1 B AH0 L G OW1 T UW1 L IH1 V IH0 NG R UW1 M M UW1 V T UW1 K IH1 CH AH0 N T EY1 B AH0 L,K AE1 N Y UW1 B AH IH1 NG JH D AE2 AH2 P AH0 N IY1 Z D R EH1 S IH0 NG F R AH1 M L IH1 V IH0 NG T EY1 B AH0 L G OW1 T UW1 L IH1 V IH0 NG R UW1 AH1 M UW1 V T UW1 K IH1 CH AH0 N T EY1 B AH0 L,Move ( Living_Table ) Find ( Japanese_Dressing Living_Table  ) Grasp ( Japanese_Dressing ) Move ( Living_Room ) ( Kitchen_Table )
Go to Dining_Room  move to Side_Table  finally leave the apartment .,G OW1 T UW1 D AY1 N IH0 NG R UW1 M M UW1 V T UW1 S AY1 D T EY1 B AH0 L F AY1 N AH0 L IY0 L IY1 V DH AH0 AH0 P AA1 R T M AH0 N T,G OW1 T UW1 D AY1 N IH0 NG R UW1 M M UW1 V T UW1 S D T EY1 B AH0 L F AY1 N AH0 L IY0 HH IY1 V DH AH0 AH0 P AA1 R T AH0 AY T,Move ( Dining_Room ) Move ( Side_Table )  Move ( apartment )
Would you go to Living_Table take Green_Tea er come back .,W UH1 D Y UW1 G OW1 T UW1 L IH1 V IH0 NG T EY1 B AH0 L T EY1 K G R IY1 N T IY1 ER0 K AH1 M B AE1 K,W UH1 D SH Y UW1 G OW1 T UW1 L IH1 V IH0 NG T EY1 B AH0 L T EY1 K G R IY1 N T IY1 ER0 K OW1 AH1 M B AE1 K,Move ( Living_Table ) Find ( Green_Tea Living_Table ) Grasp ( Green_Tea ) Move ( HERE )
Would you go to Kitchen_Table take bear_doll er come back .,W UH1 D Y UW1 G OW1 T UW1 K IH1 CH AH0 N T EY1 B AH0 L T EY1 K B EH1 R D AA1 L ER0 K AH1 M B AE1 K,W UH1 D Y UW1 G OW1 T UW1 K IH1 CH AH0 N T EY1 B AH0 L T EY1 IH0 B EH1 R D UH L ER0 K AH1 M B AH2 K,Move ( Kitchen_Table ) Find ( bear_doll Kitchen_Table ) Grasp ( bear_doll ) Move ( HERE )
Go to bed_room then find a person neayby bring Brown_Tea from Dining_Sofa .,G OW1 T UW1 B EH1 D R UW1 M DH EH1 N F AY1 N D AH0 P ER1 S AH0 N N IH1 R B AY1 B R IH1 NG B R AW1 N T IY1 F R AH1 M D AY1 N IH0 NG S OW1 F AH0,G OW1 T UW1 B EH1 D R UW1 M DH EH1 N F AY1 N D AH0 JH ER1 S AH0 N N IH1 R B AY1 B R IH1 NG B R AW1 N T IY1 AH1 M D AY1 N IH0 NG S OW1 F AH0,Move ( bed_room ) Find ( person bed_room ) Move ( Dining_Sofa ) Grasp ( Brown_Tea )
Go to Corridor  go to Living_Table then exit the apartment .,G OW1 T UW1 K AO1 R AH0 D ER0 G OW1 T UW1 L IH1 V IH0 NG T EY1 B AH0 L DH EH1 N EH1 G Z IH0 T DH AH0 AH0 P AA1 R T M AH0 N T,G OW1 T UW1 Z AO1 R AH0 M D ER0 G OW1 OY T UW1 L IH1 V IH0 NG T EY1 B AH0 L DH EH1 N EH1 G Z IH0 T AH0 OY0 G P AA1 R T M AH0 N T,Move ( Corridor ) Move ( Living_Table )  Move ( apartment )
Can you go to Living_Room Grasp Cup_Noodle  bring it to Sofa .,K AE1 N Y UW1 G OW1 T UW1 L IH1 V IH0 NG R UW1 M G R AE1 S P K AH1 P N UW1 D AH0 L B R IH1 NG IH1 T T UW1 S OW1 F AH0,K AE1 N Y UW1 OW1 T UW1 L IH1 V IH0 NG R UW1 M G R AE1 S P K AH1 P N UW1 D AH0 L B OY0 IH1 N NG IH1 T T UW1 EY0 OW1 F AH0,Move ( Living_Room ) Find ( Cup_Noodle Living_Room ) Grasp ( Cup_Noodle ) Move ( Sofa )  Find ( Cup_Noodle Sofa ) Grasp ( Cup_Noodle ) Move ( Living_Room )
Go to Sofa move to Living_Table take Onion_Dressing .,G OW1 T UW1 S OW1 F AH0 M UW1 V T UW1 L IH1 V IH0 NG T EY1 B AH0 L T EY1 K AH1 N Y AH0 N D R EH1 S IH0 NG,G OW1 T UW1 S OW1 F AH0 M UW1 V T UW1 L IH1 V IH0 NG OY2 EY1 B AH0 L T EY1 UW0 AH1 NG Y AH0 N R EH1 S IH0 NG,Move ( Sofa ) Move ( Living_Table ) Find ( Onion_Dressing Sofa ) Grasp ( Onion_Dressing ) Move ( HERE )
Go to kitchen next find rubik's_cube take it .,G OW1 T UW1 K IH1 CH AH0 N N EH1 K S T F AY1 N D R UW1 B IH0 K S K Y UW1 B T EY1 K IH1 T,G T UW1 K IH1 CH AH0 AW1 N N EH1 K S T F AY1 OY0 N D R TH AH2 UW1 EH0 B IH0 K S K Y AY1 T EY1 K IH1 T,Move (  kitchen  ) Find ( rubik's_cube kitchen  ) Grasp ( rubik's_cube ) 
Move to Dining_Table  next detect apple  get it .,M UW1 V T UW1 D AY1 N IH0 NG T EY1 B AH0 L N EH1 K S T D IH0 T EH1 K T AE1 P AH0 L G EH1 T IH1 T,M UW1 V T UW1 D AY1 N NG T EY1 B AH0 L N EH1 K S T D IH0 T EH1 K T AE1 P L G IY EH1 OY0 T IH1 T,Move ( Dining_Table ) Find ( apple Dining_Table ) Grasp ( apple )
Go to kitchen Grasp Brown_Tea place it on Dining_Table okay .,G OW1 T UW1 K IH1 CH AH0 N G R AE1 S P B R AW1 N T IY1 P L EY1 S IH1 T AA1 N D AY1 N IH0 NG T EY1 B AH0 L OW2 K EY1,G OW1 T UW1 EH K IH1 CH AH0 N G R AE1 S P R AW1 N T IY1 OY0 P L EY1 S IH1 T AA1 N D UW N IH0 NG T EY1 B AH0 L AO K EY1,Move ( kitchen ) Grasp ( Brown_Tea ) Move ( Dining_Table ) Place ( Brown_Tea Dining_Table )
Would you go to Dining_Sofa get Bleach carry it to Sofa .,W UH1 D Y UW1 G OW1 T UW1 D AY1 N IH0 NG S OW1 F AH0 G EH1 T B L IY1 CH K AE1 R IY0 IH1 T T UW1 S OW1 F AH0,W UH1 D Y UW1 G OW1 T UW1 D AY1 N IH0 NG S OW1 F AH0 G B L IY1 CH K AE1 R IY0 IH1 T T UW1 S OW1 F AH0,Move (  Dining_Sofa ) Find ( Bleach Dining_Sofa  ) Grasp ( Bleach )  Move ( Sofa )
Go to bed_room  go to Kitchen_Table er leave the apartment .,G OW1 T UW1 B EH1 D R UW1 M G OW1 T UW1 K IH1 CH AH0 N T EY1 B AH0 L ER0 L IY1 V DH AH0 AH0 P AA1 R T M AH0 N T,G OW1 AA0 UW1 B AO EH1 D R UW1 M G OW1 T UW1 K CH AH0 T T EY1 EH0 B AH0 L ER0 EH1 L IY1 V DH AH0 AH0 P AA1 R T M AH0 N T,Move ( bed_room ) Move ( Kitchen_Table )  Move ( apartment )
Go to Dining_Room er find a person neayby bring Cup_Star from Bar .,G OW1 T UW1 D AY1 N IH0 NG R UW1 M ER0 F AY1 N D AH0 P ER1 S AH0 N N IH1 R B AY1 B R IH1 NG K AH1 P S T AA1 R F R AH1 M B AA1 R,TH OW1 UW1 D AY1 N IH0 R UW1 M ER0 F AY1 N D P ER1 S AH0 N ZH IH1 R B AY1 B R IH1 K UW0 P S T AA1 R F R AH1 M B AA1 IH,Move ( Dining_Room ) Find ( person Dining_Room ) Move ( Bar ) Grasp ( Cup_Star )
