Input,phonemelabel,Noisylabel,Labeldata
Go to Kitchen_Table take Orange_Juice put it on Living_Sofa please .,G OW1 T UW1 K IH1 CH AH0 N T EY1 B AH0 L T EY1 K AO1 R AH0 N JH JH UW1 S P UH1 T IH1 T AA1 N L IH1 V IH0 NG S OW1 F AH0 P L IY1 Z,G T UW1 K IH1 AY1 AH0 N T EY1 B AH0 L AO0 T EY1 K AO1 R AH0 N JH UW1 OW1 P UH1 T IH1 T L IH1 V IH0 NG S F AH0 TH T L IY1 Z,Move (  Kitchen_Table  ) Find ( Orange_Juice Kitchen_Table  ) Grasp ( Orange_Juice ) Plcae ( Orange_Juice Living_Sofa )
Can you go to bed_room get Bath_Cleaner then come back .,K AE1 N Y UW1 G OW1 T UW1 B EH1 D R UW1 M G EH1 T B AE1 TH K L IY1 N ER0 DH EH1 N K AH1 M B AE1 K,K AE1 N N Y UW1 G OW1 AA2 B D R UW1 M G EH1 HH T Y B AE1 K L IY1 N ER0 DH EH1 N K IY M B AE1 K,Move (  bed_room  ) Find ( Bath_Cleaner bed_room ) Grasp ( Bath_Cleaner ) Move ( HERE )
Well go to Living_Table  take toy_car finally come back .,W EH1 L G OW1 T UW1 L IH1 V IH0 NG T EY1 B AH0 L T EY1 K T OY1 K AA1 R F AY1 N AH0 L IY0 K AH1 M B AE1 K,W OW L G OW1 UW1 L IH1 V IH0 NG EY1 OY1 B AH0 L T EY1 K T OY1 K V R AY1 N AH0 L IY0 K AH1 B AE1 K,Move ( Living_Table ) Grasp ( toy_car ) Move ( HERE )
Well get camera from Kitchen_Table go to kitchen go to Visitor_Room .,W EH1 L G EH1 T K AE1 M ER0 AH0 F R AH1 M K IH1 CH AH0 N T EY1 B AH0 L G OW1 T UW1 K IH1 CH AH0 N G OW1 T UW1 V IH1 Z IH0 T ER0 R UW1 M,W EH1 L G T K AE1 M ER0 EY2 F R AH1 M K IH1 CH AH0 N T EY1 AH0 L G OW1 T UW1 K IH1 CH EH1 AH0 N G OW1 T UW1 V IH1 Z IH0 ER0 R UW1 M,Move ( Kitchen_Table ) Find ( camera Kitchen_Table  ) Grasp ( camera )  Move ( kitchen ) Move ( Visitor_Room )
Would you bring soysauce from Dining_Sofa go to Living_Table go to Sofa  .,W UH1 D Y UW1 B R IH1 NG S OY1 S AO2 S F R AH1 M D AY1 N IH0 NG S OW1 F AH0 G OW1 T UW1 L IH1 V IH0 NG T EY1 B AH0 L G OW1 T UW1 S OW1 F AH0,W UH1 D Y DH B R IH1 NG S OY1 S AO2 S F R M AY1 N IH0 S OW1 AH0 G OW1 T UW1 L IH1 V IH0 TH T EH2 EY1 B AH0 L AE G OW1 T UW1 S OW1 F AH0,Move ( Dining_Sofa ) Place ( soysauce Dining_Sofa ) Move ( Living_Table ) Move ( Living_Table ) 
Would you move to Bar get camera bring it to Kitchen_Table .,W UH1 D Y UW1 M UW1 V T UW1 B AA1 R G EH1 T K AE1 M ER0 AH0 B R IH1 NG IH1 T T UW1 K IH1 CH AH0 N T EY1 B AH0 L,W UH1 D Y UW1 M UW1 V T UW1 B AA1 R G EH1 T K AE1 M ER0 AH0 B R IH1 NG IH1 T T D K IH1 EH ZH CH AH0 N T EY1 B AH0 L,Move ( Bar ) Find ( camera Bar  ) Grasp ( camera ) Move ( Kitchen_Table )
Can you go to Living_Table take canned_juice carry it to Sofa .,K AE1 N Y UW1 G OW1 T UW1 L IH1 V IH0 NG T EY1 B AH0 L T EY1 K K AE1 N D JH UW1 S K AE1 R IY0 IH1 T T UW1 S OW1 F AH0,K AE1 N Y UW1 G OW1 IH T UW1 L AH1 IH1 IH0 NG T EY1 B AH0 L T EY1 K K AE1 N D JH UW1 S K AE1 R IY0 IH1 T T UW1 S OW1 F AH0,Move ( Living_Table  ) Find ( canned_juice Living_Table ) Grasp ( canned_juice ) Move ( Sofa )
Would you bring bell_pepper from Reception_Table move to Bar go to Living_Room .,W UH1 D Y UW1 B R IH1 NG B EH1 L P EH1 P ER0 F R AH1 M R IH0 S EH1 P SH AH0 N T EY1 B AH0 L M UW1 V T UW1 B AA1 R G OW1 T UW1 L IH1 V IH0 NG R UW1 M,W UH1 AW1 D Y UW1 AH0 B R JH IH1 NG B EH1 L P AH2 EH1 P ER0 F R AH1 M R IH0 S EH1 P SH AH0 N T EY1 B AH0 L M UW1 K T UW1 B R G EY T UW1 UW IH1 V IH0 NG R UW1 M,Move ( Reception_Table ) Find ( bell_pepper Reception_Table ) Move ( Bar ) Move ( Living_Room )
Go to Living_Table find a person neayby finally follow a person .,G OW1 T UW1 L IH1 V IH0 NG T EY1 B AH0 L F AY1 N D AH0 P ER1 S AH0 N N IH1 R B AY1 F AY1 N AH0 L IY0 F AA1 L OW0 AH0 P ER1 S AH0 N,G AY2 OW1 T UW1 L IH1 K V IH0 NG T B AH0 L F AY1 N AO1 D AH0 P ER1 F S AH0 N IH1 R B F AY1 AH0 L IY0 F AA1 L OW0 AH0 P ER1 S AH0 N,Move ( Living_Table ) Find ( person Living_Table  ) Follow ( person )
Well go to Living_Sofa  take Red_Potato finally come back .,W EH1 L G OW1 T UW1 L IH1 V IH0 NG S OW1 F AH0 T EY1 K R EH1 D P AH0 T EY1 T OW2 F AY1 N AH0 L IY0 K AH1 M B AE1 K,W EH1 AA G OW1 T UW1 L IH1 IH0 NG S OW1 F AH0 T EY1 K R IY D P AH0 T EY1 T OW2 F AY1 P N AH0 L IY0 K AH1 M B AE1 K,Move ( Living_Sofa ) Grasp ( Red_Potato ) Move ( HERE )
Go to lobby  find a person neayby  finally follow a person .,G OW1 T UW1 L AA1 B IY0 F AY1 N D AH0 P ER1 S AH0 N N IH1 R B AY1 F AY1 N AH0 L IY0 F AA1 L OW0 AH0 P ER1 S AH0 N,G AY1 T UW1 L AA1 B IY0 F AY1 N D AH0 P ER1 S AH0 N N NG IH1 R B AY1 F AY1 N AH0 L UW1 AA1 L OW0 AH0 M ER1 UW2 AH0 N,Move ( lobby ) Find ( person lobby ) Follow ( person )
Would you move to Side_Table Grasp apple and come back .,W UH1 D Y UW1 M UW1 V T UW1 S AY1 D T EY1 B AH0 L G R AE1 S P AE1 P AH0 L AH0 N D K AH1 M B AE1 K,W UH1 Y UW1 M UW1 V T UW1 S AY1 D T EY1 B AH0 L G AE1 S P AE1 P AH0 L AH0 EY UW AO0 K AH1 M B AE1 K,Move ( Side_Table ) Grasp ( apple ) Move ( HERE )
Would you go to Kitchen_Room Grasp empty_ketchup er come back .,W UH1 D Y UW1 G OW1 T UW1 K IH1 CH AH0 N R UW1 M G R AE1 S P EH1 M P T IY0 K EH1 CH AH0 P ER0 K AH1 M B AE1 K,W IY UH1 D Y UW1 G OW1 T UW1 K IH1 CH W AH0 R UW1 M G R AE1 S P EH1 M P T ZH K EH1 CH OY1 AH0 P ER0 K CH AH1 M B AE1 W K,Move ( Kitchen_Room ) Find ( empty_ketchup Kitchen_Room ) Move ( HERE )
Go to Living_Room get Long_Potato throw it into Dustbin please .,G OW1 T UW1 L IH1 V IH0 NG R UW1 M G EH1 T L AO1 NG P AH0 T EY1 T OW2 TH R OW1 IH1 T IH1 N T UW0 D AH1 S T B IH0 N P L IY1 Z,G T UW1 L IH1 V F NG R UW1 M G EH1 T L AO1 NG P EY0 T AH0 T IH EY1 T EY0 TH R OW1 IH1 AW2 T IH1 N T UW0 D AH1 S T IH0 N P L IY1 Z,Move ( Living_Room ) Find ( Long_Potato Living_Room ) Grasp ( Long_Potato ) Move ( Dustbin ) Place ( Long_Potato Dustbin )
Go to Dining_Room  go to Living_Table then exit the apartment .,G OW1 T UW1 D AY1 N IH0 NG R UW1 M G OW1 T UW1 L IH1 V IH0 NG T EY1 B AH0 L DH EH1 N EH1 G Z IH0 T DH AH0 AH0 P AA1 R T M AH0 N T,G OW1 T UW1 D AY1 N NG R UW1 M G OW1 T AA UW1 L IH1 V IH0 NG F T EY1 B F AH0 L DH N EH1 G Z T DH AH0 AH0 P AA1 R T M AH0 AE0 T,Move ( Dining_Room ) Move ( Living_Table )  Move ( apartment )
Go to Corridor Grasp pink_cup throw it into Dustbin please .,G OW1 T UW1 K AO1 R AH0 D ER0 G R AE1 S P P IH1 NG K K AH1 P TH R OW1 IH1 T IH1 N T UW0 D AH1 S T B IH0 N P L IY1 Z,AE1 OW1 T UW1 K AO1 R AH0 D ER0 G R AE1 S P P IH1 NG K K AH1 P TH R OW1 IH1 T IY IH1 N T UW0 D AH1 S T B IH0 N P L IY1 Z,Move ( Corridor ) Grasp ( pink_cup ) Move ( Dustbin ) Place ( pink_cup Dustbin  ) 
Move to Living_Table  go to Kitchen_Table then exit the apartment .,M UW1 V T UW1 L IH1 V IH0 NG T EY1 B AH0 L G OW1 T UW1 K IH1 CH AH0 N T EY1 B AH0 L DH EH1 N EH1 G Z IH0 T DH AH0 AH0 P AA1 R T M AH0 N T,M UW1 V T UW1 L IH1 AW0 V IH0 NG T EY1 B AH0 L G OW1 T UW1 L IH1 CH AH0 N T EY1 B ER1 L DH EH1 N EH1 G Z IH0 T DH AH0 AH0 P AA1 T M AH0 N T,Move ( Living_Table ) Move ( Kitchen_Table ) Move ( apartment )
Go to Corridor Grasp Stick_Potato place it on Dining_Sofa okay .,G OW1 T UW1 K AO1 R AH0 D ER0 G R AE1 S P S T IH1 K P AH0 T EY1 T OW2 P L EY1 S IH1 T AA1 N D AY1 N IH0 NG S OW1 F AH0 OW2 K EY1,G OW1 T K AO1 R AH0 D ER0 G R AE1 S P S T K P AH0 T EY1 OW2 P L EY1 S T AA1 N D AY1 N IH0 NG S OW1 F AH0 OW2 K EY1,Move ( Corridor ) Grasp ( Stick_Potato ) Move ( Dining_Sofa ) Place ( Stick_Potato Dining_Sofa )
Move to Dining_Table find a person neayby then follow a person .,M UW1 V T UW1 D AY1 N IH0 NG T EY1 B AH0 L F AY1 N D AH0 P ER1 S AH0 N N IH1 R B AY1 DH EH1 N F AA1 L OW0 AH0 P ER1 S AH0 N,M UW1 V T UW1 D AY1 N IH0 NG T EY1 B AH0 L F AY1 N D IH2 AH0 P ER1 S AH0 N N IH1 R B AY1 DH EH1 N F AA1 L OW0 AH0 P S AH0 N,Move (  Dining_Table  ) Find ( person Dining_Table  ) Follow ( pesron )
Well go to Side_Table  take rabbit_doll  bring it to Dining_Sofa .,W EH1 L G OW1 T UW1 S AY1 D T EY1 B AH0 L T EY1 K R AE1 B AH0 T D AA1 L B R IH1 NG IH1 T T UW1 D AY1 N IH0 NG S OW1 F AH0,AY2 W EH1 OW0 L G OW1 T UW1 S AY1 D T EY1 B AH0 L T EY1 K R AE1 B AH0 T D AA1 AE1 L B R IH1 NG IH1 UW0 T UW1 AY1 Y DH N IH0 NG S OW1 F AH0,Move (  Side_Table ) Find ( rabbit_doll Side_Table  ) Grasp ( rabbit_doll )  Move ( Dining_Sofa )
Go to Living_Sofa find a person neayby finally follow a person .,G OW1 T UW1 L IH1 V IH0 NG S OW1 F AH0 F AY1 N D AH0 P ER1 S AH0 N N IH1 R B AY1 F AY1 N AH0 L IY0 F AA1 L OW0 AH0 P ER1 S AH0 N,G OW1 OY0 T UW1 SH L AO1 UH1 IH0 S OW1 F AH0 F AY1 N AH0 AW0 P ER1 S AH0 N N IH1 R B AY1 F AH N AH0 L IY0 F OW0 AH0 P ER1 S AH0 N,Move ( Living_Sofa ) Find ( person Living_Sofa  ) Follow ( person )
Go to Side_Table find a person neayby finally follow a person .,G OW1 T UW1 S AY1 D T EY1 B AH0 L F AY1 N D AH0 P ER1 S AH0 N N IH1 R B AY1 F AY1 N AH0 L IY0 F AA1 L OW0 AH0 P ER1 S AH0 N,G OW1 T UW1 S AY1 D T EY1 B AH0 L AY1 N D AH0 F P ER1 S AH0 N N IH1 R B AY1 F N AH0 L IY0 AA1 L OW0 AH0 P ER1 S N,Move ( Side_Table ) Find ( person Side_Table  ) Follow ( person )
Go to Living_Room go to Side_Table  and exit from kitchen .,G OW1 T UW1 L IH1 V IH0 NG R UW1 M G OW1 T UW1 S AY1 D T EY1 B AH0 L AH0 N D EH1 G Z IH0 T F R AH1 M K IH1 CH AH0 N,G OW1 T UW1 L IH1 V IH0 NG R M AE G OW1 T UW1 S AY1 D T AW0 EY1 B AH0 L AH0 N D EH1 G Z IH0 T R AH1 AW0 K IH1 UW CH AH0 N,Move ( Living_Room ) Move ( Side_Table ) Move ( kitchen )
Well move to Dining_Table get cubic_clock and come back .,W EH1 L M UW1 V T UW1 D AY1 N IH0 NG T EY1 B AH0 L G EH1 T K Y UW1 B IH0 K K L AA1 K AH0 N D K AH1 M B AE1 K,W EH1 L M UW1 V T UW1 D IH1 OW0 N IH0 NG T EY1 B AH0 G EH1 T K Y B IH0 ER0 K L AA1 K AH0 ER2 N D K AH1 M AH B AE1 K,Move ( Dining_Table ) Grasp ( cubic_clock ) Move ( Dining_Table ) Grasp ( cubic_clock ) Move ( HERE )
Move to Dining_Table  get toy_penguin  exit from bed_room okay .,M UW1 V T UW1 D AY1 N IH0 NG T EY1 B AH0 L G EH1 T T OY1 P EH1 NG G W AH0 N EH1 G Z IH0 T F R AH1 M B EH1 D R UW1 M OW2 K EY1,M UW1 V T UW1 D AY1 N IH0 NG T EY1 B AH0 G OY0 T T OY1 P EH1 NG G OW0 AH0 N EH1 G Z IH0 T F R SH M B EH1 D R UW1 UH M OW2 K EY1,Move ( Dining_Table ) Find ( toy_penguin Dining_Table ) Grasp ( toy_penguin ) Move ( bed_room )
Go to Visitor_Room er find a person neayby bring Strawberry_Juice from Reception_Table .,G OW1 T UW1 V IH1 Z IH0 T ER0 R UW1 M ER0 F AY1 N D AH0 P ER1 S AH0 N N IH1 R B AY1 B R IH1 NG S T R AO1 B EH2 R IY0 JH UW1 S F R AH1 M R IH0 S EH1 P SH AH0 N T EY1 B AH0 L,G OW1 T UW1 HH V IH1 Z IH0 T ER0 R UW1 M ER0 F AY1 N D AH0 P ER1 S AH0 N IH1 R B AY1 B R S NG AA2 S T R AO1 B EH2 R IY0 JH UW1 S OW0 R AH1 M R IH0 S EH1 P SH AH0 N T EY1 B AH0,Move ( Visitor_Room ) Find ( person Visitor_Room ) Move ( Reception_Table ) Grasp ( Strawberry_Juice )
Go to Visitor_Room Grasp filled_ketchup place it on Dining_Sofa okay .,G OW1 T UW1 V IH1 Z IH0 T ER0 R UW1 M G R AE1 S P F IH1 L D K EH1 CH AH0 P P L EY1 S IH1 T AA1 N D AY1 N IH0 NG S OW1 F AH0 OW2 K EY1,G OW1 IH0 V IH1 Z IH0 T ER0 R UW1 M G R AE1 S P Y L F IH1 L D K EH1 CH AH0 P P L EY1 S IH1 AA1 N D AY1 N IH0 NG S OW1 F AH0 OW2 OY0 K EY1,Move ( Visitor_Room ) Grasp ( filled_ketchup ) Move ( Dining_Sofa ) Place ( filled_ketchup Dining_Sofa )
Go to kitchen then find a person neayby bring filled_ketchup from Kitchen_Table .,G OW1 T UW1 K IH1 CH AH0 N DH EH1 N F AY1 N D AH0 P ER1 S AH0 N N IH1 R B AY1 B R IH1 NG F IH1 L D K EH1 CH AH0 P F R AH1 M K IH1 CH AH0 N T EY1 B AH0 L,G OW1 T UW1 K CH AH0 N DH EH1 N F AY1 N D AH0 P ER1 S AH0 N OW1 IH1 R B AY1 B OW0 IH1 F IH1 L D K EH1 CH AH0 P F R AH1 K IH1 AY1 CH AH0 T EY1 B AH0 L,Move ( kitchen ) Find ( person kitchen ) Move ( Kitchen_Table ) Grasp ( filled_ketchup )
Go to Living_Room  move to Living_Table  finally leave the apartment .,G OW1 T UW1 L IH1 V IH0 NG R UW1 M M UW1 V T UW1 L IH1 V IH0 NG T EY1 B AH0 L F AY1 N AH0 L IY0 L IY1 V DH AH0 AH0 P AA1 R T M AH0 N T,G OW1 L T UW1 L AW V AE1 P IH0 AO R UW1 M M UW1 V T UW1 Y L IH1 V IH0 NG T EY1 B AH0 L AY1 N AH0 L IY0 IY1 DH AH0 AH0 P AA1 R T M N T,Move ( Living_Room ) Move ( Living_Table )  Move ( apartment )
Well go to Dining_Table  take Cup_Noodle finally come back .,W EH1 L G OW1 T UW1 D AY1 N IH0 NG T EY1 B AH0 L T EY1 K K AH1 P N UW1 D AH0 L F AY1 N AH0 L IY0 K AH1 M B AE1 K,W L OW1 T IH0 UW1 D N IH0 T EY1 AH0 L EY1 K K AH1 P N UW1 D AH0 L F AY1 N M B AH0 L IY0 K AH1 Z M B AE1 K,Move ( Dining_Table ) Grasp ( Cup_Noodle ) Move ( HERE )
Go to Living_Room go to Dining_Table  and exit from bed_room .,G OW1 T UW1 L IH1 V IH0 NG R UW1 M G OW1 T UW1 D AY1 N IH0 NG T EY1 B AH0 L AH0 N D EH1 G Z IH0 T F R AH1 M B EH1 D R UW1 M,G OW1 T UW1 L V IH0 NG R UW1 M G F OW1 T UW1 D AY1 AA1 N IH0 NG T EY1 B AH0 UH2 L AH0 N D EH1 TH IH0 T F R AH1 B AH2 EH1 D R UW1,Move ( Living_Room ) Move ( Dining_Table ) Move ( bed_room )
Move to Living_Sofa  next detect Cup_Star  get it .,M UW1 V T UW1 L IH1 V IH0 NG S OW1 F AH0 N EH1 K S T D IH0 T EH1 K T K AH1 P S T AA1 R G EH1 T IH1 T,M UW1 V T UW1 L IH1 V IH0 NG S OW1 F AH0 N EH1 K S T D IH0 AY1 T EH1 K T K AH1 P T T HH G EH1 T IH1 T,Move ( Living_Sofa ) Find ( Cup_Star Living_Sofa ) Grasp ( Cup_Star )
Go to Kitchen_Room  go to Dining_Sofa then exit the apartment .,G OW1 T UW1 K IH1 CH AH0 N R UW1 M G OW1 T UW1 D AY1 N IH0 NG S OW1 F AH0 DH EH1 N EH1 G Z IH0 T DH AH0 AH0 P AA1 R T M AH0 N T,G OW1 T UW1 K IH1 CH AH0 N R UW1 M G OW1 T UW1 UH1 IY0 N IH0 NG S OW1 F AH0 DH EH1 N EH1 G Z IH0 T DH AH0 AH0 P AA1 R T F M AH0 N T,Move ( Kitchen_Room ) Move ( Dining_Sofa )  Move ( apartment )
Would you go to Side_Table get cubic_clock carry it to Dining_Table .,W UH1 D Y UW1 G OW1 T UW1 S AY1 D T EY1 B AH0 L G EH1 T K Y UW1 B IH0 K K L AA1 K K AE1 R IY0 IH1 T T UW1 D AY1 N IH0 NG T EY1 B AH0 L,W UH1 D Y UW1 G OW1 AY1 T AH UW1 S AY1 D T EY1 B AH0 L G EH1 T K Y UW1 B IH0 K K L AA1 K K AE1 R IY0 IH1 T T UW1 D AY1 N IH0 EY2 NG T EY1 B UH1 AH0 L,Move (  Side_Table ) Find ( cubic_clock Side_Table  ) Grasp ( cubic_clock )  Move ( Dining_Table )
Can you go to Kitchen_Table take Japanese_Dressing carry it to Reception_Table .,K AE1 N Y UW1 G OW1 T UW1 K IH1 CH AH0 N T EY1 B AH0 L T EY1 K JH AE2 P AH0 N IY1 Z D R EH1 S IH0 NG K AE1 R IY0 IH1 T T UW1 R IH0 S EH1 P SH AH0 N T EY1 B AH0 L,K AE1 N Y UW1 G OW1 T UW1 K CH AH0 N T AO2 B IY AH0 L T EY1 UH K JH AE2 P AH0 IY1 Z D CH EH1 S IH0 NG K AE1 R IY0 T T UW1 R IH0 S EH1 P F SH AH0 IY N AO0 T EY1 AH0 L,Move ( Kitchen_Table  ) Find ( Japanese_Dressing Kitchen_Table ) Grasp ( Japanese_Dressing ) Move ( Reception_Table )
Go to lobby  move to Kitchen_Table  then leave the apartment .,G OW1 T UW1 L AA1 B IY0 M UW1 V T UW1 K IH1 CH AH0 N T EY1 B AH0 L DH EH1 N L IY1 V DH AH0 AH0 P AA1 R T M AH0 N T,G OW1 T UW1 L AA1 IY0 M UW1 V T UW1 K IH1 CH AH0 N T B OW L DH EH1 N L IY1 V AH0 P AA1 R EH0 T M AH0 N T,Move ( lobby ) Move ( Kitchen_Table ) Move ( apartment )
Would you go to Kitchen_Table get soysauce carry it to Living_Sofa .,W UH1 D Y UW1 G OW1 T UW1 K IH1 CH AH0 N T EY1 B AH0 L G EH1 T S OY1 S AO2 S K AE1 R IY0 IH1 T T UW1 L IH1 V IH0 NG S OW1 F AH0,W UH1 D Y UW1 G OW1 T UW1 K IH1 CH AH0 N T EY1 B AH0 L G EH1 T S OY1 S AO2 S K AE1 R IY0 SH T T Y UW1 AH2 L V IH UH IH1 V OW IH0 NG S OW1 OW0 F AH0,Move (  Kitchen_Table ) Find ( soysauce Kitchen_Table  ) Grasp ( soysauce )  Move ( Living_Sofa )
Go to Sofa get Red_Potato  exit from Kitchen_Room okay .,G OW1 T UW1 S OW1 F AH0 G EH1 T R EH1 D P AH0 T EY1 T OW2 EH1 G Z IH0 T F R AH1 M K IH1 CH AH0 N R UW1 M OW2 K EY1,G OW1 T UW1 S OW1 G EH1 R EH1 D P T EY1 T OW2 G Z IH0 T F R AH1 K IH1 CH AH0 N R UW1 M OW2 IH0 EY1,Move (  Sofa  ) Find ( Red_Potato Sofa  ) Grasp ( Red_Potato ) Move ( Kitchen_Room )
Move to Kitchen_Table get toy_duck place it on Dining_Table okay .,M UW1 V T UW1 K IH1 CH AH0 N T EY1 B AH0 L G EH1 T T OY1 D AH1 K P L EY1 S IH1 T AA1 N D AY1 N IH0 NG T EY1 B AH0 L OW2 K EY1,M V T K IH1 CH AH0 N T EY1 B AH0 L G EH1 T T OY1 D AH1 K P L EY1 S ZH IH1 OY0 T N D AY1 N IH0 NG T EY1 B AH0 L OW2 K EY1,Move ( Kitchen_Table ) Find ( toy_duck Kitchen_Table  ) Grasp ( toy_duck )  Move ( Dining_Table ) Place ( toy_duck Kitchen_Table )
Go to Corridor get salt throw it into Dustbin please .,G OW1 T UW1 K AO1 R AH0 D ER0 G EH1 T S AO1 L T TH R OW1 IH1 T IH1 N T UW0 D AH1 S T B IH0 N P L IY1 Z,G T EH0 K AO1 R AH0 D ER0 G EH1 T S AO1 L T TH R OW1 IH1 T IH1 AA0 N T UW0 D AH1 S T B IH0 N P IY1 Z,Move ( Corridor ) Find ( salt Corridor ) Grasp ( salt ) Move ( Dustbin ) Place ( salt Dustbin )
Would you go to Dining_Room Grasp empty_plastic_bottle er come back .,W UH1 D Y UW1 G OW1 T UW1 D AY1 N IH0 NG R UW1 M G R AE1 S P EH1 M P T IY0 P L AE1 S T IH0 K B AA1 T AH0 L ER0 K AH1 M B AE1 K,W UH1 D Y UW1 G OW1 T UW1 D AY1 N IH0 NG R UW1 M G R AE1 S P EH P EY2 T IY0 P L AE1 S T IH0 K B AA1 T AH0 L ER0 K EY2 AH0 M B ZH K,Move ( Dining_Room ) Find ( empty_plastic_bottle Dining_Room ) Move ( HERE )
Go to Corridor next find a person neayby get Cloth_Cleaner from Kitchen_Table .,G OW1 T UW1 K AO1 R AH0 D ER0 N EH1 K S T F AY1 N D AH0 P ER1 S AH0 N N IH1 R B AY1 G EH1 T K L AO1 TH K L IY1 N ER0 F R AH1 M K IH1 CH AH0 N T EY1 B AH0 L,G OW1 T UW1 K AO1 UW TH OY0 R AH0 D ER0 N EH1 K S T F AY1 N D AH0 P ER1 S AH0 OY IH1 R B G EH1 T K L AO1 TH K L AY N ER0 F R AH1 M K IH1 CH EY1 N AY EY1 B AH0 L,Move ( Corridor ) Find ( person ) Move ( Kitchen_Table ) Grasp ( Cloth_Cleaner )
Well get Cup_Noodle from Dining_Sofa go to kitchen move to Sofa .,W EH1 L G EH1 T K AH1 P N UW1 D AH0 L F R AH1 M D AY1 N IH0 NG S OW1 F AH0 G OW1 T UW1 K IH1 CH AH0 N M UW1 V T UW1 S OW1 F AH0,W EH1 L G EH1 T K AH1 P N UW1 D AH0 L F R AH1 M D AY1 N EH NG S OW1 F AH0 G OW1 T UW1 K AA0 CH AH0 N M UW1 V T UW1 S OW1 AH0,Move ( Dining_Sofa ) Grasp ( Cup_Noodle ) Move ( kitchen ) Move ( Sofa )
Go to bed_room take filled_plastic_bottle place it on Dining_Table okay .,G OW1 T UW1 B EH1 D R UW1 M T EY1 K F IH1 L D P L AE1 S T IH0 K B AA1 T AH0 L P L EY1 S IH1 T AA1 N D AY1 N IH0 NG T EY1 B AH0 L OW2 K EY1,G OW1 T UW1 UH EH1 D R UW1 M T EY1 K F IH1 AE1 L D P L AE1 S T IH0 K B AA1 T AH0 L P AA2 L EY1 S IH1 AE1 T AA1 N D AY1 N IH0 NG T EY1 B ER1 L EY1 OW2 K M EY1,Move (  bed_room  ) Find ( filled_plastic_bottle bed_room ) Grasp ( filled_plastic_bottle ) Move ( Dining_Table )
Go to Sofa move to Dining_Table  then leave the apartment .,G OW1 T UW1 S OW1 F AH0 M UW1 V T UW1 D AY1 N IH0 NG T EY1 B AH0 L DH EH1 N L IY1 V DH AH0 AH0 P AA1 R T M AH0 N T,G OW1 T S OW1 F AH0 M UW1 V T UW1 D AY1 N IH0 NG T EY1 B AH0 L DH EH1 N IY1 V DH AH0 P AA1 R T AE2 N T,Move ( Sofa ) Move ( Dining_Table ) Move ( apartment )
Go to kitchen  go to Side_Table er leave the apartment .,G OW1 T UW1 K IH1 CH AH0 N G OW1 T UW1 S AY1 D T EY1 B AH0 L ER0 L IY1 V DH AH0 AH0 P AA1 R T M AH0 N T,G OW1 T UW1 K IH1 CH AH0 N G OW1 T UW1 S AY1 D T EY1 B AH0 L ER0 V DH AH0 AH0 P AA1 R T M AH0 N T,Move ( kitchen ) Move ( Side_Table )  Move ( apartment )
Go to Visitor_Room  go to Bar then exit the apartment .,G OW1 T UW1 V IH1 Z IH0 T ER0 R UW1 M G OW1 T UW1 B AA1 R DH EH1 N EH1 G Z IH0 T DH AH0 AH0 P AA1 R T M AH0 N T,G OW1 T UW1 V IH1 Z IH0 T ER0 R UW1 M G OW1 T UW1 B AA1 R DH EH1 N EH1 G Z IH0 T DH AH0 AH0 P AA1 R T M AH0 N T,Move ( Visitor_Room ) Move ( Bar )  Move ( apartment )
Move to Kitchen_Table  next detect Korean_Soup  get it .,M UW1 V T UW1 K IH1 CH AH0 N T EY1 B AH0 L N EH1 K S T D IH0 T EH1 K T K AO2 R IY1 AH0 N S UW1 P G EH1 T IH1 T,M UW1 V T K IH1 CH AH0 N T EY1 B AH0 L EH1 K S T Y D IH0 T OW2 EH1 K OY0 K R IY1 AH0 N S UW1 UW G EH1 T IH1 SH T,Move ( Kitchen_Table ) Find ( Korean_Soup Kitchen_Table ) Grasp ( Korean_Soup )
Would you go to Dining_Room Grasp Chip_Star finally come back .,W UH1 D Y UW1 G OW1 T UW1 D AY1 N IH0 NG R UW1 M G R AE1 S P CH IH1 P S T AA1 R F AY1 N AH0 L IY0 K AH1 M B AE1 K,AW1 UH1 D Y UW1 G OW1 T UW1 D AY1 N IH0 NG R M G G AE1 AH2 S P CH IH1 P AA1 S T AA1 F AY1 N AH0 IY0 K AH1 M B AE1 K,Move ( Dining_Room ) Find ( Chip_Star Dining_Room ) Grasp ( Chip_Star )  Move ( HERE )
Go to kitchen and find a person neayby bring Cloth_Cleaner from Side_Table .,G OW1 T UW1 K IH1 CH AH0 N AH0 N D F AY1 N D AH0 P ER1 S AH0 N N IH1 R B AY1 B R IH1 NG K L AO1 TH K L IY1 N ER0 F R AH1 M S AY1 D T EY1 B AH0 L,G OW1 T UW1 K IH1 CH AH0 OW AH0 N D AW1 F AY1 N D EH AH0 P ER1 OY1 N N IH1 R B AY1 B R IH1 NG K L AO1 TH K L IY1 N ER0 F R AH1 OW1 S AE1 AY1 D T EY1 B AH0 L,Move ( kitchen ) Find ( person kitchen ) Move ( Side_Table ) Grasp ( Cloth_Cleaner )  Move ( person )
Go to Bar  and  detect canned_juice Grasp it .,G OW1 T UW1 B AA1 R AH0 N D D IH0 T EH1 K T K AE1 N D JH UW1 S G R AE1 S P IH1 T,G T UW1 B AA1 AH0 AE0 D IH0 T EH1 K T K N D JH UW1 S G R AE1 S P IH1 T,Move (  Bar  ) Find ( canned_juice Bar  ) Grasp ( canned_juice ) 
Go to bed_room get soysauce throw it into Dustbin please .,G OW1 T UW1 B EH1 D R UW1 M G EH1 T S OY1 S AO2 S TH R OW1 IH1 T IH1 N T UW0 D AH1 S T B IH0 N P L IY1 Z,G CH OW1 T UW1 B CH D R UW1 M G EH1 EY1 HH S OY1 S AO2 S EH TH R IH1 T IH1 N T UW0 D AH S T B IH0 N P L IY1 Z,Move ( bed_room ) Find ( soysauce bed_room ) Grasp ( soysauce ) Move ( Dustbin ) Place ( soysauce Dustbin )
Can you bring Japanese_Dressing from Living_Table go to Living_Room move to Kitchen_Table .,K AE1 N Y UW1 B R IH1 NG JH AE2 P AH0 N IY1 Z D R EH1 S IH0 NG F R AH1 M L IH1 V IH0 NG T EY1 B AH0 L G OW1 T UW1 L IH1 V IH0 NG R UW1 M M UW1 V T UW1 K IH1 CH AH0 N T EY1 B AH0 L,K AE1 N Y UW1 B R AE2 NG JH AE2 P AH0 N Z Z Y D R EH1 S IH0 NG F R UW AH1 AY1 AA1 IH1 V IH0 NG T EY1 B L G OW1 T UW1 IH1 V UW2 NG R UW1 M NG M OW0 V T UW1 K IH1 CH AH0 N T EY1 B K L,Move ( Living_Table ) Find ( Japanese_Dressing Living_Table  ) Grasp ( Japanese_Dressing ) Move ( Living_Room ) ( Kitchen_Table )
Go to Dining_Room  move to Side_Table  finally leave the apartment .,G OW1 T UW1 D AY1 N IH0 NG R UW1 M M UW1 V T UW1 S AY1 D T EY1 B AH0 L F AY1 N AH0 L IY0 L IY1 V DH AH0 AH0 P AA1 R T M AH0 N T,G OW1 T UW1 D AY1 N IH0 NG R UW1 OW0 M UW1 V T AW2 UW1 S AY1 D T EY1 B AH0 L F AY1 N AH0 L IY0 L IY1 V DH AH0 AH0 P R T M AH0 N T,Move ( Dining_Room ) Move ( Side_Table )  Move ( apartment )
Would you go to Living_Table take Green_Tea er come back .,W UH1 D Y UW1 G OW1 T UW1 L IH1 V IH0 NG T EY1 B AH0 L T EY1 K G R IY1 N T IY1 ER0 K AH1 M B AE1 K,W UH1 Y UW1 G OW1 T IH1 V IH0 NG T EY1 UW0 B AH0 L OW T EY1 K G R IY1 N T ER0 K AW2 AH1 M B AE1 K,Move ( Living_Table ) Find ( Green_Tea Living_Table ) Grasp ( Green_Tea ) Move ( HERE )
Would you go to Kitchen_Table take bear_doll er come back .,W UH1 D Y UW1 G OW1 T UW1 K IH1 CH AH0 N T EY1 B AH0 L T EY1 K B EH1 R D AA1 L ER0 K AH1 M B AE1 K,AH1 W UH1 OW D Y UW1 G OW1 T UW1 K IH1 CH AW AH0 N T EY1 B AH2 L T EY1 K B EH1 EH1 R AA1 L ER0 K AH1 M G AE1 K,Move ( Kitchen_Table ) Find ( bear_doll Kitchen_Table ) Grasp ( bear_doll ) Move ( HERE )
Go to bed_room then find a person neayby bring Brown_Tea from Dining_Sofa .,G OW1 T UW1 B EH1 D R UW1 M DH EH1 N F AY1 N D AH0 P ER1 S AH0 N N IH1 R B AY1 B R IH1 NG B R AW1 N T IY1 F R AH1 M D AY1 N IH0 NG S OW1 F AH0,G OW1 T UW1 B EH1 D R M DH EH1 F AY1 D AH0 P CH ER1 S AH0 N N IH1 R B AO2 AY1 ER B R IH1 B R AW1 N T EH1 F EH2 ER0 AH1 M AY1 N IH0 NG AH2 OW1 OW1 F AW1 AH0,Move ( bed_room ) Find ( person bed_room ) Move ( Dining_Sofa ) Grasp ( Brown_Tea )
Go to Corridor  go to Living_Table then exit the apartment .,G OW1 T UW1 K AO1 R AH0 D ER0 G OW1 T UW1 L IH1 V IH0 NG T EY1 B AH0 L DH EH1 N EH1 G Z IH0 T DH AH0 AH0 P AA1 R T M AH0 N T,G OY1 OW1 T UW1 K AO1 R AH0 D AW2 ER0 G OW1 T UW1 L IH1 V IH0 NG T B AH0 DH EH1 N EH1 G IY1 DH AH0 AA2 AH0 P AA1 R IH M AH0 N T,Move ( Corridor ) Move ( Living_Table )  Move ( apartment )
Can you go to Living_Room Grasp Cup_Noodle  bring it to Sofa .,K AE1 N Y UW1 G OW1 T UW1 L IH1 V IH0 NG R UW1 M G R AE1 S P K AH1 P N UW1 D AH0 L B R IH1 NG IH1 T T UW1 S OW1 F AH0,K AE1 N Y UW1 EY0 G OW1 DH T UW1 L IH1 V IH0 NG R UW1 M G R AE1 S P K UW1 AH1 P N UW1 D AH0 L TH R IH1 NG IH1 T T UW1 S OW1 F AH0,Move ( Living_Room ) Find ( Cup_Noodle Living_Room ) Grasp ( Cup_Noodle ) Move ( Sofa )  Find ( Cup_Noodle Sofa ) Grasp ( Cup_Noodle ) Move ( Living_Room )
Go to Sofa move to Living_Table take Onion_Dressing .,G OW1 T UW1 S OW1 F AH0 M UW1 V T UW1 L IH1 V IH0 NG T EY1 B AH0 L T EY1 K AH1 N Y AH0 N D R EH1 S IH0 NG,G OW1 T UW1 S OW1 F AH0 M UW1 TH T UW1 L IH1 V IH0 NG T EY1 B AH0 L T EY1 AH1 N Y AH0 N D R OW EH1 S IH0 NG,Move ( Sofa ) Move ( Living_Table ) Find ( Onion_Dressing Sofa ) Grasp ( Onion_Dressing ) Move ( HERE )
Go to kitchen next find rubik's_cube take it .,G OW1 T UW1 K IH1 CH AH0 N N EH1 K S T F AY1 N D R UW1 B IH0 K S K Y UW1 B T EY1 K IH1 T,G OW1 T EH1 UW1 SH K IH1 ZH CH AH0 N N EH1 K S T F AY1 W N IY2 AH2 R B IH0 K S K TH UW1 T EY1 K IH1 T,Move (  kitchen  ) Find ( rubik's_cube kitchen  ) Grasp ( rubik's_cube ) 
Move to Dining_Table  next detect apple  get it .,M UW1 V T UW1 D AY1 N IH0 NG T EY1 B AH0 L N EH1 K S T D IH0 T EH1 K T AE1 P AH0 L G EH1 T IH1 T,M UW1 V T UW1 D AY1 N IH0 IH2 NG T EY1 B AH0 L N EH1 K S T D IH0 T EH1 AE1 AH0 L G EH1 T IH1 T,Move ( Dining_Table ) Find ( apple Dining_Table ) Grasp ( apple )
Go to kitchen Grasp Brown_Tea place it on Dining_Table okay .,G OW1 T UW1 K IH1 CH AH0 N G R AE1 S P B R AW1 N T IY1 P L EY1 S IH1 T AA1 N D AY1 N IH0 NG T EY1 B AH0 L OW2 K EY1,G OW1 T UW1 K IH1 CH AH0 N W G R AE1 S P B R AW1 N T L S IH1 T AA1 N D AY1 N IH0 NG T EY1 IY1 AH0 JH L OW2 EY1,Move ( kitchen ) Grasp ( Brown_Tea ) Move ( Dining_Table ) Place ( Brown_Tea Dining_Table )
Would you go to Dining_Sofa get Bleach carry it to Sofa .,W UH1 D Y UW1 G OW1 T UW1 D AY1 N IH0 NG S OW1 F AH0 G EH1 T B L IY1 CH K AE1 R IY0 IH1 T T UW1 S OW1 F AH0,W UH1 D Y G ER2 OW1 T UW1 D AY1 N IH0 NG S OW1 F AH0 G EH1 T B L IY1 CH K AE1 ZH IY0 IH1 S T T UW1 OW1 F AH0,Move (  Dining_Sofa ) Find ( Bleach Dining_Sofa  ) Grasp ( Bleach )  Move ( Sofa )
Go to bed_room  go to Kitchen_Table er leave the apartment .,G OW1 T UW1 B EH1 D R UW1 M G OW1 T UW1 K IH1 CH AH0 N T EY1 B AH0 L ER0 L IY1 V DH AH0 AH0 P AA1 R T M AH0 N T,G OW1 T UW1 B EH1 D OW0 UW1 G OW1 T UW1 K IH1 CH AO1 AH0 N T EY1 B AH0 L ER0 L IY1 V DH AH0 AH0 P AA1 R T M AH0 N T,Move ( bed_room ) Move ( Kitchen_Table )  Move ( apartment )
