Input,phonemelabel,Noisylabel,Labeldata
Can you bring white_cup from Bar go to lobby move to Living_Sofa .,K AE1 N Y UW1 B R IH1 NG W AY1 T K AH1 P F R AH1 M B AA1 R G OW1 T UW1 L AA1 B IY0 M UW1 V T UW1 L IH1 V IH0 NG S OW1 F AH0,K AE1 N Y UW1 B R IH1 NG W AY1 T K AH1 P F R AH1 M B OY AA1 R G OW1 AE2 AH1 L AA1 B ER0 M UW1 V T UW1 L IH1 V IH0 NG S OW1 F AH0,Move ( Bar ) Find ( white_cup Bar  ) Grasp ( white_cup ) Move ( lobby ) ( Living_Sofa )
Would you bring white_cup from Reception_Table move to Sofa go to Living_Room .,W UH1 D Y UW1 B R IH1 NG W AY1 T K AH1 P F R AH1 M R IH0 S EH1 P SH AH0 N T EY1 B AH0 L M UW1 V T UW1 S OW1 F AH0 G OW1 T UW1 L IH1 V IH0 NG R UW1 M,W UH1 D Y UW1 B R IH1 NG W AY1 T K S AH1 P F AO2 R AO2 AH1 M R IH0 S M P SH N T EY1 B AH0 OY2 M UW1 V T UW1 S OW1 F AH0 G OW1 T UW1 L IH1 V IH0 AA0 R UW1 M,Move ( Reception_Table ) Find ( white_cup Reception_Table ) Move ( Sofa ) Move ( Living_Room )
Can you go to kitchen get Cup_Star then come back .,K AE1 N Y UW1 G OW1 T UW1 K IH1 CH AH0 N G EH1 T K AH1 P S T AA1 R DH EH1 N K AH1 M B AE1 K,K AE1 N AY2 UW1 G OW1 T UW1 K IH1 CH AH0 N G EH1 T K AH1 P S T AA1 R DH EH1 N K AH1 M B AE1 K,Move (  kitchen  ) Find ( Cup_Star kitchen ) Grasp ( Cup_Star ) Move ( HERE )
Go to Living_Table move to Living_Sofa take Red_Tea .,G OW1 T UW1 L IH1 V IH0 NG T EY1 B AH0 L M UW1 V T UW1 L IH1 V IH0 NG S OW1 F AH0 T EY1 K R EH1 D T IY1,G OW1 T UW1 L IH1 V IH0 NG T UW2 UH B AH0 L M UW1 IH V T UW1 IH1 IH0 NG S OW1 F AH0 T EY1 K R EH1 AH1 D T OY0 IY1,Move ( Living_Table ) Move ( Living_Sofa ) Find ( Red_Tea Living_Table ) Grasp ( Red_Tea ) Move ( HERE )
Go to kitchen next find a person neayby get cigarette from Sofa .,G OW1 T UW1 K IH1 CH AH0 N N EH1 K S T F AY1 N D AH0 P ER1 S AH0 N N IH1 R B AY1 G EH1 T S IH2 G ER0 EH1 T F R AH1 M S OW1 F AH0,G OW1 T UW1 K IH1 CH AH0 N EH1 AA2 S CH EY AH0 F AY1 N D AH0 P ER1 S N N IH1 R B AY0 AY1 G EH1 T S IH2 ER0 EH1 T F R AH1 M S OW1 F AH0,Move ( kitchen ) Find ( person ) Move ( Sofa ) Grasp ( cigarette )
Would you move to Reception_Table get empty_ketchup bring it to Side_Table .,W UH1 D Y UW1 M UW1 V T UW1 R IH0 S EH1 P SH AH0 N T EY1 B AH0 L G EH1 T EH1 M P T IY0 K EH1 CH AH0 P B R IH1 NG IH1 T T UW1 S AY1 D T EY1 B AH0 L,W AY OY1 UH1 D Y UW1 M V T UW1 R IH0 S EH1 P SH AH0 N T B AH0 L G EH1 T EH1 M P T IY0 K OW2 CH AH0 P B R IH1 NG IH1 T T UW1 S AY1 D T W B AH0 L,Move ( Reception_Table ) Find ( empty_ketchup Reception_Table  ) Grasp ( empty_ketchup ) Move ( Side_Table )
Go to Sofa move to Dining_Table  then leave the apartment .,G OW1 T UW1 S OW1 F AH0 M UW1 V T UW1 D AY1 N IH0 NG T EY1 B AH0 L DH EH1 N L IY1 V DH AH0 AH0 P AA1 R T M AH0 N T,G OW1 T UW1 S OW1 OW AH0 M UW1 V T EH2 D AY1 N IH0 NG T EY1 B AH0 L DH IY2 N L IY1 V DH AH0 AH0 P AA1 AY1 T M AH0 N,Move ( Sofa ) Move ( Dining_Table ) Move ( apartment )
Go to Dining_Room  go to Living_Table er leave the apartment .,G OW1 T UW1 D AY1 N IH0 NG R UW1 M G OW1 T UW1 L IH1 V IH0 NG T EY1 B AH0 L ER0 L IY1 V DH AH0 AH0 P AA1 R T M AH0 N T,G OW1 T UW1 TH D AY1 N IH0 NG R UW1 OW1 T D L IH1 V IH0 NG T EY1 B ER0 IH1 L IY1 V DH AH0 AH0 OY2 AA1 M R T M AH0 N T,Move ( Dining_Room ) Move ( Living_Table )  Move ( apartment )
Can you go to Living_Sofa take camera carry it to Dining_Sofa .,K AE1 N Y UW1 G OW1 T UW1 L IH1 V IH0 NG S OW1 F AH0 T EY1 K K AE1 M ER0 AH0 K AE1 R IY0 IH1 T T UW1 D AY1 N IH0 NG S OW1 F AH0,K AE1 N Y UW1 G OW1 T UW1 L IH1 AH0 V IH0 NG S OW1 F AH0 T EY1 K K AE1 M ER0 AH0 K IY AE1 R IY0 IH1 T T UW1 D AY1 N IH0 NG S OW1 F AH0,Move ( Living_Sofa  ) Find ( camera Living_Sofa ) Grasp ( camera ) Move ( Dining_Sofa )
Go to Kitchen_Room next find filled_plastic_bottle Grasp it .,G OW1 T UW1 K IH1 CH AH0 N R UW1 M N EH1 K S T F AY1 N D F IH1 L D P L AE1 S T IH0 K B AA1 T AH0 L G R AE1 S P IH1 T,G OW1 T K IH1 CH AH0 N R UW1 M N EH1 K AH1 S T TH F AY1 N D IH1 L D P L AE1 S T IH0 K AW2 B AA1 T AH0 L G OW2 R AE1 S P IH1 T,Move ( Kitchen_Room ) Find ( filled_plastic_bottle Kitchen_Room ) Grasp ( filled_plastic_bottle )
Go to Living_Sofa go to Dining_Room  and exit the apartment .,G OW1 T UW1 L IH1 V IH0 NG S OW1 F AH0 G OW1 T UW1 D AY1 N IH0 NG R UW1 M AH0 N D EH1 G Z IH0 T DH AH0 AH0 P AA1 R T M AH0 N T,G AY1 OW1 OW0 UW1 L EY2 V IH0 NG S OW1 UH2 F AH0 G OW1 T UW1 D AY1 N IH0 NG DH R UW1 M AH0 N D EH1 G Z ER0 IH0 OY0 DH AH0 AH0 P AA1 R T M IY2 N T,Move ( Living_Sofa ) Move ( Living_Sofa ) Move ( apartment )
Move to Dining_Table get rubik's_cube place it on Side_Table okay .,M UW1 V T UW1 D AY1 N IH0 NG T EY1 B AH0 L G EH1 T R UW1 B IH0 K S K Y UW1 B P L EY1 S IH1 T AA1 N S AY1 D T EY1 B AH0 L OW2 K EY1,M UW1 V T UW1 D AY1 N AH0 NG T EY1 AH0 L G EH1 T UW1 IH0 K S K Y UW1 B P L EY1 S IH1 T AA1 N S AY1 D T EY1 B AH0 L OW2 K EY1,Move ( Dining_Table ) Find ( rubik's_cube Dining_Table  ) Grasp ( rubik's_cube )  Move ( Side_Table ) Place ( rubik's_cube Dining_Table )
Would you bring Seafood_Noodle from Dining_Table move to Bar go to Visitor_Room .,W UH1 D Y UW1 B R IH1 NG S IY1 F UW2 D N UW1 D AH0 L F R AH1 M D AY1 N IH0 NG T EY1 B AH0 L M UW1 V T UW1 B AA1 R G OW1 T UW1 V IH1 Z IH0 T ER0 R UW1 M,W UH1 D UW1 B R IH1 NG S IY1 F UW2 D N UW1 D AH0 L F R AH1 M D AY1 N IH0 NG T EY1 B AH0 L M UW1 V T UW1 B AA1 R G OW1 T UW1 V IH1 Z IH0 T ER0 R UW1 M,Move ( Dining_Table ) Find ( Seafood_Noodle Dining_Table ) Move ( Bar ) Move ( Visitor_Room )
Go to Kitchen_Room take Green_Tea place it on Side_Table okay .,G OW1 T UW1 K IH1 CH AH0 N R UW1 M T EY1 K G R IY1 N T IY1 P L EY1 S IH1 T AA1 N S AY1 D T EY1 B AH0 L OW2 K EY1,G OW1 T AA0 UW1 K IH1 CH AH0 N R IY2 UW1 M T EY1 W K G R IY1 N T IY1 P L EY1 S IH1 T AA1 N S AY1 IY1 D T EY1 B AH0 L OW2 K F,Move (  Kitchen_Room  ) Find ( Green_Tea Kitchen_Room ) Grasp ( Green_Tea ) Move ( Side_Table )
Go to Visitor_Room Grasp rabbit_doll place it on Living_Sofa okay .,G OW1 T UW1 V IH1 Z IH0 T ER0 R UW1 M G R AE1 S P R AE1 B AH0 T D AA1 L P L EY1 S IH1 T AA1 N L IH1 V IH0 NG S OW1 F AH0 OW2 K EY1,G OW1 G T V Z IH0 T ER0 R UW1 M R AE1 S P R AE1 B AH0 T D AA1 L P L EY1 S IH1 T AA2 AO2 N L IH1 V IH0 NG S OW1 P F AH0 OW2 K EY1,Move ( Visitor_Room ) Grasp ( rabbit_doll ) Move ( Living_Sofa ) Place ( rabbit_doll Living_Sofa )
Move to Kitchen_Table  next detect nursing_bottle  get it .,M UW1 V T UW1 K IH1 CH AH0 N T EY1 B AH0 L N EH1 K S T D IH0 T EH1 K T N ER1 S IH0 NG B AA1 T AH0 L G EH1 T IH1 T,M UW1 V T UW1 K IH1 CH AH0 N T EY1 B L AH0 L N EH1 K S T D IH0 T EH1 K T N ER1 S IH0 NG B AA1 T AH0 L G EH1 T IH1 T,Move ( Kitchen_Table ) Find ( nursing_bottle Kitchen_Table ) Grasp ( nursing_bottle )
Go to Kitchen_Table then detect Red_Tea  take it .,G OW1 T UW1 K IH1 CH AH0 N T EY1 B AH0 L DH EH1 N D IH0 T EH1 K T R EH1 D T IY1 T EY1 K IH1 T,G OW1 T UW1 K IH1 CH AH0 N T EY1 B AH0 L DH EH1 EY N ER0 D IH0 T EH1 K T R AO0 IY0 D T IY1 T EY1 K IH1 T,Move ( Kitchen_Table ) Find ( Red_Tea Kitchen_Table ) Grasp ( Red_Tea )  Move ( Red_Tea )
Go to Dining_Table and find a person neayby bring cigarette from Living_Sofa .,G OW1 T UW1 D AY1 N IH0 NG T EY1 B AH0 L AH0 N D F AY1 N D AH0 P ER1 S AH0 N N IH1 R B AY1 B R IH1 NG S IH2 G ER0 EH1 T F R AH1 M L IH1 V IH0 NG S OW1 F AH0,G OW1 T UW1 D AY1 N IH0 NG T EY1 B AH0 L AH0 N F AE2 N D JH AH0 P ER1 S IY0 N IH1 R B AY1 B R IH1 NG S IH2 G ER0 TH EH1 T Z F R AH0 AH1 M L IH1 V IH0 NG P S F AH0,Move (  Dining_Table  ) Find ( cigarette Dining_Table  ) Grasp ( cigarette ) Find ( pesron Dining_Table ) Plcae ( cigarette PERSON )
Go to Kitchen_Room  move to Dining_Sofa  finally leave the apartment .,G OW1 T UW1 K IH1 CH AH0 N R UW1 M M UW1 V T UW1 D AY1 N IH0 NG S OW1 F AH0 F AY1 N AH0 L IY0 L IY1 V DH AH0 AH0 P AA1 R T M AH0 N T,G OW1 T UW1 K AA0 IH1 CH AH0 N R UW1 M M UW1 V T UW1 D AY1 EH2 IH0 NG S OW1 F AH0 F AY1 N AH0 L IY0 L IY1 V DH AH0 AH0 OY1 P AA1 R T M AH0 N T,Move ( Kitchen_Room ) Move ( Dining_Sofa )  Move ( apartment )
Go to Living_Room next find rubik's_cube Grasp it .,G OW1 T UW1 L IH1 V IH0 NG R UW1 M N EH1 K S T F AY1 N D R UW1 B IH0 K S K Y UW1 B G R AE1 S P IH1 T,G OW1 T UW1 L IH1 V IH0 UW1 M K S T F AE2 N D R UW1 B IH0 K K Y UW1 B G R AE1 S P IH1 AE2,Move ( Living_Room ) Find ( rubik's_cube Living_Room ) Grasp ( rubik's_cube )
Can you go to Kitchen_Room Grasp Orange_Juice  bring it to Dining_Sofa .,K AE1 N Y UW1 G OW1 T UW1 K IH1 CH AH0 N R UW1 M G R AE1 S P AO1 R AH0 N JH JH UW1 S B R IH1 NG IH1 T T UW1 D AY1 N IH0 NG S OW1 F AH0,K AE1 N UW1 G OW1 UW1 K IH1 CH AH0 N R UW1 M G D AE1 M S P AO1 R AH0 N JH OW1 JH UW1 S IY1 R IH1 NG T T UW1 D AY1 N IH0 EY1 AH1 S OW0 OW1 F AH0,Move ( Kitchen_Room ) Find ( Orange_Juice Kitchen_Room ) Grasp ( Orange_Juice ) Move ( Dining_Sofa )  Find ( Orange_Juice Dining_Sofa ) Grasp ( Orange_Juice ) Move ( Kitchen_Room )
Well go to Sofa  take hourglass  bring it to Living_Sofa .,W EH1 L G OW1 T UW1 S OW1 F AH0 T EY1 K AW1 ER0 G L AE2 S B R IH1 NG IH1 T T UW1 L IH1 V IH0 NG S OW1 F AH0,W EH1 L G OW1 T UW1 S OW1 F AH0 AH T EY1 K AO2 AW1 ER0 G AE2 S B UW0 R IH1 NG IH1 T T UW1 L IH1 V IH0 NG EH OW1 F AH0,Move (  Sofa ) Find ( hourglass Sofa  ) Grasp ( hourglass )  Move ( Living_Sofa )
Would you move to Living_Sofa Grasp sugar and come back .,W UH1 D Y UW1 M UW1 V T UW1 L IH1 V IH0 NG S OW1 F AH0 G R AE1 S P SH UH1 G ER0 AH0 N D K AH1 M B AE1 K,W UH1 D Y UW1 M UW1 V T UW1 L V IH0 NG S OW1 F AH0 AE1 G R AE1 P SH UH1 G ER0 AH0 N D K AH1 M EY2 AA2 K,Move ( Living_Sofa ) Grasp ( sugar ) Move ( HERE )
Move to Dining_Sofa  go to Living_Sofa then exit the apartment .,M UW1 V T UW1 D AY1 N IH0 NG S OW1 F AH0 G OW1 T UW1 L IH1 V IH0 NG S OW1 F AH0 DH EH1 N EH1 G Z IH0 T DH AH0 AH0 P AA1 R T M AH0 N T,M UW1 V T UW1 D AO1 N IH0 NG S OW1 F AH0 G OW1 T UW1 L IH1 V NG S F AH0 DH EH1 N EH1 G Z T AE2 DH AH0 AW1 AH0 P R T M AH0 N T,Move ( Dining_Sofa ) Move ( Living_Sofa ) Move ( apartment )
Go to Dining_Room  go to Living_Sofa then exit the apartment .,G OW1 T UW1 D AY1 N IH0 NG R UW1 M G OW1 T UW1 L IH1 V IH0 NG S OW1 F AH0 DH EH1 N EH1 G Z IH0 T DH AH0 AH0 P AA1 R T M AH0 N T,G OW1 T UW1 D AY1 N IH0 NG R UW1 M M G OW1 T UW1 L IH1 V IH0 NG S OW1 F AH0 DH EH1 N EH1 G Z IH0 T DH AH0 AH0 P UW2 AA1 R T M AH0 N T,Move ( Dining_Room ) Move ( Living_Sofa )  Move ( apartment )
Go to bed_room  find a person neayby  finally follow a person .,G OW1 T UW1 B EH1 D R UW1 M F AY1 N D AH0 P ER1 S AH0 N N IH1 R B AY1 F AY1 N AH0 L IY0 F AA1 L OW0 AH0 P ER1 S AH0 N,G OW1 T UW1 B EH1 R UW1 M AH0 AY1 N D AH0 P ER1 S AH0 N N IH1 R B F AY1 N AH0 L IY0 F AA1 L DH P ER1 S AH0 N,Move ( bed_room ) Find ( person bed_room ) Follow ( person )
Can you go to Side_Table take Egg_Soup carry it to Kitchen_Table .,K AE1 N Y UW1 G OW1 T UW1 S AY1 D T EY1 B AH0 L T EY1 K EH1 G S UW1 P K AE1 R IY0 IH1 T T UW1 K IH1 CH AH0 N T EY1 B AH0 L,K AE1 N Y UW1 G OW1 T UW1 S AY1 D T EY1 B AO2 L T EY1 K EH1 G S UW1 P K AE1 R IY0 IH1 V T T UW1 K T CH AH0 N T B L,Move ( Side_Table  ) Find ( Egg_Soup Side_Table ) Grasp ( Egg_Soup ) Move ( Kitchen_Table )
Go to Sofa go to Dining_Room  and leave the apartment .,G OW1 T UW1 S OW1 F AH0 G OW1 T UW1 D AY1 N IH0 NG R UW1 M AH0 N D L IY1 V DH AH0 AH0 P AA1 R T M AH0 N T,G OW1 T UW1 S OW1 F AH0 G OW1 T UW1 D AY1 N IH0 NG R UW1 M AH0 N R D L IY1 V DH AH0 P AA1 UW R T M AH0 N T,Move ( Sofa )  Move ( Dining_Room )  Move ( apartment )
Would you move to Living_Sofa take Strawberry_Juice then come back .,W UH1 D Y UW1 M UW1 V T UW1 L IH1 V IH0 NG S OW1 F AH0 T EY1 K S T R AO1 B EH2 R IY0 JH UW1 S DH EH1 N K AH1 M B AE1 K,W UH1 D Y UW1 UW1 V T UW1 L IH1 V IH0 NG S OW1 F AH0 T EY1 K S T R AO1 B EH2 R IY0 JH UW1 S DH EH1 UH N K AH1 M B AE1 K,Move ( Living_Sofa ) Find ( Strawberry_Juice Living_Sofa ) Grasp ( Strawberry_Juice ) Move ( HERE )
Move to Dining_Sofa get apple place it on Sofa okay .,M UW1 V T UW1 D AY1 N IH0 NG S OW1 F AH0 G EH1 T AE1 P AH0 L P L EY1 S IH1 T AA1 N S OW1 F AH0 OW2 K EY1,M UW1 V T UW1 D AY1 IH0 NG AH0 S OW1 F AH0 G EH1 T AE1 P AH0 L P L EY1 IH1 T AA1 N S OW1 F AH0 OW2 K EY1,Move ( Dining_Sofa ) Find ( apple Dining_Sofa  ) Grasp ( apple )  Move ( Sofa ) Place ( apple Dining_Sofa )
Go to Kitchen_Room go to Side_Table  and exit from Living_Room .,G OW1 T UW1 K IH1 CH AH0 N R UW1 M G OW1 T UW1 S AY1 D T EY1 B AH0 L AH0 N D EH1 G Z IH0 T F R AH1 M L IH1 V IH0 NG R UW1 M,G OW1 T UW1 K UW2 CH AH0 N ER2 R UW1 AH1 G OW1 T UW1 S AY1 D T B AH0 L AH0 N D EH1 Z IH0 T OW R AH1 AY0 M L IH1 V IH0 NG R UW1 M,Move ( Kitchen_Room ) Move ( Side_Table ) Move ( Living_Room )
Well move to Living_Sofa get rabbit_doll and come back .,W EH1 L M UW1 V T UW1 L IH1 V IH0 NG S OW1 F AH0 G EH1 T R AE1 B AH0 T D AA1 L AH0 N D K AH1 M B AE1 K,W EH1 L M UW1 V T UW1 IH1 EH1 V IH0 NG S OW1 F AH0 G EH1 T R AE1 B AH0 T D AA1 AH0 N D OW1 K AH1 M CH B UW1 AE1 K,Move ( Living_Sofa ) Grasp ( rabbit_doll ) Move ( Living_Sofa ) Grasp ( rabbit_doll ) Move ( HERE )
Call a person then ask for an order get toy_duck from Sofa .,K AO1 L AH0 P ER1 S AH0 N DH EH1 N AE1 S K F AO1 R AE1 N AO1 R D ER0 G EH1 T T OY1 D AH1 K F R AH1 M S OW1 F AH0,K AO1 L AH0 P ER1 AH0 N DH EH1 N AE1 S AH F AO1 R AE1 N AO1 R D ER0 G EH1 T T OY1 D AH1 K F R AH1 M S OW1 F AH0,Say ( person ) Listen ( toy_duck ) Move ( Sofa ) Find ( toy_duck Sofa ) Grasp ( toy_duck ) Move ( toy_duck ) Place ( toy_duck Sofa ) 
Call a person then ask for an order get Chip_Star from Bar .,K AO1 L AH0 P ER1 S AH0 N DH EH1 N AE1 S K F AO1 R AE1 N AO1 R D ER0 G EH1 T CH IH1 P S T AA1 R F R AH1 M B AA1 R,K AO1 L AH0 P ER1 S AH0 N DH EH1 N AE1 S K F AO1 AE1 N EH AA0 AO1 R G EH1 T CH IH1 P S T AA1 R F R Z M B AA1 R,Say ( person ) Listen ( Chip_Star ) Move ( Bar ) Find ( Chip_Star Bar ) Grasp ( Chip_Star ) Move ( Chip_Star ) Place ( Chip_Star Bar ) 
Go to Corridor and find a person neayby bring empty_plastic_bottle from Kitchen_Table .,G OW1 T UW1 K AO1 R AH0 D ER0 AH0 N D F AY1 N D AH0 P ER1 S AH0 N N IH1 R B AY1 B R IH1 NG EH1 M P T IY0 P L AE1 S T IH0 K B AA1 T AH0 L F R AH1 M K IH1 CH AH0 N T EY1 B AH0 L,G OW1 T UW1 K AO1 Y R AH0 D IY1 ER0 AH0 N D F AY1 N D AH0 P ER1 S AH0 OW1 N N OY IH1 R B AY1 B R IH1 NG EH1 M P T IY0 P L AO1 S T IH0 K B AA1 T AH0 L F R M K CH AH0 N T EY1 B AW2 AH0 L,Move ( Corridor ) Find ( person Corridor ) Move ( Kitchen_Table ) Grasp ( empty_plastic_bottle )  Move ( person )
Go to Reception_Table  and  detect ground_pepper Grasp it .,G OW1 T UW1 R IH0 S EH1 P SH AH0 N T EY1 B AH0 L AH0 N D D IH0 T EH1 K T G R AW1 N D P EH1 P ER0 G R AE1 S P IH1 T,G OW1 T UW1 R IH0 S TH EH1 P SH AH0 N T EY1 AY0 B AO0 L AH0 ER1 N D D IH0 T EH1 K T G R AW1 N D P EH1 P B ER0 G R AE1 S P IH1 T,Move (  Reception_Table  ) Find ( ground_pepper Reception_Table  ) Grasp ( ground_pepper ) 
Call a person then ask for an order get Bath_Cleaner from Sofa .,K AO1 L AH0 P ER1 S AH0 N DH EH1 N AE1 S K F AO1 R AE1 N AO1 R D ER0 G EH1 T B AE1 TH K L IY1 N ER0 F R AH1 M S OW1 F AH0,K AO1 L AH0 P ER1 IH0 S AH0 N EH1 N AE1 S K F Z R AE1 N AO1 AO R D ER0 G EH1 T B AE1 TH K L DH N ER0 F R AH1 M S OW1 F AH0,Say ( person ) Listen ( Bath_Cleaner ) Move ( Sofa ) Find ( Bath_Cleaner Sofa ) Grasp ( Bath_Cleaner ) Move ( Bath_Cleaner ) Place ( Bath_Cleaner Sofa ) 
Go to Dining_Table go to bed_room  and leave the apartment .,G OW1 T UW1 D AY1 N IH0 NG T EY1 B AH0 L G OW1 T UW1 B EH1 D R UW1 M AH0 N D L IY1 V DH AH0 AH0 P AA1 R T M AH0 N T,G OW1 T UW1 D AY1 N IH0 NG EY1 EH1 EY1 B AH0 L G OW1 T UW1 B EH1 D R UW1 M AH0 OY1 N L IY1 V DH AH0 TH AH0 P AA1 AO R M AH0 N T,Move ( Dining_Table )  Move ( bed_room )  Move ( apartment )
Go to Reception_Table take empty_ketchup put it on Kitchen_Table please .,G OW1 T UW1 R IH0 S EH1 P SH AH0 N T EY1 B AH0 L T EY1 K EH1 M P T IY0 K EH1 CH AH0 P P UH1 T IH1 T AA1 N K IH1 CH AH0 N T EY1 B AH0 L P L IY1 Z,G OW1 T UW1 R IH0 S K P SH OY0 AH0 N T B AA AH0 L T JH EY1 EH1 M P T IY0 OW1 EH1 CH AH0 P P UH1 T IH1 T AA1 N K IH1 CH AH0 N T EY1 B AH0 L P L IY1 Z,Move (  Reception_Table  ) Find ( empty_ketchup Reception_Table  ) Grasp ( empty_ketchup ) Plcae ( empty_ketchup Kitchen_Table )
Would you go to Sofa  take nursing_bottle  bring it to Reception_Table .,W UH1 D Y UW1 G OW1 T UW1 S OW1 F AH0 T EY1 K N ER1 S IH0 NG B AA1 T AH0 L B R IH1 NG IH1 T T UW1 R IH0 S EH1 P SH AH0 N T EY1 B AH0 L,W UH1 D Y UW1 G OW1 T UW1 S OW1 F AH0 T EY1 K N ER1 S IH0 AA2 B AA1 T AH0 L B R IH1 NG IH1 T T UW1 R IH0 S EH1 P SH AH0 UW1 N T EY1 K B L,Move ( Sofa ) Find ( nursing_bottle Sofa ) Grasp ( nursing_bottle ) Move ( Reception_Table )
Would you go to Reception_Table  take toy_penguin  bring it to Living_Table .,W UH1 D Y UW1 G OW1 T UW1 R IH0 S EH1 P SH AH0 N T EY1 B AH0 L T EY1 K T OY1 P EH1 NG G W AH0 N B R IH1 NG IH1 T T UW1 L IH1 V IH0 NG T EY1 B AH0 L,W UH1 D Y UW1 G OW1 T UW1 R IH0 AW1 EH1 P SH EH1 N T EY1 B AH0 L T EY1 K T OY1 P EH1 NG G W AH0 UW0 N B R IH1 NG IH1 T T UW1 IH1 V IH0 AA0 T EY1 B AH0 OW2 L,Move ( Reception_Table ) Find ( toy_penguin Reception_Table ) Grasp ( toy_penguin ) Move ( Living_Table )
Well go to Kitchen_Table  take Bath_Cleaner  bring it to Dining_Table .,W EH1 L G OW1 T UW1 K IH1 CH AH0 N T EY1 B AH0 L T EY1 K B AE1 TH K L IY1 N ER0 B R IH1 NG IH1 T T UW1 D AY1 N IH0 NG T EY1 B AH0 L,W EH1 L UW2 OW1 T UW1 K IH1 AH0 N T EY1 ER1 B K L T EH2 AW2 AE1 TH K L L IY1 N ER0 OW1 B R IH1 NG IH1 UW1 D AY1 UH2 N IH0 NG T EY1 B EY0 L,Move (  Kitchen_Table ) Find ( Bath_Cleaner Kitchen_Table  ) Grasp ( Bath_Cleaner )  Move ( Dining_Table )
Go to lobby er find a person neayby bring Bath_Cleaner from Kitchen_Table .,G OW1 T UW1 L AA1 B IY0 ER0 F AY1 N D AH0 P ER1 S AH0 N N IH1 R B AY1 B R IH1 NG B AE1 TH K L IY1 N ER0 F R AH1 M K IH1 CH AH0 N T EY1 B AH0 L,OW1 T UW1 L AA1 B IY0 ER0 F AY1 D AH0 ER1 OW0 S AH0 N N IH1 B AY1 B R IH1 AW1 NG IH2 B AE1 K L IY1 N ER0 R AH1 AA0 M K IH1 CH K AH0 N T EY1 B ER0 L,Move ( lobby ) Find ( person lobby ) Move ( Kitchen_Table ) Grasp ( Bath_Cleaner )
Can you go to Visitor_Room Grasp Japanese_Tea  bring it to Sofa .,K AE1 N Y UW1 G OW1 T UW1 V IH1 Z IH0 T ER0 R UW1 M G R AE1 S P JH AE2 P AH0 N IY1 Z T IY1 B R IH1 NG IH1 T T UW1 S OW1 F AH0,K AE1 N Y UW1 G OW1 T UW1 V IH1 Z IH0 T ER0 R UW1 M NG R AE1 S P UH1 JH AE2 P AH0 OY2 N IY1 Z T IY1 B R IH1 NG IH1 T T UW1 S OW1 F AH0,Move ( Visitor_Room ) Find ( Japanese_Tea Visitor_Room ) Grasp ( Japanese_Tea ) Move ( Sofa )  Find ( Japanese_Tea Sofa ) Grasp ( Japanese_Tea ) Move ( Visitor_Room )
Go to Kitchen_Room er find a person neayby bring hourglass from Side_Table .,G OW1 T UW1 K IH1 CH AH0 N R UW1 M ER0 F AY1 N D AH0 P ER1 S AH0 N N IH1 R B AY1 B R IH1 NG AW1 ER0 G L AE2 S F R AH1 M S AY1 D T EY1 B AH0 L,G OW1 T UW1 K IH1 CH AW0 AH0 N R UW1 M ER0 F R AY1 N D AH0 P ER1 S AH0 N N AY R B AY1 SH IH1 ER1 AW1 ER0 G L AE2 R F R AH1 M S AO0 AY1 D T EY1 B AH0 L,Move ( Kitchen_Room ) Find ( person Kitchen_Room ) Move ( Side_Table ) Grasp ( hourglass )
Move to Dining_Sofa  go to Living_Table then exit the apartment .,M UW1 V T UW1 D AY1 N IH0 NG S OW1 F AH0 G OW1 T UW1 L IH1 V IH0 NG T EY1 B AH0 L DH EH1 N EH1 G Z IH0 T DH AH0 AH0 P AA1 R T M AH0 N T,AW0 M UW1 V OY1 UW1 D AY1 N IH0 NG S OW1 F AH0 G OW1 T UW1 L IH1 V IH0 NG T EY1 R AH0 L AA2 EH1 AW2 EH1 G Z EH1 T DH AH0 AH0 P AA1 R T M AH0 N T,Move ( Dining_Sofa ) Move ( Living_Table ) Move ( apartment )
Would you move to Living_Table Grasp toy_car and come back .,W UH1 D Y UW1 M UW1 V T UW1 L IH1 V IH0 NG T EY1 B AH0 L G R AE1 S P T OY1 K AA1 R AH0 N D K AH1 M B AE1 K,W UH1 D Y UW1 M UW1 V T UW1 L IH1 IH0 NG T EY1 B AH0 L G R AE1 IY0 P T OY1 AA1 R AH0 N D K AH1 M UW1 B AE1 K,Move ( Living_Table ) Grasp ( toy_car ) Move ( HERE )
Go to Kitchen_Room  move to Dining_Table  finally leave the apartment .,G OW1 T UW1 K IH1 CH AH0 N R UW1 M M UW1 V T UW1 D AY1 N IH0 NG T EY1 B AH0 L F AY1 N AH0 L IY0 L IY1 V DH AH0 AH0 P AA1 R T M AH0 N T,G OW1 AW2 T UW1 K IH1 CH AH0 OY0 R UW1 M M UW1 V T UW1 UW D AY1 N IH0 NG T EY1 B AH0 IH2 L F AY1 N AH0 L OW IY0 L IY1 V DH AH0 AH0 P AA1 R T M UW1,Move ( Kitchen_Room ) Move ( Dining_Table )  Move ( apartment )
Would you move to Kitchen_Table take Cloth_Cleaner then come back .,W UH1 D Y UW1 M UW1 V T UW1 K IH1 CH AH0 N T EY1 B AH0 L T EY1 K K L AO1 TH K L IY1 N ER0 DH EH1 N K AH1 M B AE1 K,W IH0 UH1 D Y UW1 M UW1 T UW1 K IH1 AH0 AH0 N T EY1 B AH0 L T EY1 K K AO1 TH K L IY1 HH N ER0 DH EH1 N K AH1 M B EY0 AE1 K,Move ( Kitchen_Table ) Find ( Cloth_Cleaner Kitchen_Table ) Grasp ( Cloth_Cleaner ) Move ( HERE )
Go to Kitchen_Room then find a person neayby bring rubik's_cube from Bar .,G OW1 T UW1 K IH1 CH AH0 N R UW1 M DH EH1 N F AY1 N D AH0 P ER1 S AH0 N N IH1 R B AY1 B R IH1 NG R UW1 B IH0 K S K Y UW1 B F R AH1 M B AA1 R,G OW1 UW1 K IH1 CH AH0 N R UW1 M DH EH1 N AY1 N D AH0 P ER1 AA1 OW AW2 N IH1 R AY1 B R NG UW1 B IH0 K N K Y UW1 B F R M B AA1 R,Move ( Kitchen_Room ) Find ( person Kitchen_Room ) Move ( Bar ) Grasp ( rubik's_cube )
Go to Side_Table take Korean_Soup put it on Kitchen_Table please .,G OW1 T UW1 S AY1 D T EY1 B AH0 L T EY1 K K AO2 R IY1 AH0 N S UW1 P P UH1 T IH1 T AA1 N K IH1 CH AH0 N T EY1 B AH0 L P L IY1 Z,G EH2 OW1 T UW1 S AY1 D T EY1 B AH0 L T EY1 K K ER0 R IY1 AH0 N S UW1 P P UH1 T IH1 CH T AA1 N K IH1 CH AH0 N T EY1 HH B AH0 L P L IY1 Z,Move (  Side_Table  ) Find ( Korean_Soup Side_Table  ) Grasp ( Korean_Soup ) Plcae ( Korean_Soup Kitchen_Table )
Go to Dining_Table  and  detect soysauce Grasp it .,G OW1 T UW1 D AY1 N IH0 NG T EY1 B AH0 L AH0 N D D IH0 T EH1 K T S OY1 S AO2 S G R AE1 S P IH1 T,G OW1 T UW1 D AY1 N IH0 NG T OY2 EY1 B AH0 L AH0 N D D IH0 T EH1 UW0 K T S OY1 S S G R AE1 OY1 S P IH1 T,Move (  Dining_Table  ) Find ( soysauce Dining_Table  ) Grasp ( soysauce ) 
Well move to Living_Table Grasp hourglass then come back .,W EH1 L M UW1 V T UW1 L IH1 V IH0 NG T EY1 B AH0 L G R AE1 S P AW1 ER0 G L AE2 S DH EH1 N K AH1 M B AE1 K,N W EH1 L M UW1 V T UW1 L IH1 V ER0 NG T EY1 B AH0 L G R AE1 S P AW1 ER0 G L AE2 S DH EH1 N K AH1 M B AE1 K,Move ( Living_Table ) Move ( hourglass ) Move ( HERE )
Go to Bar then detect cubic_clock  take it .,G OW1 T UW1 B AA1 R DH EH1 N D IH0 T EH1 K T K Y UW1 B IH0 K K L AA1 K T EY1 K IH1 T,G T UW1 B AA1 R IH0 K N D IH0 T EH1 K T K Y UW1 B IH0 K K L AA1 K T EY1 K IH1 T,Move ( Bar ) Find ( cubic_clock Bar ) Grasp ( cubic_clock )  Move ( cubic_clock )
Go to Kitchen_Room take Blue_Potato put it on Kitchen_Table please .,G OW1 T UW1 K IH1 CH AH0 N R UW1 M T EY1 K B L UW1 P AH0 T EY1 T OW2 P UH1 T IH1 T AA1 N K IH1 CH AH0 N T EY1 B AH0 L P L IY1 Z,G OW1 T G UW1 K IH1 CH AH0 N R UW1 M T EY1 K B L UW1 P AH0 T K EY1 T OW2 P UH1 T IH1 T AA1 N IH1 CH AH0 N T EY1 B AH0 L P L IY1 Z,Move ( Kitchen_Room ) Find ( Blue_Potato Kitchen_Room ) Grasp ( Blue_Potato ) Move ( Kitchen_Table ) Place ( Blue_Potato Kitchen_Table )
Go to kitchen  go to Side_Table er leave the apartment .,G OW1 T UW1 K IH1 CH AH0 N G OW1 T UW1 S AY1 D T EY1 B AH0 L ER0 L IY1 V DH AH0 AH0 P AA1 R T M AH0 N T,G OW1 T UW1 K CH AH0 N G OW1 T UW1 S AY1 D T EY1 B AH0 L ER0 L IY1 V DH AH0 AH0 P AA1 R V T EY1 M AH0 V N T,Move ( kitchen ) Move ( Side_Table )  Move ( apartment )
Go to Visitor_Room get nursing_bottle throw it into Dustbin please .,G OW1 T UW1 V IH1 Z IH0 T ER0 R UW1 M G EH1 T N ER1 S IH0 NG B AA1 T AH0 L TH R OW1 IH1 T IH1 N T UW0 D AH1 S T B IH0 N P L IY1 Z,G OW1 T UW1 V IH1 Z IH0 T ER0 M R UW1 OY1 G EH1 T N ER1 S IH0 NG B AA1 T AH0 L EY2 TH OW1 IH1 T IH1 N N UW0 AA2 AH1 S T B IH0 N P L IY1 Z,Move ( Visitor_Room ) Find ( nursing_bottle Visitor_Room ) Grasp ( nursing_bottle ) Move ( Dustbin ) Place ( nursing_bottle Dustbin )
Go to Bar and find a person neayby bring Red_Potato from Side_Table .,G OW1 T UW1 B AA1 R AH0 N D F AY1 N D AH0 P ER1 S AH0 N N IH1 R B AY1 B R IH1 NG R EH1 D P AH0 T EY1 T OW2 F R AH1 M S AY1 D T EY1 B AH0 L,G OW1 Y T UW1 B G AA1 R AH0 N L D F AY1 N D AH0 P ER1 S AH0 N N IH1 R B AY1 B R IH1 NG R EH1 D P AH0 EY1 T EY F R AH1 M S AY1 Y T EY1 B AH0 L,Move (  Bar  ) Find ( Red_Potato Bar  ) Grasp ( Red_Potato ) Find ( pesron Bar ) Plcae ( Red_Potato PERSON )
Would you move to Reception_Table Grasp ground_pepper and come back .,W UH1 D Y UW1 M UW1 V T UW1 R IH0 S EH1 P SH AH0 N T EY1 B AH0 L G R AE1 S P G R AW1 N D P EH1 P ER0 AH0 N D K AH1 M B AE1 K,W UH1 D UW1 M UW1 V T UW1 R IH0 S EH1 P SH EY0 T EY1 B AH0 L G R AE1 S P G R AW1 N D P EH1 P ER0 AH0 N D K HH AH1 B AE1 K,Move ( Reception_Table ) Grasp ( ground_pepper ) Move ( HERE )
Would you move to Sofa get salt bring it to Kitchen_Table .,W UH1 D Y UW1 M UW1 V T UW1 S OW1 F AH0 G EH1 T S AO1 L T B R IH1 NG IH1 T T UW1 K IH1 CH AH0 N T EY1 B AH0 L,W UH1 D Y UW1 M UW1 V T UW1 S OW1 F AH0 G EH1 T S AO1 L T B R IH1 NG IH1 T T UW1 K IH1 CH AH0 N T AY1 B AH0 L,Move ( Sofa ) Find ( salt Sofa  ) Grasp ( salt ) Move ( Kitchen_Table )
Go to Dining_Table and find a person neayby bring empty_plastic_bottle from Dining_Sofa .,G OW1 T UW1 D AY1 N IH0 NG T EY1 B AH0 L AH0 N D F AY1 N D AH0 P ER1 S AH0 N N IH1 R B AY1 B R IH1 NG EH1 M P T IY0 P L AE1 S T IH0 K B AA1 T AH0 L F R AH1 M D AY1 N IH0 NG S OW1 F AH0,G OW1 T UW1 D AY1 N IH0 NG T EY1 B AH0 L AH0 N D F AY1 N D AH0 P ER1 S AH0 N N IH1 R B AY1 B R IH1 IH0 EH1 M P T IY0 P L AE1 S T EY2 IH0 K B AA1 T AH0 L F R AH1 IY1 D AY1 IH0 NG S OW1 F,Move (  Dining_Table  ) Find ( empty_plastic_bottle Dining_Table  ) Grasp ( empty_plastic_bottle ) Find ( pesron Dining_Table ) Plcae ( empty_plastic_bottle PERSON )
Move to Dining_Table and detect Egg_Soup get it .,M UW1 V T UW1 D AY1 N IH0 NG T EY1 B AH0 L AH0 N D D IH0 T EH1 K T EH1 G S UW1 P G EH1 T IH1 T,M UW1 V T UW1 D N IH0 Z EY1 B AH0 L AH0 N D AW D IH0 T EH1 OY2 K T EH1 G S UW1 P G EH1 T IH1 T,Move ( Dining_Table ) Find ( Egg_Soup Dining_Table ) Grasp ( Egg_Soup )
Go to bed_room next find empty_ketchup take it .,G OW1 T UW1 B EH1 D R UW1 M N EH1 K S T F AY1 N D EH1 M P T IY0 K EH1 CH AH0 P T EY1 K IH1 T,G OW1 T UW1 B EH1 D R UW1 M N EH1 K AY1 N D EH1 UW1 M P T IY0 K AY2 EH1 CH AH0 P T EY1 K IH1 T,Move (  bed_room  ) Find ( empty_ketchup bed_room  ) Grasp ( empty_ketchup ) 
