Input,phonemelabel,Noisylabel,Labeldata
Go to Living_Sofa move to Sofa take canned_juice .,G OW1 T UW1 L IH1 V IH0 NG S OW1 F AH0 M UW1 V T UW1 S OW1 F AH0 T EY1 K K AE1 N D JH UW1 S,G OW1 T UW1 L IH1 V IH0 NG S OW1 F AH0 M UW1 V AH1 UH UW1 S OW1 F AH0 T EY1 K AE1 N D JH UW1 S,Move ( Living_Sofa ) Move ( Sofa ) Find ( canned_juice Living_Sofa ) Grasp ( canned_juice ) Move ( HERE )
Well move to Side_Table get twin_bell_alarm_clock and come back .,W EH1 L M UW1 V T UW1 S AY1 D T EY1 B AH0 L G EH1 T T W IH1 N B EH1 L AH0 L AA1 R M K L AA1 K AH0 N D K AH1 M B AE1 K,EH1 L M SH V T HH S AY1 D T EY1 B AH0 L OY1 G EH1 T T W IH1 B EH1 IH L L AA1 R AO1 M AY0 K L AO2 K AH0 N D K AH1 M B AE1 K,Move ( Side_Table ) Grasp ( twin_bell_alarm_clock ) Move ( Side_Table ) Grasp ( twin_bell_alarm_clock ) Move ( HERE )
Would you go to Bar  take Red_Tea  bring it to Living_Table .,W UH1 D Y UW1 G OW1 T UW1 B AA1 R T EY1 K R EH1 D T IY1 B R IH1 NG IH1 T T UW1 L IH1 V IH0 NG T EY1 B AH0 L,W UH1 DH Y UW1 G OW1 T UW1 B AA1 R T UW K R EH1 D IY1 B R IH1 NG IH1 T T UW1 L IH1 V IH0 EY0 NG T EY1 B AH0 L,Move ( Bar ) Find ( Red_Tea Bar ) Grasp ( Red_Tea ) Move ( Living_Table )
Go to Living_Room and find a person neayby bring Japanese_Tea from Reception_Table .,G OW1 T UW1 L IH1 V IH0 NG R UW1 M AH0 N D F AY1 N D AH0 P ER1 S AH0 N N IH1 R B AY1 B R IH1 NG JH AE2 P AH0 N IY1 Z T IY1 F R AH1 M R IH0 S EH1 P SH AH0 N T EY1 B AH0 L,G OW1 T UW1 L IH1 S V IH0 NG R UW1 M AH0 N D F AY1 N D AH0 P ER1 S AH0 N N IH1 R B AY1 B R NG JH AE2 P AH0 N IY1 Z T IY1 F R AH1 M R IH0 IH0 S EH1 P SH N T EY1 B AH0 L,Move ( Living_Room ) Find ( person Living_Room ) Move ( Reception_Table ) Grasp ( Japanese_Tea )  Move ( person )
Go to Dining_Table go to Kitchen_Room  and exit the apartment .,G OW1 T UW1 D AY1 N IH0 NG T EY1 B AH0 L G OW1 T UW1 K IH1 CH AH0 N R UW1 M AH0 N D EH1 G Z IH0 T DH AH0 AH0 P AA1 R T M AH0 N T,G OW1 T UW1 D AY1 N IH0 NG T EY1 B AH0 L G OW1 T UW1 K IH1 CH AH0 N UW1 M AH0 AO2 D EH1 G Z IH0 T DH AH0 AH0 UW0 P AA1 T M AH0 N T,Move ( Dining_Table ) Move ( Dining_Table ) Move ( apartment )
Go to Bar take Orange_Juice put it on Kitchen_Table please .,G OW1 T UW1 B AA1 R T EY1 K AO1 R AH0 N JH JH UW1 S P UH1 T IH1 T AA1 N K IH1 CH AH0 N T EY1 B AH0 L P L IY1 Z,G OW1 T UW1 B AA1 R T EY1 AO1 R AH0 N JH JH UW1 S P UH1 IH1 T AA1 CH K IH1 CH AH0 N T EY1 B L P L IY1 Z,Move (  Bar  ) Find ( Orange_Juice Bar  ) Grasp ( Orange_Juice ) Plcae ( Orange_Juice Kitchen_Table )
Go to Corridor Grasp Orange_Juice place it on Living_Sofa okay .,G OW1 T UW1 K AO1 R AH0 D ER0 G R AE1 S P AO1 R AH0 N JH JH UW1 S P L EY1 S IH1 T AA1 N L IH1 V IH0 NG S OW1 F AH0 OW2 K EY1,G OW1 T UW1 K AO1 AH0 D ER0 G R AE1 S P AO1 R AH0 N JH JH UW1 AO0 S P L EY1 S IH1 T AA1 N L IH1 IH0 NG OW S OW1 F AH0 OW2 K OW1,Move ( Corridor ) Grasp ( Orange_Juice ) Move ( Living_Sofa ) Place ( Orange_Juice Living_Sofa )
Go to lobby and find a person neayby bring Blue_Potato from Living_Sofa .,G OW1 T UW1 L AA1 B IY0 AH0 N D F AY1 N D AH0 P ER1 S AH0 N N IH1 R B AY1 B R IH1 NG B L UW1 P AH0 T EY1 T OW2 F R AH1 M L IH1 V IH0 NG S OW1 F AH0,G OW1 T UW1 OW2 L AA1 B IY0 AH0 N D F AY1 N D AH0 P ER1 S AH0 N N R B AY1 B K R DH AE2 B L UW1 P AH0 T EY1 T OW2 F R AH1 M L IH1 V IH0 NG S OW1 AY2 F AH0,Move ( lobby ) Find ( person lobby ) Move ( Living_Sofa ) Grasp ( Blue_Potato )  Move ( person )
Go to Dining_Sofa take Blue_Potato put it on Side_Table please .,G OW1 T UW1 D AY1 N IH0 NG S OW1 F AH0 T EY1 K B L UW1 P AH0 T EY1 T OW2 P UH1 T IH1 T AA1 N S AY1 D T EY1 B AH0 L P L IY1 Z,G OW1 EY1 UW1 D N G IH0 NG S OW1 F AH0 T IY1 EY1 K B L N AH2 T EY1 T OW2 P UH1 T IH1 T AA1 N S AY1 D T EY1 AH0 L P L IY1 Z,Move (  Dining_Sofa  ) Find ( Blue_Potato Dining_Sofa  ) Grasp ( Blue_Potato ) Plcae ( Blue_Potato Side_Table )
Move to Dining_Sofa  get Cup_Star  exit from lobby okay .,M UW1 V T UW1 D AY1 N IH0 NG S OW1 F AH0 G EH1 T K AH1 P S T AA1 R EH1 G Z IH0 T F R AH1 M L AA1 B IY0 OW2 K EY1,UW1 T OY2 UW1 P D AY1 N IH0 NG S OW1 F AH0 G EH1 T K AH1 P S T OW R EH1 G Z IH0 T F R AH1 M IH1 L B IY0 OW2 K EY1,Move ( Dining_Sofa ) Find ( Cup_Star Dining_Sofa ) Grasp ( Cup_Star ) Move ( lobby )
Go to Dining_Sofa go to Corridor  and exit the apartment .,G OW1 T UW1 D AY1 N IH0 NG S OW1 F AH0 G OW1 T UW1 K AO1 R AH0 D ER0 AH0 N D EH1 G Z IH0 T DH AH0 AH0 P AA1 R T M AH0 N T,G OW1 UW1 D AY1 N IH0 NG EH0 OW1 F AO2 AH0 G OW1 T UW1 AY0 K AO1 R AH0 ER0 AH0 N D EH1 Z IH0 T DH AH0 OY1 P AA1 R M M N T,Move ( Dining_Sofa ) Move ( Dining_Sofa ) Move ( apartment )
Go to Bar  and  detect Japanese_Tea Grasp it .,G OW1 T UW1 B AA1 R AH0 N D D IH0 T EH1 K T JH AE2 P AH0 N IY1 Z T IY1 G R AE1 S P IH1 T,G OW1 T UW1 B AA1 R AH0 N D D IH0 K T JH AE2 P AH0 N IY1 Z T IY1 G R AE1 P IH1 T,Move (  Bar  ) Find ( Japanese_Tea Bar  ) Grasp ( Japanese_Tea ) 
Move to Kitchen_Table  Grasp Egg_Soup  leave the apartment please .,M UW1 V T UW1 K IH1 CH AH0 N T EY1 B AH0 L G R AE1 S P EH1 G S UW1 P L IY1 V DH AH0 AH0 P AA1 R T M AH0 N T P L IY1 Z,M UW1 V T UW1 K IH1 CH AH0 N T EY1 B AH0 L G R AE1 S P EH1 G S UW1 P L IY1 DH AH0 AH0 P AA1 R T M AH0 N T P L IY1 Z,Move ( Kitchen_Table ) Find ( Egg_Soup Kitchen_Table  ) Grasp ( Egg_Soup ) Move ( apartment )
Well get tumbler from Dining_Table go to bed_room go to Visitor_Room .,W EH1 L G EH1 T T AH1 M B L ER0 F R AH1 M D AY1 N IH0 NG T EY1 B AH0 L G OW1 T UW1 B EH1 D R UW1 M G OW1 T UW1 V IH1 Z IH0 T ER0 R UW1 M,W EH1 L IH0 EH1 T T M B L ER0 F AH1 M D AY1 N JH IH0 NG T EY1 B AH0 L G OW1 T UW1 B EH1 D R UW1 M G OW1 T IH1 UW1 V IH1 Z IH0 K ER0 R UW1 M,Move ( Dining_Table ) Find ( tumbler Dining_Table  ) Grasp ( tumbler )  Move ( bed_room ) Move ( Visitor_Room )
Go to bed_room Grasp Blue_Potato throw it into Dustbin please .,G OW1 T UW1 B EH1 D R UW1 M G R AE1 S P B L UW1 P AH0 T EY1 T OW2 TH R OW1 IH1 T IH1 N T UW0 D AH1 S T B IH0 N P L IY1 Z,G OW1 T UW1 B EH1 D AO1 UW1 G R AE1 OY1 S P B L UW1 P AH0 T EY2 T OW2 TH R OW1 T IH1 N T D S B IH0 N P L IY1 Z,Move ( bed_room ) Grasp ( Blue_Potato ) Move ( Dustbin ) Place ( Blue_Potato Dustbin  ) 
Go to Bar then detect Lemon_Tea  take it .,G OW1 T UW1 B AA1 R DH EH1 N D IH0 T EH1 K T L EH1 M AH0 N T IY1 T EY1 K IH1 T,G OW1 T UW1 B AA1 R DH AO1 EH1 N D IH0 T EH1 K T L EH1 M UH N T IY1 T EY1 K IH1,Move ( Bar ) Find ( Lemon_Tea Bar ) Grasp ( Lemon_Tea )  Move ( Lemon_Tea )
Go to Corridor Grasp spray_bottle throw it into Dustbin please .,G OW1 T UW1 K AO1 R AH0 D ER0 G R AE1 S P S P R EY1 B AA1 T AH0 L TH R OW1 IH1 T IH1 N T UW0 D AH1 S T B IH0 N P L IY1 Z,G OW1 T UW1 K AO1 R AH0 AY D ER0 G R S P S P R EY1 B AA1 AH0 L TH R OW1 IH1 T IH1 N T UW0 D AH1 AE2 S T B IH0 N AO2 P L IY1 Z,Move ( Corridor ) Grasp ( spray_bottle ) Move ( Dustbin ) Place ( spray_bottle Dustbin  ) 
Move to Dining_Sofa  get Seafood_Noodle  exit from Visitor_Room okay .,M UW1 V T UW1 D AY1 N IH0 NG S OW1 F AH0 G EH1 T S IY1 F UW2 D N UW1 D AH0 L EH1 G Z IH0 T F R AH1 M V IH1 Z IH0 T ER0 R UW1 M OW2 K EY1,M UW1 V T UW1 D AY1 N IH0 S UW1 OW1 F AH0 G EH1 T S IY1 UW2 D N UW1 D AH0 L EH1 Z IH0 T F M V IH1 Z IH0 T ER0 R UW1 OW2 M K,Move ( Dining_Sofa ) Find ( Seafood_Noodle Dining_Sofa ) Grasp ( Seafood_Noodle ) Move ( Visitor_Room )
Go to Bar take cigarette  leave the apartment please .,G OW1 T UW1 B AA1 R T EY1 K S IH2 G ER0 EH1 T L IY1 V DH AH0 AH0 P AA1 R T M AH0 N T P L IY1 Z,G OW1 T UW1 B AA1 R T EY1 K S IH2 G ER0 EH1 T IY1 Y V DH AH0 P AA1 R T M AH0 N T UH L NG Z,Move ( Bar ) Grasp ( cigarette ) Move ( apartment )
Would you move to Dining_Table Grasp spray_bottle and come back .,W UH1 D Y UW1 M UW1 V T UW1 D AY1 N IH0 NG T EY1 B AH0 L G R AE1 S P S P R EY1 B AA1 T AH0 L AH0 N D K AH1 M B AE1 K,W UH1 D UW1 M UW1 V T UW1 D AY1 N IH0 NG T EY1 B AH0 L G R AE1 S P S P R EY1 B T OW1 L AH0 N D K EY1 AH1 M B AE1 K,Move ( Dining_Table ) Grasp ( spray_bottle ) Move ( HERE )
Can you go to bed_room get toy_duck then come back .,K AE1 N Y UW1 G OW1 T UW1 B EH1 D R UW1 M G EH1 T T OY1 D AH1 K DH EH1 N K AH1 M B AE1 K,AE1 OY1 Y UW2 UW1 G OW1 T UW1 B EH1 EY1 R UW1 M G T T OY1 D AH1 K DH EH1 N K AH1 M EY B AE1,Move (  bed_room  ) Find ( toy_duck bed_room ) Grasp ( toy_duck ) Move ( HERE )
Can you move to Reception_Table get Chip_Star then come back .,K AE1 N Y UW1 M UW1 V T UW1 R IH0 S EH1 P SH AH0 N T EY1 B AH0 L G EH1 T CH IH1 P S T AA1 R DH EH1 N K AH1 M B AE1 K,AE1 N Y UW1 M UW1 AA V T UW1 R IH0 CH S EH1 P SH AH0 T EY1 CH B AH0 L G UW2 T CH IH1 P S T Y R DH EH1 N K AH1 M B AE1 K,Move ( Reception_Table ) Grasp ( Chip_Star ) Move ( HERE )
Go to Kitchen_Room Grasp empty_plastic_bottle throw it into Dustbin please .,G OW1 T UW1 K IH1 CH AH0 N R UW1 M G R AE1 S P EH1 M P T IY0 P L AE1 S T IH0 K B AA1 T AH0 L TH R OW1 IH1 T IH1 N T UW0 D AH1 S T B IH0 N P L IY1 Z,G OW1 UW1 K IH1 CH AH0 N R UW1 UW0 G R AE1 S P OW N EH1 M P T IY0 P L AE1 S T IH0 K B W AA1 T AH0 L TH R OW1 IH1 T IH1 N T UW0 D AH1 S T B IH0 N L IY1 Z,Move ( Kitchen_Room ) Grasp ( empty_plastic_bottle ) Move ( Dustbin ) Place ( empty_plastic_bottle Dustbin  ) 
Go to Bar Grasp rabbit_doll  leave the apartment please .,G OW1 T UW1 B AA1 R G R AE1 S P R AE1 B AH0 T D AA1 L L IY1 V DH AH0 AH0 P AA1 R T M AH0 N T P L IY1 Z,G OW1 ER0 T UW1 B AA1 R G R S R AE1 B AH0 T D L L IY1 V DH Z AH0 AH0 P AA1 R T M AH0 N T P L IY1 Z,Move ( Bar ) Grasp ( rabbit_doll ) Move ( apartment )
Well get Long_Potato from Living_Sofa go to Dining_Room move to Dining_Sofa .,W EH1 L G EH1 T L AO1 NG P AH0 T EY1 T OW2 F R AH1 M L IH1 V IH0 NG S OW1 F AH0 G OW1 T UW1 D AY1 N IH0 NG R UW1 M M UW1 V T UW1 D AY1 N IH0 NG S OW1 F AH0,W EH1 L G EH1 T L AO1 NG AH0 T AH2 T OW2 F OY M ER1 L IH1 AE IH0 NG S OW1 F AH0 G OW1 T UW1 D AY1 N IH0 NG R UW1 M M UW1 V T UW1 D AY1 AW1 N IH0 AW2 S OW1 F AH0,Move ( Living_Sofa ) Grasp ( Long_Potato ) Move ( Dining_Room ) Move ( Dining_Sofa )
Go to lobby Grasp rubik's_cube place it on Dining_Table okay .,G OW1 T UW1 L AA1 B IY0 G R AE1 S P R UW1 B IH0 K S K Y UW1 B P L EY1 S IH1 T AA1 N D AY1 N IH0 NG T EY1 B AH0 L OW2 K EY1,G OW1 T UW1 L AA1 B IY0 G R P R UW1 B IH0 K S K Y UW1 B P L EY1 S IH1 T AA1 N D AY1 N IH0 NG T EY1 B AH0 L OW2 K EY1,Move ( lobby ) Grasp ( rubik's_cube ) Move ( Dining_Table ) Place ( rubik's_cube Dining_Table )
Would you move to Reception_Table take Red_Potato then come back .,W UH1 D Y UW1 M UW1 V T UW1 R IH0 S EH1 P SH AH0 N T EY1 B AH0 L T EY1 K R EH1 D P AH0 T EY1 T OW2 DH EH1 N K AH1 M B AE1 K,W UH1 D Y UW1 M UW1 V T UW1 IH0 S EH1 P M SH EH2 T EY1 B AH0 L T EY1 AY R EH1 D P AH0 T EY1 T OW2 DH N K AH1 M AE1 K,Move ( Reception_Table ) Find ( Red_Potato Reception_Table ) Grasp ( Red_Potato ) Move ( HERE )
Go to lobby take Cup_Star place it on Kitchen_Table okay .,G OW1 T UW1 L AA1 B IY0 T EY1 K K AH1 P S T AA1 R P L EY1 S IH1 T AA1 N K IH1 CH AH0 N T EY1 B AH0 L OW2 K EY1,G OW1 T UW1 L AA1 B IY0 T EY1 K K AH1 P S T AA1 R P L EY1 S IH1 T AA1 N K IH1 CH AH0 N T EY1 B AH0 L OW2 EY0 IH2 K EY1,Move (  lobby  ) Find ( Cup_Star lobby ) Grasp ( Cup_Star ) Move ( Kitchen_Table )
Go to Visitor_Room next find Korean_Soup take it .,G OW1 T UW1 V IH1 Z IH0 T ER0 R UW1 M N EH1 K S T F AY1 N D K AO2 R IY1 AH0 N S UW1 P T EY1 K IH1 T,G OW1 T UW1 V IH1 ER2 Z IH0 T ER0 AA2 R UW1 M N EH1 K S T F N D K AO2 R IY1 AH0 N S AO0 UW1 P EY1 K IH1 T,Move (  Visitor_Room  ) Find ( Korean_Soup Visitor_Room  ) Grasp ( Korean_Soup ) 
Would you bring Japanese_Dressing from Dining_Sofa go to Kitchen_Table go to Living_Sofa  .,W UH1 D Y UW1 B R IH1 NG JH AE2 P AH0 N IY1 Z D R EH1 S IH0 NG F R AH1 M D AY1 N IH0 NG S OW1 F AH0 G OW1 T UW1 K IH1 CH AH0 N T EY1 B AH0 L G OW1 T UW1 L IH1 V IH0 NG S OW1 F AH0,W UH1 D Y UW1 B R IH1 NG JH AE2 P AH0 M N Z D R EH1 S IH0 NG F AO1 M D AY1 IH0 NG OW1 F AH0 G OW1 T UW1 K IH1 CH AH0 N T EY1 W B AH0 L G T L IH1 V IH0 NG S OW1 F AH0,Move ( Dining_Sofa ) Place ( Japanese_Dressing Dining_Sofa ) Move ( Kitchen_Table ) Move ( Kitchen_Table ) 
Would you go to Corridor Grasp filled_plastic_bottle er come back .,W UH1 D Y UW1 G OW1 T UW1 K AO1 R AH0 D ER0 G R AE1 S P F IH1 L D P L AE1 S T IH0 K B AA1 T AH0 L ER0 K AH1 M B AE1 K,W UH1 D Y UW1 G OW1 T UW1 UW2 R AH0 D ER0 G R IY1 AE1 S P AW2 IH1 L D P L AE1 S T OY0 IH0 K B AA1 T AH0 L ER0 K AH1 M B AE1 K,Move ( Corridor ) Find ( filled_plastic_bottle Corridor ) Move ( HERE )
Go to Side_Table find a person neayby finally follow a person .,G OW1 T UW1 S AY1 D T EY1 B AH0 L F AY1 N D AH0 P ER1 S AH0 N N IH1 R B AY1 F AY1 N AH0 L IY0 F AA1 L OW0 AH0 P ER1 S AH0 N,AW0 OW1 T UW1 S B AY1 D T EY1 B AH0 Y L F AY1 N D AH0 P ER1 S AH0 N N IH1 R B AY1 F AY1 N AH0 L IY0 F AA1 L OW0 AH0 P ER1 S AH0 HH,Move ( Side_Table ) Find ( person Side_Table  ) Follow ( person )
Go to Dining_Room next find Red_Tea Grasp it .,G OW1 T UW1 D AY1 N IH0 NG R UW1 M N EH1 K S T F AY1 N D R EH1 D T IY1 G R AE1 S P IH1 T,G OW1 T UW1 D AY1 N IH0 NG R UW1 M N EH1 K S T F AY1 N D R EH1 D T IY1 G R AE1 S P IH1 T,Move ( Dining_Room ) Find ( Red_Tea Dining_Room ) Grasp ( Red_Tea )
Well go to Kitchen_Table  take cigarette finally come back .,W EH1 L G OW1 T UW1 K IH1 CH AH0 N T EY1 B AH0 L T EY1 K S IH2 G ER0 EH1 T F AY1 N AH0 L IY0 K AH1 M B AE1 K,W EH1 L G OW1 T UW1 K IH1 AA0 AH0 N ER1 B AH0 L T EY1 K S IH2 G ER0 EH1 T F AY1 N AH0 L IY0 K AH1 M B AE1 K,Move ( Kitchen_Table ) Grasp ( cigarette ) Move ( HERE )
Go to Living_Sofa move to Dining_Table take toy_penguin .,G OW1 T UW1 L IH1 V IH0 NG S OW1 F AH0 M UW1 V T UW1 D AY1 N IH0 NG T EY1 B AH0 L T EY1 K T OY1 P EH1 NG G W AH0 N,EY G OW1 UW1 L IH1 V IH0 NG S OW1 EH1 AH0 M UW1 V T UW1 UH0 D AY1 N IH0 NG T EY1 B AH0 L T EY1 K T OY1 P EH1 NG G W N,Move ( Living_Sofa ) Move ( Dining_Table ) Find ( toy_penguin Living_Sofa ) Grasp ( toy_penguin ) Move ( HERE )
Go to kitchen next find canned_juice take it .,G OW1 T UW1 K IH1 CH AH0 N N EH1 K S T F AY1 N D K AE1 N D JH UW1 S T EY1 K IH1 T,G OW1 UW1 K IH1 CH AH0 N K S T F L AY1 N D K AE1 W N JH UW1 S T EY1 K IH1 T,Move (  kitchen  ) Find ( canned_juice kitchen  ) Grasp ( canned_juice ) 
Go to Visitor_Room go to Living_Sofa  and exit from Corridor .,G OW1 T UW1 V IH1 Z IH0 T ER0 R UW1 M G OW1 T UW1 L IH1 V IH0 NG S OW1 F AH0 AH0 N D EH1 G Z IH0 T F R AH1 M K AO1 R AH0 D ER0,AH0 G OW1 T UW1 V IH1 Z IH0 T ER0 R UW1 G OW1 T M UW1 L IH1 V NG S OW1 F AH0 AH0 N D EH1 G Z AY AW2 IH0 F R AH1 M K AO1 R AH0 AY ER0,Move ( Visitor_Room ) Move ( Living_Sofa ) Move ( Corridor )
Can you go to Kitchen_Room get rubik's_cube then come back .,K AE1 N Y UW1 G OW1 T UW1 K IH1 CH AH0 N R UW1 M G EH1 T R UW1 B IH0 K S K Y UW1 B DH EH1 N K AH1 M B AE1 K,K N Y UW1 G OW1 T UW1 K IH1 CH AH0 N R UW1 M G EH1 T R UW1 B IH0 K S K Y UW1 AY B DH EH1 N K AH1 M B AE1 K,Move (  Kitchen_Room  ) Find ( rubik's_cube Kitchen_Room ) Grasp ( rubik's_cube ) Move ( HERE )
Would you go to Dining_Sofa take empty_ketchup er come back .,W UH1 D Y UW1 G OW1 T UW1 D AY1 N IH0 NG S OW1 F AH0 T EY1 K EH1 M P T IY0 K EH1 CH AH0 P ER0 K AH1 M B AE1 K,W UH1 D Y UW1 G OW1 AH0 T UW1 SH D AY1 P IH0 NG OW1 F AH0 T EY1 K EH1 M P T IY0 AO2 EH1 CH AH0 P ER0 G K AH1 M B AO0 AE1 K,Move ( Dining_Sofa ) Find ( empty_ketchup Dining_Sofa ) Grasp ( empty_ketchup ) Move ( HERE )
Go to kitchen then find a person neayby bring canned_juice from Living_Table .,G OW1 T UW1 K IH1 CH AH0 N DH EH1 N F AY1 N D AH0 P ER1 S AH0 N N IH1 R B AY1 B R IH1 NG K AE1 N D JH UW1 S F R AH1 M L IH1 V IH0 NG T EY1 B AH0 L,CH G OW1 T UW1 K IH1 AO CH AH0 N DH EH1 N AY1 N D AH0 P ER1 S AH0 B N IH1 R B AY1 B R EH0 NG K AE1 AE0 D JH UW1 S F R AH1 M L IH1 V IH0 NG T EY1 AH0 L,Move ( kitchen ) Find ( person kitchen ) Move ( Living_Table ) Grasp ( canned_juice )
Can you go to Living_Room get sugar then come back .,K AE1 N Y UW1 G OW1 T UW1 L IH1 V IH0 NG R UW1 M G EH1 T SH UH1 G ER0 DH EH1 N K AH1 M B AE1 K,K AE1 N Y UW1 G T UW1 L IH1 V IY2 NG R UW1 M G EH1 T SH UH1 G ER0 DH EH1 N AH1 M B IY,Move (  Living_Room  ) Find ( sugar Living_Room ) Grasp ( sugar ) Move ( HERE )
Would you go to Side_Table  take Stick_Potato  bring it to Dining_Sofa .,W UH1 D Y UW1 G OW1 T UW1 S AY1 D T EY1 B AH0 L T EY1 K S T IH1 K P AH0 T EY1 T OW2 B R IH1 NG IH1 T T UW1 D AY1 N IH0 NG S OW1 F AH0,W UH1 D Y UW1 G OW1 T UW1 S AY1 D T EY1 B AH0 L T EY1 K S T IH1 K P AH0 T EY1 T OW2 B R ER1 NG IH1 T ER UW1 D AY1 N IH0 NG UW2 OW1 F AH0,Move ( Side_Table ) Find ( Stick_Potato Side_Table ) Grasp ( Stick_Potato ) Move ( Dining_Sofa )
Call a person then ask for an order get Red_Potato from Living_Sofa .,K AO1 L AH0 P ER1 S AH0 N DH EH1 N AE1 S K F AO1 R AE1 N AO1 R D ER0 G EH1 T R EH1 D P AH0 T EY1 T OW2 F R AH1 M L IH1 V IH0 NG S OW1 F AH0,K AO1 L AH0 P ER1 S AH0 N DH EH1 N AE1 S K F AO1 AE1 N AO1 R D ER0 G EH1 T R L P AH0 T EY1 T OW2 F R AH1 M L IH1 IH0 NG S OW1 F AH0,Say ( person ) Listen ( Red_Potato ) Move ( Living_Sofa ) Find ( Red_Potato Living_Sofa ) Grasp ( Red_Potato ) Move ( Red_Potato ) Place ( Red_Potato Living_Sofa ) 
Go to Kitchen_Table move to Side_Table  then leave the apartment .,G OW1 T UW1 K IH1 CH AH0 N T EY1 B AH0 L M UW1 V T UW1 S AY1 D T EY1 B AH0 L DH EH1 N L IY1 V DH AH0 AH0 P AA1 R T M AH0 N T,G OW1 T UW1 K IH1 CH AH0 N T EY1 B AH0 L M UW1 V EY1 UW1 S AY1 D T DH AH0 L DH EH1 N L IY1 V DH AH0 AH0 P AA1 UH0 T M AH0 N T,Move ( Kitchen_Table ) Move ( Side_Table ) Move ( apartment )
Go to Bar take Blue_Potato put it on Sofa please .,G OW1 T UW1 B AA1 R T EY1 K B L UW1 P AH0 T EY1 T OW2 P UH1 T IH1 T AA1 N S OW1 F AH0 P L IY1 Z,G EY1 T UW1 B AA1 R T EY1 K B L P AH0 T EY1 T OW2 P T IH1 T AA1 N S OW1 F AH0 P L IY1 Z,Move (  Bar  ) Find ( Blue_Potato Bar  ) Grasp ( Blue_Potato ) Plcae ( Blue_Potato Sofa )
Go to Dining_Sofa and find a person neayby bring spray_bottle from Bar .,G OW1 T UW1 D AY1 N IH0 NG S OW1 F AH0 AH0 N D F AY1 N D AH0 P ER1 S AH0 N N IH1 R B AY1 B R IH1 NG S P R EY1 B AA1 T AH0 L F R AH1 M B AA1 R,G OW1 T UW1 D G N IH0 NG OW1 F AH0 AH0 N D UW F AY1 N D EH P ER1 S AE2 AW2 N N IH1 R B AY1 B R IH1 NG S P R EY1 B AA1 T AH0 L F R AH1 TH B AA1 R,Move (  Dining_Sofa  ) Find ( spray_bottle Dining_Sofa  ) Grasp ( spray_bottle ) Find ( pesron Dining_Sofa ) Plcae ( spray_bottle PERSON )
Go to Side_Table move to Living_Table  then leave the apartment .,G OW1 T UW1 S AY1 D T EY1 B AH0 L M UW1 V T UW1 L IH1 V IH0 NG T EY1 B AH0 L DH EH1 N L IY1 V DH AH0 AH0 P AA1 R T M AH0 N T,G OW1 T G AY EH UW1 S AY1 D T EY1 B IH AH0 L UW1 T UW1 L IH1 V IH0 W T EY1 EH0 B AH0 L DH EH1 N L IY1 V DH AH0 IH1 AH0 P AA1 R T M AH0 N T,Move ( Side_Table ) Move ( Living_Table ) Move ( apartment )
Well get ground_pepper from Living_Table go to bed_room go to Kitchen_Room .,W EH1 L G EH1 T G R AW1 N D P EH1 P ER0 F R AH1 M L IH1 V IH0 NG T EY1 B AH0 L G OW1 T UW1 B EH1 D R UW1 M G OW1 T UW1 K IH1 CH AH0 N R UW1 M,W EH1 L G EH1 T G R AW1 N D P EH1 P ER0 OW0 F R AH1 M L IH1 V JH NG T EY1 B AH0 L G OW1 T UW1 B EH1 D R M G OW1 UW1 K IH1 AO CH AH0 N R AE2 M,Move ( Living_Table ) Find ( ground_pepper Living_Table  ) Grasp ( ground_pepper )  Move ( bed_room ) Move ( Kitchen_Room )
Go to Living_Table find a person neayby  er follow a person .,G OW1 T UW1 L IH1 V IH0 NG T EY1 B AH0 L F AY1 N D AH0 P ER1 S AH0 N N IH1 R B AY1 ER0 F AA1 L OW0 AH0 P ER1 S AH0 N,G OW1 T UW1 L IH1 V IH0 NG T EY1 B AH0 L F AY1 N D AH0 P ER1 S AH0 AY0 N IH1 R B AY1 ER0 F AA1 L OW0 AH0 P S AH0 N,Move ( Living_Table ) Find ( person Living_Table ) Follow ( person )
Go to Dining_Sofa Grasp Stick_Potato  leave the apartment please .,G OW1 T UW1 D AY1 N IH0 NG S OW1 F AH0 G R AE1 S P S T IH1 K P AH0 T EY1 T OW2 L IY1 V DH AH0 AH0 P AA1 R T M AH0 N T P L IY1 Z,G OW1 T UW1 D AY1 N ER2 IH0 ER0 S OW1 F AH0 G R AE1 S P T IY UH P AH0 Z EY1 T OW2 L IY1 V DH AH0 P AA1 R T M AH0 N P L IY1 Z,Move ( Dining_Sofa ) Grasp ( Stick_Potato ) Move ( apartment )
Would you bring Cup_Star from Dining_Table go to Living_Sofa go to Kitchen_Table  .,W UH1 D Y UW1 B R IH1 NG K AH1 P S T AA1 R F R AH1 M D AY1 N IH0 NG T EY1 B AH0 L G OW1 T UW1 L IH1 V IH0 NG S OW1 F AH0 G OW1 T UW1 K IH1 CH AH0 N T EY1 B AH0 L,W UH1 Y B UW0 R IH1 NG K AH1 UW0 P S T AA1 R R AH1 M D AY1 N AO1 IH0 NG T W P EY1 B AH0 AW1 G OW1 T UW1 L HH V IH0 NG EY0 S OW1 F AH0 G OW1 T UW1 K IH1 CH AH0 EH2 N T EY1 B AH0 L,Move ( Dining_Table ) Place ( Cup_Star Dining_Table ) Move ( Living_Sofa ) Move ( Living_Sofa ) 
Go to Reception_Table go to lobby  and leave the apartment .,G OW1 T UW1 R IH0 S EH1 P SH AH0 N T EY1 B AH0 L G OW1 T UW1 L AA1 B IY0 AH0 N D L IY1 V DH AH0 AH0 P AA1 R T M AH0 N T,UW2 G OW1 T EH0 UW1 R IH0 S EH1 P SH AH0 N T EY1 B AH0 L G OW1 T ER1 UW1 L AA1 B IY0 AH0 N D L OY2 IY1 V DH AH0 AH0 P AA1 R T M N T,Move ( Reception_Table )  Move ( lobby )  Move ( apartment )
Go to Side_Table next detect Japanese_Tea  take it .,G OW1 T UW1 S AY1 D T EY1 B AH0 L N EH1 K S T D IH0 T EH1 K T JH AE2 P AH0 N IY1 Z T IY1 T EY1 K IH1 T,G OW1 T UW1 S AY1 D T EY1 B AH0 L N EH1 OW1 S T AE2 D IH0 T EH1 K T JH P AH0 N IY1 Z T IY1 T EY1 K IH1 T,Move ( Side_Table ) Find ( Japanese_Tea Side_Table  ) Grasp ( Japanese_Tea )
Move to Living_Sofa get pink_cup place it on Living_Table okay .,M UW1 V T UW1 L IH1 V IH0 NG S OW1 F AH0 G EH1 T P IH1 NG K K AH1 P P L EY1 S IH1 T AA1 N L IH1 V IH0 NG T EY1 B AH0 L OW2 K EY1,M UW1 V T UW1 L IH1 UH2 IH0 NG IY0 S OW1 F AH0 EH1 T P IH1 NG K AH1 P P L EY1 S IH1 B T AA1 L UH2 Y IH1 V IH0 NG T ER1 B AH0 L OW2 K EY1,Move ( Living_Sofa ) Find ( pink_cup Living_Sofa  ) Grasp ( pink_cup )  Move ( Living_Table ) Place ( pink_cup Living_Sofa )
Go to lobby next find ground_pepper Grasp it .,G OW1 T UW1 L AA1 B IY0 N EH1 K S T F AY1 N D G R AW1 N D P EH1 P ER0 G R AE1 S P IH1 T,G OW1 T UW1 L AA1 B IY0 N K S T F AY1 N D G R N D P EH1 P IH1 ER0 G R S P IH1 OY2 T,Move ( lobby ) Find ( ground_pepper lobby ) Grasp ( ground_pepper )
Move to Living_Sofa  Grasp Dish_Cleaner  leave the apartment please .,M UW1 V T UW1 L IH1 V IH0 NG S OW1 F AH0 G R AE1 S P D IH1 SH K L IY1 N ER0 L IY1 V DH AH0 AH0 P AA1 R T M AH0 N T P L IY1 Z,M AO0 UW1 V T UW1 V G IH0 NG S OW1 F AH0 T R AE1 S D IH1 SH K L IY1 N ER0 L IY1 V DH AH0 UW0 K AH0 P OW2 AA1 R T M AH0 N T P L IY1 Z,Move ( Living_Sofa ) Find ( Dish_Cleaner Living_Sofa  ) Grasp ( Dish_Cleaner ) Move ( apartment )
Go to bed_room  find a person neayby  finally follow a person .,G OW1 T UW1 B EH1 D R UW1 M F AY1 N D AH0 P ER1 S AH0 N N IH1 R B AY1 F AY1 N AH0 L IY0 F AA1 L OW0 AH0 P ER1 S AH0 N,G OW1 T UW1 B EH1 D R UW1 M F AY1 N D AH0 P M S AH0 N OW ER2 N IH1 R B AY1 F AY1 N AH0 AO IY0 F AA1 AW2 L OW0 AH0 P ER1 AW1 AH1 AH0 N,Move ( bed_room ) Find ( person bed_room ) Follow ( person )
Call a person then ask for an order get Lemon_Tea from Living_Table .,K AO1 L AH0 P ER1 S AH0 N DH EH1 N AE1 S K F AO1 R AE1 N AO1 R D ER0 G EH1 T L EH1 M AH0 N T IY1 F R AH1 M L IH1 V IH0 NG T EY1 B AH0 L,K AO1 IY1 AH0 P ER1 S AH0 AE N DH EH1 N AE1 S K F AO1 R AE1 N AO1 R D ER0 G EH1 T L EH1 AE2 M AH0 N T IY1 F CH R AH1 M V IH0 NG T EY1 B AH0 L,Say ( person ) Listen ( Lemon_Tea ) Move ( Living_Table ) Find ( Lemon_Tea Living_Table ) Grasp ( Lemon_Tea ) Move ( Lemon_Tea ) Place ( Lemon_Tea Living_Table ) 
Go to kitchen  go to Living_Table then exit the apartment .,G OW1 T UW1 K IH1 CH AH0 N G OW1 T UW1 L IH1 V IH0 NG T EY1 B AH0 L DH EH1 N EH1 G Z IH0 T DH AH0 AH0 P AA1 R T M AH0 N T,OW1 T UW1 IH1 CH N G OW1 Z T UW1 L V IH0 NG T EY1 N B AH0 L IY0 DH N EH1 G Z IH0 T DH AH0 AH0 P AA1 R T M N T,Move ( kitchen ) Move ( Living_Table )  Move ( apartment )
Can you go to Dining_Room get toy_car then come back .,K AE1 N Y UW1 G OW1 T UW1 D AY1 N IH0 NG R UW1 M G EH1 T T OY1 K AA1 R DH EH1 N K AH1 M B AE1 K,K AE1 N Y UW1 OW1 T UW1 UW2 AY1 N IH0 NG R UW1 M G EH1 T T OY1 AE1 AA1 R DH EH1 N K AH1 M B AE1 K,Move (  Dining_Room  ) Find ( toy_car Dining_Room ) Grasp ( toy_car ) Move ( HERE )
Would you go to Dining_Table  take apple  bring it to Reception_Table .,W UH1 D Y UW1 G OW1 T UW1 D AY1 N IH0 NG T EY1 B AH0 L T EY1 K AE1 P AH0 L B R IH1 NG IH1 T T UW1 R IH0 S EH1 P SH AH0 N T EY1 B AH0 L,W D Y UW1 G OW1 T UW1 P AY1 N IH0 NG T EY1 B AH0 L T EY1 K AE1 AW P AH0 L IY1 B R IH1 OW1 IH1 DH T UW1 R IH0 ER2 S EH1 OY0 SH AH0 N T EY1 B AH0 L,Move ( Dining_Table ) Find ( apple Dining_Table ) Grasp ( apple ) Move ( Reception_Table )
Can you bring sauce from Sofa go to bed_room move to Kitchen_Table .,K AE1 N Y UW1 B R IH1 NG S AO1 S F R AH1 M S OW1 F AH0 G OW1 T UW1 B EH1 D R UW1 M M UW1 V T UW1 K IH1 CH AH0 N T EY1 B AH0 L,K AE1 N UW1 R IH1 NG AO1 S F R AH1 M S AH2 OW1 F AH0 G OW1 T UW1 B EH1 D R UW1 M M UW1 V T UW1 K AO1 IH1 CH N T EY1 B AH0 AY L,Move ( Sofa ) Find ( sauce Sofa  ) Grasp ( sauce ) Move ( bed_room ) ( Kitchen_Table )
Go to lobby take rabbit_doll place it on Bar okay .,G OW1 T UW1 L AA1 B IY0 T EY1 K R AE1 B AH0 T D AA1 L P L EY1 S IH1 T AA1 N B AA1 R OW2 K EY1,OW1 T UW1 L AA1 B IY0 T EY1 K R AE1 B AH0 T D EY2 AW0 L P G EY1 S IH1 T TH AA1 N B AA1 R OW2 EY1,Move (  lobby  ) Find ( rabbit_doll lobby ) Grasp ( rabbit_doll ) Move ( Bar )
Go to Visitor_Room Grasp Chip_Star place it on Side_Table okay .,G OW1 T UW1 V IH1 Z IH0 T ER0 R UW1 M G R AE1 S P CH IH1 P S T AA1 R P L EY1 S IH1 T AA1 N S AY1 D T EY1 B AH0 L OW2 K EY1,G OW1 T UW1 V IH1 Z IH0 T ER0 R UW1 M G AE1 S P CH IH1 P S T AA1 R P L EY1 S IH1 T AA1 N S AW2 AY1 D T EY1 S B AH0 L OW2 K EY1,Move ( Visitor_Room ) Grasp ( Chip_Star ) Move ( Side_Table ) Place ( Chip_Star Side_Table )
Go to Sofa  and  detect toy_duck Grasp it .,G OW1 T UW1 S OW1 F AH0 AH0 N D D IH0 T EH1 K T T OY1 D AH1 K G R AE1 S P IH1 T,G OW1 T UW1 S OW1 F AH0 AH0 N D D IH0 T M EH1 K T T OY1 D K G R AE1 P T,Move (  Sofa  ) Find ( toy_duck Sofa  ) Grasp ( toy_duck ) 
Can you go to bed_room get Red_Potato then come back .,K AE1 N Y UW1 G OW1 T UW1 B EH1 D R UW1 M G EH1 T R EH1 D P AH0 T EY1 T OW2 DH EH1 N K AH1 M B AE1 K,K AE1 N Y UW1 G OW1 T UW1 B EH1 D R UW1 M G EH1 T R EH1 D P AH0 T EY1 T OW2 DH EH1 N K AH1 M B AE1 OY K,Move (  bed_room  ) Find ( Red_Potato bed_room ) Grasp ( Red_Potato ) Move ( HERE )
