Input,phonemelabel,Noisylabel,Labeldata
Can you bring white_cup from Bar go to lobby move to Living_Sofa .,K AE1 N Y UW1 B R IH1 NG W AY1 T K AH1 P F R AH1 M B AA1 R G OW1 T UW1 L AA1 B IY0 M UW1 V T UW1 L IH1 V IH0 NG S OW1 F AH0,K AE1 N Y UW1 B IY1 IH1 AY0 W AY1 T K AH1 F R AH1 EY B AA1 R G OW1 T UW1 L AA1 B IY0 UW1 V T UW1 L IH1 IH0 NG S OW1 F AH0,Move ( Bar ) Find ( white_cup Bar  ) Grasp ( white_cup ) Move ( lobby ) ( Living_Sofa )
Would you bring white_cup from Reception_Table move to Sofa go to Living_Room .,W UH1 D Y UW1 B R IH1 NG W AY1 T K AH1 P F R AH1 M R IH0 S EH1 P SH AH0 N T EY1 B AH0 L M UW1 V T UW1 S OW1 F AH0 G OW1 T UW1 L IH1 V IH0 NG R UW1 M,W UH1 D Y UW1 B R IH1 OW0 W AY1 T K AH1 F R AH1 M R IH0 UW1 S EH1 P SH AH0 N T F EY1 B AH0 L M UW1 V T UW1 S OW1 EH F AH0 G OW1 T UW0 IY1 L IH1 V IH0 NG R UW1 M,Move ( Reception_Table ) Find ( white_cup Reception_Table ) Move ( Sofa ) Move ( Living_Room )
Can you go to kitchen get Cup_Star then come back .,K AE1 N Y UW1 G OW1 T UW1 K IH1 CH AH0 N G EH1 T K AH1 P S T AA1 R DH EH1 N K AH1 M B AE1 K,NG AE1 N Y UW1 G OW1 T UW1 K IH1 CH AH0 OY0 N G EH1 T K AH1 P S Z AA1 R DH EH1 N K AH1 M B AE1 K,Move (  kitchen  ) Find ( Cup_Star kitchen ) Grasp ( Cup_Star ) Move ( HERE )
Go to Living_Table move to Living_Sofa take Red_Tea .,G OW1 T UW1 L IH1 V IH0 NG T EY1 B AH0 L M UW1 V T UW1 L IH1 V IH0 NG S OW1 F AH0 T EY1 K R EH1 D T IY1,UW0 G OW1 T SH UW1 L IH1 AH1 V IH0 NG T EY1 B AH0 L M UW1 V T UW1 L IH1 V IH0 NG AA2 OW1 F AH0 T EY1 K R EH1 D AW2 IY1 T,Move ( Living_Table ) Move ( Living_Sofa ) Find ( Red_Tea Living_Table ) Grasp ( Red_Tea ) Move ( HERE )
Go to kitchen next find a person neayby get cigarette from Sofa .,G OW1 T UW1 K IH1 CH AH0 N N EH1 K S T F AY1 N D AH0 P ER1 S AH0 N N IH1 R B AY1 G EH1 T S IH2 G ER0 EH1 T F R AH1 M S OW1 F AH0,G OW1 T UW1 K IH1 CH AH0 N N EH1 K S T F AY1 AY N D AH0 P ER1 S AH0 N N ER2 R B G EH1 T S IH2 G ER0 EH1 N AO2 F R AH1 M S OW1 F AH0,Move ( kitchen ) Find ( person ) Move ( Sofa ) Grasp ( cigarette )
Would you move to Reception_Table get empty_ketchup bring it to Side_Table .,W UH1 D Y UW1 M UW1 V T UW1 R IH0 S EH1 P SH AH0 N T EY1 B AH0 L G EH1 T EH1 M P T IY0 K EH1 CH AH0 P B R IH1 NG IH1 T T UW1 S AY1 D T EY1 B AH0 L,W UH1 D Y UW1 OY1 UW1 V T UW1 R IH0 S P SH AH0 AH N CH T EY1 B AH0 AW0 G OW EH1 T EH1 M P T IY0 K IH0 EH1 CH AH0 P B R IH1 NG IH1 T T UW1 S AY1 D JH T EY1 B EH1 D L,Move ( Reception_Table ) Find ( empty_ketchup Reception_Table  ) Grasp ( empty_ketchup ) Move ( Side_Table )
Go to Sofa move to Dining_Table  then leave the apartment .,G OW1 T UW1 S OW1 F AH0 M UW1 V T UW1 D AY1 N IH0 NG T EY1 B AH0 L DH EH1 N L IY1 V DH AH0 AH0 P AA1 R T M AH0 N T,G OW1 T UW1 S OW1 F AE2 AH0 M UW1 V UW1 D N IH0 AW T EY1 B AH0 L W EH1 N L IY1 V DH AH0 AH0 P AA1 R T M AH0 N T,Move ( Sofa ) Move ( Dining_Table ) Move ( apartment )
Go to Dining_Room  go to Living_Table er leave the apartment .,G OW1 T UW1 D AY1 N IH0 NG R UW1 M G OW1 T UW1 L IH1 V IH0 NG T EY1 B AH0 L ER0 L IY1 V DH AH0 AH0 P AA1 R T M AH0 N T,G OW1 T UW1 D N IH0 NG R UW1 M G OW1 T UW1 L IH1 V IH0 AA NG T EY1 AH0 AY0 AH0 ER ER1 L ER0 L IY1 V DH AH0 AH0 R T M AH0 N T,Move ( Dining_Room ) Move ( Living_Table )  Move ( apartment )
Can you go to Living_Sofa take camera carry it to Dining_Sofa .,K AE1 N Y UW1 G OW1 T UW1 L IH1 V IH0 NG S OW1 F AH0 T EY1 K K AE1 M ER0 AH0 K AE1 R IY0 IH1 T T UW1 D AY1 N IH0 NG S OW1 F AH0,K AE1 N Y UW1 G OW1 T UW1 L IH1 V IH IH0 NG S OW1 ER2 F T EY1 K V IH0 AE1 M ER0 AH0 K UW AE1 R IY0 IH1 T T UW1 D AY1 N B NG S OW1 F AH0,Move ( Living_Sofa  ) Find ( camera Living_Sofa ) Grasp ( camera ) Move ( Dining_Sofa )
Go to Kitchen_Room next find filled_plastic_bottle Grasp it .,G OW1 T UW1 K IH1 CH AH0 N R UW1 M N EH1 K S T F AY1 N D F IH1 L D P L AE1 S T IH0 K B AA1 T AH0 L G R AE1 S P IH1 T,G OW1 T UW1 OW0 K IH1 CH AH0 R UW1 M N EH1 K S T F N D F IH1 L D P L AE1 IY S T IH0 K B AA1 T AH0 L OW1 G R AE1 S P IH1 T,Move ( Kitchen_Room ) Find ( filled_plastic_bottle Kitchen_Room ) Grasp ( filled_plastic_bottle )
Go to Living_Sofa go to Dining_Room  and exit the apartment .,G OW1 T UW1 L IH1 V IH0 NG S OW1 F AH0 G OW1 T UW1 D AY1 N IH0 NG R UW1 M AH0 N D EH1 G Z IH0 T DH AH0 AH0 P AA1 R T M AH0 N T,G OW1 T UW1 L IH1 V NG S OW1 F AO AH0 G OW1 UW1 D AY1 N IH0 NG R UW1 M AH0 N D EH1 G Z IH0 T DH AH0 AH0 P AA1 R T M AH0 N T,Move ( Living_Sofa ) Move ( Living_Sofa ) Move ( apartment )
Move to Dining_Table get rubik's_cube place it on Side_Table okay .,M UW1 V T UW1 D AY1 N IH0 NG T EY1 B AH0 L G EH1 T R UW1 B IH0 K S K Y UW1 B P L EY1 S IH1 T AA1 N S AY1 D T EY1 B AH0 L OW2 K EY1,M UW1 V T UW1 D AY1 P N IH0 NG T EY1 B AW AH0 G EH1 T R UW1 B IH0 K S K UW1 P L EY1 T AA1 N S AY1 D T EY1 B AH0 L OW2 K EY1,Move ( Dining_Table ) Find ( rubik's_cube Dining_Table  ) Grasp ( rubik's_cube )  Move ( Side_Table ) Place ( rubik's_cube Dining_Table )
Would you bring Seafood_Noodle from Dining_Table move to Bar go to Visitor_Room .,W UH1 D Y UW1 B R IH1 NG S IY1 F UW2 D N UW1 D AH0 L F R AH1 M D AY1 N IH0 NG T EY1 B AH0 L M UW1 V T UW1 B AA1 R G OW1 T UW1 V IH1 Z IH0 T ER0 R UW1 M,W UH1 D Y UW1 B R IH1 NG S IY1 AA UW2 D N UW1 D AH0 L F R AH1 M D AY1 N IH0 NG ER2 T EY1 B AH0 L M UW1 V T UW1 B AA1 R EH G T UW1 V IH1 Z IH0 T ER0 R UW1 M,Move ( Dining_Table ) Find ( Seafood_Noodle Dining_Table ) Move ( Bar ) Move ( Visitor_Room )
Go to Kitchen_Room take Green_Tea place it on Side_Table okay .,G OW1 T UW1 K IH1 CH AH0 N R UW1 M T EY1 K G R IY1 N T IY1 P L EY1 S IH1 T AA1 N S AY1 D T EY1 B AH0 L OW2 K EY1,G OW1 T UW1 K IH1 CH AH0 N R IH0 IH M T EH0 EY1 K G R IY1 N N T DH P AE0 L EY1 S IH1 T AA1 UH2 N S AY1 D T EY1 B AH0 IY0 L AE0 K EY1,Move (  Kitchen_Room  ) Find ( Green_Tea Kitchen_Room ) Grasp ( Green_Tea ) Move ( Side_Table )
Go to Visitor_Room Grasp rabbit_doll place it on Living_Sofa okay .,G OW1 T UW1 V IH1 Z IH0 T ER0 R UW1 M G R AE1 S P R AE1 B AH0 T D AA1 L P L EY1 S IH1 T AA1 N L IH1 V IH0 NG S OW1 F AH0 OW2 K EY1,G OW1 T UW1 V IH1 Z IH0 T ER0 R UW1 M G R AE1 S P R AE1 B AH0 T D OY2 UW1 L P L EY1 S IH1 T AA1 N L IH1 V IH0 NG S OW1 F AH0 OW2 K EY1,Move ( Visitor_Room ) Grasp ( rabbit_doll ) Move ( Living_Sofa ) Place ( rabbit_doll Living_Sofa )
Move to Kitchen_Table  next detect nursing_bottle  get it .,M UW1 V T UW1 K IH1 CH AH0 N T EY1 B AH0 L N EH1 K S T D IH0 T EH1 K T N ER1 S IH0 NG B AA1 T AH0 L G EH1 T IH1 T,M V T UW1 K IH1 CH AH0 N T EY1 B IH OW0 AH0 L IY1 EH1 S T D IH0 T EH1 K T N ER1 S IH0 NG B AA1 T AH0 L G EH1 T IH1 T,Move ( Kitchen_Table ) Find ( nursing_bottle Kitchen_Table ) Grasp ( nursing_bottle )
Go to Kitchen_Table then detect Red_Tea  take it .,G OW1 T UW1 K IH1 CH AH0 N T EY1 B AH0 L DH EH1 N D IH0 T EH1 K T R EH1 D T IY1 T EY1 K IH1 T,L UH0 OW1 T UW1 K IH1 CH AH0 N T EY1 B AH0 L DH EH1 N D IH0 T EH1 K T OW1 R EH1 D T IY1 T EY1 K IH1 T,Move ( Kitchen_Table ) Find ( Red_Tea Kitchen_Table ) Grasp ( Red_Tea )  Move ( Red_Tea )
Go to Dining_Table and find a person neayby bring cigarette from Living_Sofa .,G OW1 T UW1 D AY1 N IH0 NG T EY1 B AH0 L AH0 N D F AY1 N D AH0 P ER1 S AH0 N N IH1 R B AY1 B R IH1 NG S IH2 G ER0 EH1 T F R AH1 M L IH1 V IH0 NG S OW1 F AH0,G OW1 T TH D AY1 N IH0 NG T EY1 B AH0 L AH0 N D F AY1 ZH N CH D AH0 ER1 S AH0 N N IH1 R B AY1 B R IH1 NG S IH2 G ER0 EH1 T M R AH1 M L IH1 IH0 NG OY0 IY0 F AH0,Move (  Dining_Table  ) Find ( cigarette Dining_Table  ) Grasp ( cigarette ) Find ( pesron Dining_Table ) Plcae ( cigarette PERSON )
Go to Kitchen_Room  move to Dining_Sofa  finally leave the apartment .,G OW1 T UW1 K IH1 CH AH0 N R UW1 M M UW1 V T UW1 D AY1 N IH0 NG S OW1 F AH0 F AY1 N AH0 L IY0 L IY1 V DH AH0 AH0 P AA1 R T M AH0 N T,G OW1 T UW1 K IH1 CH AH0 N R UW1 P M UW1 V T AE1 D AY1 N UH IH0 NG S OW1 F AH0 F AY1 N AH0 L IY0 L IY1 V DH AH0 AH0 P AA1 R T M AH0 N T,Move ( Kitchen_Room ) Move ( Dining_Sofa )  Move ( apartment )
Go to Living_Room next find rubik's_cube Grasp it .,G OW1 T UW1 L IH1 V IH0 NG R UW1 M N EH1 K S T F AY1 N D R UW1 B IH0 K S K Y UW1 B G R AE1 S P IH1 T,G OW1 T UW1 L IH1 V IH0 NG R UW1 IH1 M N UW2 K S T F N D R UW1 NG IH0 HH K S K Y UW1 B G AO0 AE1 S P IH1 T,Move ( Living_Room ) Find ( rubik's_cube Living_Room ) Grasp ( rubik's_cube )
Can you go to Kitchen_Room Grasp Orange_Juice  bring it to Dining_Sofa .,K AE1 N Y UW1 G OW1 T UW1 K IH1 CH AH0 N R UW1 M G R AE1 S P AO1 R AH0 N JH JH UW1 S B R IH1 NG IH1 T T UW1 D AY1 N IH0 NG S OW1 F AH0,K AE1 EY Y UW1 G OW1 T UW1 IY0 IH1 CH AH0 N R UW1 M G R AE1 S P AO1 R N JH JH UW1 S B R IH1 IH1 UW0 T T UW1 AH0 AY1 AE0 IH0 NG N S OW1 F AH0,Move ( Kitchen_Room ) Find ( Orange_Juice Kitchen_Room ) Grasp ( Orange_Juice ) Move ( Dining_Sofa )  Find ( Orange_Juice Dining_Sofa ) Grasp ( Orange_Juice ) Move ( Kitchen_Room )
Well go to Sofa  take hourglass  bring it to Living_Sofa .,W EH1 L G OW1 T UW1 S OW1 F AH0 T EY1 K AW1 ER0 G L AE2 S B R IH1 NG IH1 T T UW1 L IH1 V IH0 NG S OW1 F AH0,W EH1 L G OW1 T AE0 UW1 OW1 F AH0 EY1 K AW1 ER0 L AE2 S B R IH1 NG IH1 T T UW1 L IH1 V IH0 NG S F AH0,Move (  Sofa ) Find ( hourglass Sofa  ) Grasp ( hourglass )  Move ( Living_Sofa )
Would you move to Living_Sofa Grasp sugar and come back .,W UH1 D Y UW1 M UW1 V T UW1 L IH1 V IH0 NG S OW1 F AH0 G R AE1 S P SH UH1 G ER0 AH0 N D K AH1 M B AE1 K,W UH1 D Y UW1 M TH T UW1 L IH1 V IH0 NG S OW1 F AH0 IY0 AE1 S P SH UH1 G ER0 AH0 N D K AH1 M B AE1 K,Move ( Living_Sofa ) Grasp ( sugar ) Move ( HERE )
Move to Dining_Sofa  go to Living_Sofa then exit the apartment .,M UW1 V T UW1 D AY1 N IH0 NG S OW1 F AH0 G OW1 T UW1 L IH1 V IH0 NG S OW1 F AH0 DH EH1 N EH1 G Z IH0 T DH AH0 AH0 P AA1 R T M AH0 N T,M UW1 V UW1 D UW2 AY1 N IH0 NG S OW1 F G OW1 T UW1 L IH1 V IH0 NG S F AH0 DH EH1 N EH1 G Z IH0 T DH AH0 AH0 M P AH0 R T M AH0 N T,Move ( Dining_Sofa ) Move ( Living_Sofa ) Move ( apartment )
Go to Dining_Room  go to Living_Sofa then exit the apartment .,G OW1 T UW1 D AY1 N IH0 NG R UW1 M G OW1 T UW1 L IH1 V IH0 NG S OW1 F AH0 DH EH1 N EH1 G Z IH0 T DH AH0 AH0 P AA1 R T M AH0 N T,G OW1 T AW D AY1 N IH0 NG R UW1 M G EH0 OW1 T UW1 L IH1 V ER IH0 NG Z S OW1 F AH0 DH EH1 N EH1 Z IH0 T DH AH0 AH0 P AA1 R T M N T,Move ( Dining_Room ) Move ( Living_Sofa )  Move ( apartment )
Go to bed_room  find a person neayby  finally follow a person .,G OW1 T UW1 B EH1 D R UW1 M F AY1 N D AH0 P ER1 S AH0 N N IH1 R B AY1 F AY1 N AH0 L IY0 F AA1 L OW0 AH0 P ER1 S AH0 N,G OW1 T UW1 B EH1 D R M F AY1 D AH0 P ER1 S AH0 N N IH1 R B AY1 F AY1 N AH0 L IY0 F AA1 L JH OW0 AH0 S AH0 N,Move ( bed_room ) Find ( person bed_room ) Follow ( person )
Can you go to Side_Table take Egg_Soup carry it to Kitchen_Table .,K AE1 N Y UW1 G OW1 T UW1 S AY1 D T EY1 B AH0 L T EY1 K EH1 G S UW1 P K AE1 R IY0 IH1 T T UW1 K IH1 CH AH0 N T EY1 B AH0 L,K AE1 N Y K G OW1 T UW1 S D T EY1 B AH0 L T EY1 K AW0 G S UW1 P AH0 K AE1 AW2 R IY0 IH1 T T UW1 K W CH AE AH0 N T EY1 B EH0 AH0 L,Move ( Side_Table  ) Find ( Egg_Soup Side_Table ) Grasp ( Egg_Soup ) Move ( Kitchen_Table )
Go to Sofa go to Dining_Room  and leave the apartment .,G OW1 T UW1 S OW1 F AH0 G OW1 T UW1 D AY1 N IH0 NG R UW1 M AH0 N D L IY1 V DH AH0 AH0 P AA1 R T M AH0 N T,G OW1 T UW1 OW1 F G OW1 T UW1 D AY1 N IH0 NG R UW1 M AH0 N D L IY1 OW2 V DH AH0 AH0 P AA1 R T M AH0 N AW,Move ( Sofa )  Move ( Dining_Room )  Move ( apartment )
Would you move to Living_Sofa take Strawberry_Juice then come back .,W UH1 D Y UW1 M UW1 V T UW1 L IH1 V IH0 NG S OW1 F AH0 T EY1 K S T R AO1 B EH2 R IY0 JH UW1 S DH EH1 N K AH1 M B AE1 K,W UH1 Y EH UW1 M UW1 V T UW1 L IH1 V IH0 NG S OW1 F UH0 T EY1 K S T R AO1 B EH2 R IY0 JH UW1 S DH EH1 K AH1 M B AE1 W K,Move ( Living_Sofa ) Find ( Strawberry_Juice Living_Sofa ) Grasp ( Strawberry_Juice ) Move ( HERE )
Move to Dining_Sofa get apple place it on Sofa okay .,M UW1 V T UW1 D AY1 N IH0 NG S OW1 F AH0 G EH1 T AE1 P AH0 L P L EY1 S IH1 T AA1 N S OW1 F AH0 OW2 K EY1,M UW1 V T UW1 D AY1 N IH0 NG S OW1 F AH0 G EH1 T AE1 P AH0 V L EY1 S IH1 EH2 AA1 N S OW1 F AH0 AH1 OW2 K EY1,Move ( Dining_Sofa ) Find ( apple Dining_Sofa  ) Grasp ( apple )  Move ( Sofa ) Place ( apple Dining_Sofa )
Go to Kitchen_Room go to Side_Table  and exit from Living_Room .,G OW1 T UW1 K IH1 CH AH0 N R UW1 M G OW1 T UW1 S AY1 D T EY1 B AH0 L AH0 N D EH1 G Z IH0 T F R AH1 M L IH1 V IH0 NG R UW1 M,AY IH0 OW1 T UW1 K IH1 CH AH0 N R UW1 M G OW1 T UW1 ER1 AY1 D T EY1 IH AH0 L AH0 N D EH1 G Z IH0 UH T F UW R AH1 DH L IH1 V IH0 NG R UW1 DH AY2,Move ( Kitchen_Room ) Move ( Side_Table ) Move ( Living_Room )
Well move to Living_Sofa get rabbit_doll and come back .,W EH1 L M UW1 V T UW1 L IH1 V IH0 NG S OW1 F AH0 G EH1 T R AE1 B AH0 T D AA1 L AH0 N D K AH1 M B AE1 K,W EH1 L M UW1 V T UW1 L IH1 IH0 NG OW1 F AH0 G AH T R AE1 B AH0 T D AA1 L AH0 N W K AH1 B AE1 K,Move ( Living_Sofa ) Grasp ( rabbit_doll ) Move ( Living_Sofa ) Grasp ( rabbit_doll ) Move ( HERE )
Call a person then ask for an order get toy_duck from Sofa .,K AO1 L AH0 P ER1 S AH0 N DH EH1 N AE1 S K F AO1 R AE1 N AO1 R D ER0 G EH1 T T OY1 D AH1 K F R AH1 M S OW1 F AH0,K AO1 L AH0 P AO2 S AH0 N DH EH1 N AE1 S K F R AE1 ZH N AO1 R D ER0 G EH1 T T OY1 D AH1 K F R W AH1 M S AA0 F AH0,Say ( person ) Listen ( toy_duck ) Move ( Sofa ) Find ( toy_duck Sofa ) Grasp ( toy_duck ) Move ( toy_duck ) Place ( toy_duck Sofa ) 
Call a person then ask for an order get Chip_Star from Bar .,K AO1 L AH0 P ER1 S AH0 N DH EH1 N AE1 S K F AO1 R AE1 N AO1 R D ER0 G EH1 T CH IH1 P S T AA1 R F R AH1 M B AA1 R,K TH AO1 L AH0 P ER1 S N DH N AE1 S K AA AO1 R AA1 N AO1 R D ER0 EH1 T CH CH IH1 P S T AA1 R F R AH1 AH M B AA1 R,Say ( person ) Listen ( Chip_Star ) Move ( Bar ) Find ( Chip_Star Bar ) Grasp ( Chip_Star ) Move ( Chip_Star ) Place ( Chip_Star Bar ) 
Go to Corridor and find a person neayby bring empty_plastic_bottle from Kitchen_Table .,G OW1 T UW1 K AO1 R AH0 D ER0 AH0 N D F AY1 N D AH0 P ER1 S AH0 N N IH1 R B AY1 B R IH1 NG EH1 M P T IY0 P L AE1 S T IH0 K B AA1 T AH0 L F R AH1 M K IH1 CH AH0 N T EY1 B AH0 L,G OW1 UW1 K AO1 R AH0 D ER0 AH0 N D F AY1 N D AH0 P S AH0 N EY EH0 N IH1 B B R IH1 NG EH1 M P T IY0 P L AE1 AO0 T IH0 K B AA1 T AH0 L Z F AH1 K IH1 CH AH0 N T EY1 B AH0 L,Move ( Corridor ) Find ( person Corridor ) Move ( Kitchen_Table ) Grasp ( empty_plastic_bottle )  Move ( person )
Go to Reception_Table  and  detect ground_pepper Grasp it .,G OW1 T UW1 R IH0 S EH1 P SH AH0 N T EY1 B AH0 L AH0 N D D IH0 T EH1 K T G R AW1 N D P EH1 P ER0 G R AE1 S P IH1 T,V G OW1 T UW1 R IH0 S EH1 P SH AH0 N T TH EY1 B AH0 L AH0 N D D IH0 T EH1 K T G R OW0 AW1 N P EH1 P ER0 G R AE1 P IH1 T,Move (  Reception_Table  ) Find ( ground_pepper Reception_Table  ) Grasp ( ground_pepper ) 
Call a person then ask for an order get Bath_Cleaner from Sofa .,K AO1 L AH0 P ER1 S AH0 N DH EH1 N AE1 S K F AO1 R AE1 N AO1 R D ER0 G EH1 T B AE1 TH K L IY1 N ER0 F R AH1 M S OW1 F AH0,K AO1 AH0 T P ER1 S AH0 N EH1 N W AE1 AO0 K F AO1 R AE1 N AO1 D IY ER0 EH2 G EH1 T D AA0 B AE1 AY2 K L IY1 N ER0 R AH1 M S OW1 AH0,Say ( person ) Listen ( Bath_Cleaner ) Move ( Sofa ) Find ( Bath_Cleaner Sofa ) Grasp ( Bath_Cleaner ) Move ( Bath_Cleaner ) Place ( Bath_Cleaner Sofa ) 
Go to Dining_Table go to bed_room  and leave the apartment .,G OW1 T UW1 D AY1 N IH0 NG T EY1 B AH0 L G OW1 T UW1 B EH1 D R UW1 M AH0 N D L IY1 V DH AH0 AH0 P AA1 R T M AH0 N T,G OW1 T D AY1 N IH0 NG T EY1 B Z L IY2 G OW1 UW1 B EH1 D AY1 UW1 M AH0 N D L IY1 V DH AH0 AH0 P R T M AH0 N,Move ( Dining_Table )  Move ( bed_room )  Move ( apartment )
Go to Reception_Table take empty_ketchup put it on Kitchen_Table please .,G OW1 T UW1 R IH0 S EH1 P SH AH0 N T EY1 B AH0 L T EY1 K EH1 M P T IY0 K EH1 CH AH0 P P UH1 T IH1 T AA1 N K IH1 CH AH0 N T EY1 B AH0 L P L IY1 Z,G OW1 T UW1 ER1 R IH0 EH1 P AH0 N T EY1 B AH0 T EY1 OW1 K EH1 M P T IY0 K EH1 CH AH0 P P UH1 T IH1 T AA1 K IH1 CH AH0 N OY1 EY1 AH0 L P L IY1,Move (  Reception_Table  ) Find ( empty_ketchup Reception_Table  ) Grasp ( empty_ketchup ) Plcae ( empty_ketchup Kitchen_Table )
Would you go to Sofa  take nursing_bottle  bring it to Reception_Table .,W UH1 D Y UW1 G OW1 T UW1 S OW1 F AH0 T EY1 K N ER1 S IH0 NG B AA1 T AH0 L B R IH1 NG IH1 T T UW1 R IH0 S EH1 P SH AH0 N T EY1 B AH0 L,W UH1 D Y UW1 G T UW1 IH2 S OW1 AH0 T EY1 K N ER1 S IH0 NG B AA1 T AH0 L B R IH1 NG AO T T UW1 R IH0 S EH1 P AH0 N T EY1 B AH0 L,Move ( Sofa ) Find ( nursing_bottle Sofa ) Grasp ( nursing_bottle ) Move ( Reception_Table )
Would you go to Reception_Table  take toy_penguin  bring it to Living_Table .,W UH1 D Y UW1 G OW1 T UW1 R IH0 S EH1 P SH AH0 N T EY1 B AH0 L T EY1 K T OY1 P EH1 NG G W AH0 N B R IH1 NG IH1 T T UW1 L IH1 V IH0 NG T EY1 B AH0 L,W IH1 UH1 Y UW1 G OW1 T UW1 R IH0 S EH1 P N AH0 N T EY1 B AH0 L T EY1 K T OY1 P EH1 NG G W AH0 N B R IH1 NG IH1 T B UW1 L IH1 V IH0 NG T EY1 B AH0 L,Move ( Reception_Table ) Find ( toy_penguin Reception_Table ) Grasp ( toy_penguin ) Move ( Living_Table )
Well go to Kitchen_Table  take Bath_Cleaner  bring it to Dining_Table .,W EH1 L G OW1 T UW1 K IH1 CH AH0 N T EY1 B AH0 L T EY1 K B AE1 TH K L IY1 N ER0 B R IH1 NG IH1 T T UW1 D AY1 N IH0 NG T EY1 B AH0 L,W L G OW1 AY1 T AW2 UW1 K IH1 CH AH0 N T EY1 B AH0 L T EY1 K B AE1 TH K L IY1 N ER0 B R IH1 NG IH1 T T UW1 D AY1 N IH0 NG T EY1 B L,Move (  Kitchen_Table ) Find ( Bath_Cleaner Kitchen_Table  ) Grasp ( Bath_Cleaner )  Move ( Dining_Table )
Go to lobby er find a person neayby bring Bath_Cleaner from Kitchen_Table .,G OW1 T UW1 L AA1 B IY0 ER0 F AY1 N D AH0 P ER1 S AH0 N N IH1 R B AY1 B R IH1 NG B AE1 TH K L IY1 N ER0 F R AH1 M K IH1 CH AH0 N T EY1 B AH0 L,G OW1 T UW1 L AA1 B IY0 ER0 F AY1 N AA D AW0 P ER1 S AH0 N N IH1 R B AY1 B T NG B AE1 TH K AW AY0 L IY1 N ER0 F R AH1 M K IH1 CH AH0 N T AA2 B AH0 L,Move ( lobby ) Find ( person lobby ) Move ( Kitchen_Table ) Grasp ( Bath_Cleaner )
Can you go to Visitor_Room Grasp Japanese_Tea  bring it to Sofa .,K AE1 N Y UW1 G OW1 T UW1 V IH1 Z IH0 T ER0 R UW1 M G R AE1 S P JH AE2 P AH0 N IY1 Z T IY1 B R IH1 NG IH1 T T UW1 S OW1 F AH0,OY2 K AE0 N Y UW1 G OW1 T UW1 V IH1 Z IH0 T ER0 R UW1 G EY2 R S P JH AE2 P AH0 N IY1 Z T AY2 ZH B R IH1 NG IH1 T T UW1 S OW1 F AH0,Move ( Visitor_Room ) Find ( Japanese_Tea Visitor_Room ) Grasp ( Japanese_Tea ) Move ( Sofa )  Find ( Japanese_Tea Sofa ) Grasp ( Japanese_Tea ) Move ( Visitor_Room )
Go to Kitchen_Room er find a person neayby bring hourglass from Side_Table .,G OW1 T UW1 K IH1 CH AH0 N R UW1 M ER0 F AY1 N D AH0 P ER1 S AH0 N N IH1 R B AY1 B R IH1 NG AW1 ER0 G L AE2 S F R AH1 M S AY1 D T EY1 B AH0 L,G OW1 T UW1 K IH1 CH AH0 R M ER0 F AY1 D D AH0 P ER1 S AH0 N N IH1 R B AY1 B R IH1 NG AW1 ER0 G L AE2 S R AH1 M S AY1 D T EY1 B AH0 L,Move ( Kitchen_Room ) Find ( person Kitchen_Room ) Move ( Side_Table ) Grasp ( hourglass )
Move to Dining_Sofa  go to Living_Table then exit the apartment .,M UW1 V T UW1 D AY1 N IH0 NG S OW1 F AH0 G OW1 T UW1 L IH1 V IH0 NG T EY1 B AH0 L DH EH1 N EH1 G Z IH0 T DH AH0 AH0 P AA1 R T M AH0 N T,M UW1 V T UW1 D AY1 N B IH0 NG AH0 S OW1 ER0 F AH0 G OW1 T UW1 L IH1 V IH0 NG T EY1 B AH0 L DH IY EH1 EH1 G Z IH0 T DH UH1 AH0 P AA1 R T AH0 N T,Move ( Dining_Sofa ) Move ( Living_Table ) Move ( apartment )
Would you move to Living_Table Grasp toy_car and come back .,W UH1 D Y UW1 M UW1 V T UW1 L IH1 V IH0 NG T EY1 B AH0 L G R AE1 S P T OY1 K AA1 R AH0 N D K AH1 M B AE1 K,W UH1 D Y UW1 M UW1 V T UW1 L IH1 V IH0 NG T OY1 OY0 EY1 B AH0 G R S AW T OY1 K AA1 R OW AH0 N D Z K AH1 M B AE1 K,Move ( Living_Table ) Grasp ( toy_car ) Move ( HERE )
Go to Kitchen_Room  move to Dining_Table  finally leave the apartment .,G OW1 T UW1 K IH1 CH AH0 N R UW1 M M UW1 V T UW1 D AY1 N IH0 NG T EY1 B AH0 L F AY1 N AH0 L IY0 L IY1 V DH AH0 AH0 P AA1 R T M AH0 N T,G P IY1 T UW1 K IH1 CH AH0 N R UW1 M M UW1 V T UW1 D AY1 N IH0 NG T EY1 B AH0 L F AW0 AY1 N AH0 L IY0 ER0 L IY1 V DH AH0 AH0 L AA1 R T M AH0 N T,Move ( Kitchen_Room ) Move ( Dining_Table )  Move ( apartment )
Would you move to Kitchen_Table take Cloth_Cleaner then come back .,W UH1 D Y UW1 M UW1 V T UW1 K IH1 CH AH0 N T EY1 B AH0 L T EY1 K K L AO1 TH K L IY1 N ER0 DH EH1 N K AH1 M B AE1 K,W UH1 D Y UW1 M UW1 V T UW1 K IH1 AH0 N T EY1 SH AH0 ER2 L T EY1 K K L AO1 TH K L IY1 N ER0 DH EH1 N K AH1 B AE1 K,Move ( Kitchen_Table ) Find ( Cloth_Cleaner Kitchen_Table ) Grasp ( Cloth_Cleaner ) Move ( HERE )
Go to Kitchen_Room then find a person neayby bring rubik's_cube from Bar .,G OW1 T UW1 K IH1 CH AH0 N R UW1 M DH EH1 N F AY1 N D AH0 P ER1 S AH0 N N IH1 R B AY1 B R IH1 NG R UW1 B IH0 K S K Y UW1 B F R AH1 M B AA1 R,OW1 T UW1 K IH1 CH AH0 N R UH OY M DH EH1 N AY1 N D AH0 P ER1 S ZH AH0 N N IH1 R B AY1 B IH1 NG R UW1 B IH0 K S K Y UW1 OW B F AW1 R AH1 M AO0 AA1 R,Move ( Kitchen_Room ) Find ( person Kitchen_Room ) Move ( Bar ) Grasp ( rubik's_cube )
Go to Side_Table take Korean_Soup put it on Kitchen_Table please .,G OW1 T UW1 S AY1 D T EY1 B AH0 L T EY1 K K AO2 R IY1 AH0 N S UW1 P P UH1 T IH1 T AA1 N K IH1 CH AH0 N T EY1 B AH0 L P L IY1 Z,G OW1 T UW1 S AY1 D T EY1 B AH0 L T EY1 K AO2 R IY1 AH0 N S UW1 P P UH1 T IH1 AA1 IY2 N K IH1 CH TH N T EY1 B AH0 L P L IY1 Z,Move (  Side_Table  ) Find ( Korean_Soup Side_Table  ) Grasp ( Korean_Soup ) Plcae ( Korean_Soup Kitchen_Table )
Go to Dining_Table  and  detect soysauce Grasp it .,G OW1 T UW1 D AY1 N IH0 NG T EY1 B AH0 L AH0 N D D IH0 T EH1 K T S OY1 S AO2 S G R AE1 S P IH1 T,G OW1 T UW1 D AY1 N IH0 NG UH EY1 IH1 AO1 EH2 L AH0 AY0 N D D IH0 T EH1 K UH1 S OY1 S AO2 S G R AE1 S P IH1 T,Move (  Dining_Table  ) Find ( soysauce Dining_Table  ) Grasp ( soysauce ) 
Well move to Living_Table Grasp hourglass then come back .,W EH1 L M UW1 V T UW1 L IH1 V IH0 NG T EY1 B AH0 L G R AE1 S P AW1 ER0 G L AE2 S DH EH1 N K AH1 M B AE1 K,W EH1 L M UW1 V T UW1 L IH1 V IH0 NG EY1 B AH0 L G R AE1 S P AW1 ER0 EH1 G AW1 AE2 S DH Z EH1 K AH1 M B AE1 K,Move ( Living_Table ) Move ( hourglass ) Move ( HERE )
Go to Bar then detect cubic_clock  take it .,G OW1 T UW1 B AA1 R DH EH1 N D IH0 T EH1 K T K Y UW1 B IH0 K K L AA1 K T EY1 K IH1 T,G OW1 T UW1 B AA1 IH0 EH1 D EY0 T EH1 K T K Y UW1 B IH0 K K AH AA1 K T K M IH1 T,Move ( Bar ) Find ( cubic_clock Bar ) Grasp ( cubic_clock )  Move ( cubic_clock )
Go to Kitchen_Room take Blue_Potato put it on Kitchen_Table please .,G OW1 T UW1 K IH1 CH AH0 N R UW1 M T EY1 K B L UW1 P AH0 T EY1 T OW2 P UH1 T IH1 T AA1 N K IH1 CH AH0 N T EY1 B AH0 L P L IY1 Z,G Y OW1 AY1 T UW1 K IH1 CH AH0 N R UW1 L M T EY1 K L UW1 P AH0 T EY1 OW2 P UH1 T IH1 T Y N K IH1 CH AO0 AH0 N AO1 T TH B TH AH0 L P L IY1 Z,Move ( Kitchen_Room ) Find ( Blue_Potato Kitchen_Room ) Grasp ( Blue_Potato ) Move ( Kitchen_Table ) Place ( Blue_Potato Kitchen_Table )
Go to kitchen  go to Side_Table er leave the apartment .,G OW1 T UW1 K IH1 CH AH0 N G OW1 T UW1 S AY1 D T EY1 B AH0 L ER0 L IY1 V DH AH0 AH0 P AA1 R T M AH0 N T,G T UW1 EY0 IH1 DH CH AH0 N G OW1 T S AY1 D T EY1 B AH0 L ER0 L V DH AH0 AH0 P AA1 R T Y AH0 N T,Move ( kitchen ) Move ( Side_Table )  Move ( apartment )
Go to Visitor_Room get nursing_bottle throw it into Dustbin please .,G OW1 T UW1 V IH1 Z IH0 T ER0 R UW1 M G EH1 T N ER1 S IH0 NG B AA1 T AH0 L TH R OW1 IH1 T IH1 N T UW0 D AH1 S T B IH0 N P L IY1 Z,G OW1 T UW1 AH0 V IH1 Z IH0 T ER0 R UW1 UH2 G EH1 T N ER1 S IH0 NG B AA1 SH T AH0 L TH OW1 IH1 T IH1 N T UW0 D AH1 S T B N P L IY1 Z,Move ( Visitor_Room ) Find ( nursing_bottle Visitor_Room ) Grasp ( nursing_bottle ) Move ( Dustbin ) Place ( nursing_bottle Dustbin )
Go to Bar and find a person neayby bring Red_Potato from Side_Table .,G OW1 T UW1 B AA1 R AH0 N D F AY1 N D AH0 P ER1 S AH0 N N IH1 R B AY1 B R IH1 NG R EH1 D P AH0 T EY1 T OW2 F R AH1 M S AY1 D T EY1 B AH0 L,G OW1 T UW1 B AA1 R AH0 HH N D F AY1 N D AH0 P ER1 S AH0 N IH1 R B AY1 B R IH1 NG R EH1 K D P AH0 EY1 T W F R AH1 M IH1 S AY1 D T EY1 B AH0 L,Move (  Bar  ) Find ( Red_Potato Bar  ) Grasp ( Red_Potato ) Find ( pesron Bar ) Plcae ( Red_Potato PERSON )
Would you move to Reception_Table Grasp ground_pepper and come back .,W UH1 D Y UW1 M UW1 V T UW1 R IH0 S EH1 P SH AH0 N T EY1 B AH0 L G R AE1 S P G R AW1 N D P EH1 P ER0 AH0 N D K AH1 M B AE1 K,W UH1 D Y IY1 IH1 M V T UW1 R IH0 S EH1 P SH N T EY1 B IH2 L G R S P G R AW1 N IY2 P EH1 P ER0 AH0 D K AH1 M EY AE1 K,Move ( Reception_Table ) Grasp ( ground_pepper ) Move ( HERE )
Would you move to Sofa get salt bring it to Kitchen_Table .,W UH1 D Y UW1 M UW1 V T UW1 S OW1 F AH0 G EH1 T S AO1 L T B R IH1 NG IH1 T T UW1 K IH1 CH AH0 N T EY1 B AH0 L,AE UH1 EY0 UW1 M UW1 V T UW1 S OW1 F AH0 G ZH EH1 T S AO1 L T B R IH1 IH1 T K IH1 CH AH0 EY1 B AH0 L,Move ( Sofa ) Find ( salt Sofa  ) Grasp ( salt ) Move ( Kitchen_Table )
Go to Dining_Table and find a person neayby bring empty_plastic_bottle from Dining_Sofa .,G OW1 T UW1 D AY1 N IH0 NG T EY1 B AH0 L AH0 N D F AY1 N D AH0 P ER1 S AH0 N N IH1 R B AY1 B R IH1 NG EH1 M P T IY0 P L AE1 S T IH0 K B AA1 T AH0 L F R AH1 M D AY1 N IH0 NG S OW1 F AH0,G OW1 T UW1 AY1 N IH0 NG T EY1 B AH0 L AH0 N F AY1 EY0 D AH0 P ER1 S AH0 N N IH1 R B AY1 B R IH1 NG EH1 M P T IY0 P Z L S T IH0 K B AH AA1 T AH0 L F R AH1 M D AY1 N IH0 AA0 S OW1 F AH0,Move (  Dining_Table  ) Find ( empty_plastic_bottle Dining_Table  ) Grasp ( empty_plastic_bottle ) Find ( pesron Dining_Table ) Plcae ( empty_plastic_bottle PERSON )
Move to Dining_Table and detect Egg_Soup get it .,M UW1 V T UW1 D AY1 N IH0 NG T EY1 B AH0 L AH0 N D D IH0 T EH1 K T EH1 G S UW1 P G EH1 T IH1 T,M UW1 V T UW1 D AY1 N IH0 NG T EY1 B AH0 L AH0 N D D IH0 AE EH1 K T EH1 G S UW1 P G EH1 T T,Move ( Dining_Table ) Find ( Egg_Soup Dining_Table ) Grasp ( Egg_Soup )
Go to bed_room next find empty_ketchup take it .,G OW1 T UW1 B EH1 D R UW1 M N EH1 K S T F AY1 N D EH1 M P T IY0 K EH1 CH AH0 P T EY1 K IH1 T,G OW1 T B EH1 D R UW1 M N EH1 K S T F AY1 N EH1 M AH P T IY0 AO K EH1 AH0 P T EY1 K IH1,Move (  bed_room  ) Find ( empty_ketchup bed_room  ) Grasp ( empty_ketchup ) 
