Input,phonemelabel,Noisylabel,Labeldata
Go to Visitor_Room Grasp Red_Tea place it on Dining_Sofa okay .,G OW1 T UW1 V IH1 Z IH0 T ER0 R UW1 M G R AE1 S P R EH1 D T IY1 P L EY1 S IH1 T AA1 N D AY1 N IH0 NG S OW1 F AH0 OW2 K EY1,G OW1 UW1 V IH1 Z IH0 T ER0 R UW1 M G R AE1 S V P R EH1 D L IY1 P EY1 B S IH1 T AA2 N D AY1 N IH0 NG S F AH0 OW2 K,Move ( Visitor_Room ) Grasp ( Red_Tea ) Move ( Dining_Sofa ) Place ( Red_Tea Dining_Sofa )
Would you go to Living_Sofa take twin_bell_alarm_clock er come back .,W UH1 D Y UW1 G OW1 T UW1 L IH1 V IH0 NG S OW1 F AH0 T EY1 K T W IH1 N B EH1 L AH0 L AA1 R M K L AA1 K ER0 K AH1 M B AE1 K,W UH1 D Y UW1 G UW2 OW1 T UW1 L IH1 V IH0 NG S EY1 F AH0 T EY1 K T W AW2 ER0 N EH1 IY0 L AH0 L AA1 R M K UW0 L AA1 K EY0 K EH0 M B AE1 K,Move ( Living_Sofa ) Find ( twin_bell_alarm_clock Living_Sofa ) Grasp ( twin_bell_alarm_clock ) Move ( HERE )
Would you move to Reception_Table take hourglass then come back .,W UH1 D Y UW1 M UW1 V T UW1 R IH0 S EH1 P SH AH0 N T EY1 B AH0 L T EY1 K AW1 ER0 G L AE2 S DH EH1 N K AH1 M B AE1 K,W UH1 D Y UW1 AW1 UW1 V T UW1 R EY1 S EH1 P SH AH0 N T EY1 B AH0 L T K AW1 ER0 G L AE2 S DH EH1 N K OY1 AH1 AW0 M B AE1 K,Move ( Reception_Table ) Find ( hourglass Reception_Table ) Grasp ( hourglass ) Move ( HERE )
Go to Kitchen_Table  take Japanese_Tea put it on Bar okay .,G OW1 T UW1 K IH1 CH AH0 N T EY1 B AH0 L T EY1 K JH AE2 P AH0 N IY1 Z T IY1 P UH1 T IH1 T AA1 N B AA1 R OW2 K EY1,G OW1 T UW1 K IH1 CH AH0 N T EY1 B AH0 JH T EY1 K JH AE2 P AH0 N IY1 Z Y T IY1 P UH1 T IH1 T AA1 N B AA1 R OW2 K EY1,Move ( Kitchen_Table )  Grasp ( Japanese_Tea ) Move ( Bar ) Place ( Japanese_Tea Kitchen_Table )
Would you go to Dining_Sofa get cubic_clock carry it to Reception_Table .,W UH1 D Y UW1 G OW1 T UW1 D AY1 N IH0 NG S OW1 F AH0 G EH1 T K Y UW1 B IH0 K K L AA1 K K AE1 R IY0 IH1 T T UW1 R IH0 S EH1 P SH AH0 N T EY1 B AH0 L,W UH1 D UW1 HH OW1 T UW1 D AY1 EY0 N IH0 NG S OW1 AA1 AA G ER0 EH1 T K Y UW1 B IH2 IH0 K K L AA1 K R IY0 IH1 T T AH0 R IH0 S EH1 IH2 AH0 T EY1 B AH0 L,Move (  Dining_Sofa ) Find ( cubic_clock Dining_Sofa  ) Grasp ( cubic_clock )  Move ( Reception_Table )
Go to Kitchen_Room er find a person neayby bring Japanese_Tea from Dining_Table .,G OW1 T UW1 K IH1 CH AH0 N R UW1 M ER0 F AY1 N D AH0 P ER1 S AH0 N N IH1 R B AY1 B R IH1 NG JH AE2 P AH0 N IY1 Z T IY1 F R AH1 M D AY1 N IH0 NG T EY1 B AH0 L,G OW1 T B UW1 K IH1 CH AH0 N R UW1 M ER0 F OY1 AY1 N D AH0 P ER1 S AH0 N N IH1 R B B R IH1 NG JH AE2 P AH0 N IY1 Z IY1 F R IH2 D AY1 EH2 IH0 NG T EY1 B AH0 L,Move ( Kitchen_Room ) Find ( person Kitchen_Room ) Move ( Dining_Table ) Grasp ( Japanese_Tea )
Move to Dining_Table  Grasp filled_ketchup  leave the apartment please .,M UW1 V T UW1 D AY1 N IH0 NG T EY1 B AH0 L G R AE1 S P F IH1 L D K EH1 CH AH0 P L IY1 V DH AH0 AH0 P AA1 R T M AH0 N T P L IY1 Z,M UW1 V T UW1 D AY1 N IH0 NG T EY1 B AH0 L AA2 G R S P F IH1 L D K EH1 CH AH0 P L IY1 V DH AH0 AH0 P AA1 R T M AH0 N T P L IY1 Z,Move ( Dining_Table ) Find ( filled_ketchup Dining_Table  ) Grasp ( filled_ketchup ) Move ( apartment )
Well get Strawberry_Juice from Dining_Table go to Dining_Room go to lobby .,W EH1 L G EH1 T S T R AO1 B EH2 R IY0 JH UW1 S F R AH1 M D AY1 N IH0 NG T EY1 B AH0 L G OW1 T UW1 D AY1 N IH0 NG R UW1 M G OW1 T UW1 L AA1 B IY0,AA1 W EH1 L G EH1 T S T AO1 B EH2 R IY0 JH UW1 S F R AH1 M D AY1 N IH0 NG AY2 EY1 B AH0 L G OW1 T UW1 D AY1 N IH0 NG R UW1 ER0 M G OW1 T L AA1 B IY0,Move ( Dining_Table ) Find ( Strawberry_Juice Dining_Table  ) Grasp ( Strawberry_Juice )  Move ( Dining_Room ) Move ( lobby )
Go to Living_Table move to Sofa take Dish_Cleaner .,G OW1 T UW1 L IH1 V IH0 NG T EY1 B AH0 L M UW1 V T UW1 S OW1 F AH0 T EY1 K D IH1 SH K L IY1 N ER0,G HH OW1 T UW1 L IH1 V IH0 NG T EY1 B AY0 L M UW1 V T UW1 IH1 S OW1 F AH0 AH1 EY1 K IH1 SH K L N ER0,Move ( Living_Table ) Move ( Sofa ) Find ( Dish_Cleaner Living_Table ) Grasp ( Dish_Cleaner ) Move ( HERE )
Go to Kitchen_Table  take toy_penguin put it on Bar okay .,G OW1 T UW1 K IH1 CH AH0 N T EY1 B AH0 L T EY1 K T OY1 P EH1 NG G W AH0 N P UH1 T IH1 T AA1 N B AA1 R OW2 K EY1,G OW1 T AO2 UW1 K AH2 CH AW N T EY1 AH0 L T EY1 NG T OY1 P EH1 NG G W AH0 N AY P UH1 T UH2 IH1 T AA1 N OY B AA1 R OW2 K EY1,Move ( Kitchen_Table )  Grasp ( toy_penguin ) Move ( Bar ) Place ( toy_penguin Kitchen_Table )
Go to Living_Table next detect camera  take it .,G OW1 T UW1 L IH1 V IH0 NG T EY1 B AH0 L N EH1 K S T D IH0 T EH1 K T K AE1 M ER0 AH0 T EY1 K IH1 T,ER2 OW1 T L IH1 V IH0 NG T EY1 B AH0 L N EH1 EY2 K S T D IH0 T EH1 K T K AE1 M ER0 T EY1 K IH1 T,Move ( Living_Table ) Find ( camera Living_Table  ) Grasp ( camera )
Would you go to Dining_Sofa get Cloth_Cleaner carry it to Kitchen_Table .,W UH1 D Y UW1 G OW1 T UW1 D AY1 N IH0 NG S OW1 F AH0 G EH1 T K L AO1 TH K L IY1 N ER0 K AE1 R IY0 IH1 T T UW1 K IH1 CH AH0 N T EY1 B AH0 L,W UH1 D AH Y UW1 G OW1 T UW1 UW0 AY1 N IH0 NG S F AA1 AH0 G AO EH1 OW0 T K L AO1 TH AA2 R IY1 N ER0 K AE1 R IY0 T T ER0 K IH1 CH AH0 N T EY1 B AH0 L,Move (  Dining_Sofa ) Find ( Cloth_Cleaner Dining_Sofa  ) Grasp ( Cloth_Cleaner )  Move ( Kitchen_Table )
Go to bed_room next find toy_duck take it .,G OW1 T UW1 B EH1 D R UW1 M N EH1 K S T F AY1 N D T OY1 D AH1 K T EY1 K IH1 T,G JH OW1 T UW1 EH1 D R UW1 M N EH1 K S T F AY1 N D T D AE1 K T EY1 K IH1 T,Move (  bed_room  ) Find ( toy_duck bed_room  ) Grasp ( toy_duck ) 
Go to Corridor Grasp Cup_Noodle throw it into Dustbin please .,G OW1 T UW1 K AO1 R AH0 D ER0 G R AE1 S P K AH1 P N UW1 D AH0 L TH R OW1 IH1 T IH1 N T UW0 D AH1 S T B IH0 N P L IY1 Z,AH1 UW1 K AO1 R AH0 D ER0 G R AE1 S P K P N D AH0 AA1 L TH R OW1 IH1 IH1 N T UW0 D AH1 S T B IH0 N B IY1 L IY1 Z,Move ( Corridor ) Grasp ( Cup_Noodle ) Move ( Dustbin ) Place ( Cup_Noodle Dustbin  ) 
Well get twin_bell_alarm_clock from Side_Table go to lobby move to Reception_Table .,W EH1 L G EH1 T T W IH1 N B EH1 L AH0 L AA1 R M K L AA1 K F R AH1 M S AY1 D T EY1 B AH0 L G OW1 T UW1 L AA1 B IY0 M UW1 V T UW1 R IH0 S EH1 P SH AH0 N T EY1 B AH0 L,W EH1 L G EH1 T T W IH1 N B EH1 L EY0 AH0 L AA1 R M K L AA1 K F R AH1 M S AY1 D T EY1 B AH0 L G EH1 IH2 EY2 UW1 L AA1 B M AY2 V T AY2 AY2 AA0 R IH0 S EH1 P SH AH1 T EY1 B AH AH0 L,Move ( Side_Table ) Grasp ( twin_bell_alarm_clock ) Move ( lobby ) Move ( Reception_Table )
Can you go to Side_Table take filled_ketchup carry it to Dining_Table .,K AE1 N Y UW1 G OW1 T UW1 S AY1 D T EY1 B AH0 L T EY1 K F IH1 L D K EH1 CH AH0 P K AE1 R IY0 IH1 T T UW1 D AY1 N IH0 NG T EY1 B AH0 L,K AE1 N Y UW1 G T UW1 S AY1 D T EY1 B AH0 L T EY1 K F IH1 L D K EH1 NG CH AH0 P K AE1 R IY0 IH1 T T UW1 D AY1 N IH0 NG EY1 B AH0 L,Move ( Side_Table  ) Find ( filled_ketchup Side_Table ) Grasp ( filled_ketchup ) Move ( Dining_Table )
Go to Bar get tumbler  exit from kitchen okay .,G OW1 T UW1 B AA1 R G EH1 T T AH1 M B L ER0 EH1 G Z IH0 T F R AH1 M K IH1 CH AH0 N OW2 K EY1,G K OW1 UH T UW1 B AA1 UW1 G OY0 T T AH1 M B L ER0 EH1 G Z IH0 T F R AH1 M K IH1 CH AH0 N OW2 K EY1,Move (  Bar  ) Find ( tumbler Bar  ) Grasp ( tumbler ) Move ( kitchen )
Go to Visitor_Room next find bear_doll take it .,G OW1 T UW1 V IH1 Z IH0 T ER0 R UW1 M N EH1 K S T F AY1 N D B EH1 R D AA1 L T EY1 K IH1 T,G OW1 T UW1 V IH1 IH0 T ER0 R SH AO UW1 AW2 M N EY0 K S T F ER1 AY1 N D B EH1 R D AA1 L T EY1 EH0 IH1 T,Move (  Visitor_Room  ) Find ( bear_doll Visitor_Room  ) Grasp ( bear_doll ) 
Move to Kitchen_Table  get filled_ketchup  exit from Living_Room okay .,M UW1 V T UW1 K IH1 CH AH0 N T EY1 B AH0 L G EH1 T F IH1 L D K EH1 CH AH0 P EH1 G Z IH0 T F R AH1 M L IH1 V IH0 NG R UW1 M OW2 K EY1,M V T ZH K CH AH0 N T AO B AH0 L G EH1 T AW1 F IH1 W D CH K EH1 AH0 P EH1 G Z IH0 T F AH1 M L IH1 V IH0 R UW1 M OW2 K EY1,Move ( Kitchen_Table ) Find ( filled_ketchup Kitchen_Table ) Grasp ( filled_ketchup ) Move ( Living_Room )
Well get Japanese_Dressing from Bar go to Corridor go to Kitchen_Room .,W EH1 L G EH1 T JH AE2 P AH0 N IY1 Z D R EH1 S IH0 NG F R AH1 M B AA1 R G OW1 T UW1 K AO1 R AH0 D ER0 G OW1 T UW1 K IH1 CH AH0 N R UW1 M,W UH0 L G EH1 T JH AE2 P AH0 N IY1 Z D R EH1 S IH0 F R AH1 M B AA1 R G OW1 T UW1 P AO1 R AH0 D ER0 G IY0 OW1 T JH UW1 K IH1 CH AH0 N R UW1 M,Move ( Bar ) Find ( Japanese_Dressing Bar  ) Grasp ( Japanese_Dressing )  Move ( Corridor ) Move ( Kitchen_Room )
Go to bed_room take dog_doll put it on Dining_Table please .,G OW1 T UW1 B EH1 D R UW1 M T EY1 K D AO1 G D AA1 L P UH1 T IH1 T AA1 N D AY1 N IH0 NG T EY1 B AH0 L P L IY1 Z,R G OW1 T UW1 B EH1 D R UW1 T EY1 K F AO1 G D AA1 L P UH1 AE0 T IH1 TH T AA1 N D AY1 N IH0 NG T EY1 B AH0 L P L IY1 Z,Move ( bed_room ) Find ( dog_doll bed_room ) Grasp ( dog_doll ) Move ( Dining_Table ) Place ( dog_doll Dining_Table )
Go to Corridor Grasp dog_doll place it on Reception_Table okay .,G OW1 T UW1 K AO1 R AH0 D ER0 G R AE1 S P D AO1 G D AA1 L P L EY1 S IH1 T AA1 N R IH0 S EH1 P SH AH0 N T EY1 B AH0 L OW2 K EY1,G OW1 T UW1 K AO1 R AH0 D ER0 G R AE1 P P D AO1 G D AA1 L P L EY1 S IH1 T AA1 N R IH0 S EH1 P SH AH0 N T EY1 B AH0 L AY1 OW2 K AO EY1,Move ( Corridor ) Grasp ( dog_doll ) Move ( Reception_Table ) Place ( dog_doll Reception_Table )
Can you move to Dining_Table get bell_pepper then come back .,K AE1 N Y UW1 M UW1 V T UW1 D AY1 N IH0 NG T EY1 B AH0 L G EH1 T B EH1 L P EH1 P ER0 DH EH1 N K AH1 M B AE1 K,K AE1 N Y UW1 M UW1 V T D AY1 N IH0 NG T EY1 B L G AA2 T EH1 L P EH1 P ER0 DH EH1 K AH1 M B AE1 K,Move ( Dining_Table ) Grasp ( bell_pepper ) Move ( HERE )
Would you move to Sofa take Korean_Soup then come back .,W UH1 D Y UW1 M UW1 V T UW1 S OW1 F AH0 T EY1 K K AO2 R IY1 AH0 N S UW1 P DH EH1 N K AH1 M B AE1 K,W UH1 D AA0 Y G M UW1 V T UW1 S F AH0 T EY1 K AO2 R IY1 AH0 AE1 S UW1 P DH EH1 N K M B AE1 R,Move ( Sofa ) Find ( Korean_Soup Sofa ) Grasp ( Korean_Soup ) Move ( HERE )
Go to Side_Table find a person neayby  er follow a person .,G OW1 T UW1 S AY1 D T EY1 B AH0 L F AY1 N D AH0 P ER1 S AH0 N N IH1 R B AY1 ER0 F AA1 L OW0 AH0 P ER1 S AH0 N,G OW1 T UW1 S AY1 D EY1 B AH0 L F AY1 OW2 N D AH0 P ER1 S AH0 N N IY2 IH1 R B ER2 AY1 ER0 F AA1 L AH0 P ER1 S AH0 N,Move ( Side_Table ) Find ( person Side_Table ) Follow ( person )
Go to Kitchen_Table find a person neayby  er follow a person .,G OW1 T UW1 K IH1 CH AH0 N T EY1 B AH0 L F AY1 N D AH0 P ER1 S AH0 N N IH1 R B AY1 ER0 F AA1 L OW0 AH0 P ER1 S AH0 N,AE0 OW1 T UW1 K IH CH AH0 N T EY1 B AH0 L F AY1 N D AE1 P ER1 S AH0 N AE2 IY1 IH1 R B AY1 ER0 IY0 AA1 L OW0 AH0 P EY1 S AH0 N,Move ( Kitchen_Table ) Find ( person Kitchen_Table ) Follow ( person )
Go to bed_room Grasp Red_Potato throw it into Dustbin please .,G OW1 T UW1 B EH1 D R UW1 M G R AE1 S P R EH1 D P AH0 T EY1 T OW2 TH R OW1 IH1 T IH1 N T UW0 D AH1 S T B IH0 N P L IY1 Z,G OW1 AO1 T UW1 B EH1 D R M G R AE1 S P R EH1 D EH2 AH0 TH W T OW2 TH R OW1 IH1 T IH1 N T UW0 D AH1 AA2 S T AH2 B IH0 N P L IY1 Z,Move ( bed_room ) Grasp ( Red_Potato ) Move ( Dustbin ) Place ( Red_Potato Dustbin  ) 
Go to bed_room Grasp hourglass throw it into Dustbin okay .,G OW1 T UW1 B EH1 D R UW1 M G R AE1 S P AW1 ER0 G L AE2 S TH R OW1 IH1 T IH1 N T UW0 D AH1 S T B IH0 N OW2 K EY1,G OW1 T AY B EH1 D R UW1 M G R AE1 HH S P AW1 G L AE2 S TH R OW1 T IH1 N T UW0 D AH1 S T B IH0 N OW2 K UH1 EY1,Move (  bed_room  ) Find ( hourglass bed_room  ) Grasp ( hourglass ) Move ( Dustbin ) Place ( hourglass Dustbin ) 
Go to Living_Table and find a person neayby bring Blue_Potato from Dining_Sofa .,G OW1 T UW1 L IH1 V IH0 NG T EY1 B AH0 L AH0 N D F AY1 N D AH0 P ER1 S AH0 N N IH1 R B AY1 B R IH1 NG B L UW1 P AH0 T EY1 T OW2 F R AH1 M D AY1 N IH0 NG S OW1 F AH0,G OW1 T UW1 L IH1 V IH0 AE0 T EY1 P B AH0 L ER2 AH0 N D F AY1 N D AH0 P ER1 S N N IH1 R B IH2 OY0 B R IH1 NG K B L UW1 P AH0 T EY1 T OW2 F R AH1 UW2 D AY1 N IH0 NG S OW1 F AH0,Move (  Living_Table  ) Find ( Blue_Potato Living_Table  ) Grasp ( Blue_Potato ) Find ( pesron Living_Table ) Plcae ( Blue_Potato PERSON )
Move to Side_Table  Grasp Red_Potato  leave the apartment please .,M UW1 V T UW1 S AY1 D T EY1 B AH0 L G R AE1 S P R EH1 D P AH0 T EY1 T OW2 L IY1 V DH AH0 AH0 P AA1 R T M AH0 N T P L IY1 Z,M UW1 V T UW1 S AY1 D T ER1 B AH0 L G R AE1 UH1 S P AA R P AH0 T EY1 T OW2 L IY1 AY DH AH0 AH0 P AA1 R T M AH0 N T P L IY1 UH1 Z,Move ( Side_Table ) Find ( Red_Potato Side_Table  ) Grasp ( Red_Potato ) Move ( apartment )
Well get white_cup from Kitchen_Table go to bed_room go to Visitor_Room .,W EH1 L G EH1 T W AY1 T K AH1 P F R AH1 M K IH1 CH AH0 N T EY1 B AH0 L G OW1 T UW1 B EH1 D R UW1 M G OW1 T UW1 V IH1 Z IH0 T ER0 R UW1 M,W EH1 L G EH1 T W AY1 T K AH1 P AO0 R AH1 M K IH1 CH AH0 T EY1 B AH0 L G OW1 T UW1 B EH1 D R M G OW1 UW1 V IH1 Z IH0 T ER0 R UW1,Move ( Kitchen_Table ) Find ( white_cup Kitchen_Table  ) Grasp ( white_cup )  Move ( bed_room ) Move ( Visitor_Room )
Go to Living_Room  go to Reception_Table then exit the apartment .,G OW1 T UW1 L IH1 V IH0 NG R UW1 M G OW1 T UW1 R IH0 S EH1 P SH AH0 N T EY1 B AH0 L DH EH1 N EH1 G Z IH0 T DH AH0 AH0 P AA1 R T M AH0 N T,G T UW1 L IH1 V IH0 NG R UW1 M G OW1 T UW1 R IH0 S EH1 AE SH AH0 N T EY1 B AH0 L DH EH1 N EH1 G Z IH0 T DH AH0 AH0 AH P AA1 R T M IH AH0 T,Move ( Living_Room ) Move ( Reception_Table )  Move ( apartment )
Go to Reception_Table  and  detect spray_bottle Grasp it .,G OW1 T UW1 R IH0 S EH1 P SH AH0 N T EY1 B AH0 L AH0 N D D IH0 T EH1 K T S P R EY1 B AA1 T AH0 L G R AE1 S P IH1 T,G OW1 G UW1 R IH0 S EH1 P SH AH0 N T EY1 B T AH0 L AH0 N D D IH0 T AW1 EH1 K T S P R EY1 B AA1 T AH0 L G R AO0 S P IH1 T,Move (  Reception_Table  ) Find ( spray_bottle Reception_Table  ) Grasp ( spray_bottle ) 
Go to lobby  go to Bar then exit the apartment .,G OW1 T UW1 L AA1 B IY0 G OW1 T UW1 B AA1 R DH EH1 N EH1 G Z IH0 T DH AH0 AH0 P AA1 R T M AH0 N T,G OW1 T UW1 L AA1 B IY0 G OW1 T UW1 B AA1 R DH EH1 N EH1 G Z IH0 T DH AH0 AH0 P AA1 R T M AH0 N T,Move ( lobby ) Move ( Bar )  Move ( apartment )
Go to Dining_Table go to Kitchen_Room  and leave the apartment .,G OW1 T UW1 D AY1 N IH0 NG T EY1 B AH0 L G OW1 T UW1 K IH1 CH AH0 N R UW1 M AH0 N D L IY1 V DH AH0 AH0 P AA1 R T M AH0 N T,OW1 T UW1 AY1 N IH0 NG T EY1 B AH0 L G OW1 IY0 K IH1 CH N R UH1 UW1 M AH0 N D L IY1 V DH AH0 AH0 P UW AA1 R UW M AH0 N T,Move ( Dining_Table )  Move ( Kitchen_Room )  Move ( apartment )
Move to Living_Sofa  go to Kitchen_Table then exit the apartment .,M UW1 V T UW1 L IH1 V IH0 NG S OW1 F AH0 G OW1 T UW1 K IH1 CH AH0 N T EY1 B AH0 L DH EH1 N EH1 G Z IH0 T DH AH0 AH0 P AA1 R T M AH0 N T,M UW1 V UW1 L IH1 V IH0 NG S OW1 F AH0 G OW1 M UW1 K IH1 CH F N T EY1 B AH0 L DH AW1 EH1 N EH1 G ER2 IH0 T DH AH0 AH0 P AA1 R T M IH2 N T,Move ( Living_Sofa ) Move ( Kitchen_Table ) Move ( apartment )
Would you go to lobby Grasp apple er come back .,W UH1 D Y UW1 G OW1 T UW1 L AA1 B IY0 G R AE1 S P AE1 P AH0 L ER0 K AH1 M B AE1 K,W UH1 D Y UW1 G OW1 T UW1 L AA1 B G R AE1 S P AA0 AE1 P AH0 L ER0 K AH1 M AA0 B AE1 K,Move ( lobby ) Find ( apple lobby ) Move ( HERE )
Go to Kitchen_Room Grasp salt throw it into Dustbin please .,G OW1 T UW1 K IH1 CH AH0 N R UW1 M G R AE1 S P S AO1 L T TH R OW1 IH1 T IH1 N T UW0 D AH1 S T B IH0 N P L IY1 Z,G OW1 ER0 UW1 K IH1 CH AH0 N R UW1 M G R AE1 S P S AO1 L T T TH OW1 IH1 T IH1 EH1 N T UW0 D AH1 S T B IH0 N P L IY1 Z,Move ( Kitchen_Room ) Grasp ( salt ) Move ( Dustbin ) Place ( salt Dustbin  ) 
Would you bring Japanese_Tea from Bar go to Dining_Sofa go to Reception_Table  .,W UH1 D Y UW1 B R IH1 NG JH AE2 P AH0 N IY1 Z T IY1 F R AH1 M B AA1 R G OW1 T UW1 D AY1 N IH0 NG S OW1 F AH0 G OW1 T UW1 R IH0 S EH1 P SH AH0 N T EY1 B AH0 L,W UH1 Y EY B R IH1 B NG JH AE2 P AH0 N IY1 Z T AW0 IY1 F R AH1 M B AA1 R G OW1 T AE1 UW1 UW1 AY1 N IH0 NG S OW1 F G OW1 AY0 T UW1 R IH0 S EH1 P SH AH0 N T EY1 B AH0 L,Move ( Bar ) Place ( Japanese_Tea Bar ) Move ( Dining_Sofa ) Move ( Dining_Sofa ) 
Would you go to Visitor_Room Grasp Red_Potato finally come back .,W UH1 D Y UW1 G OW1 T UW1 V IH1 Z IH0 T ER0 R UW1 M G R AE1 S P R EH1 D P AH0 T EY1 T OW2 F AY1 N AH0 L IY0 K AH1 M B AE1 K,W UH1 D Y UW1 IY G OW1 T UW1 V IH1 Z IH0 T ER0 R UW1 K M G R AE1 S P R D P AH0 T AY1 EY1 T OW2 F AY1 N AH0 L IY0 K M B AE1 K,Move ( Visitor_Room ) Find ( Red_Potato Visitor_Room ) Grasp ( Red_Potato )  Move ( HERE )
Go to Living_Table go to Dining_Room  and exit the apartment .,G OW1 T UW1 L IH1 V IH0 NG T EY1 B AH0 L G OW1 T UW1 D AY1 N IH0 NG R UW1 M AH0 N D EH1 G Z IH0 T DH AH0 AH0 P AA1 R T M AH0 N T,G OW1 T UW1 L B IH1 V IH0 NG T EY1 B AH0 L G OW1 T UW1 D AY1 AO1 N IH0 OY2 NG R UW1 M AH0 N D EH1 G Z IH0 T DH AH AH0 P R T M AH0 N T,Move ( Living_Table ) Move ( Living_Table ) Move ( apartment )
Go to Living_Table move to Sofa  then leave the apartment .,G OW1 T UW1 L IH1 V IH0 NG T EY1 B AH0 L M UW1 V T UW1 S OW1 F AH0 DH EH1 N L IY1 V DH AH0 AH0 P AA1 R T M AH0 N T,G OW1 T UW1 L IH1 V IH0 NG T EY1 B TH AH0 L M UW1 AW1 OW1 T UW1 S F AH0 DH EH1 N L IY1 V DH AH0 AH0 AA1 R T M AH0 N AE T,Move ( Living_Table ) Move ( Sofa ) Move ( apartment )
Would you move to Sofa take Korean_Soup then come back .,W UH1 D Y UW1 M UW1 V T UW1 S OW1 F AH0 T EY1 K K AO2 R IY1 AH0 N S UW1 P DH EH1 N K AH1 M B AE1 K,EH2 W UH1 D Y UW1 M UW1 V AW2 T UW1 S OY2 F AH0 T EY1 K K AO2 R IY1 AH0 N L UW1 P DH EH1 N K AH1 B K,Move ( Sofa ) Find ( Korean_Soup Sofa ) Grasp ( Korean_Soup ) Move ( HERE )
Go to Living_Room  go to Dining_Sofa er leave the apartment .,G OW1 T UW1 L IH1 V IH0 NG R UW1 M G OW1 T UW1 D AY1 N IH0 NG S OW1 F AH0 ER0 L IY1 V DH AH0 AH0 P AA1 R T M AH0 N T,G OW1 T UW1 L IH1 V IH0 R UW1 M G OW1 T UW1 D AY1 N IH0 NG S OW1 F AH0 ER0 L IY1 V DH AH0 AH0 P AA1 R T AH0 N CH,Move ( Living_Room ) Move ( Dining_Sofa )  Move ( apartment )
Go to kitchen next find Lemon_Tea take it .,G OW1 T UW1 K IH1 CH AH0 N N EH1 K S T F AY1 N D L EH1 M AH0 N T IY1 T EY1 K IH1 T,G OW1 T OY1 UW1 IH1 CH AH0 N N EH1 S D T OY2 F AY1 N D L EH1 M AH0 N T IY1 T EY1 K IH1 T,Move (  kitchen  ) Find ( Lemon_Tea kitchen  ) Grasp ( Lemon_Tea ) 
Move to Kitchen_Table and detect Brown_Tea get it .,M UW1 V T UW1 K IH1 CH AH0 N T EY1 B AH0 L AH0 N D D IH0 T EH1 K T B R AW1 N T IY1 G EH1 T IH1 T,M UW1 V T UW1 K IH1 CH AH0 N AH2 EY1 B AH0 L AH0 N D D IH0 T AW1 EH1 K T B R AW1 N G EH1 T IH1 EH0,Move ( Kitchen_Table ) Find ( Brown_Tea Kitchen_Table ) Grasp ( Brown_Tea )
Go to Reception_Table find a person neayby  er follow a person .,G OW1 T UW1 R IH0 S EH1 P SH AH0 N T EY1 B AH0 L F AY1 N D AH0 P ER1 S AH0 N N IH1 R B AY1 ER0 F AA1 L OW0 AH0 P ER1 S AH0 N,G OW1 T UW1 EY0 IH0 S EH1 SH AH0 N EY1 B AH0 L F AY1 N D AH0 P ER1 S AH0 N N IH1 R B AY1 ER0 F OW AA1 L OW0 AH0 P ER1 S AH0 N,Move ( Reception_Table ) Find ( person Reception_Table ) Follow ( person )
Go to lobby  move to Sofa  then leave the apartment .,G OW1 T UW1 L AA1 B IY0 M UW1 V T UW1 S OW1 F AH0 DH EH1 N L IY1 V DH AH0 AH0 P AA1 R T M AH0 N T,G OW1 T UW1 L AA1 B IY0 M UW1 V UW1 S OW1 F EH1 N L IY1 V DH AH0 AH0 P EH2 AA1 R IH0 T M AH0 N T,Move ( lobby ) Move ( Sofa ) Move ( apartment )
Go to Corridor  move to Sofa  then leave the apartment .,G OW1 T UW1 K AO1 R AH0 D ER0 M UW1 V T UW1 S OW1 F AH0 DH EH1 N L IY1 V DH AH0 AH0 P AA1 R T M AH0 N T,G OW1 T UW1 K ER CH R AH0 D ER0 M UW1 V T UW1 S OW1 F AH0 DH EH1 N L IY1 UW2 AH0 AH0 P AA1 R T OY0 M AH0 N T,Move ( Corridor ) Move ( Sofa ) Move ( apartment )
Would you go to Visitor_Room Grasp Blue_Potato er come back .,W UH1 D Y UW1 G OW1 T UW1 V IH1 Z IH0 T ER0 R UW1 M G R AE1 S P B L UW1 P AH0 T EY1 T OW2 ER0 K AH1 M B AE1 K,W UH1 D Y UW1 G OW1 T UW1 V IH1 Z IH0 T ER0 R UW1 M G R AE1 S P B L UW1 P AH0 T EY1 T OW2 ER0 K AH1 M B AE1 AO K,Move ( Visitor_Room ) Find ( Blue_Potato Visitor_Room ) Move ( HERE )
Go to kitchen  go to Living_Sofa er leave the apartment .,G OW1 T UW1 K IH1 CH AH0 N G OW1 T UW1 L IH1 V IH0 NG S OW1 F AH0 ER0 L IY1 V DH AH0 AH0 P AA1 R T M AH0 N T,G OW1 T UW1 K AE0 CH AH0 N G OW1 T L IH1 T V AW1 IH0 NG S OW1 F EY AH0 OW1 IY1 V DH AH0 AH0 P AA1 R T M AH0 N V,Move ( kitchen ) Move ( Living_Sofa )  Move ( apartment )
Go to Side_Table  and  detect Lemon_Tea Grasp it .,G OW1 T UW1 S AY1 D T EY1 B AH0 L AH0 N D D IH0 T EH1 K T L EH1 M AH0 N T IY1 G R AE1 S P IH1 T,G AW2 OW1 T UW1 Y AY1 D T EY1 B AH0 L AH0 N D D IY1 T EH1 K T EH1 M AH0 N T IY1 G AH2 D N R AE1 S P IH1 T,Move (  Side_Table  ) Find ( Lemon_Tea Side_Table  ) Grasp ( Lemon_Tea ) 
Well move to Dining_Table get empty_ketchup and come back .,W EH1 L M UW1 V T UW1 D AY1 N IH0 NG T EY1 B AH0 L G EH1 T EH1 M P T IY0 K EH1 CH AH0 P AH0 N D K AH1 M B AE1 K,CH EH1 L M V T AH1 D AY1 N IH0 NG T EY1 B AH0 L G EH1 T EH1 M AE T IY0 K EH1 CH AH0 AH0 N D K UW2 TH AH1 M M B AE1 K,Move ( Dining_Table ) Grasp ( empty_ketchup ) Move ( Dining_Table ) Grasp ( empty_ketchup ) Move ( HERE )
Can you move to Bar get ground_pepper then come back .,K AE1 N Y UW1 M UW1 V T UW1 B AA1 R G EH1 T G R AW1 N D P EH1 P ER0 DH EH1 N K AH1 M B AE1 K,EY1 AE1 N Y UW1 M UW1 V T UW1 B AA1 R IY0 EH1 T G R AW1 N D P EH1 P ER0 EH1 N K M B AE1 K,Move ( Bar ) Grasp ( ground_pepper ) Move ( HERE )
Well get tumbler from Living_Table go to Living_Room move to Dining_Table .,W EH1 L G EH1 T T AH1 M B L ER0 F R AH1 M L IH1 V IH0 NG T EY1 B AH0 L G OW1 T UW1 L IH1 V IH0 NG R UW1 M M UW1 V T UW1 D AY1 N IH0 NG T EY1 B AH0 L,W EH1 L AW EH1 T T M B L F R OY2 M L IH1 V IH0 NG IH2 T EY1 P AH0 L G OW1 T UW1 L IH1 V IH0 NG R UW1 M M UW1 V UW1 D AY1 N IH0 NG T EY1 M AH0 L,Move ( Living_Table ) Grasp ( tumbler ) Move ( Living_Room ) Move ( Dining_Table )
Well move to Bar get toy_car and come back .,W EH1 L M UW1 V T UW1 B AA1 R G EH1 T T OY1 K AA1 R AH0 N D K AH1 M B AE1 K,W EH1 M UW1 V T UW1 B AA1 R G EH1 T T OY1 K UW1 AA1 TH R AH0 N D AH1 M AO0 B AE1 K,Move ( Bar ) Grasp ( toy_car ) Move ( Bar ) Grasp ( toy_car ) Move ( HERE )
Go to bed_room get filled_ketchup throw it into Dustbin please .,G OW1 T UW1 B EH1 D R UW1 M G EH1 T F IH1 L D K EH1 CH AH0 P TH R OW1 IH1 T IH1 N T UW0 D AH1 S T B IH0 N P L IY1 Z,G OW1 T UW1 B EH1 IY1 AH1 EY M G EH1 T F IH1 L D K EH1 CH S ZH P TH R UW OW1 IH1 UW0 T IH1 N T UW0 D AH1 S T B IH0 N P L IY1 Z,Move ( bed_room ) Find ( filled_ketchup bed_room ) Grasp ( filled_ketchup ) Move ( Dustbin ) Place ( filled_ketchup Dustbin )
Would you go to Dining_Sofa  take twin_bell_alarm_clock  bring it to Bar .,W UH1 D Y UW1 G OW1 T UW1 D AY1 N IH0 NG S OW1 F AH0 T EY1 K T W IH1 N B EH1 L AH0 L AA1 R M K L AA1 K B R IH1 NG IH1 T T UW1 B AA1 R,EY0 W UH1 D IH1 Y UW1 G OW1 T UW1 D AY1 N IH0 NG S OW1 F AH0 T UW EY1 K T W IH1 P AY2 EH1 OY1 L AH0 L AA1 EH0 M L AA1 AW2 B R IH1 NG IH1 AY0 T UW1 B AA1,Move ( Dining_Sofa ) Find ( twin_bell_alarm_clock Dining_Sofa ) Grasp ( twin_bell_alarm_clock ) Move ( Bar )
Go to Sofa then detect ground_pepper  take it .,G OW1 T UW1 S OW1 F AH0 DH EH1 N D IH0 T EH1 K T G R AW1 N D P EH1 P ER0 T EY1 K IH1 T,G IH0 T UW1 S OW1 F AH0 DH EH1 N D IH0 T EH1 K T G R AW1 N D P EH1 P ER0 T EY1 K IH1 T,Move ( Sofa ) Find ( ground_pepper Sofa ) Grasp ( ground_pepper )  Move ( ground_pepper )
Well go to Sofa  take bear_doll finally come back .,W EH1 L G OW1 T UW1 S OW1 F AH0 T EY1 K B EH1 R D AA1 L F AY1 N AH0 L IY0 K AH1 M B AE1 K,W EH1 L G OW1 T UW1 S OW1 AH0 AO1 EY1 K B EH1 R AA D AA1 AO0 NG F AY1 N AH0 L K AH1 M B AE1 K,Move ( Sofa ) Grasp ( bear_doll ) Move ( HERE )
Move to Living_Sofa  Grasp bell_pepper  leave the apartment please .,M UW1 V T UW1 L IH1 V IH0 NG S OW1 F AH0 G R AE1 S P B EH1 L P EH1 P ER0 L IY1 V DH AH0 AH0 P AA1 R T M AH0 N T P L IY1 Z,UW2 AY1 M UW1 V T UW1 AH1 UH2 IH1 V W NG S OW1 AE0 F AH0 ER0 G R AE1 AW0 S P EH1 L P EH1 P ER0 EH1 L IY1 V DH AH0 AH0 P EY AA1 R T M AH0 N T P L IY1 Z,Move ( Living_Sofa ) Find ( bell_pepper Living_Sofa  ) Grasp ( bell_pepper ) Move ( apartment )
Can you go to lobby get toy_penguin then come back .,K AE1 N Y UW1 G OW1 T UW1 L AA1 B IY0 G EH1 T T OY1 P EH1 NG G W AH0 N DH EH1 N K AH1 M B AE1 K,Y AE1 N Y UW1 G OW1 UW1 L AA1 B IY0 G EH1 T T OY1 P EH1 NG W AH0 N EH1 N UW AH1 M B AE1 K,Move (  lobby  ) Find ( toy_penguin lobby ) Grasp ( toy_penguin ) Move ( HERE )
Go to Sofa get Chip_Star  exit from Living_Room okay .,G OW1 T UW1 S OW1 F AH0 G EH1 T CH IH1 P S T AA1 R EH1 G Z IH0 T F R AH1 M L IH1 V IH0 NG R UW1 M OW2 K EY1,G OW1 T UW1 S OW1 Z F AH0 G EH1 T CH OY1 P S T AA1 R EH1 G Z IH0 T F R AH1 M L IH1 V IH0 NG R UW1 M OW2 K EY1,Move (  Sofa  ) Find ( Chip_Star Sofa  ) Grasp ( Chip_Star ) Move ( Living_Room )
Go to bed_room then find a person neayby bring toy_duck from Sofa .,G OW1 T UW1 B EH1 D R UW1 M DH EH1 N F AY1 N D AH0 P ER1 S AH0 N N IH1 R B AY1 B R IH1 NG T OY1 D AH1 K F R AH1 M S OW1 F AH0,G OW1 UW1 B EH1 D R UW1 M DH EH1 D N F N D AH0 P ER1 S AH0 N N IH1 R B AY1 B R IH1 L OY2 NG T D AH1 K F R AH1 ER1 M S OW1 F AH0,Move ( bed_room ) Find ( person bed_room ) Move ( Sofa ) Grasp ( toy_duck )
Go to Kitchen_Table find a person neayby finally follow a person .,G OW1 T UW1 K IH1 CH AH0 N T EY1 B AH0 L F AY1 N D AH0 P ER1 S AH0 N N IH1 R B AY1 F AY1 N AH0 L IY0 F AA1 L OW0 AH0 P ER1 S AH0 N,OW1 T UW1 K IH1 CH AH0 N T EY1 B AH0 L F AY1 N D AH0 ER1 S AH0 N N IH1 R B AY1 F AY1 N AH0 L IY0 F AA1 L OW0 ER1 S AH0 N,Move ( Kitchen_Table ) Find ( person Kitchen_Table  ) Follow ( person )
Can you go to Visitor_Room get Bath_Cleaner then come back .,K AE1 N Y UW1 G OW1 T UW1 V IH1 Z IH0 T ER0 R UW1 M G EH1 T B AE1 TH K L IY1 N ER0 DH EH1 N K AH1 M B AE1 K,K AE1 N Y UW1 ER1 G OW1 T UW1 V IH1 R Z IH0 T ER0 R UW1 M G EH1 T B TH K L IY1 N ER0 DH EH1 N K AH1 M B AE1 K,Move (  Visitor_Room  ) Find ( Bath_Cleaner Visitor_Room ) Grasp ( Bath_Cleaner ) Move ( HERE )
Can you bring empty_ketchup from Bar go to Dining_Room move to Living_Sofa .,K AE1 N Y UW1 B R IH1 NG EH1 M P T IY0 K EH1 CH AH0 P F R AH1 M B AA1 R G OW1 T UW1 D AY1 N IH0 NG R UW1 M M UW1 V T UW1 L IH1 V IH0 NG S OW1 F AH0,K AE1 N Y UW1 B R IH1 NG EH1 M P T IY0 K EH1 CH AH0 P F AH1 M B AA1 EY0 R G OW1 UW1 D N IH0 NG R UH0 UW1 M M UW1 V T UW1 L IH1 V T S OW1 F AH0,Move ( Bar ) Find ( empty_ketchup Bar  ) Grasp ( empty_ketchup ) Move ( Dining_Room ) ( Living_Sofa )
